EduID,Name,Phone1,Phone2,Phone3,Phone4,Phone5,Street Address,Locality,Pincode,City,Country,Mail,Website,Person to Contact,Working Hours,Services Offered,Details,Images URL,Keywords
181466,NIIT Ltd.,+91 172 3368454,,,,,"S.C.O. 156-157, 1st Floor, Sector-34A",Sector 34,122001,chandigarh,India,alika.koshy@niit.com,http://www.niit.com,Alika Koshy,Monday - Saturday: 9 AM - 6 PM,"Hotel Management Colleges , Coaching & Tuitions , Job Training , Administration Training , Certification Courses Training , Computer Networking Training , Content Management Software Training , Database Training , Enterprise Training , Hardware Training , Microsoft Training , Middleware Training , Mobile Development Training , Multimedia & Design Training , Networking & Cisco Training , Oracle Training , Programming Languages Training , Robotics Training , Software Tools Training , Web Technologies Training , SAP Training , Database Management Training , DOEACC 'O' Level Training , Datastage Certification Training , Oracle BPM Training , Web Designing Training , C, C++ Training , Documentum Training , Oracle Fusion Middleware Training , Oracle ADF Training , DOEACC 'A' Level Training , Basic Networking Training , Data Warehousing Training , B.Sc. Colleges , Advanced Networking Training , Embedded Systems Training , Oracle OAF Training , Mobile Application Testing Training , CCNP Certification Training , Mobile Gaming & E-Learning Diploma Training , Oracle Finance Training , Oracle Certification Training , Mobile Application Development Training , Java & J2EE Training , Embedded C Training , Embedded QT Training , Embedded Robotics Training , Advanced MS Excel Training , Java Script Training , Cisco PIX Training , CCNA Certification Training , Windows 2008 Server Certification Training , Oracle 9i Training , ","NIIT Ltd. is a leading Global Talent Development Corporation, building skilled manpower pool for global industry requirements. The company which was set up in 1981, to help the nascent IT industry overcome its human resource challenges, has today grown to be amongst worlds leading talent development companies offering learning solutions to Individuals, Enterprises and Institutions across 40 countries. Leading IT journal Dataquest has conferred upon NIIT the Top IT Training Company award successively for the past 20 years, since the inception of this category. NIIT Ltd. training solutions in IT, Banking, Finance and Insurance, Knowledge Process Outsourcing (KPO), Business Process Management (BPM), Executive Management Education, Vocational Skills, School Learning Solutions and Communication and Professional Life Skills has impacted over 35 million learners since inception. NIIT Ltd. expertise in learning content development, training delivery and education process management make it the most preferred training partner, worldwide. NIIT Ltd. has been ranked 4th in Best companies to work for in India, 2013-14, by Great Place to Work Institute and Top 10 Best Employers in India- 2011 by Aon Hewitt. The company has also been voted the second most trusted education brand in India by Brand Equity- Nielsen Survey 2011. Contact us for further details.  ","http://localserviceassets.blob.core.windows.net:80/businessphoto-t/enterprise-solutions-1e9060ee-3187-4836-8fbc-98b5a4019e64.jpg , http://localserviceassets.blob.core.windows.net:80/businessphoto-t/franchisor-it-award-657dec19-1c54-4d2f-ace9-e0e4cbd2d966.jpg , http://localserviceassets.blob.core.windows.net:80/businessphoto-t/img_python-b29a4d27-f6d8-45a8-aac6-1974a3396738.jpg , http://localserviceassets.blob.core.windows.net:80/businessphoto-t/NIIT_logo-db2879f3-0aeb-4834-ba5b-ecd51a7015b2.png , http://localserviceassets.blob.core.windows.net:80/businessphoto-t/NIITWEB-PAGE-new-53e1a8a0-a14e-4bb3-8bc1-4e31bcf4179e.jpg , http://localserviceassets.blob.core.windows.net:80/businessphoto-t/school-solutions-e5988bdb-66c5-4c23-a1b9-b3cdf5dd9c71.jpg , http://localserviceassets.blob.core.windows.net:80/businessphoto-m/enterprise-solutions-1e9060ee-3187-4836-8fbc-98b5a4019e64.jpg , http://localserviceassets.blob.core.windows.net:80/businessphoto-m/franchisor-it-award-657dec19-1c54-4d2f-ace9-e0e4cbd2d966.jpg , http://localserviceassets.blob.core.windows.net:80/businessphoto-m/img_python-b29a4d27-f6d8-45a8-aac6-1974a3396738.jpg , http://localserviceassets.blob.core.windows.net:80/businessphoto-m/NIIT_logo-db2879f3-0aeb-4834-ba5b-ecd51a7015b2.png , http://localserviceassets.blob.core.windows.net:80/businessphoto-m/NIITWEB-PAGE-new-53e1a8a0-a14e-4bb3-8bc1-4e31bcf4179e.jpg , http://localserviceassets.blob.core.windows.net:80/businessphoto-m/school-solutions-e5988bdb-66c5-4c23-a1b9-b3cdf5dd9c71.jpg , ","Aviation Management Training , B.Sc Animation Colleges , B.Sc. Colleges , Basic Networking Training , Big Data Training , BizTalk Server 2010 Training , Boutique Management Job Training , Business Analysis Training , C, C++ Training , CACPT Coaching , CAT Coaching , CCNA Certification Training , CCNP Certification Training , Certified Financial Executive (CFX) Coaching , Certified Financial Planner (CFP) Coaching , Chartered Financial Analyst (CFA) Coaching , Cisco PIX Training , Data Science Certification Training , Data Warehousing Training , Database Management Training , Database Testing Training , Datastage Certification Training , Digital Art Coaching , Digital Marketing Course , Documentum Training , DOEACC 'A' Level Training , DOEACC 'O' Level Training , Embedded Applications Training , Embedded C Training , Embedded Controller Training , Embedded Database Training , Embedded Development Training , Embedded Hardware Training , Embedded Programming Training , Embedded QT Training , Embedded Robotics Training , Embedded Systems Training , Event Management Job Training , Finance Training , Financial Modeling Course Training , Financial Risk Management (FRM) Training , Fire Safety Management Training , Hospital Management Training , Hospitality & Retail Job Training , Hotel Management Certificate Colleges , Hotel Management Degree Colleges , Hotel Management Diploma Colleges , HTML Training , ICWA Coaching , Integrated Building Management (IBM) Training , Integrated Professional Competency (IPCC) Coaching , International Financial Reporting Standards (IFRS) Coaching , IT Governance Job Training , IT Infrastructure Library (ITIL) Training , Java & J2EE Training , Java Beans Training , Java Script Training , Leadership Management Training , Merchandising & Retail Course , Mobile Application Development Training , Mobile Application Testing Training , Mobile Gaming & E-Learning Diploma Training , Multimedia & Animation Training , Oracle 10g DBA Training , Oracle 11g DBA Training , Oracle 9i Training , Oracle ADF Training , Oracle Application Training , Oracle Apps DBA Training , Oracle ASCP Training , Oracle BPM Training , Oracle Business Intelligence Training , Oracle Certification Training , Oracle DBA Training , Oracle Finance Training , Oracle Fusion Middleware Training , Oracle HRMS Training , Oracle OAF Training , Oracle OCA Training , Oracle PL Training , Oracle RAC Training , Oracle SCM Training , Oracle SOA Training , Oracle SQL Training , Oracle Weblogic Server Administration Training , Project Management Certification Training , Sales Skill Training , SAP FICO Training , SBI PO Training , Secretarial Practice Training , SEO Training , Software Configuration Management Training , Software Engineering with UML Training , SQL Server Training , Tailoring Classes , Tally Training , Teacher Training , Telecom Training , Web Designing Training , Web Development Training , Web Logic Training , Windows 2008 Server Certification Training , "
181467,AKON Academy,9914771399,,,,,"No. 94/95 , 3rd floor",Sector 34A,160034,chandigarh,India,akonchandigarh@gmail.com,http://www.akonacademy.com,Bhumika Thakur,Monday - Sunday: 8 AM - 6 PM,"UGC Net Coaching , Home & Private Tuitions , UGC Net Commerce Coaching , UGC Net Economics Coaching , UGC Net Chemistry Coaching , CSIR UGC Net Life Sciences , SSC Entrance Exam Coaching , UGC Net Geography Coaching , IAS Entrance Coaching , UGC Net JRF Home Coaching , 2nd Year PUC Coaching , ","AKON ACADEMY is a pioneer institute in the field of grooming of students for different competitive examinations. The institute has given excellent results particularly in IAS/PCS CSAT, Bank(IBPS & SBI)-PO & Clerk, SSC, UGC NET/JRF Exams, GATE/PSU, TET( CTET, HTET, PsTET, HpTET) Coaching, MBA(CAT/CMAT)entrance Tests, CLAT/Law entrance exam, Hotel Management Entrance Tests, CDS, NDA, AFCAT, RAILWAYS entrance exams etc. Kindly contact us for more details.  ","http://localserviceassets.blob.core.windows.net:80/businessphoto-t/11-a8359751-8dbb-482c-abb6-4094f4c1a7d4.jpg , http://localserviceassets.blob.core.windows.net:80/businessphoto-t/22-a68e3b7d-f0cc-4749-82ef-4211f7a1ba9f.jpg , http://localserviceassets.blob.core.windows.net:80/businessphoto-m/11-a8359751-8dbb-482c-abb6-4094f4c1a7d4.jpg , http://localserviceassets.blob.core.windows.net:80/businessphoto-m/22-a68e3b7d-f0cc-4749-82ef-4211f7a1ba9f.jpg , ","UGC Net Commerce Coaching , UGC Net Economics Coaching , UGC Net Geography Coaching , UGC Net JRF Home Coaching , "
181468,SIEC Education Pvt. Ltd.,+91 172 3368977,,,,,"SCO, 451-452",Sector 35C,160035,chandigarh,India,shailendra@siecindia.com,http://www.siecindia.com,Shailendra Verma,Monday - Sunday : 24 Hrs,"Big Data Analytics Online Training , R Analytics Online Training , SAS Analytics Online Training , Web Analytics Online Training , SPSS Analytics Online Training , Tableau Analytics Online Training , Siebel Business Analytics Online Training , Hadoop Online Training , Microstrategy Online Training , PTE Coaching , Spoken English Classes , GRE Coaching , SAT Coaching , IELTS Coaching , TOEFL Coaching , GMAT Coaching , ","Sonya International Education - SIEC has vast experience in providing IELTS/TOEFL Coaching, GRE/SAT Coaching and GMAT Coaching. Bringing the best of value to our customers, we also care as much about our customers. Enhancing customer satisfaction through continual improvements in our Quality Management System. We look forward to your business and hope you would give us a chance to serve. Contact us to avail our service.  ","http://localserviceassets.blob.core.windows.net:80/businessphoto-t/logo21-c44e298b-c30b-4181-8049-edb0594bdf08.png , http://localserviceassets.blob.core.windows.net:80/businessphoto-t/1-8-2016%207-25-16%20PM-59ca9f5b-4011-4612-9b3c-60ff0b89d1b5.png , http://localserviceassets.blob.core.windows.net:80/businessphoto-t/1-8-2016%207-24-40%20PM-6210b7cb-81e7-4d64-baa4-2a038f320f95.png , http://localserviceassets.blob.core.windows.net:80/businessphoto-t/1-8-2016%207-24-18%20PM-936e32c5-c3c1-45a5-9efa-ca4d3c701773.png , http://localserviceassets.blob.core.windows.net:80/businessphoto-t/1-8-2016%207-22-58%20PM-b9be9015-b8af-4a7b-8371-9a89885adbd5.png , http://localserviceassets.blob.core.windows.net:80/businessphoto-m/logo21-c44e298b-c30b-4181-8049-edb0594bdf08.png , http://localserviceassets.blob.core.windows.net:80/businessphoto-m/1-8-2016%207-25-16%20PM-59ca9f5b-4011-4612-9b3c-60ff0b89d1b5.png , http://localserviceassets.blob.core.windows.net:80/businessphoto-m/1-8-2016%207-24-40%20PM-6210b7cb-81e7-4d64-baa4-2a038f320f95.png , http://localserviceassets.blob.core.windows.net:80/businessphoto-m/1-8-2016%207-24-18%20PM-936e32c5-c3c1-45a5-9efa-ca4d3c701773.png , http://localserviceassets.blob.core.windows.net:80/businessphoto-m/1-8-2016%207-22-58%20PM-b9be9015-b8af-4a7b-8371-9a89885adbd5.png , ","Classroom Tuitions , Daily Classes , GMAT Coaching , GRE Coaching , Hadoop Online Training , IELTS Coaching , Microstrategy Online Training , Spoken English Classes , SPSS Analytics Online Training , Tableau Analytics Online Training , TOEFL Coaching , Web Analytics Online Training , "
181469,Waves Tutorial,9915452288,,,,,No. 80/81,Sector 34,160034,chandigarh,India,,,,"Monday - Saturday: 9.30 AM - 8 PM, Monday - Saturday: 9.30 AM - 8 PM","SSC Entrance Exam Coaching , IAS Entrance Coaching , Banking Tuitions , SBI PO Training , ",,,
181470,Competition Classes,9780369366,,,,,No. 40,Sector 41D,160036,chandigarh,India,,,Anil Kumar,,"SSC Entrance Exam Coaching , RRB Entrance Exam Coaching , IBPS Bank Interview Coaching , School Tuitions for Math, Physics, Chemistry , Banking Tuitions , 2nd Year PUC Coaching , GMAT Coaching , CBSE Tuitions for Maths , College Tuitions for Maths , SSB & NDA Coaching , ",,,"IBPS Bank Interview Coaching , RRB Entrance Exam Coaching , School Tuitions for Math, Physics, Chemistry , SSB & NDA Coaching , SSC Entrance Exam Coaching , "
181471,NG Tutorials,9779125555,,,,,No. A/763,Sector 19C,160019,chandigarh,India,,,Nisha Gautam,,"School Tuitions for Math, Physics, Chemistry , School Tuitions for All Subjects , 2nd Year PUC Coaching , 10th STD Tuitions , 9th STD Tuitions , ",,,
181472,Institut De Francais,0172 - 2270685, 9814769688,,,,Hosue No. 2921,Mohali,160062,chandigarh,India,,,Dr. Navnit Kaur ,,"Language Training , French Language Training , Polish Lanuguage Training , Norwegian Language Training , Danish Language Training , Foreign Languages Coaching , Czech Language Training , Spoken English Classes , Language Development Coaching , ",,,"Norwegian Language Training , Polish Lanuguage Training , Spoken English Classes , "
181473,French Ace,9501694431,,,,,No. 442,Sector 12,134109,chandigarh,India,undinit20@gamil.com,,unit,,,,,
181474,Aiflc Foreign Languages & Translation Services,0172 - 4009390, 9888012118,,,,No. 19,Sector 8 B,160008,chandigarh,India,,http://www.aiflc.in,Ashu Jain ,Monday - Sunday: 9.30 AM - 6.30 PM,"Corporate Training Providers , Translators & Interpreters , Tourist Guides , Language Training , Arabic Language Training , French Language Training , German Language Training , Italian Language Training , Japanese Language Training , Korean Language Training , Mandarin Chinese Language Training , Russian Language Training , Urdu Language Training , Polish Lanuguage Training , Norwegian Language Training , Danish Language Training , Foreign Languages Coaching , Czech Language Training , Spoken English Classes , German Language Translators , Spanish Language Translators , French Language Translators , Italian Language Translators , Chinese Language Translators , Japanese Language Translators , Russian Translators , Korean Language Translators , Dutch Language Translators , English Language Translators , Hindi Language Translators , Corporate Accent Training , Spoken Bengali Classes , Arabic Language Translators , ",,,"Danish Language Training , Dutch Language Translators , English Language Translators , Foreign Languages Coaching , French Language Training , French Language Translators , German Language Training , German Language Translators , Hindi Language Translators , Italian Language Training , Italian Language Translators , Japanese Language Training , Japanese Language Translators , Korean Language Training , Korean Language Translators , Mandarin Chinese Language Training , Norwegian Language Training , Polish Lanuguage Training , Russian Language Training , Russian Translators , Spanish Language Translators , Spoken Bengali Classes , Spoken English Classes , Urdu Language Training , "
181475,Victor Tution Centre,9465231591,,,,,No. 1137,Sector 32C,141010,chandigarh,India,,,Victor,Monday - Saturday: 5 PM - 9 PM,"SBI PO Training , 10th STD Tuitions , ",,,
181476,Avalon Achievers,0172 - 5024540, 7355166164,,,,No. 68,Sector 17C,160017,chandigarh,India,avalonachievers@gmail.com,http://www.avalonachievers.com,,,"GRE Coaching , SAT Coaching , GMAT Coaching , ",,,
181477,Focus Institute,+91 172 3368091,,,,,No. 362/363,Sector 34A,160022,chandigarh,India,,http://www.focusinstitutechd.com,Pooja,,"Physics Tuitions (11th & 12th) , School Tuitions for Math, Physics, Chemistry , Medical Entrance Coaching , Biomedical Tuitions , CBSE Tuitions for Maths , ",,,
181478,Think Next Technologies Pvt. Ltd.,+91 172 3368141,,,,,No. 113,Mohali,160005,chandigarh,India,thinknextmohali@gmail.com,http://www.thinknexttraining.com,Munish Mittal,,"Job Training , Web Technologies Training , PHP & MySQL Training , SEO Training , Advanced Web Design Training , Digital Marketing Course , IELTS Coaching , ",,,"1 Year Program , 3 Months Program , 6 Months Program , Certification programs , "
181479,Professional Coaching Center,9876831214,,,,,No. 1897/2,Sector 52,160001,chandigarh,India,,,Surendra,,"Computer Science Tuitions (11th & 12th STD) , Physics Tuitions (11th & 12th) , Commerce Tuitions (11th & 12th STD) , School Tuitions for Math, Physics, Chemistry , School Tuitions for Accounts, Finance, Statistics , School Tuitions for All Subjects , 2nd Year PUC Coaching , SBI PO Training , 10th STD Tuitions , 9th STD Tuitions , School Tuitions for Biology , ",,,"Physics Tuitions (11th & 12th) , SBI PO Training , School Tuitions for Accounts, Finance, Statistics , School Tuitions for All Subjects , School Tuitions for Biology , School Tuitions for Math, Physics, Chemistry , "
181480,Sharma Maths Classes,0172 - 2739122, 9815939122,,,,No. 5460,Manimajra,160101,chandigarh,India,,,R.D. Sharma,Monday - Friday: 4 PM - 7 PM,"CBSE Tuitions for Maths , College Tuitions for Maths , ",,,
181481,PTC Aviation Academy,+91 44 33230207,,,,,"No. 16/29, 1st Main Road",Chromepet,600044,chandigarh,India,hrnova@worldptc.com,http://www.worldptc.com,Nova/Joseph,"Monday - Friday: 9 AM - 6 PM, Saturday: 9 AM - 1 PM","Coaching & Tuitions , Job Training , Shipping & Logistic Training , Aviation Industry Job Vacancies , Pilot Training , Airhostess Job Training , Airport Ground Staff Training , Flight Dispatcher Training , Presentations Skills Training , Aviation Management Training , IATA UFTTA Job Training , Spoken English Classes , Personality Development Training , Cabin Crew Job Training , Galileo GDS Job Training , Mass Communication Training , IELTS Coaching , TOEFL Coaching , Aircraft Maintenance Engineering (AME) Coaching , Travel & Tourism Job Training , Diploma in Pilot Training , Diploma in Air Hostess Training , Diploma in Airport Ground Staff Training , Diploma in Flight Dispatch Operations Training , Diploma in Aviation Management Training , Diploma in IATA UFTTA Job Training , Diploma in Galileo GDS Training , Language Development Coaching , Diploma in Travel & Tourism Training , Diploma in Hospitality Training , Aptitude Training , Diploma in Air Ticketing Training , Diploma in Banking & Finance (DBF) Training , Diploma in Fashion Designing Coaching , Public Speaking Training , ","PTC Aviation Academy, CHENNAI, is led by a professional team of enthusiasts with leading airline backgrounds. We specialize in training & development for airline personnel in various departments such as Ground crew, CSA, Ground staff, Documentation staff in Cargo until Airport Managers. We also specialize in recruitment for airlines & Cargo services. PTC - Aviation Academy is initiated and managed by Airline Professionals and a highly enterprising and motivated team. A premiere Aviation Academy offering courses in Ground Crew Training, Customer Services, Hospitality, and Travel & Tourism Training, Soft skill and English Fluency training. Contact us for your needs.  ","http://localserviceassets.blob.core.windows.net:80/businessphoto-t/PTCAC-1-047c9faf-52a7-4411-9a31-30d6f19ae3ba.jpg , http://localserviceassets.blob.core.windows.net:80/businessphoto-t/PTCAC-2-c3bbc0f8-b332-42e4-86f8-6ea0c574e7c2.jpg , http://localserviceassets.blob.core.windows.net:80/businessphoto-t/PTCAC-3-fcaba1e9-a5e8-4339-b986-e6f8ecb9860e.jpg , http://localserviceassets.blob.core.windows.net:80/businessphoto-t/PTCAC-4-91750188-2862-40a4-8cae-ed3a3d4fa199.jpg , http://localserviceassets.blob.core.windows.net:80/businessphoto-t/PTCAC-5-35d168a7-1f0e-4235-a0d0-15e18d2953a5.jpg , http://localserviceassets.blob.core.windows.net:80/businessphoto-t/Placement01-9ea8a301-82b1-4ff3-8e09-472fb4850feb.jpg , http://localserviceassets.blob.core.windows.net:80/businessphoto-t/Placement02-ebcf4cce-0496-4571-827b-6dd937dc39b9.jpg , http://localserviceassets.blob.core.windows.net:80/businessphoto-t/placemnent03-105bb34c-d21f-4d96-a473-bd379e099a88.jpg , http://localserviceassets.blob.core.windows.net:80/businessphoto-t/1-0f211369-c317-4697-ae8c-2c107860ab27.jpg , http://localserviceassets.blob.core.windows.net:80/businessphoto-t/2-fd823521-2c09-4bad-99c6-9ffb15431148.jpg , http://localserviceassets.blob.core.windows.net:80/businessphoto-t/3-a894d595-d3b9-4ac3-803f-4994ee3bbea6.jpg , http://localserviceassets.blob.core.windows.net:80/businessphoto-t/4-a0aa35d0-aa20-4080-aff0-9a156d327177.jpg , http://localserviceassets.blob.core.windows.net:80/businessphoto-t/5-cc0fdc3a-2132-4ee9-9dfc-7e786336c502.jpg , http://localserviceassets.blob.core.windows.net:80/businessphoto-t/6-e85615cd-51b4-475d-82d2-c2748608738b.jpg , http://localserviceassets.blob.core.windows.net:80/businessphoto-m/PTCAC-1-047c9faf-52a7-4411-9a31-30d6f19ae3ba.jpg , http://localserviceassets.blob.core.windows.net:80/businessphoto-m/PTCAC-2-c3bbc0f8-b332-42e4-86f8-6ea0c574e7c2.jpg , http://localserviceassets.blob.core.windows.net:80/businessphoto-m/PTCAC-3-fcaba1e9-a5e8-4339-b986-e6f8ecb9860e.jpg , http://localserviceassets.blob.core.windows.net:80/businessphoto-m/PTCAC-4-91750188-2862-40a4-8cae-ed3a3d4fa199.jpg , http://localserviceassets.blob.core.windows.net:80/businessphoto-m/PTCAC-5-35d168a7-1f0e-4235-a0d0-15e18d2953a5.jpg , http://localserviceassets.blob.core.windows.net:80/businessphoto-m/Placement01-9ea8a301-82b1-4ff3-8e09-472fb4850feb.jpg , http://localserviceassets.blob.core.windows.net:80/businessphoto-m/Placement02-ebcf4cce-0496-4571-827b-6dd937dc39b9.jpg , http://localserviceassets.blob.core.windows.net:80/businessphoto-m/placemnent03-105bb34c-d21f-4d96-a473-bd379e099a88.jpg , http://localserviceassets.blob.core.windows.net:80/businessphoto-m/1-0f211369-c317-4697-ae8c-2c107860ab27.jpg , http://localserviceassets.blob.core.windows.net:80/businessphoto-m/2-fd823521-2c09-4bad-99c6-9ffb15431148.jpg , http://localserviceassets.blob.core.windows.net:80/businessphoto-m/3-a894d595-d3b9-4ac3-803f-4994ee3bbea6.jpg , http://localserviceassets.blob.core.windows.net:80/businessphoto-m/4-a0aa35d0-aa20-4080-aff0-9a156d327177.jpg , http://localserviceassets.blob.core.windows.net:80/businessphoto-m/5-cc0fdc3a-2132-4ee9-9dfc-7e786336c502.jpg , http://localserviceassets.blob.core.windows.net:80/businessphoto-m/6-e85615cd-51b4-475d-82d2-c2748608738b.jpg , ","1 Month Program , 1 Week Program , 1 Year Program , 2 Weeks Programs , 3 Months Program , 6 Months Program , Aircraft Maintenance Engineering (AME) Coaching , Airhostess Job Training , Airport Ground Staff Training , Aptitude Training , Aviation Industry Job Vacancies , Aviation Management Training , Below Rs.1000 , Cabin Crew Job Training , Classroom Tuitions , Daily Classes , Diploma in Fashion Designing Coaching , Diploma in Flight Dispatch Operations Training , Diploma in Galileo GDS Training , Diploma in Hospitality Training , Diploma in IATA UFTTA Job Training , Diploma in Pilot Training , Diploma in Travel & Tourism Training , Flight Dispatcher Training , Galileo GDS Job Training , IATA UFTTA Job Training , IELTS Coaching , Language Development Coaching , Mass Communication Training , More than Rs.20000 , Personality Development Training , Pilot Training , Presentations Skills Training , Public Speaking Training , Rs.10000-Rs.20000 , Rs.1000-Rs.5000 , Rs.5000-Rs.10000 , Shipping & Logistic Training , Spoken English Classes , TOEFL Coaching , Travel & Tourism Job Training , "
181482,Fusion Coaching,+91 172 3368589,,,,,No. 23,Mohali,160055,chandigarh,India,khurana_1600@yahoo.co.in,http://https://www.fusioncoaching.in,,,"2nd Year PUC Coaching , CBSE Tuitions for Maths , 10th STD Tuitions , 9th STD Tuitions , ",,,
181483,Corner Stone,0172 - 3938906, 7307208826,,,,"SCF 57, 2nd Floor",Mohali,160064,chandigarh,India,studyatcornerstone@gmail.com,,Kamal Tuteja,Monday - Sunday: 8 AM - 9 PM,"Big Data Analytics Online Training , R Analytics Online Training , Spoken English Classes , ",,,
181484,Daffodils English Academy,0 - 4606666, 9216599324,,,,No. 2425/2426,Sector 22C,166022,chandigarh,India,chddaffodils@gmail.com,http://https://www.daffodilsstudy.com,Pooja,Monday - Saturday: 9 AM - 6 PM ( Lunch: 2 PM - 2.30 PM ),"Spoken English Classes , 2nd Year PUC Coaching , ",,,
181485,The Institute of Computer Accountant,+91 172 3368122,,,,,"SCO-16/17, 4th Floor",Sector 34,160034,chandigarh,India,chandigarh7113.cia@icagroup.in,http://icajobguarantee.com,Sudhir,Monday - Saturday: 8 AM - 8 PM,"Job Training , Corporate Training Providers , Enterprise Training , Accounting Job Training , CACPT Coaching , Commerce Tuitions (11th & 12th STD) , CS Coaching , Tally Training , Diploma in Banking & Finance (DBF) Coaching , CAT Coaching , Spoken English Classes , Banking Tuitions , MBA & BBA Coaching , Taxation Training , Share Marketing Training , Online Test Series for Exam , ","Back in 1999, when IT industry was gearing up for a major expansion drive in India, ICA began its journey with a mission to provide quality IT services at affordable prices to the masses. Almost two decades later, we are still on the mission; and in this process we have shaped thousands of careers and changed peoples' perception on accounts & finance education. Today we are considered as one of the leaders in accounts & finance education nationwide, with our top-notch training centers across the country offering the widest range of IT training program. The experiences of having trained over 2 lakh+ students helps us in understanding the exact requirements of the students and design our training program to suit their needs.  ",,"CS Coaching , Diploma in Banking & Finance (DBF) Coaching , MBA & BBA Coaching , Online Test Series for Exam , Share Marketing Training , Spoken English Classes , Tally Training , Taxation Training , "
