EduID,Name,Phone1,Phone2,Phone3,Phone4,Phone5,Street Address,Locality,Pincode,City,Country,Mail,Website,Person to Contact,Working Hours,Services Offered,Details,Images URL,Keywords
185617,Institute of Engineering,0824 - 2400112, 8722583369,,,,Post Box No. 23,Panambur,575010,mangalore,India,kavya.soni31@yahoo.com,http://www.amiestudycircle.com,Kavya,Monday - Saturday: 9 AM - 6 PM,"Engineering Tuitions , Mechanical Engineering Tuitions , Aerospace Engineering Tuitions , Biomedical Engineering Tuitions , Biomechanical Engineering Tuitions , Automotive Engineering Tuitions , Civil Engineering Tuitions , Architectural Engineering Tuitions , Electrical Engineering Tuitions , IT & Computer Science Engineering Tuitions , Robotics Engineering Tuitions , Microelectronic Engineering Tuitions , Chemical Engineering Tuitions , Environmental Engineering Tuitions , Materials Science Engineering Tuitions , Agricultural Engineering Tuitions , Engineering Tuitions - Other Branches , Engineering Physics Tuitions , Biotechnology Engineering Tuitions , Genetic Engineering Tuitions , Engineering Chemistry Tuitions , Mechatronics Engineering Tuitions , Software Engineering Tuitions , Electronics & Communication Engineering Tuitions , Instrumentation Technology Engineering Tuitions , Telecommunication Engineering Tuitions , Industrial & Production Engineering Tuitions , ",,,"Biomedical Engineering Tuitions , Biotechnology Engineering Tuitions , Chemical Engineering Tuitions , Civil Engineering Tuitions , Electrical Engineering Tuitions , Electronics & Communication Engineering Tuitions , Engineering Chemistry Tuitions , Engineering Physics Tuitions , Engineering Tuitions - Other Branches , Environmental Engineering Tuitions , Genetic Engineering Tuitions , Industrial & Production Engineering Tuitions , Instrumentation Technology Engineering Tuitions , IT & Computer Science Engineering Tuitions , Materials Science Engineering Tuitions , Mechanical Engineering Tuitions , Mechatronics Engineering Tuitions , Microelectronic Engineering Tuitions , Robotics Engineering Tuitions , Software Engineering Tuitions , Telecommunication Engineering Tuitions , "
185618,Veta,0824 - 3259979,,,,,3rd Floor,Hampankatta,575001,mangalore,India,,http://www.veta.in,,,"Spoken English Classes , ",,,
185619,Virutsha Academy,9972717383,,,,,No. 4-1-219/28,Bejai,575004,mangalore,India,,,,,"CACPT Coaching , CBSE Tuitions for Maths , CBSE Tuitions for Physics , CBSE Tuitions for Chemistry , ",,,
185620,Aqeel Spoken English,,,,,,3rd Floor,Bibi Alabi Road,575001,mangalore,India,aqeel.spoken@yahoo.com,,,,"Spoken English Classes , ",,,
185621,Cosmos Tutorials,9980462526, 7899523621,,,,Ground Floor,Hampankatta,575001,mangalore,India,,,,,"2nd Year PUC Coaching , Advanced Level (A-Level) Maths Tuitions , Advanced Level (A-Level) Physics Tuitions , 1st Year PUC Coaching , 10th STD Tuitions , 9th STD Tuitions , ",,,
185622,Gyan Shop,0824 - 4287772, 7795777722,,,,3rd Floor,Kankanady,575002,mangalore,India,,,,,"IIT Engineering Entrance Coaching , IB Maths Tuitions , IB Physics Tuitions , CET Entrance Coaching , IIT-JEE Coaching , ",,,
185623,Star Education Institute,0824 - 4253905,,,,,"No. C-41, 3rd Floor",Bunder,575001,mangalore,India,,,,,"Computer Science Tuitions (11th & 12th STD) , Spoken English Classes , ",,,
185624,Star Education Institute,0824 - 2464489,,,,,,Thokkottu,574183,mangalore,India,,,,,"Computer Science Tuitions (11th & 12th STD) , Spoken English Classes , ",,,
185625,Brilliant Coaching Classes,0824 - 2495995, 0824 - 4256995, 9900554995,,,3rd Floor,Kodailbail,575002,mangalore,India,,,,,"CET Entrance Coaching , 10th STD Tuitions , ",,,
185626,Brilliant Coaching Classes,0824 - 4267995,,,,,,Balmatta,575002,mangalore,India,,,,,"CET Entrance Coaching , 10th STD Tuitions , ",,,
185627,IMS Learning Resource Pvt. Ltd.,0824 - 2428408, 0824 - 4262288, 9945499858,,,1st Floor,Bendoor,575001,mangalore,India,,,,,"MBA & BBA Coaching , ",,,
185628,Accent English Lab,9343563831, 9480013840,,,,2nd Floor,Hampankatta,575001,mangalore,India,,,,Monday - Saturday: 9 AM - 6.30 PM,"Spoken English Classes , ",,,
185629,Delhi Academy of Medical Sciences,9886067181, 9886065161,,,,No. 475/6,Balmatta,575002,mangalore,India,,http://www.damsdelhi.com,,,"Medical Entrance Coaching , ",,,
185630,Matrix Coaching Centre,9900414509,,,,,2nd Floor,Surathkal,575014,mangalore,India,hiudupa@gmail.com,,G.K. Udupa,Monday - Sunday: 9 AM - 6.30 PM,"Computer Science Tuitions (11th & 12th STD) , Commerce Tuitions (11th & 12th STD) , Economics Coaching Classes (11th & 12th STD) , 10th STD Tuitions , 9th STD Tuitions , ","Matrix Coaching Centre for Competitive Studies is leading service provider with many years of experience in the industry. We provide services for CET Entrance Coaching, AIEEE Coaching, AITMT Coaching, NTSE Coaching, AMIE Coaching & SSB & NDA Coaching. We guarantee efficient service and satisfaction to our clients. We are happy to have you as our valuable client.  ",,
185631,PTC Aviation Academy,+91 44 33230207,,,,,"No. 16/29, 1st Main Road",Chromepet,600044,mangalore,India,hrnova@worldptc.com,http://www.worldptc.com,Nova/Joseph,"Monday - Friday: 9 AM - 6 PM, Saturday: 9 AM - 1 PM","Coaching & Tuitions , Job Training , Shipping & Logistic Training , Aviation Industry Job Vacancies , Pilot Training , Airhostess Job Training , Airport Ground Staff Training , Flight Dispatcher Training , Presentations Skills Training , Aviation Management Training , IATA UFTTA Job Training , Spoken English Classes , Personality Development Training , Cabin Crew Job Training , Galileo GDS Job Training , Mass Communication Training , IELTS Coaching , TOEFL Coaching , Aircraft Maintenance Engineering (AME) Coaching , Travel & Tourism Job Training , Diploma in Pilot Training , Diploma in Air Hostess Training , Diploma in Airport Ground Staff Training , Diploma in Flight Dispatch Operations Training , Diploma in Aviation Management Training , Diploma in IATA UFTTA Job Training , Diploma in Galileo GDS Training , Language Development Coaching , Diploma in Travel & Tourism Training , Diploma in Hospitality Training , Aptitude Training , Diploma in Air Ticketing Training , Diploma in Banking & Finance (DBF) Training , Diploma in Fashion Designing Coaching , Public Speaking Training , ","PTC Aviation Academy, CHENNAI, is led by a professional team of enthusiasts with leading airline backgrounds. We specialize in training & development for airline personnel in various departments such as Ground crew, CSA, Ground staff, Documentation staff in Cargo until Airport Managers. We also specialize in recruitment for airlines & Cargo services. PTC - Aviation Academy is initiated and managed by Airline Professionals and a highly enterprising and motivated team. A premiere Aviation Academy offering courses in Ground Crew Training, Customer Services, Hospitality, and Travel & Tourism Training, Soft skill and English Fluency training. Contact us for your needs.  ","http://localserviceassets.blob.core.windows.net:80/businessphoto-t/PTCAC-1-047c9faf-52a7-4411-9a31-30d6f19ae3ba.jpg , http://localserviceassets.blob.core.windows.net:80/businessphoto-t/PTCAC-2-c3bbc0f8-b332-42e4-86f8-6ea0c574e7c2.jpg , http://localserviceassets.blob.core.windows.net:80/businessphoto-t/PTCAC-3-fcaba1e9-a5e8-4339-b986-e6f8ecb9860e.jpg , http://localserviceassets.blob.core.windows.net:80/businessphoto-t/PTCAC-4-91750188-2862-40a4-8cae-ed3a3d4fa199.jpg , http://localserviceassets.blob.core.windows.net:80/businessphoto-t/PTCAC-5-35d168a7-1f0e-4235-a0d0-15e18d2953a5.jpg , http://localserviceassets.blob.core.windows.net:80/businessphoto-t/Placement01-9ea8a301-82b1-4ff3-8e09-472fb4850feb.jpg , http://localserviceassets.blob.core.windows.net:80/businessphoto-t/Placement02-ebcf4cce-0496-4571-827b-6dd937dc39b9.jpg , http://localserviceassets.blob.core.windows.net:80/businessphoto-t/placemnent03-105bb34c-d21f-4d96-a473-bd379e099a88.jpg , http://localserviceassets.blob.core.windows.net:80/businessphoto-t/1-0f211369-c317-4697-ae8c-2c107860ab27.jpg , http://localserviceassets.blob.core.windows.net:80/businessphoto-t/2-fd823521-2c09-4bad-99c6-9ffb15431148.jpg , http://localserviceassets.blob.core.windows.net:80/businessphoto-t/3-a894d595-d3b9-4ac3-803f-4994ee3bbea6.jpg , http://localserviceassets.blob.core.windows.net:80/businessphoto-t/4-a0aa35d0-aa20-4080-aff0-9a156d327177.jpg , http://localserviceassets.blob.core.windows.net:80/businessphoto-t/5-cc0fdc3a-2132-4ee9-9dfc-7e786336c502.jpg , http://localserviceassets.blob.core.windows.net:80/businessphoto-t/6-e85615cd-51b4-475d-82d2-c2748608738b.jpg , http://localserviceassets.blob.core.windows.net:80/businessphoto-m/PTCAC-1-047c9faf-52a7-4411-9a31-30d6f19ae3ba.jpg , http://localserviceassets.blob.core.windows.net:80/businessphoto-m/PTCAC-2-c3bbc0f8-b332-42e4-86f8-6ea0c574e7c2.jpg , http://localserviceassets.blob.core.windows.net:80/businessphoto-m/PTCAC-3-fcaba1e9-a5e8-4339-b986-e6f8ecb9860e.jpg , http://localserviceassets.blob.core.windows.net:80/businessphoto-m/PTCAC-4-91750188-2862-40a4-8cae-ed3a3d4fa199.jpg , http://localserviceassets.blob.core.windows.net:80/businessphoto-m/PTCAC-5-35d168a7-1f0e-4235-a0d0-15e18d2953a5.jpg , http://localserviceassets.blob.core.windows.net:80/businessphoto-m/Placement01-9ea8a301-82b1-4ff3-8e09-472fb4850feb.jpg , http://localserviceassets.blob.core.windows.net:80/businessphoto-m/Placement02-ebcf4cce-0496-4571-827b-6dd937dc39b9.jpg , http://localserviceassets.blob.core.windows.net:80/businessphoto-m/placemnent03-105bb34c-d21f-4d96-a473-bd379e099a88.jpg , http://localserviceassets.blob.core.windows.net:80/businessphoto-m/1-0f211369-c317-4697-ae8c-2c107860ab27.jpg , http://localserviceassets.blob.core.windows.net:80/businessphoto-m/2-fd823521-2c09-4bad-99c6-9ffb15431148.jpg , http://localserviceassets.blob.core.windows.net:80/businessphoto-m/3-a894d595-d3b9-4ac3-803f-4994ee3bbea6.jpg , http://localserviceassets.blob.core.windows.net:80/businessphoto-m/4-a0aa35d0-aa20-4080-aff0-9a156d327177.jpg , http://localserviceassets.blob.core.windows.net:80/businessphoto-m/5-cc0fdc3a-2132-4ee9-9dfc-7e786336c502.jpg , http://localserviceassets.blob.core.windows.net:80/businessphoto-m/6-e85615cd-51b4-475d-82d2-c2748608738b.jpg , ","1 Month Program , 1 Week Program , 1 Year Program , 2 Weeks Programs , 3 Months Program , 6 Months Program , Aircraft Maintenance Engineering (AME) Coaching , Airhostess Job Training , Airport Ground Staff Training , Aptitude Training , Aviation Industry Job Vacancies , Aviation Management Training , Below Rs.1000 , Cabin Crew Job Training , Classroom Tuitions , Daily Classes , Diploma in Fashion Designing Coaching , Diploma in Flight Dispatch Operations Training , Diploma in Galileo GDS Training , Diploma in Hospitality Training , Diploma in IATA UFTTA Job Training , Diploma in Pilot Training , Diploma in Travel & Tourism Training , Flight Dispatcher Training , Galileo GDS Job Training , IATA UFTTA Job Training , IELTS Coaching , Language Development Coaching , Mass Communication Training , More than Rs.20000 , Personality Development Training , Pilot Training , Presentations Skills Training , Public Speaking Training , Rs.10000-Rs.20000 , Rs.1000-Rs.5000 , Rs.5000-Rs.10000 , Shipping & Logistic Training , Spoken English Classes , TOEFL Coaching , Travel & Tourism Job Training , "
185632,Edutech Tutorials,0824 - 4256670,,,,,2nd Floor,Falnir,575002,mangalore,India,,,Pooja,Monday - Saturday: 3.30 PM - 9 PM,"GATE Coaching , Big Data Analytics Online Training , R Analytics Online Training , GATE Biotechnology Coaching , GATE Civil Engineering Coaching , GATE Chemical Engineering Coaching , GATE Computer Science Coaching , GATE Chemistry Coaching , GATE Mathematics Coaching , GATE Physics Coaching , GATE Electronics Engineering Coaching , GATE Electrical Engineering Coaching , GATE Instrumental Engineering Coaching , GATE Mechanical Engineering Coaching , GATE Production Engineering Coaching , GATE Industrial Engineering Coaching , GATE Coaching for Other Subjects , CBSE Tuitions for Maths , CBSE Tuitions for Physics , CBSE Tuitions for Chemistry , ",,,"GATE Chemistry Coaching , GATE Civil Engineering Coaching , GATE Coaching for Other Subjects , GATE Computer Science Coaching , GATE Electrical Engineering Coaching , GATE Electronics Engineering Coaching , GATE Industrial Engineering Coaching , GATE Instrumental Engineering Coaching , GATE Mathematics Coaching , GATE Mechanical Engineering Coaching , GATE Physics Coaching , GATE Production Engineering Coaching , R Analytics Online Training , "
185633,Shree Devi Coaching Class,9620421806,,,,,,Kadri,575002,mangalore,India,,,Karunakara shetty,Monday - Saturday: 10 AM - 4 PM,"Spoken English Classes , ",,,
185634,Quick Academy,0824 - 2454724, 9242207089,,,,1st Floor,Ladyhill,575006,mangalore,India,,http://www.alohaindia.com,,,"UGC Net Coaching , UGC Net English Literature Coaching , Spoken English Classes , ",,,
185635,Agile TEC IT Training Center,0824 - 4260555, 8880421893,,,,"Office No. 4, 1st Floor, Commercial Complex",Lalbagh,575003,mangalore,India,info@agiletec.in,http://www.agiletec.in,Suhas,Monday - Saturday: 9 AM - 7.30 PM,"Certification Courses Training , Database Training , Mobile Development Training , Programming Languages Training , Web Technologies Training , Programming Languages Online Training , Database Management Training , Android Application Development Training , Advanced C Programming Training , Web Designing Training , Core Java Online Training , C, C++ Training , Java & J2EE Training , Hibernate Computer Training , Basic Language Training , IEEE Computer Projects Training , PHP & MySQL Training , Academic Projects Training , Struts Training , Spring Training , HADOOP Training , Advanced JAVA Training , Advanced C++ Training , Big Data Training , HTML Training , Apache Tomcat Training , CSS Training , JQuery Training , Final Year Project Training , Advanced PHP Training , ","Agile TEC IT Training Center:""Welcome to AgileTEC.
We are a group of IT graduates having hands on experience on software development and the faculty from different colleges. The various course materials have been carefully designed to fulfill your needs and current IT demands.
We are a group of IT professionals who share similar vision of starting a computer education centre which would provide quality training in various specializations of IT.
We offer various courses, both short term and long term. Visit our site http://www.agiletec.in/courses.shtml for more details.Do join us,explore the field of software technology and become an expert in IT.
AgileTEC course developers and instructors combine extensive experience and knowledge of the principles of learning to provide quality IT training.What We Offer
- Training by experienced IT Professionals
- Project guidance to attain practical knowledge on the programming languages learnt
- Academic project guidance- Seminar on current IT trends
- Java/J2EE/Android Certification oriented courses
- Opportunity to work on live projects ""  ","http://localserviceassets.blob.core.windows.net:80/businessphoto-t/14-11-2015%2017-23-15-b51bd7e8-e684-48e3-8f46-17e2f4d46ecb.jpg , http://localserviceassets.blob.core.windows.net:80/businessphoto-t/14-11-2015%2017-23-40-d923ae78-3bcf-4ee8-abf4-7da5360de45e.jpg , http://localserviceassets.blob.core.windows.net:80/businessphoto-t/14-11-2015%2017-23-46-2e613264-1036-443f-9e01-8556d46fe650.jpg , http://localserviceassets.blob.core.windows.net:80/businessphoto-t/14-11-2015%2017-23-53-9e1e43df-1c35-4780-ae72-492679f4836c.jpg , http://localserviceassets.blob.core.windows.net:80/businessphoto-t/14-11-2015%2017-24-02-55bcd392-e918-4f3c-b00d-a3282bdea726.jpg , http://localserviceassets.blob.core.windows.net:80/businessphoto-t/14-11-2015%2017-24-25-2a1aa9ae-31c6-4959-86a7-f3577b9173fb.jpg , http://localserviceassets.blob.core.windows.net:80/businessphoto-t/service1-bf9b9517-7c8a-4fdc-be29-209dc2238406.jpg , http://localserviceassets.blob.core.windows.net:80/businessphoto-t/service2-e8f99a84-7876-497b-a21b-e737a2176824.jpg , http://localserviceassets.blob.core.windows.net:80/businessphoto-m/14-11-2015%2017-23-15-b51bd7e8-e684-48e3-8f46-17e2f4d46ecb.jpg , http://localserviceassets.blob.core.windows.net:80/businessphoto-m/14-11-2015%2017-23-40-d923ae78-3bcf-4ee8-abf4-7da5360de45e.jpg , http://localserviceassets.blob.core.windows.net:80/businessphoto-m/14-11-2015%2017-23-46-2e613264-1036-443f-9e01-8556d46fe650.jpg , http://localserviceassets.blob.core.windows.net:80/businessphoto-m/14-11-2015%2017-23-53-9e1e43df-1c35-4780-ae72-492679f4836c.jpg , http://localserviceassets.blob.core.windows.net:80/businessphoto-m/14-11-2015%2017-24-02-55bcd392-e918-4f3c-b00d-a3282bdea726.jpg , http://localserviceassets.blob.core.windows.net:80/businessphoto-m/14-11-2015%2017-24-25-2a1aa9ae-31c6-4959-86a7-f3577b9173fb.jpg , http://localserviceassets.blob.core.windows.net:80/businessphoto-m/service1-bf9b9517-7c8a-4fdc-be29-209dc2238406.jpg , http://localserviceassets.blob.core.windows.net:80/businessphoto-m/service2-e8f99a84-7876-497b-a21b-e737a2176824.jpg , ","Android Application Development Training , Apache Tomcat Training , Basic Language Training , Big Data Training , C, C++ Training , Core Java Online Training , CSS Training , Database Management Training , Final Year Project Training , HADOOP Training , Hibernate Computer Training , HTML Training , IEEE Computer Projects Training , Java & J2EE Training , JQuery Training , PHP & MySQL Training , Spring Training , Struts Training , Web Designing Training , "
185636,Excel Design & Techno Tutor,9743849147,,,,,,Kinnigoli,574151,mangalore,India,,,,,"Engineering Tuitions , Mechanical Engineering Tuitions , Aerospace Engineering Tuitions , Biomedical Engineering Tuitions , Biomechanical Engineering Tuitions , Automotive Engineering Tuitions , Civil Engineering Tuitions , Architectural Engineering Tuitions , Electrical Engineering Tuitions , IT & Computer Science Engineering Tuitions , Robotics Engineering Tuitions , Microelectronic Engineering Tuitions , Chemical Engineering Tuitions , Environmental Engineering Tuitions , Materials Science Engineering Tuitions , Agricultural Engineering Tuitions , Engineering Tuitions - Other Branches , Engineering Physics Tuitions , Biotechnology Engineering Tuitions , Genetic Engineering Tuitions , Engineering Chemistry Tuitions , Mechatronics Engineering Tuitions , Software Engineering Tuitions , Electronics & Communication Engineering Tuitions , Instrumentation Technology Engineering Tuitions , Telecommunication Engineering Tuitions , Industrial & Production Engineering Tuitions , Engineering EAMCET Coaching , IIT Engineering Entrance Coaching , ",,,"Biomedical Engineering Tuitions , Biotechnology Engineering Tuitions , Chemical Engineering Tuitions , Civil Engineering Tuitions , Electrical Engineering Tuitions , Electronics & Communication Engineering Tuitions , Engineering Chemistry Tuitions , Engineering EAMCET Coaching , Engineering Physics Tuitions , Engineering Tuitions - Other Branches , Environmental Engineering Tuitions , Genetic Engineering Tuitions , IIT Engineering Entrance Coaching , Industrial & Production Engineering Tuitions , Instrumentation Technology Engineering Tuitions , IT & Computer Science Engineering Tuitions , Materials Science Engineering Tuitions , Mechanical Engineering Tuitions , Mechatronics Engineering Tuitions , Microelectronic Engineering Tuitions , Robotics Engineering Tuitions , Software Engineering Tuitions , Telecommunication Engineering Tuitions , "
185637,Aptus Academy,9008408505,,,,,"1st Floor, Kakanady Bypass Road, Near Omega Hospital",Pumpwell,575004,mangalore,India,aptusacademymlr@gmail.com,,Jayachandra,Monday - Sunday: 9 AM - 9 PM,"Spoken English Classes , Spoken Kannada Classes , ","Aptus Academy - We are in this field from many years and have huge experience in it. At Aptus Academy, students will develop the skills for academic performance and confidence & interactive skills - in general. We can help you improve your subject knowledge, reading skills and problem-solving abilities. We begin with a unique approach of learning that sets us apart from other tutors. In fact, more students turn to us than any other tutor. For further details feel free to contact us.  ",,
185638,Trisha Classes,9945212302, 9740551602,,,,,Bolar,574201,mangalore,India,nsgopi77@hotmail.com,http://www.trishaclasses.com,Nagesh,"Monday - Saturday: 8 AM - 8 PM, Sunday: 8 AM - 2 PM","CMA Coaching , ","Trisha Classes offer excellent service, effective coaching, easy accessibility, timely tips, friendly ambience, making every student feel owned and important. At Trisha Classes We arrange College Tuitions for Accounts Finance Statistics, Tuitions for College Subjects, CACPT Coaching, ACS Coaching. Contact us for further details  ",,"1 Month Program , 1 Week Program , 1 Year Program , 2 Weeks Programs , 3 Months Program , 6 Months Program , Below Rs.1000 , Classroom Tuitions , Rs.5000-Rs.10000 , Short Term , "
185639,Cfal india. com,0824 - 4279374, 9900520233,,,,,Kapikad,575004,mangalore,India,teachers@cfalindia.com,http://www.cfalindia.com,Teachers,Monday - Saturday: 9.30 AM - 6.30 PM,"Actuarial Science Coaching , Advanced Economics Coaching Classes (College level and above) , Advanced Level (A-Level) Chemistry Tuitions , ",,,
