EduID,Name,Phone1,Phone2,Phone3,Phone4,Phone5,Street Address,Locality,Pincode,City,Country,Mail,Website,Person to Contact,Working Hours,Services Offered,Details,Images URL,Keywords
170546,Rayborn Right Brain Education,0422 - 4359927, 9361999927,,,,"No.1569-D , 1st Floor .",Trichy Road,641018,coimbatore,India,jobs.rayborn@gmail.com,http://www.rayborn.in,Gayathri ,Monday - Sunday: 10 AM - 7 PM,"Coaching & Tuitions , Fine Art & Canvas Painting , Drawing & Painting Classes , Fine Arts & Painting Works , Oil Painting Classes , Water Painting Classes , Handwriting, Spelling & Reading Classes , ",,,
170547,Shankar IAS Academy,+91 422 3382540,,,,,"No. 6,",Ramnagar,641009,coimbatore,India,siapovai@gmail.com,,Shankar,Monday - Sunday: 10 AM - 9 PM ( Lunch: 12 PM - 1.30 PM ),"Corporate Training Providers , Aeronautics Engineering Tuitions , IAS Entrance Coaching , ACT Exam Coaching , Corporate Accent Training , Banking Training , Corporate Computer Training , CSQA (Certified Software Quality Analyst) Training , ACS Coaching , ",,,"Corporate Computer Training , CSQA (Certified Software Quality Analyst) Training , IAS Entrance Coaching , "
170548,Divine E Solutions,0422 - 4273402, 0422 - 4323722, 9952415402,,,No. 220/223,Gandhi Puram,641012,coimbatore,India,divineesolutions@gmail.com,,Joseph,Monday - Saturday: 9.30 AM - 7 PM,"Computer - Leasing & Rentals , Computer Dealers , Astrologers , Computer Repair & Services , Coaching & Tuitions , Job Training , Computer Software Dealers , Computer Accessory Dealers , Solar Product Dealers , Software Development Services , Computer Networking Services , Security System Dealers , Office Furniture Dealers , Computer Rentals , Computer Server Dealers , Computer Networking Accessory Dealers , Building Consultants & Contractors , Administration Training , Computer Networking Training , Ethical Hacking Training , Networking & Cisco Training , Scrap Buyers , Operating System Online Training , Solar Products Repair & Services , Computer Networking Online Training , Battery Repair & Services , Scanner Repairs & Services , Printer Dealers , Scanner Dealers , Solar Thermal Collector Dealers , Computer Router Dealers , Computer Server Rentals , Computer Network Infrastructure Upgrades , Solaris Administration Training , Computer Hacking Forensic Investigation , Computer Scanners Repair & Services , Computer Scanner Dealers , Computer Data Cabinet Dealers , Solar Cooker Dealers , Solar Hair Dryer Dealers , Solaris OS Online Training , Solar Battery Repair & Services , Solar Power Pack Dealers , Solar Power Plant Dealers , Solar CCTV Camera Dealers , Computer Printer Dealers , Solar Steam Generating System Dealers , Solar Street Light Dealers , Computer Mouse Repair & Services , Computer Motherboard Repair Services , Solar Water Heater Dealers , Solar Lantern Dealers , Computer Disaster Recovery Services , ",,,"Computer Furniture Dealers , Computer Games Software Providers , Computer Hacking Forensic Investigation , Computer Hardware Job Training , Computer Horoscope Services , Computer Monitor & Keyboard Dealers , Computer Motherboard & Processor Dealers , Computer Motherboard Repair Services , Computer Mouse Repair & Services , Computer Network Cabling Services , Computer Network Infrastructure Upgrades , Computer Printer Dealers , Computer Printer Rentals , Computer Printer Repair & Services , Computer RAM & Hard Disk Dealers , Computer Router Dealers , Computer Scanner Dealers , Computer Scanner Rentals , Computer Scanners Repair & Services , Computer Science Tuitions (11th & 12th STD) , Computer Scrap Buyers , Computer Server Rentals , Computer Small Accessories Dealers , Computer Table Dealers , Computer Telephony Integration Software Providers , Computer Under Warranty Service , Computer UPS & Inverter Dealers , Solar Battery Dealers , Solar Battery Repair & Services , Solar CCTV Camera Dealers , Solar Cooker Dealers , Solar Fencing Dealers , Solar Hair Dryer Dealers , Solar Inverter Dealers , Solar Lantern Dealers , Solar Lighting Suppliers , Solar module Dealers , Solar Panel Dealers , Solar Power Pack Dealers , Solar Power Plant Dealers , Solar Pump Dealers , Solar Steam Generating System Dealers , Solar Street Light Dealers , Solar Thermal Collector Dealers , Solar UPS Dealers , Solar Water Heater Dealers , Solaris Administration Training , Solaris OS Online Training , "
170549,Saraswathy Medicals,0422 - 2673499, 9943478475,,,,No.  5/51,Sundarapuram,641024,coimbatore,India,,,R. Ravindraraj,Monday - Sunday: 9 AM - 10.30 PM,"Home & Private Tuitions , Chemistry Home Tuitions for school , Chemistry Home Tuitions 11th & 12th , Chemistry Tuitions (11th & 12th) , ",,,
170550,mr.knowledge academy,9952554911,,,,,"no.5 KKR NAGAR NEAR, ANANYA GARDEN,, NANA NANI MOUTHI HOSPITAL ROAD,, VADAVALLI",Vadavalli,641041,coimbatore,India,knowledge2gaincbe@gmail.com,,bharani tharan,Monday - Saturday: 9 AM - 9 PM,"Competitive Exams Online Coaching , Biochemistry Degree Tuitions , Botony Tuitions , AIIMS Online Coaching , Medical Entrance Online Coaching , IIT JEE Online Coaching , SSC Entrance Exam Coaching , Computer Science Tuitions (11th & 12th STD) , JEE Advanced Online Coaching , Online PTE Coaching , IIT JAM Online Coaching , Physics Tuitions (11th & 12th) , Integrated Professional Competency (IPCC) Coaching , CSIR Net Mathematical Sciences Online Coaching , PMT Online Coaching , UPSC Coaching , CTET Coaching , IIT HSEE Online Coaching , IBPS Bank Interview Coaching , BHMS Coaching , Medical EAMCET Coaching , Matriculation Tuitions for Hindi & English , Navodaya Vidyalaya Entrance Coaching , PSU Entrance Coaching , PWD/CPWD Entrance Coaching , IIT Engineering Entrance Coaching , College Tuitions for Accounts, Finance, Statistics , Tuitions for College Subjects , School Tuitions for Math, Physics, Chemistry , School Tuitions for All Subjects , Spoken English Classes , B.B.A. Entrance Coaching , MBBS Tuitions , Polytechnic Entrance Coaching , B.Arch Coaching Classes , ISC Tuitions for 11th & 12th , SAT Coaching , Medical Entrance Coaching , SSC JE Entrance Coaching , Spoken Hindi Classes , Banking Tuitions , Handwriting, Spelling & Reading Classes , MBA & BBA Coaching , Biomedical Tuitions , Technical and Vocational Education and Training (TVET) , Economics Coaching Classes (11th & 12th STD) , Advanced Economics Coaching Classes (College level and above) , Chemistry Tuitions (11th & 12th) , IB Chemistry Tuitions , Biology Tuitions (11th & 12th) , 2nd Year P Show less « , ",,,"AIPMT Coaching , All India Common Entrance Examination (AICEE) Coaching , AMIE Coaching , Architecture Entrance Coaching , B.Arch Coaching Classes , B.B.A. Entrance Coaching , B.Com Coaching , B.Pharm Coaching , B.Sc. IT Coaching , Banking Tuitions , BHMS Coaching , Biochemistry Degree Tuitions , Bioinformatics Training , Biology Tuitions (11th & 12th) , Biomedical Tuitions , BJMC Coaching , BMS Coaching , Botony Tuitions , CBSE Accounts (11th & 12th ) Tuitions , CBSE Tuitions for Chemistry , CBSE Tuitions for English , CBSE Tuitions for Hindi , CBSE Tuitions for Maths , CBSE Tuitions for Physics , Certified Public Accountant (CPA) Coaching , Chemistry Tuitions (11th & 12th) , College Tuitions for Accounts, Finance, Statistics , College Tuitions for Chemistry , College Tuitions for Maths , College Tuitions for Physics , Computer Science Tuitions (11th & 12th STD) , CSIR Net Mathematical Sciences Online Coaching , CTET Coaching , Diploma in Fashion Designing Coaching , Economics Coaching Classes (11th & 12th STD) , GMAT Coaching , Handwriting, Spelling & Reading Classes , IB Chemistry Tuitions , IB Physics Tuitions , IBPS Bank Interview Coaching , ICSE Biology Tuitions , ICSE Chemistry Tuitions , ICSE English Tuitions , ICSE Maths Tuitions , ICSE Physics Tuitions , IGCSE Accounts 11th & 12th , IGCSE Business Studies 11th & 12th , IGCSE Chemistry Tuitions , IIT Engineering Entrance Coaching , IIT HSEE Online Coaching , IIT JAM Coaching , IIT JAM Online Coaching , IIT JEE Online Coaching , IIT-JEE Coaching , Integrated Professional Competency (IPCC) Coaching , ISC Tuitions for 11th & 12th , JEE Advanced Coaching , JEE Advanced Online Coaching , Learning Problem Children Coaching , M.Com Entrance Exam Coaching , Matriculation Tuitions for Hindi & English , MBA & BBA Coaching , MBA in IT Coaching , MBBS Tuitions , Medical EAMCET Coaching , Medical Entrance Coaching , Medical Entrance Online Coaching , Navodaya Vidyalaya Entrance Coaching , Online PTE Coaching , Physics Tuitions (11th & 12th) , Physiology Tuitions , PMT Online Coaching , Polytechnic Entrance Coaching , Printing Technology Courses , PSU Entrance Coaching , PWD/CPWD Entrance Coaching , SAT Coaching , School Tuitions for All Subjects , School Tuitions for Biology , School Tuitions for Math, Physics, Chemistry , Spoken English Classes , Spoken Hindi Classes , Spoken Telugu Classes , SSC Entrance Exam Coaching , SSC JE Entrance Coaching , Technical and Vocational Education and Training (TVET) , TNPSC Entrance Coaching , Tuitions for College Subjects , UPSC Coaching , Vedic Maths Coaching , Zoology Tuitions , "
170551,mr.knowledge academy,9952554911,,,,,"no.5 KKR NAGAR NEAR, ANANYA GARDEN,, NANA NANI MOUTHI HOSPITAL ROAD,, VADAVALLI",Vadavalli,641041,coimbatore,India,knowledge2gaincbe@gmail.com,,bharani tharan,,"Competitive Exams Online Coaching , Microbiology & Biotechnology Tuitions , Biochemistry Degree Tuitions , Botony Tuitions , AIIMS Online Coaching , Medical Entrance Online Coaching , IIT JEE Online Coaching , JEE Advanced Online Coaching , KCET Online Coaching , IIT JAM Online Coaching , PGT Online Coaching , PMT Online Coaching , MCI Screening Test Online Coaching , IIT HSEE Online Coaching , CS Coaching , BHMS Coaching , Medical EAMCET Coaching , Navodaya Vidyalaya Entrance Coaching , IIT Engineering Entrance Coaching , College Tuitions for Accounts, Finance, Statistics , School Tuitions for Math, Physics, Chemistry , School Tuitions for Accounts, Finance, Statistics , School Tuitions for All Subjects , Spoken English Classes , B.B.A. Entrance Coaching , MBBS Tuitions , ISC Tuitions for 11th & 12th , Economics Coaching Classes (9th & 10th STD) , Medical Entrance Coaching , Spoken Hindi Classes , MBA & BBA Coaching , Technical and Vocational Education and Training (TVET) , Economics Coaching Classes (11th & 12th STD) , Advanced Economics Coaching Classes (College level and above) , Chemistry Tuitions (11th & 12th) , Biology Tuitions (11th & 12th) , IIT JAM Coaching , CBSE Tuitions for Hindi , CBSE Tuitions for English , CBSE Tuitions for Maths , CBSE Tuitions for Physics , CBSE Tuitions for Chemistry , College Tuitions for Maths , College Tuitions for Physics , IGCSE Physics Tuitions , ICSE Hindi Tuitions , IB Maths Tuitions , ICET Coaching , BDS Coaching , Placement Training , Aptitude Training , ICSE Physics Tuitions , ",,,"AIIMS Online Coaching , Aptitude Training , B.B.A. Entrance Coaching , B.Com Entrance Exam Coaching , B.Sc. IT Coaching , BDS Coaching , BHMS Coaching , Biochemistry Degree Tuitions , Biology Tuitions (11th & 12th) , Botony Tuitions , CBSE Tuitions for Chemistry , CBSE Tuitions for English , CBSE Tuitions for Hindi , CBSE Tuitions for Maths , CBSE Tuitions for Physics , CET Entrance Coaching , Chemistry Tuitions (11th & 12th) , College Tuitions for Accounts, Finance, Statistics , College Tuitions for Maths , College Tuitions for Physics , CS Coaching , Economics Coaching Classes (11th & 12th STD) , Economics Coaching Classes (9th & 10th STD) , IB Maths Tuitions , ICET Coaching , ICSE Biology Tuitions , ICSE Hindi Tuitions , ICSE Physics Tuitions , IES Coaching , IGCSE Physics Tuitions , IIT Engineering Entrance Coaching , IIT HSEE Online Coaching , IIT JAM Coaching , IIT JAM Online Coaching , IIT JEE Online Coaching , IIT-JEE Coaching , ISC Tuitions for 11th & 12th , JEE Advanced Coaching , JEE Advanced Online Coaching , KCET Online Coaching , Maths Tuitions 11th &12th , MBA & BBA Coaching , MBBS Tuitions , MCA Entrance Exam Coaching , MCI Screening Test Online Coaching , Medical EAMCET Coaching , Medical Entrance Coaching , Medical Entrance Online Coaching , Microbiology & Biotechnology Tuitions , MSC Entrance Exam Coaching , Navodaya Vidyalaya Entrance Coaching , Online School Coaching Classes , PGT Online Coaching , Placement Training , PMT Online Coaching , Public Speaking Training , School Tuitions for Accounts, Finance, Statistics , School Tuitions for All Subjects , School Tuitions for Math, Physics, Chemistry , Spoken English Classes , Spoken Hindi Classes , Tamil Tuitions , TANCET Entrance Coaching , Technical and Vocational Education and Training (TVET) , Zoology Tuitions , "
170552,Carpe Diem Skills Academy,9902959029,,,,,"No. 65,",Saibaba Colony,641011,coimbatore,India,carpediemskillsacademy@gmail.com,,Apoorva Lakshmi Aravind,Monday - Sunday: 10 AM - 9 PM,"Corporate Training Providers , Goal Setting Training , IBPS Bank Interview Coaching , Spoken English Classes , IELTS Coaching , TOEFL Coaching , Interpersonal Skills Training , Personality Development Training , Soft Skills Training , Stress Management Training , Team Building Training , Train the Trainer , Language Development Coaching , Placement Training , Aptitude Training , Public Speaking Training , IBPS Bank Exam Coaching , ",,,"Interpersonal Skills Training , Language Development Coaching , Personality Development Training , Placement Training , Public Speaking Training , Soft Skills Training , Spoken English Classes , Stress Management Training , Team Building Training , TOEFL Coaching , Train the Trainer , "
170553,Physics Academy,+91 422 3382349,,,,,No. T85,Kovaipudur,641042,coimbatore,India,unni.pmg@gmail.com,,Unnikrishnan,Monday - Sunday: 6 AM - 9 PM,"Physics Tuitions (11th & 12th) , School Tuitions for Math, Physics, Chemistry , 2nd Year PUC Coaching , CBSE Tuitions for Maths , CBSE Tuitions for Physics , College Tuitions for Physics , 1st Year PUC Coaching , 10th STD Tuitions , 9th STD Tuitions , ",,,"CBSE Tuitions for Physics , College Tuitions for Physics , Physics Tuitions (11th & 12th) , School Tuitions for Math, Physics, Chemistry , "
170554,Karka Kasadara Tuition Centre,9443654551,,,,,No. 480,Uppilipalayam,641105,coimbatore,India,gurusaravanan1980@gmail.com,http://www.Karkakasadaratutioncentre.org,Saravanan Kannan,Monday - Sunday: 9 AM - 7 PM,"Computer Science Tuitions (11th & 12th STD) , Commerce Tuitions (11th & 12th STD) , 2nd Year PUC Coaching , Advanced Level (A-Level) Maths Tuitions , Advanced Level (A-Level) Physics Tuitions , Advanced Level (A-Level) Chemistry Tuitions , 1st Year PUC Coaching , 10th STD Tuitions , 9th STD Tuitions , ",,,"Advanced Level (A-Level) Maths Tuitions , Advanced Level (A-Level) Physics Tuitions , Commerce Tuitions (11th & 12th STD) , Computer Science Tuitions (11th & 12th STD) , "
170555,Quantum,9900880047,,,,,No. 23,Anaimalai,600008,coimbatore,India,,,Sam,Monday - Saturday: 10 AM - 7 PM,"Biochemistry Degree Tuitions , Botony Tuitions , Zoology Tuitions , Online Test Series for Exam , ",,,
170556,Institute of Computer Accountants,0422 - 2446174, 9500969309,,,,,Saibaba Colony,641011,coimbatore,India,shivaraman.ica@gmail.com,http://www.icagroup.in,Shivaraman,,"Chartered Accountant Coaching , Share Marketing Training , ",,,
170557,I Secure Education & Migration Consultant Pvt. Ltd.,+91 422 3382172,,,,,"No 4, Asha Apartments, Tatabad 2nd Street,Shivanda Colony, Coimbatore",,,coimbatore,India,isecureeducations@gmail.com,http://www.isecureconsultant.com,Anitha,Monday - Saturday: 9.30 AM - 8 PM,"Coaching & Tuitions , Nurse Training , Mauritius Education Consultants , DHA Exam Training , HAAD Exam Training , Prometric Exam Training , USA Education Consultants , UK Education Consultants , NCLEX-RN Exam Training  , CRN Exam Training , Australia Education Consultants , Canada Education Consultants , New Zealand Education Consultants , MOH exam Training , Russia Education Consultants , Cyprus Education Consultants , Austria Education Consultants , Poland Education Consultants , PTE Coaching , France Education Consultants , Germany Education Consultants , Spoken English Classes , MBBS Tuitions , MCI Screening Test Coaching , USMLE Coaching , GRE Coaching , Singapore Education Consultants , Switzerland Education Consultants , IELTS Coaching , TOEFL Coaching , GMAT Coaching , Ukraine Education Consultants , Europe Education Consultants , Italy Education Consultants , Language Development Coaching , Placement Training , Aptitude Training , Ireland Education Consultants , Sweden Education Consultants , Norway Education Consultants , Finland Education Consultants , Philippines Education Consultants , Malaysia Education Consultants , Armenia Education Consultants , Dubai Education Consultants , Denmark Education Consultants , China Education Consultants , Pre-Medical Test (PMT) Entrance Coaching , ","iSecure is a new feather in Secure Groups cap. iSecure Group, a well reputed, diversified 35 Years old prominent group companies in the UAE, proudly introduces a new division iSecure Education and Migration Consultant Pvt. Ltd, India
iSecure Education and Migration Consultant Pvt. Ltd is a Foreign Direct Investment company offering student placement and Migration services. iSecure study Abroad Team helps students to make the right overseas educational decisions. Our expertise in the field of overseas education has made us a time- tested resource in helping students to gain admission for suitable courses in recognizing universities across the Globe. We are a team of informed and committed senior education advisors/ counselors who understand the need of the students and their parents. We firmly believe in customer service to the students and our client institutions. Our strongly student centered approach to counseling means; we give students the fullest possible information on all the options available to help them make sensible decisions.
iSecure helps candidates score high in competitive exams like TOEFL, GRE and IELTS. Our foreign language training programs are suitable for anyone who is aspiring to study, work or stay abroad.Also We Deal with :
Admission in Medical Universities Abroad
Internationally recognized degrees
High Quality study programs in an International environment
Worlds oldest and highly ranked Universities
Counseling by experienced top education experts
Personal consultation and assessments
Affordable fee structure and better career prospects
Travel and accommodation arrangements
Hassle free documentation
Guidance for United States Medical Licensing Examination (USMLE)
Students with 50% marks in +2 can pursue medical course (Biology/ Science Group)
No donation, World Rank Universities recognized by Government of India.
  ","http://localserviceassets.blob.core.windows.net:80/businessphoto-t/h-b3ccc739-4993-4655-b0e4-a95d244ea8b9.jpg , http://localserviceassets.blob.core.windows.net:80/businessphoto-t/a-bebbc4cd-28dd-40cd-b106-44f1884d3ce4.jpg , http://localserviceassets.blob.core.windows.net:80/businessphoto-t/l-1c1c42d2-57a5-4449-9d50-311807606d03.jpg , http://localserviceassets.blob.core.windows.net:80/businessphoto-t/m-274a6700-d058-48e0-94b4-8be19cf345b8.jpg , http://localserviceassets.blob.core.windows.net:80/businessphoto-t/f-e17463e2-1997-4aff-98a1-6c8309cf2c85.jpg , http://localserviceassets.blob.core.windows.net:80/businessphoto-t/o-38829e10-7b3a-4fea-a71c-62cb037996df.jpg , http://localserviceassets.blob.core.windows.net:80/businessphoto-t/y-d3c41edc-73ab-40c7-b82c-db9f3efae9c6.jpg , http://localserviceassets.blob.core.windows.net:80/businessphoto-t/97866%2073406-86f5b901-6de7-46e3-9448-f5cb4de9754e.jpg , http://localserviceassets.blob.core.windows.net:80/businessphoto-m/h-b3ccc739-4993-4655-b0e4-a95d244ea8b9.jpg , http://localserviceassets.blob.core.windows.net:80/businessphoto-m/a-bebbc4cd-28dd-40cd-b106-44f1884d3ce4.jpg , http://localserviceassets.blob.core.windows.net:80/businessphoto-m/l-1c1c42d2-57a5-4449-9d50-311807606d03.jpg , http://localserviceassets.blob.core.windows.net:80/businessphoto-m/m-274a6700-d058-48e0-94b4-8be19cf345b8.jpg , http://localserviceassets.blob.core.windows.net:80/businessphoto-m/f-e17463e2-1997-4aff-98a1-6c8309cf2c85.jpg , http://localserviceassets.blob.core.windows.net:80/businessphoto-m/o-38829e10-7b3a-4fea-a71c-62cb037996df.jpg , http://localserviceassets.blob.core.windows.net:80/businessphoto-m/y-d3c41edc-73ab-40c7-b82c-db9f3efae9c6.jpg , http://localserviceassets.blob.core.windows.net:80/businessphoto-m/97866%2073406-86f5b901-6de7-46e3-9448-f5cb4de9754e.jpg , ","1 Month Program , 1 Week Program , 1 Year Program , 2 Weeks Programs , 3 Months Program , 6 Months Program , Bank Loan Assistance , China Education Consultants , College Applications , Course Counseling , CRN Exam Training , Cyprus Education Consultants , Daily Classes , Denmark Education Consultants , DHA Exam Training , Dubai Education Consultants , Europe Education Consultants , Evening Classes , Finland Education Consultants , France Education Consultants , Germany Education Consultants , GMAT Coaching , GRE Coaching , HAAD Exam Training , Holiday Classes , IELTS Coaching , Ireland Education Consultants , Italy Education Consultants , Language Development Coaching , Malaysia Education Consultants , Mauritius Education Consultants , MBBS Tuitions , MCI Screening Test Coaching , Medicine , MOH exam Training , NCLEX-RN Exam Training  , New Zealand Education Consultants , Norway Education Consultants , Online Tuitions , Philippines Education Consultants , Placement Training , Poland Education Consultants , Pre-Medical Test (PMT) Entrance Coaching , Prometric Exam Training , PTE Coaching , Russia Education Consultants , Scholarships , Singapore Education Consultants , Spoken English Classes , Summer Classes , Sweden Education Consultants , Switzerland Education Consultants , TOEFL Coaching , Travel and Accommodation Guidance , UK Education Consultants , Ukraine Education Consultants , USA Education Consultants , USMLE Coaching , Visa Applications , Weekend Classes , "
170558,Green Garden Centre for Handwriting,9843044977, 9994044667,,,,No. 46,Venkitta Puram,641062,coimbatore,India,greenhandwriting@gmail.com,,Ranganayaki,Monday - Sunday: 9.30 AM - 6 PM ( Lunch: 1 PM - 2 PM ),"School Tuitions for All Subjects , Handwriting, Spelling & Reading Classes , ",,,"6 Months Program , Below Rs.1000 , Classroom Tuitions , Daily Classes , Evening Classes , "
170559,Nesst Evening Coaching Centre,+91 422 3304236,,,,,,Pn Pudur,641041,coimbatore,India,,,,,"Enterprise Training , Home & Private Tuitions , Big Data Analytics Online Training , Law Entrance Coaching , Home Tutors for Class I-V , R Analytics Online Training , SET Entrance Coaching , Home Tutors for Class VI-X , B.Com Home Tutors , B.Sc Home Tutors , BE Home Tuitions , Biology Home Tuitions for school , Chemistry Home Tuitions for school , Hindi Home Tuitions , English Home Tuitions for school , Physics Home Tuitions for school , Economics Home Tuitions , BBA Home Tuitions , MBA Home Tuitions , ICWA Home Tuitions , MCA Home Tuitions , Foreign Languages Coaching , GMAT Private Tuitions , CA Home Tuitions , Maths Home Tuitions for school , CAT Coaching , IIT Engineering Entrance Coaching , IAS Entrance Coaching , College Tuitions for Accounts, Finance, Statistics , Tuitions for College Subjects , School Tuitions for Math, Physics, Chemistry , School Tuitions for Accounts, Finance, Statistics , School Tuitions for All Subjects , Spoken English Classes , Music & Dance & Arts Classes , GRE Coaching , SAT Coaching , Medical Entrance Coaching , Chartered Accountant Coaching , Spoken Hindi Classes , NIFT/NID/CEED/FDDI Training , Banking Tuitions , Handwriting, Spelling & Reading Classes , Mass Communication Training , MBA & BBA Coaching , 2nd Year PUC Coaching , College Tuitions for Maths , College Tuitions for Physics , College Tuitions for Chemistry , ",,,"BE Home Tuitions , Biology Home Tuitions for school , CA Home Tuitions , CAT Coaching , Chartered Accountant Coaching , Chemistry Home Tuitions for school , College Tuitions for Accounts, Finance, Statistics , College Tuitions for Chemistry , College Tuitions for Maths , College Tuitions for Physics , Economics Home Tuitions , English Home Tuitions for school , Foreign Languages Coaching , GMAT Private Tuitions , GRE Coaching , Handwriting, Spelling & Reading Classes , Hindi Home Tuitions , Home Tutors for Class I-V , Home Tutors for Class VI-X , IAS Entrance Coaching , ICWA Home Tuitions , IIT Engineering Entrance Coaching , Mass Communication Training , Maths Home Tuitions for school , MBA & BBA Coaching , MBA Home Tuitions , MCA Home Tuitions , Medical Entrance Coaching , Music & Dance & Arts Classes , NIFT/NID/CEED/FDDI Training , Physics Home Tuitions for school , R Analytics Online Training , SAT Coaching , School Tuitions for Accounts, Finance, Statistics , School Tuitions for All Subjects , School Tuitions for Math, Physics, Chemistry , SET Entrance Coaching , Spoken English Classes , Spoken Hindi Classes , Tuitions for College Subjects , "
