EduID,Name,Phone1,Phone2,Phone3,Phone4,Phone5,Street Address,Locality,Pincode,City,Country,Mail,Website,Person to Contact,Working Hours,Services Offered,Details,Images URL,Keywords
177197,Infocom Computer Academy,9480123472,,,,,,Station Road,580020,hubli,India,,,sudhir,,"Computer Software Dealers , Operating System Software Providers , Application Software Providers , MS Office Software Providers , Graphic Design Software Providers , Accounting Software Providers , Enterprise Software Providers , Computer Games Software Providers , Antivirus Software Providers , CAD & CAM Software Providers , Customized Accounting Software Providers , Tally Software Providers , Education Management Software Providers , Spoken English Classes , Biology Tuitions (11th & 12th) , 10th STD Tuitions , CBSE Accounts (11th & 12th ) Tuitions , 9th STD Tuitions , ",,,"Biology Tuitions (11th & 12th) , CAD & CAM Software Providers , CBSE Accounts (11th & 12th ) Tuitions , Computer Games Software Providers , Customized Accounting Software Providers , Education Management Software Providers , Enterprise Software Providers , Graphic Design Software Providers , MS Office Software Providers , Operating System Software Providers , Spoken English Classes , Tally Software Providers , "
177198,The Classic KAS & IAS  Study Curcle,9902043352,,,,,,Dharwad Road,580001,hubli,India,laxman.sr2@gmail.com,,Lakshman,Monday - Saturday: 8 AM - 8 PM,"UPSC Coaching , IAS Entrance Coaching , SAT Coaching , SBI PO Training , ICET Coaching , US CPA Coaching , AMIE Coaching , ",,,"UPSC Coaching , US CPA Coaching , "
177199,Little Champs,080 - 2382844, 9916820351,,,,1st floor,Hubli City,581113,hubli,India,sunithasavanur@gmail.com,,Sunitha Savanur,Monday - Saturday: 9 AM - 8 PM ( Lunch: 2 PM - 2.30 PM ),"Playschools , Dance Classes , Coaching & Tuitions , Drawing & Painting Classes , Bharatanatiyam Dance Classes , Western Dance Classes , Dandiya Dance Classes , Free Style Dance Classes , Disco Classes , Calligraphy Coaching , Maths Tuitions 11th &12th , ",,,"Free Style Dance Classes , Maths Tuitions 11th &12th , Western Dance Classes , "
177200,LOTUS Y VIDYA,080 - 2228343, 8431316060,,,,"Sri Dutta Arched Manjunath Nagar Opp, KLE School",Gokul Road,580024,hubli,India,brainyquote.ah@gmail.com,,Patil,Monday - Saturday: 6 AM - 7.30 PM,"Home & Private Tuitions , Home Tutors for Class I-V , Home Tutors for Class VI-X , Physics Home Tuitions 11th & 12th , Biology Home Tuitions 11th & 12th , School Tuitions for Math, Physics, Chemistry , School Tuitions for All Subjects , Chemistry Tuitions (11th & 12th) , CBSE Tuitions for English , CBSE Tuitions for Maths , CBSE Tuitions for Physics , CBSE Tuitions for Chemistry , 10th STD Tuitions , CBSE Accounts (11th & 12th ) Tuitions , 9th STD Tuitions , School Tuitions for Biology , ",,,"CBSE Tuitions for English , CBSE Tuitions for Maths , CBSE Tuitions for Physics , Chemistry Tuitions (11th & 12th) , Home Tutors for Class I-V , Home Tutors for Class VI-X , Physics Home Tuitions 11th & 12th , School Tuitions for All Subjects , School Tuitions for Biology , School Tuitions for Math, Physics, Chemistry , "
177201,Dr. R.B. Patil Mahesh PU College,0836 - 2332221, 9900513289,,,,,Gokul Road,580030,hubli,India,info@mpuchubli.com,http://www.maheshpucollege.com,Rajan,Monday - Sunday : 24 Hrs,"2nd Year PUC Coaching , 1st Year PUC Coaching , ",,,
177202,Physics Paradise,9886559700,,,,,,P.B. Road,580001,hubli,India,,,,,"Enterprise Training , Home & Private Tuitions , Big Data Analytics Online Training , Engineering Tuitions , Law Entrance Coaching , Home Tutors for Class I-V , R Analytics Online Training , Mechanical Engineering Tuitions , SET Entrance Coaching , Aerospace Engineering Tuitions , Home Tutors for Class VI-X , B.Com Home Tutors , Biomedical Engineering Tuitions , Biomechanical Engineering Tuitions , B.Sc Home Tutors , BE Home Tuitions , Automotive Engineering Tuitions , Civil Engineering Tuitions , Biology Home Tuitions for school , Chemistry Home Tuitions for school , Architectural Engineering Tuitions , Electrical Engineering Tuitions , Hindi Home Tuitions , English Home Tuitions for school , IT & Computer Science Engineering Tuitions , Robotics Engineering Tuitions , Physics Home Tuitions for school , Economics Home Tuitions , Microelectronic Engineering Tuitions , Chemical Engineering Tuitions , BBA Home Tuitions , MBA Home Tuitions , Environmental Engineering Tuitions , Materials Science Engineering Tuitions , ICWA Home Tuitions , MCA Home Tuitions , Foreign Languages Coaching , Agricultural Engineering Tuitions , GMAT Private Tuitions , CA Home Tuitions , Maths Home Tuitions for school , Engineering Tuitions - Other Branches , Engineering Physics Tuitions , Biotechnology Engineering Tuitions , Genetic Engineering Tuitions , Engineering Chemistry Tuitions , Mechatronics Engineering Tuitions , Software Engineering Tuitions , Electronics & Communication Engineering Tuitions , Instrumentation Technology Engineering Tuitions , Telecommunication Engineering Tuitions , Industrial & Production Engineering Tuitions , Show less  , ",,,"B.Com Home Tutors , B.Sc Home Tutors , Banking Tuitions , BBA Home Tuitions , BE Home Tuitions , Biology Home Tuitions for school , Biomechanical Engineering Tuitions , Biomedical Engineering Tuitions , Biotechnology Engineering Tuitions , CA Home Tuitions , CAT Coaching , Chartered Accountant Coaching , Chemical Engineering Tuitions , Chemistry Home Tuitions for school , Civil Engineering Tuitions , College Tuitions for Accounts, Finance, Statistics , College Tuitions for Chemistry , College Tuitions for Maths , College Tuitions for Physics , Economics Home Tuitions , Electrical Engineering Tuitions , Electronics & Communication Engineering Tuitions , Engineering Chemistry Tuitions , Engineering Physics Tuitions , Engineering Tuitions - Other Branches , English Home Tuitions for school , Environmental Engineering Tuitions , Foreign Languages Coaching , Genetic Engineering Tuitions , GMAT Private Tuitions , GRE Coaching , Handwriting, Spelling & Reading Classes , Hindi Home Tuitions , Home Tutors for Class I-V , Home Tutors for Class VI-X , IAS Entrance Coaching , ICWA Home Tuitions , IIT Engineering Entrance Coaching , Industrial & Production Engineering Tuitions , Instrumentation Technology Engineering Tuitions , IT & Computer Science Engineering Tuitions , Mass Communication Training , Materials Science Engineering Tuitions , Maths Home Tuitions for school , MBA & BBA Coaching , MBA Home Tuitions , MCA Home Tuitions , Mechanical Engineering Tuitions , Mechatronics Engineering Tuitions , Medical Entrance Coaching , Microelectronic Engineering Tuitions , Music & Dance & Arts Classes , NIFT/NID/CEED/FDDI Training , Physics Home Tuitions for school , R Analytics Online Training , Robotics Engineering Tuitions , SAT Coaching , School Tuitions for Accounts, Finance, Statistics , School Tuitions for All Subjects , School Tuitions for Math, Physics, Chemistry , SET Entrance Coaching , Software Engineering Tuitions , Spoken English Classes , Spoken Hindi Classes , Telecommunication Engineering Tuitions , Tuitions for College Subjects , "
177203,Gurukul Career Academy,0836 - 2746162, 9880417024,,,,,P.B. Road,580001,hubli,India,,,N.M. Patel,,"Enterprise Training , Home & Private Tuitions , Big Data Analytics Online Training , Engineering Tuitions , Law Entrance Coaching , Home Tutors for Class I-V , R Analytics Online Training , Mechanical Engineering Tuitions , SET Entrance Coaching , Aerospace Engineering Tuitions , Home Tutors for Class VI-X , B.Com Home Tutors , Biomedical Engineering Tuitions , Biomechanical Engineering Tuitions , B.Sc Home Tutors , BE Home Tuitions , Automotive Engineering Tuitions , Civil Engineering Tuitions , Biology Home Tuitions for school , Chemistry Home Tuitions for school , Architectural Engineering Tuitions , Electrical Engineering Tuitions , Hindi Home Tuitions , English Home Tuitions for school , IT & Computer Science Engineering Tuitions , Robotics Engineering Tuitions , Physics Home Tuitions for school , Economics Home Tuitions , Microelectronic Engineering Tuitions , Chemical Engineering Tuitions , BBA Home Tuitions , MBA Home Tuitions , Environmental Engineering Tuitions , Materials Science Engineering Tuitions , ICWA Home Tuitions , MCA Home Tuitions , Agricultural Engineering Tuitions , Foreign Languages Coaching , GMAT Private Tuitions , CA Home Tuitions , Maths Home Tuitions for school , Engineering Tuitions - Other Branches , Engineering Physics Tuitions , Biotechnology Engineering Tuitions , Genetic Engineering Tuitions , Engineering Chemistry Tuitions , Mechatronics Engineering Tuitions , Software Engineering Tuitions , Electronics & Communication Engineering Tuitions , Instrumentation Technology Engineering Tuitions , Telecommunication Engineering Tuitions , Industrial & Production Engineering Tuitions , Show less  , ",,,"B.Com Home Tutors , B.Sc Home Tutors , Banking Tuitions , BBA Home Tuitions , BE Home Tuitions , Bioinformatics Training , Biology Home Tuitions for school , Biomechanical Engineering Tuitions , Biomedical Engineering Tuitions , Biotechnology Engineering Tuitions , CA Home Tuitions , CAT Coaching , Certified Financial Planner (CFP) Coaching , Chartered Accountant Coaching , Chemical Engineering Tuitions , Chemistry Home Tuitions for school , Civil Engineering Tuitions , College Tuitions for Accounts, Finance, Statistics , College Tuitions for Chemistry , College Tuitions for Maths , College Tuitions for Physics , Economics Home Tuitions , Electrical Engineering Tuitions , Electronics & Communication Engineering Tuitions , Engineering Chemistry Tuitions , Engineering Physics Tuitions , Engineering Tuitions - Other Branches , English Home Tuitions for school , Environmental Engineering Tuitions , Foreign Languages Coaching , Genetic Engineering Tuitions , GMAT Coaching , GMAT Private Tuitions , GRE Coaching , Handwriting, Spelling & Reading Classes , Hindi Home Tuitions , Home Tutors for Class I-V , Home Tutors for Class VI-X , IAS Entrance Coaching , ICWA Home Tuitions , IIT Engineering Entrance Coaching , Industrial & Production Engineering Tuitions , Instrumentation Technology Engineering Tuitions , IT & Computer Science Engineering Tuitions , Mass Communication Training , Materials Science Engineering Tuitions , Maths Home Tuitions for school , MBA & BBA Coaching , MBA Home Tuitions , MCA Home Tuitions , Mechanical Engineering Tuitions , Mechatronics Engineering Tuitions , Medical Entrance Coaching , Microelectronic Engineering Tuitions , Music & Dance & Arts Classes , NIFT/NID/CEED/FDDI Training , Physics Home Tuitions for school , R Analytics Online Training , Robotics Engineering Tuitions , SAT Coaching , School Tuitions for Accounts, Finance, Statistics , School Tuitions for All Subjects , School Tuitions for Math, Physics, Chemistry , SET Entrance Coaching , Software Engineering Tuitions , Spoken English Classes , Spoken Hindi Classes , Telecommunication Engineering Tuitions , Tuitions for College Subjects , "
177204,Shri Krishna Tutorials,0836 - 2743738, 9480028369,,,,,P.B. Road,580001,hubli,India,,,,,"Enterprise Training , Home & Private Tuitions , Big Data Analytics Online Training , Engineering Tuitions , Law Entrance Coaching , Home Tutors for Class I-V , R Analytics Online Training , Mechanical Engineering Tuitions , SET Entrance Coaching , Aerospace Engineering Tuitions , Home Tutors for Class VI-X , B.Com Home Tutors , Biomedical Engineering Tuitions , Biomechanical Engineering Tuitions , B.Sc Home Tutors , BE Home Tuitions , Automotive Engineering Tuitions , Civil Engineering Tuitions , Biology Home Tuitions for school , Chemistry Home Tuitions for school , Architectural Engineering Tuitions , Electrical Engineering Tuitions , Hindi Home Tuitions , English Home Tuitions for school , IT & Computer Science Engineering Tuitions , Robotics Engineering Tuitions , Physics Home Tuitions for school , Economics Home Tuitions , Microelectronic Engineering Tuitions , Chemical Engineering Tuitions , BBA Home Tuitions , MBA Home Tuitions , Environmental Engineering Tuitions , Materials Science Engineering Tuitions , ICWA Home Tuitions , MCA Home Tuitions , Foreign Languages Coaching , Agricultural Engineering Tuitions , GMAT Private Tuitions , CA Home Tuitions , Maths Home Tuitions for school , Engineering Tuitions - Other Branches , Engineering Physics Tuitions , Biotechnology Engineering Tuitions , Genetic Engineering Tuitions , Engineering Chemistry Tuitions , Mechatronics Engineering Tuitions , Software Engineering Tuitions , Electronics & Communication Engineering Tuitions , Instrumentation Technology Engineering Tuitions , Telecommunication Engineering Tuitions , Industrial & Production Engineering Tuitions , Show less  , ",,,"B.Com Home Tutors , B.Sc Home Tutors , Banking Tuitions , BBA Home Tuitions , BE Home Tuitions , Biology Home Tuitions for school , Biomechanical Engineering Tuitions , Biomedical Engineering Tuitions , Biotechnology Engineering Tuitions , CA Home Tuitions , CAT Coaching , Chartered Accountant Coaching , Chemical Engineering Tuitions , Chemistry Home Tuitions for school , Civil Engineering Tuitions , College Tuitions for Accounts, Finance, Statistics , College Tuitions for Chemistry , College Tuitions for Maths , College Tuitions for Physics , Economics Home Tuitions , Electrical Engineering Tuitions , Electronics & Communication Engineering Tuitions , Engineering Chemistry Tuitions , Engineering Physics Tuitions , Engineering Tuitions - Other Branches , English Home Tuitions for school , Environmental Engineering Tuitions , Foreign Languages Coaching , Genetic Engineering Tuitions , GMAT Private Tuitions , GRE Coaching , Handwriting, Spelling & Reading Classes , Hindi Home Tuitions , Home Tutors for Class I-V , Home Tutors for Class VI-X , IAS Entrance Coaching , ICWA Home Tuitions , IIT Engineering Entrance Coaching , Industrial & Production Engineering Tuitions , Instrumentation Technology Engineering Tuitions , IT & Computer Science Engineering Tuitions , Mass Communication Training , Materials Science Engineering Tuitions , Maths Home Tuitions for school , MBA & BBA Coaching , MBA Home Tuitions , MCA Home Tuitions , Mechanical Engineering Tuitions , Mechatronics Engineering Tuitions , Medical Entrance Coaching , Microelectronic Engineering Tuitions , Music & Dance & Arts Classes , NIFT/NID/CEED/FDDI Training , Physics Home Tuitions for school , R Analytics Online Training , Robotics Engineering Tuitions , SAT Coaching , School Tuitions for Accounts, Finance, Statistics , School Tuitions for All Subjects , School Tuitions for Math, Physics, Chemistry , SET Entrance Coaching , Software Engineering Tuitions , Spoken English Classes , Spoken Hindi Classes , Telecommunication Engineering Tuitions , Tuitions for College Subjects , "
177205,Iice Career Consultants,0836 - 2770268, 9343100184,,,,,Dharwad,580001,hubli,India,,,Viswannath,Monday - Saturday: 8 AM - 8 PM,"IIT-JEE Coaching , ",,,
177206,Anil`s Commerce Tutorials,0836 - 2472300, 9886431818,,,,,Station Road,580007,hubli,India,,,Mangala Yaragatti,,"Enterprise Training , Home & Private Tuitions , Big Data Analytics Online Training , Engineering Tuitions , Law Entrance Coaching , Home Tutors for Class I-V , R Analytics Online Training , Mechanical Engineering Tuitions , SET Entrance Coaching , Aerospace Engineering Tuitions , Home Tutors for Class VI-X , B.Com Home Tutors , Biomedical Engineering Tuitions , Biomechanical Engineering Tuitions , B.Sc Home Tutors , BE Home Tuitions , Automotive Engineering Tuitions , Civil Engineering Tuitions , Biology Home Tuitions for school , Chemistry Home Tuitions for school , Architectural Engineering Tuitions , Electrical Engineering Tuitions , Hindi Home Tuitions , English Home Tuitions for school , IT & Computer Science Engineering Tuitions , Robotics Engineering Tuitions , Physics Home Tuitions for school , Economics Home Tuitions , Microelectronic Engineering Tuitions , Chemical Engineering Tuitions , BBA Home Tuitions , MBA Home Tuitions , Environmental Engineering Tuitions , Materials Science Engineering Tuitions , ICWA Home Tuitions , MCA Home Tuitions , Agricultural Engineering Tuitions , Foreign Languages Coaching , GMAT Private Tuitions , CA Home Tuitions , Maths Home Tuitions for school , Engineering Tuitions - Other Branches , Engineering Physics Tuitions , Biotechnology Engineering Tuitions , Genetic Engineering Tuitions , Engineering Chemistry Tuitions , Mechatronics Engineering Tuitions , Software Engineering Tuitions , Electronics & Communication Engineering Tuitions , Instrumentation Technology Engineering Tuitions , Telecommunication Engineering Tuitions , Industrial & Production Engineering Tuitions , Show less  , ",,,"B.Com Home Tutors , B.Sc Home Tutors , Banking Tuitions , BBA Home Tuitions , BE Home Tuitions , Bioinformatics Training , Biology Home Tuitions for school , Biomechanical Engineering Tuitions , Biomedical Engineering Tuitions , Biotechnology Engineering Tuitions , CA Home Tuitions , CAT Coaching , Certified Financial Planner (CFP) Coaching , Chartered Accountant Coaching , Chemical Engineering Tuitions , Chemistry Home Tuitions for school , Civil Engineering Tuitions , College Tuitions for Accounts, Finance, Statistics , College Tuitions for Chemistry , College Tuitions for Maths , College Tuitions for Physics , Economics Home Tuitions , Electrical Engineering Tuitions , Electronics & Communication Engineering Tuitions , Engineering Chemistry Tuitions , Engineering Physics Tuitions , Engineering Tuitions - Other Branches , English Home Tuitions for school , Environmental Engineering Tuitions , Foreign Languages Coaching , Genetic Engineering Tuitions , GMAT Coaching , GMAT Private Tuitions , GRE Coaching , Handwriting, Spelling & Reading Classes , Hindi Home Tuitions , Home Tutors for Class I-V , Home Tutors for Class VI-X , IAS Entrance Coaching , ICWA Home Tuitions , IIT Engineering Entrance Coaching , Industrial & Production Engineering Tuitions , Instrumentation Technology Engineering Tuitions , IT & Computer Science Engineering Tuitions , Mass Communication Training , Materials Science Engineering Tuitions , Maths Home Tuitions for school , MBA & BBA Coaching , MBA Home Tuitions , MCA Home Tuitions , Mechanical Engineering Tuitions , Mechatronics Engineering Tuitions , Medical Entrance Coaching , Microelectronic Engineering Tuitions , Music & Dance & Arts Classes , NIFT/NID/CEED/FDDI Training , Physics Home Tuitions for school , R Analytics Online Training , Robotics Engineering Tuitions , SAT Coaching , School Tuitions for Accounts, Finance, Statistics , School Tuitions for All Subjects , School Tuitions for Math, Physics, Chemistry , SET Entrance Coaching , Software Engineering Tuitions , Spoken English Classes , Spoken Hindi Classes , Telecommunication Engineering Tuitions , Tuitions for College Subjects , "
177207,Hanchinmani Classes,0836 - 2463185,,,,,,Dharwad,580004,hubli,India,,,Parinitha,,"College Tuitions for Accounts, Finance, Statistics , Tuitions for College Subjects , 2nd Year PUC Coaching , College Tuitions for Maths , College Tuitions for Physics , College Tuitions for Chemistry , 1st Year PUC Coaching , ",,,"College Tuitions for Physics , Tuitions for College Subjects , "
177208,Phoenix English Academy,,,,,,,Dharwad,580009,hubli,India,,,,,"Enterprise Training , Home & Private Tuitions , Big Data Analytics Online Training , Engineering Tuitions , Law Entrance Coaching , Home Tutors for Class I-V , R Analytics Online Training , Mechanical Engineering Tuitions , SET Entrance Coaching , Aerospace Engineering Tuitions , Home Tutors for Class VI-X , B.Com Home Tutors , Biomedical Engineering Tuitions , Biomechanical Engineering Tuitions , B.Sc Home Tutors , BE Home Tuitions , Automotive Engineering Tuitions , Civil Engineering Tuitions , Biology Home Tuitions for school , Chemistry Home Tuitions for school , Architectural Engineering Tuitions , Electrical Engineering Tuitions , Hindi Home Tuitions , English Home Tuitions for school , IT & Computer Science Engineering Tuitions , Robotics Engineering Tuitions , Physics Home Tuitions for school , Economics Home Tuitions , Microelectronic Engineering Tuitions , Chemical Engineering Tuitions , BBA Home Tuitions , MBA Home Tuitions , Environmental Engineering Tuitions , Materials Science Engineering Tuitions , ICWA Home Tuitions , MCA Home Tuitions , Agricultural Engineering Tuitions , Foreign Languages Coaching , GMAT Private Tuitions , CA Home Tuitions , Maths Home Tuitions for school , Engineering Tuitions - Other Branches , Engineering Physics Tuitions , Biotechnology Engineering Tuitions , Genetic Engineering Tuitions , Engineering Chemistry Tuitions , Mechatronics Engineering Tuitions , Software Engineering Tuitions , Electronics & Communication Engineering Tuitions , Instrumentation Technology Engineering Tuitions , Telecommunication Engineering Tuitions , Industrial & Production Engineering Tuitions , Show less  , ",,,"B.Com Home Tutors , B.Sc Home Tutors , Banking Tuitions , BBA Home Tuitions , BE Home Tuitions , Bioinformatics Training , Biology Home Tuitions for school , Biomechanical Engineering Tuitions , Biomedical Engineering Tuitions , Biotechnology Engineering Tuitions , CA Home Tuitions , CAT Coaching , Certified Financial Planner (CFP) Coaching , Chartered Accountant Coaching , Chemical Engineering Tuitions , Chemistry Home Tuitions for school , Civil Engineering Tuitions , College Tuitions for Accounts, Finance, Statistics , College Tuitions for Chemistry , College Tuitions for Maths , College Tuitions for Physics , Economics Home Tuitions , Electrical Engineering Tuitions , Electronics & Communication Engineering Tuitions , Engineering Chemistry Tuitions , Engineering Physics Tuitions , Engineering Tuitions - Other Branches , English Home Tuitions for school , Environmental Engineering Tuitions , Foreign Languages Coaching , Genetic Engineering Tuitions , GMAT Coaching , GMAT Private Tuitions , GRE Coaching , Handwriting, Spelling & Reading Classes , Hindi Home Tuitions , Home Tutors for Class I-V , Home Tutors for Class VI-X , IAS Entrance Coaching , ICWA Home Tuitions , IIT Engineering Entrance Coaching , Industrial & Production Engineering Tuitions , Instrumentation Technology Engineering Tuitions , IT & Computer Science Engineering Tuitions , Mass Communication Training , Materials Science Engineering Tuitions , Maths Home Tuitions for school , MBA & BBA Coaching , MBA Home Tuitions , MCA Home Tuitions , Mechanical Engineering Tuitions , Mechatronics Engineering Tuitions , Medical Entrance Coaching , Microelectronic Engineering Tuitions , Music & Dance & Arts Classes , NIFT/NID/CEED/FDDI Training , Physics Home Tuitions for school , R Analytics Online Training , Robotics Engineering Tuitions , SAT Coaching , School Tuitions for Accounts, Finance, Statistics , School Tuitions for All Subjects , School Tuitions for Math, Physics, Chemistry , SET Entrance Coaching , Software Engineering Tuitions , Spoken English Classes , Spoken Hindi Classes , Telecommunication Engineering Tuitions , Tuitions for College Subjects , "
