EduID,Name,Phone1,Phone2,Phone3,Phone4,Phone5,Street Address,Locality,Pincode,City,Country,Mail,Website,Person to Contact,Working Hours,Services Offered,Details,Images URL,Keywords
170677,Hayagreeva Tuition Centre,9965527462,,,,,Balaji nagar extension,Sidhapudur,641044,coimbatore,India,,,Rama,,"Spoken English Classes , 2nd Year PUC Coaching , CBSE Tuitions for Maths , 1st Year PUC Coaching , 10th STD Tuitions , 9th STD Tuitions , ",,,
170678,FIITJEE Regional Centre,+91 422 3304154,,,,,suguna polytechnic,Nehru Nagar,641014,coimbatore,India,,http://www.fiitjeeregional.com,Rajappa,,"IIT Engineering Entrance Coaching , IIT JAM Coaching , IIT-JEE Coaching , ",,,
170679,Akshaya Education Academy,9894826787,,,,,No. 5/11,Neelikonampalayam,641043,coimbatore,India,,,,,"Chemistry Tuitions (11th & 12th) , College Tuitions for Maths , ",,,
170680,Kimoni Brain Drill,9362637724,,,,,No. 41,Gandhi Puram,641012,coimbatore,India,,,Chitra,Monday - Sunday: 9 AM - 5 PM,"Abacus & Mental Arithmetic Coaching , Vedic Maths Coaching , ",,,
170681,Vasara Maths Coaching Centre,9894758525,,,,,Ground Floor,Saibaba Colony,641011,coimbatore,India,,,,,"School Tuitions for Math, Physics, Chemistry , School Tuitions for All Subjects , 2nd Year PUC Coaching , College Tuitions for Maths , 1st Year PUC Coaching , ",,,
170682,Siva Coaching Centre,9442132293,,,,,No. 23/B,Velandipalayam,641025,coimbatore,India,,,Lalitha,,"Spoken English Classes , Banking Tuitions , 2nd Year PUC Coaching , 1st Year PUC Coaching , ",,,
170683,Pranavam English Academy,0422 - 2668196,,,,,No. 41 ,Ramanathapuram,641035,coimbatore,India,,,,"Monday - Sunday: 9 AM - 7.30 PM, Monday - Sunday: 9 AM - 7.30 PM","Spoken English Classes , ",,,
170684,Success Tutorial & Tution Centre,+91 422 3382422,,,,,1st Floor,Koundampalayam,641030,coimbatore,India,,,Mani,Monday - Saturday: 9 AM - 12.30 PM,"Engineering Tuitions , Mechanical Engineering Tuitions , Aerospace Engineering Tuitions , Biomedical Engineering Tuitions , Biomechanical Engineering Tuitions , Automotive Engineering Tuitions , Civil Engineering Tuitions , Architectural Engineering Tuitions , Electrical Engineering Tuitions , IT & Computer Science Engineering Tuitions , Robotics Engineering Tuitions , Microelectronic Engineering Tuitions , Computer Science Tuitions (11th & 12th STD) , Chemical Engineering Tuitions , Environmental Engineering Tuitions , Materials Science Engineering Tuitions , Agricultural Engineering Tuitions , Engineering Tuitions - Other Branches , Engineering Physics Tuitions , Biotechnology Engineering Tuitions , Genetic Engineering Tuitions , Engineering Chemistry Tuitions , Mechatronics Engineering Tuitions , Software Engineering Tuitions , Electronics & Communication Engineering Tuitions , Instrumentation Technology Engineering Tuitions , Telecommunication Engineering Tuitions , Industrial & Production Engineering Tuitions , School Tuitions for Math, Physics, Chemistry , Spoken English Classes , Chartered Accountant Coaching , MBA & BBA Coaching , ",,,"Biomedical Engineering Tuitions , Biotechnology Engineering Tuitions , Chartered Accountant Coaching , Chemical Engineering Tuitions , Civil Engineering Tuitions , Computer Science Tuitions (11th & 12th STD) , Electrical Engineering Tuitions , Electronics & Communication Engineering Tuitions , Engineering Chemistry Tuitions , Engineering Physics Tuitions , Engineering Tuitions - Other Branches , Environmental Engineering Tuitions , Genetic Engineering Tuitions , Industrial & Production Engineering Tuitions , Instrumentation Technology Engineering Tuitions , IT & Computer Science Engineering Tuitions , Materials Science Engineering Tuitions , MBA & BBA Coaching , Mechanical Engineering Tuitions , Mechatronics Engineering Tuitions , Microelectronic Engineering Tuitions , Robotics Engineering Tuitions , School Tuitions for Math, Physics, Chemistry , Software Engineering Tuitions , Spoken English Classes , Telecommunication Engineering Tuitions , "
170685,Unique IAS Academy,+91 422 3304139,,,,,No. 1,Gandhi Puram,641012,coimbatore,India,uniqueiasacademy@gmail.com,http://www.uniqueiasacademy.com,Manikandan,Monday - Sunday: 10 AM - 8 PM,"IPS Entrance Exam Coaching , IAS Entrance Coaching , AIEEE Coaching , ACCA Training , TNPSC Entrance Coaching , ",,,"1 Year Program , Classroom Tuitions , Daily Classes , Short Term , "
170686,Smrithi Academy,9944400984,,,,,No. 850,Peelamedu,641004,coimbatore,India,,,Srividya,Monday - Sunday: 9 AM - 5 PM,"Abacus & Mental Arithmetic Coaching , Spoken English Classes , ",,,
170687,Mercury Academy,9942272714, 9443372714,,,,No. 9B,Uppilipalayam,641015,coimbatore,India,,,Raghav,Monday - Saturday: 9 AM - 6 PM,"Abacus & Mental Arithmetic Coaching , Corporate Training Providers , Spoken English Classes , Corporate Communication Skills Training , Personality Development Training , Soft Skills Training , Vedic Maths Coaching , ",,,
170688,Edufly Global Studies Consultants Pvt. Ltd,0422 - 4208155, 9894711011,,,,No. 20,R.S. Puram,641002,coimbatore,India,faiz@eduflyglobal.com,http://www.eduflyglobal.com,Faiz,,"Coaching & Tuitions , Scholarship Abroad Consultants , USA Education Consultants , UK Education Consultants , Australia Education Consultants , Canada Education Consultants , New Zealand Education Consultants , France Education Consultants , Germany Education Consultants , Singapore Education Consultants , Switzerland Education Consultants , Europe Education Consultants , Malaysia Education Consultants , Dubai Education Consultants , China Education Consultants , ",,,"France Education Consultants , Germany Education Consultants , Malaysia Education Consultants , New Zealand Education Consultants , Singapore Education Consultants , Switzerland Education Consultants , UK Education Consultants , USA Education Consultants , "
170689,GTS Access,9003433633, 9952513816,,,,No. 3/A,Ganapathy,641006,coimbatore,India,gtsaccess@gmail.com,,Balasundaram,,"Technical Analysis Coaching , 2nd Year PUC Coaching , 1st Year PUC Coaching , Homi Bhabha Exam Coaching , B.Sc. IT Coaching , BSC Entrance Exam Coaching , MSC Entrance Exam Coaching , BCA Entrance Exam Coaching , MCA Entrance Exam Coaching , ",,,"Homi Bhabha Exam Coaching , MCA Entrance Exam Coaching , MSC Entrance Exam Coaching , Technical Analysis Coaching , "
170690,Shahabath Nata Coaching,8344488809, 9952453499,,,,"No. 518/2, 2nd Floor",Gandhi Puram,641012,coimbatore,India,infoo.iarch@gmail.com,http://https://www.iarch.co.in,Shahabath,Monday - Sunday: 9 AM - 6 PM,"NATA Coaching , Architecture Entrance Coaching , ",,,
170691,Akshara Hindi Academy,9994319810,,,,,No. 378,Gandhi Puram,641012,coimbatore,India,vtmkcbe@gmail.com,,Manikandan,Monday - Saturday: 10 AM - 1 PM,"Spoken English Classes , Spoken Hindi Classes , ",,,
170692,Radian IAS Academy,+91 422 3382805,,,,,"No. 343, 1st Floor, 7th Street, Cross Cut Road",Gandhipuram,641012,coimbatore,India,coimbatoreradian@gmail.com,http://www.radianiasacademy.org,Saravana Kumaran,"Monday - Saturday: 9 AM - 8 PM, Sunday: 9 AM - 7 PM","GATE Coaching , GATE Biotechnology Coaching , GATE Civil Engineering Coaching , GATE Chemical Engineering Coaching , GATE Computer Science Coaching , GATE Physics Coaching , IPS Entrance Exam Coaching , GATE Electronics Engineering Coaching , GATE Electrical Engineering Coaching , SSC Entrance Exam Coaching , RRB Entrance Exam Coaching , GATE Instrumental Engineering Coaching , GATE Mechanical Engineering Coaching , GATE Production Engineering Coaching , GATE Industrial Engineering Coaching , GATE Coaching for Other Subjects , UPSC Coaching , IBPS Bank Interview Coaching , PSU Entrance Coaching , CAT Coaching , IAS Entrance Coaching , NIFT/NID/CEED/FDDI Training , Banking Tuitions , Insurance Exam Coaching , MCA Entrance Coaching , Placement Training , Aptitude Training , TANCET Entrance Coaching , AMIE Coaching , TNPSC Entrance Coaching , XAT Entrance Coaching , ","Radian IAS Academy has vast experience in the field. We provide Training for TNPSC Entrance Coaching, Banking Tuitions, UPSC Coaching, IAS Entrance Coaching & GATE Coaching. All our faculties are highly qualified and experiences persons. We are well known for our services in the market and are happy to have you as our customer.For more details kindly contact us.  ","http://localserviceassets.blob.core.windows.net:80/businessphoto-t/1-14d4cbb0-d277-4326-a1e9-27f6ab0cdf71.jpg , http://localserviceassets.blob.core.windows.net:80/businessphoto-t/2-df3d720a-7973-419d-9937-72096612c9d4.jpg , http://localserviceassets.blob.core.windows.net:80/businessphoto-t/3-17ff8cee-d2ac-4509-a7de-3b8edebc84a1.jpg , http://localserviceassets.blob.core.windows.net:80/businessphoto-t/4-5234cc70-9dee-419d-9f79-b9a67f2415e0.jpg , http://localserviceassets.blob.core.windows.net:80/businessphoto-t/5-7cc74f1a-e4d2-4d2a-aabf-1ed9b98361a2.jpg , http://localserviceassets.blob.core.windows.net:80/businessphoto-m/1-14d4cbb0-d277-4326-a1e9-27f6ab0cdf71.jpg , http://localserviceassets.blob.core.windows.net:80/businessphoto-m/2-df3d720a-7973-419d-9937-72096612c9d4.jpg , http://localserviceassets.blob.core.windows.net:80/businessphoto-m/3-17ff8cee-d2ac-4509-a7de-3b8edebc84a1.jpg , http://localserviceassets.blob.core.windows.net:80/businessphoto-m/4-5234cc70-9dee-419d-9f79-b9a67f2415e0.jpg , http://localserviceassets.blob.core.windows.net:80/businessphoto-m/5-7cc74f1a-e4d2-4d2a-aabf-1ed9b98361a2.jpg , ","1 Year Program , 6 Months Program , AMIE Coaching , Aptitude Training , Banking Tuitions , CAT Coaching , Daily Classes , GATE Electrical Engineering Coaching , GATE Electronics Engineering Coaching , GATE Industrial Engineering Coaching , GATE Instrumental Engineering Coaching , GATE Mechanical Engineering Coaching , GATE Physics Coaching , GATE Production Engineering Coaching , IAS Entrance Coaching , IBPS Bank Interview Coaching , Insurance Exam Coaching , IPS Entrance Exam Coaching , MCA Entrance Coaching , NIFT/NID/CEED/FDDI Training , Placement Training , PSU Entrance Coaching , RRB Entrance Exam Coaching , SSC Entrance Exam Coaching , TANCET Entrance Coaching , TNPSC Entrance Coaching , UPSC Coaching , XAT Entrance Coaching , "
170693,Corporate Trainer,0422 - 2594348, 9442575644,,,,No. C2,Singanallur,641005,coimbatore,India,machyuth@yahoo.co.in,,M. Achyuth ,Monday - Sunday: 9 AM - 6 PM ( Lunch: 1 PM - 2 PM ),"RRB Entrance Exam Coaching , CAT Coaching , SAT Coaching , Banking Tuitions , ",,,
170694,IET Academy,+91 422 3382576,,,,,No. 205,Sidhapudur,641044,coimbatore,India,varatharajan_srivari@yahoo.in,http://www.ietcoimbatore.com,Varadharaj,Monday - Sunday: 8 AM - 8 PM,"CACPT Coaching , CAT Coaching , ACT Exam Coaching , MAT coaching , Online CAT Preparation Coaching , ICWA Coaching , ACS Coaching , ","IET (Institute of Engineering and Technology) is a premier institution in the field of Engineering and Technology since 1997, providing excellent service to students. The organization has been involved in running coaching classes for various examinations like AMIE, AIEEE, CAT, Competitive exam (BSNL-JTO, Bank, Railway), GATE, IIT-JEE, MAT, PLACEMENT (MNC), TANCET (MBA/MCA/ME), TRB, TNPSC, etc.It accelerates learning process, facilitates better interaction between staff and students and interaction amongst students. We have consciously adopted a smaller batch size so that our faculty members will be able to provide personal attention to all participants. As an institution, it has been our constant endeavour to provide the best course material for the students desirous of taking up the above exams. Our team of talented professors has prepared the study material in a lucid, concise and easy way to understand. Detailed information about each of our courses is given alongside and please be feeling free to contact us for any of your queries regarding the above courses.The intensive and result oriented classroom training sessions are a hallmark of ECEC operations. Through highly developed and mature classroom teaching modules, we deliver knowledge that is interesting as well as result-oriented. Of those who join us, hundreds make it regularly through the toughest of examinations to the best colleges of the nation like the IIMs, MCA Colleges etc. High levels of discipline, formal & structured teaching methods, and the latest and best quality courseware add to the punch that our faculty members provide.  ",,"MAT coaching , Online CAT Preparation Coaching , "
170695,"Zee Computers, Coimbatore",+91 422 3304104,,,,,"#141, 2nd street, standard tower",Uppilipalayam,545454,coimbatore,India,ganesuniss@sulekha.net,,Kaviyarasan,"Monday - Friday: 09.00 AM - 05.00 PM ( Lunch: 01.00 PM - 02.00 PM ), Saturday: 10.00 AM - 01.00 PM","Packers and Movers , Home Electronics & Appliances Dealers , Coaching & Tuitions , GATE Coaching , Within City Packers and Movers , GATE Biotechnology Coaching , GATE Civil Engineering Coaching , Two Wheeler Carrier Services , Within India Packers and Movers , GATE Chemical Engineering Coaching , GATE Computer Science Coaching , Outside India Packers and Movers , GATE Chemistry Coaching , GATE Mathematics Coaching , GATE Physics Coaching , GATE Electronics Engineering Coaching , GATE Electrical Engineering Coaching , GATE Instrumental Engineering Coaching , Washing Machine Dealers , GATE Production Engineering Coaching , GATE Coaching for Other Subjects , Residential Pest Control , Car Carriers , Cockroach Pest Control , B.Sc. IT Coaching , ",,"http://localserviceassets.blob.core.windows.net:80/businessphoto-t/1669-5488ecca-a02a-4bdd-b1b0-de7f9214161c.jpg , http://localserviceassets.blob.core.windows.net:80/businessphoto-t/9866-0f96722d-2267-4059-b9cf-b97e7ec1506a.jpg , http://localserviceassets.blob.core.windows.net:80/businessphoto-t/IMG-20160103-WA0000-180d609d-9d7d-4727-a039-6ff2e2b4404a.jpg , http://localserviceassets.blob.core.windows.net:80/businessphoto-t/5882-717526de-1767-4274-bcea-327fe5363a95.jpg , http://localserviceassets.blob.core.windows.net:80/businessphoto-t/2633-7d577307-ba53-40ff-9aa0-51675df3cedc.jpg , http://localserviceassets.blob.core.windows.net:80/businessphoto-t/IMG-20160108-WA0000-e3b1d8c4-22d8-407c-80fe-2aca4c1dbf2d.jpg , http://localserviceassets.blob.core.windows.net:80/businessphoto-t/7325-529f0f71-87e3-4f58-acfc-1073dcace993.jpg , http://localserviceassets.blob.core.windows.net:80/businessphoto-t/2264-ad52e000-e851-49ba-9f39-5a7c4b8027a0.jpg , http://localserviceassets.blob.core.windows.net:80/businessphoto-t/1495-a4093bfb-45ed-4fd7-8b19-d748193c3ef7.jpg , http://localserviceassets.blob.core.windows.net:80/businessphoto-t/4359-5fa70ce5-1864-4baf-b870-439307a5b66a.jpg , http://localserviceassets.blob.core.windows.net:80/businessphoto-t/1453267568763-9a4220d7-b0a3-4198-af46-5b0e8a9b0ce1.jpg , http://localserviceassets.blob.core.windows.net:80/businessphoto-t/06_Screenshot-63d70c0d-fae9-47ec-b2ab-40aac2094488.png , http://localserviceassets.blob.core.windows.net:80/businessphoto-t/tempimg-5b2661ad-a660-4a39-b7aa-178909398f999646-27126566-8bcb-416f-84e7-8d240cd56041.png , http://localserviceassets.blob.core.windows.net:80/businessphoto-t/2633-7d577307-ba53-40ff-9aa0-51675df3cedc6969-da72a659-fd49-49cf-b8b3-c93643d561d5.png , http://localserviceassets.blob.core.windows.net:80/businessphoto-t/06_Screenshot-63d70c0d-fae9-47ec-b2ab-40aac20944884481-3160b307-8161-4b6c-9e95-c4b8111bf38c.png , http://localserviceassets.blob.core.windows.net:80/businessphoto-t/IMG-20160108-WA0000-e3b1d8c4-22d8-407c-80fe-2aca4c1dbf2d2777-4a37c125-51e4-42dc-a58f-1a1dc8aa7836.png , http://localserviceassets.blob.core.windows.net:80/businessphoto-t/1669-5488ecca-a02a-4bdd-b1b0-de7f9214161c7426-8ad110fe-a099-4265-a090-abba7ccbb445.png , http://localserviceassets.blob.core.windows.net:80/businessphoto-t/IMG-20160103-WA0000-180d609d-9d7d-4727-a039-6ff2e2b4404a4323-e84cc0c3-4dac-482e-b033-949862090031.png , http://localserviceassets.blob.core.windows.net:80/businessphoto-t/9866-0f96722d-2267-4059-b9cf-b97e7ec1506a8706-098686ad-5893-4a13-b0bf-0833c9b405a0.png , http://localserviceassets.blob.core.windows.net:80/businessphoto-t/Desert-b1ab1910-5cf4-4d07-9c56-3bcf5aa14b636013-116192d3-306f-4992-931f-641effb3a634.png , http://localserviceassets.blob.core.windows.net:80/businessphoto-t/tempimg-5b2661ad-a660-4a39-b7aa-178909398f999646-27126566-8bcb-416f-84e7-8d240cd56041869-bfcb3ccb-12c9-49c6-b827-646d30ec52fd.png , http://localserviceassets.blob.core.windows.net:80/businessphoto-t/2633-7d577307-ba53-40ff-9aa0-51675df3cedc7322-a44e52f4-eb91-4545-a1f8-208987f48fb0.png , http://localserviceassets.blob.core.windows.net:80/businessphoto-t/1453267568763-9a4220d7-b0a3-4198-af46-5b0e8a9b0ce17685-7d12080a-5960-4965-ab85-7e74f32506f1.png , http://localserviceassets.blob.core.windows.net:80/businessphoto-t/2633-7d577307-ba53-40ff-9aa0-51675df3cedc6969-da72a659-fd49-49cf-b8b3-c93643d561d58959-ed10a675-cf01-471b-a760-8ebd6ba86a2f.png , http://localserviceassets.blob.core.windows.net:80/businessphoto-t/06_Screenshot-63d70c0d-fae9-47ec-b2ab-40aac20944889207-f58d26b0-ad9f-4dc5-b6f9-a062ddf8c9f2.png , http://localserviceassets.blob.core.windows.net:80/businessphoto-t/06_Screenshot-63d70c0d-fae9-47ec-b2ab-40aac20944884481-3160b307-8161-4b6c-9e95-c4b8111bf38c920-149aa0b7-25d4-4458-8308-73759b17f22a.png , http://localserviceassets.blob.core.windows.net:80/businessphoto-t/1997-2ae2c28d-6b6c-410d-8334-a3022111dfa3.jpg , http://localserviceassets.blob.core.windows.net:80/businessphoto-m/1669-5488ecca-a02a-4bdd-b1b0-de7f9214161c.jpg , http://localserviceassets.blob.core.windows.net:80/businessphoto-m/9866-0f96722d-2267-4059-b9cf-b97e7ec1506a.jpg , http://localserviceassets.blob.core.windows.net:80/businessphoto-m/IMG-20160103-WA0000-180d609d-9d7d-4727-a039-6ff2e2b4404a.jpg , http://localserviceassets.blob.core.windows.net:80/businessphoto-m/5882-717526de-1767-4274-bcea-327fe5363a95.jpg , http://localserviceassets.blob.core.windows.net:80/businessphoto-m/2633-7d577307-ba53-40ff-9aa0-51675df3cedc.jpg , http://localserviceassets.blob.core.windows.net:80/businessphoto-m/IMG-20160108-WA0000-e3b1d8c4-22d8-407c-80fe-2aca4c1dbf2d.jpg , http://localserviceassets.blob.core.windows.net:80/businessphoto-m/7325-529f0f71-87e3-4f58-acfc-1073dcace993.jpg , http://localserviceassets.blob.core.windows.net:80/businessphoto-m/2264-ad52e000-e851-49ba-9f39-5a7c4b8027a0.jpg , http://localserviceassets.blob.core.windows.net:80/businessphoto-m/1495-a4093bfb-45ed-4fd7-8b19-d748193c3ef7.jpg , http://localserviceassets.blob.core.windows.net:80/businessphoto-m/4359-5fa70ce5-1864-4baf-b870-439307a5b66a.jpg , http://localserviceassets.blob.core.windows.net:80/businessphoto-m/1453267568763-9a4220d7-b0a3-4198-af46-5b0e8a9b0ce1.jpg , http://localserviceassets.blob.core.windows.net:80/businessphoto-m/06_Screenshot-63d70c0d-fae9-47ec-b2ab-40aac2094488.png , http://localserviceassets.blob.core.windows.net:80/businessphoto-m/tempimg-5b2661ad-a660-4a39-b7aa-178909398f999646-27126566-8bcb-416f-84e7-8d240cd56041.png , http://localserviceassets.blob.core.windows.net:80/businessphoto-m/2633-7d577307-ba53-40ff-9aa0-51675df3cedc6969-da72a659-fd49-49cf-b8b3-c93643d561d5.png , http://localserviceassets.blob.core.windows.net:80/businessphoto-m/06_Screenshot-63d70c0d-fae9-47ec-b2ab-40aac20944884481-3160b307-8161-4b6c-9e95-c4b8111bf38c.png , http://localserviceassets.blob.core.windows.net:80/businessphoto-m/IMG-20160108-WA0000-e3b1d8c4-22d8-407c-80fe-2aca4c1dbf2d2777-4a37c125-51e4-42dc-a58f-1a1dc8aa7836.png , http://localserviceassets.blob.core.windows.net:80/businessphoto-m/1669-5488ecca-a02a-4bdd-b1b0-de7f9214161c7426-8ad110fe-a099-4265-a090-abba7ccbb445.png , http://localserviceassets.blob.core.windows.net:80/businessphoto-m/IMG-20160103-WA0000-180d609d-9d7d-4727-a039-6ff2e2b4404a4323-e84cc0c3-4dac-482e-b033-949862090031.png , http://localserviceassets.blob.core.windows.net:80/businessphoto-m/9866-0f96722d-2267-4059-b9cf-b97e7ec1506a8706-098686ad-5893-4a13-b0bf-0833c9b405a0.png , http://localserviceassets.blob.core.windows.net:80/businessphoto-m/Desert-b1ab1910-5cf4-4d07-9c56-3bcf5aa14b636013-116192d3-306f-4992-931f-641effb3a634.png , http://localserviceassets.blob.core.windows.net:80/businessphoto-m/tempimg-5b2661ad-a660-4a39-b7aa-178909398f999646-27126566-8bcb-416f-84e7-8d240cd56041869-bfcb3ccb-12c9-49c6-b827-646d30ec52fd.png , http://localserviceassets.blob.core.windows.net:80/businessphoto-m/2633-7d577307-ba53-40ff-9aa0-51675df3cedc7322-a44e52f4-eb91-4545-a1f8-208987f48fb0.png , http://localserviceassets.blob.core.windows.net:80/businessphoto-m/1453267568763-9a4220d7-b0a3-4198-af46-5b0e8a9b0ce17685-7d12080a-5960-4965-ab85-7e74f32506f1.png , http://localserviceassets.blob.core.windows.net:80/businessphoto-m/2633-7d577307-ba53-40ff-9aa0-51675df3cedc6969-da72a659-fd49-49cf-b8b3-c93643d561d58959-ed10a675-cf01-471b-a760-8ebd6ba86a2f.png , http://localserviceassets.blob.core.windows.net:80/businessphoto-m/06_Screenshot-63d70c0d-fae9-47ec-b2ab-40aac20944889207-f58d26b0-ad9f-4dc5-b6f9-a062ddf8c9f2.png , http://localserviceassets.blob.core.windows.net:80/businessphoto-m/06_Screenshot-63d70c0d-fae9-47ec-b2ab-40aac20944884481-3160b307-8161-4b6c-9e95-c4b8111bf38c920-149aa0b7-25d4-4458-8308-73759b17f22a.png , http://localserviceassets.blob.core.windows.net:80/businessphoto-m/1997-2ae2c28d-6b6c-410d-8334-a3022111dfa3.jpg , ","GATE Chemistry Coaching , GATE Civil Engineering Coaching , GATE Coaching for Other Subjects , GATE Computer Science Coaching , GATE Electrical Engineering Coaching , GATE Electronics Engineering Coaching , GATE Instrumental Engineering Coaching , GATE Mathematics Coaching , GATE Physics Coaching , GATE Production Engineering Coaching , Outside India Packers and Movers , Residential Pest Control , Two Wheeler Carrier Services , Washing Machine Dealers , Within City Packers and Movers , Within India Packers and Movers , "
170696,Hindi Tution Center,9965430046, 9003328715,,,,No. 54,Thudiyalur,641017,coimbatore,India,sathya54@live.com,,Sathya Narainan,,"Spoken Hindi Classes , ",,,
170697,SAS Study Coaching Centre,9843063076,,,,,No. 27/1,Saibaba Colony,641001,coimbatore,India,,,,,"School Tuitions for Math, Physics, Chemistry , 2nd Year PUC Coaching , CBSE Tuitions for Maths , College Tuitions for Maths , 1st Year PUC Coaching , ",,,
170698,Professionals Institute of India - PII,9444378281,,,,,"25/1,1st Floor,9th Street,tatabad,100ft Road",Gandhipuram,641012,coimbatore,India,pii.coimbatore@gmail.com,http://www.piiindia.co.in,Shakivel,Monday - Sunday: 9 AM - 8 PM,"GATE Coaching , GATE Biotechnology Coaching , GATE Civil Engineering Coaching , GATE Chemical Engineering Coaching , GATE Computer Science Coaching , GATE Chemistry Coaching , GATE Mathematics Coaching , GATE Physics Coaching , GATE Electronics Engineering Coaching , GATE Electrical Engineering Coaching , GATE Instrumental Engineering Coaching , GATE Mechanical Engineering Coaching , GATE Production Engineering Coaching , GATE Industrial Engineering Coaching , GATE Coaching for Other Subjects , UPSC Coaching , IIT-JEE Coaching , IES Coaching , TNPSC Entrance Coaching , ","<p>&nbsp;Professionals Institute of India - PII has immense experience in this business. We provide coaching for all boards. Our motto is to provide the best teaching to the students. We have a huge list of impressive success of students. We promise a better future for your children in higher education and knowledge. We make your life better and brighter. Education is a primary ingredient and also a key to success in any profession. With a booming economy and a young population, there is a tremendous need for the quality education to equip this population with skills to handle assignments that spring from such a growing economy like ours. Contact us for further details.</p>  ",,"GATE Computer Science Coaching , GATE Electrical Engineering Coaching , GATE Electronics Engineering Coaching , GATE Industrial Engineering Coaching , GATE Instrumental Engineering Coaching , GATE Mathematics Coaching , GATE Mechanical Engineering Coaching , GATE Physics Coaching , GATE Production Engineering Coaching , IES Coaching , IIT-JEE Coaching , TNPSC Entrance Coaching , UPSC Coaching , "
170699,Naren IAS Academy,+91 422 3382423,,,,,No. 126/K,Gopalapuram,641018,coimbatore,India,nareniasacademy@gmail.com,http://www.nareniasacademy.com/,Balachandran,,"IAS Entrance Coaching , IELTS Coaching , ","Naren IAS Academy has vast experience in the field. We provide Training for Coaching & Tuitions like IPS Entrance Exam Coaching, RRB Entrance Exam Coaching, Law Entrance Coaching, IAS Entrance Coaching, Banking, Tuitions, CLAT Entrance Coaching, Placement Training, Aptitude Training, TGT & PGT & PRT Coaching and TNPSC Entrance Coaching. All our faculties are highly qualified and experiences persons. For more details kindly contact us.  ",,
170700,Coimbatore Academy,9566462222,,,,,No. 343,Gandhi Puram,641012,coimbatore,India,coimbatoreinstitute@gmail.com,,,"Monday - Sunday: 9.30 AM - 8 PM, Monday - Sunday: 9.30 AM - 8 PM","GATE Coaching , GATE Civil Engineering Coaching , GATE Computer Science Coaching , GATE Mathematics Coaching , GATE Electronics Engineering Coaching , SSC Entrance Exam Coaching , GATE Mechanical Engineering Coaching , Technical Analysis Coaching , Banking Tuitions , TNPSC Entrance Coaching , ",,,"GATE Mechanical Engineering Coaching , SSC Entrance Exam Coaching , Technical Analysis Coaching , TNPSC Entrance Coaching , "
170701,Aakash Institute,+91 422 3304151,,,,,"No. 1, 2nd Floor",R.S. Puram,641002,coimbatore,India,,,,,"Medical Entrance Coaching , 2nd Year PUC Coaching , 1st Year PUC Coaching , 10th STD Tuitions , IIT-JEE Coaching , 9th STD Tuitions , Pre-Medical Test (PMT) Entrance Coaching , ",,,"Medical Entrance Coaching , Pre-Medical Test (PMT) Entrance Coaching , "
