EduID,Name,Phone1,Phone2,Phone3,Phone4,Phone5,Street Address,Locality,Pincode,City,Country,Mail,Website,Person to Contact,Working Hours,Services Offered,Details,Images URL,Keywords
169743,Kaplon Group,7096123000, 9825520962,,,,"803, Windor Plaza, A-Wing",Alkapuri,390007,vadodara,India,kaplonoverseas@gmail.com,http://www.kaplonoverseas.com,Viral Jaiswal,Monday - Saturday: 9 AM - 8 PM,"Coaching & Tuitions , Job Training , Corporate Training Providers , Language Training , Multimedia & Design Training , MBA Part Time Distance Education , 2D Animation Training , French Language Training , M.B.A. Distance Education , German Language Training , M.Sc. TQM Distance Education , M.Sc. Physics Distance Education , M.Sc. Botany Distance Education , M.Sc. Zoology Distance Education , M.Sc. Mathematics Distance Education , SSC Entrance Exam Coaching , RRB Entrance Exam Coaching , M.Sc. Chemistry Distance Education , M.C.A. Distance Education , MIF Distance Education , MAF Distance Education , 12th Open School Distance Education , Diploma in Civil Engineering Distance Education , Diploma Visual Effects (VFX) Training , Call Center & BPO Job Training , Diploma in IT Engineering Distance Education , Diploma in Chemical Engineering Distance Education , Diploma in Electrical Engineering Distance Education , Diploma in Industrial Relation Course Distance Education , UPSC Coaching , B.A Distance Education , B.Com Distance Education , M.Com Distance Education , Industrial Management Distance Education , Certified Public Accountant (CPA) Distance Education , M.Phil Distance Education , PGDITM Distance Education , NEET Entrance Coaching , M.A. Distance Education , BBA Distance Education , BCA Distance Education , IBPS Bank Interview Coaching , IAS Entrance Coaching , Spoken English Classes , ACT Exam Coaching , Online Homeopathy Distance Education , Executive BBA Distance Education , M.Tech. Distance Education , IT Program Distance Education , B.Tech. Distance Education , GRE Coaching , ","Our aim is to bring education into life of individuals from every walk of life, be it students, professionals, Govt. servants, business heads, or housewives. We want to impart International quality education at Indian prices so that we can produce world class computer literates for whom sky will be the only limit for progress no matter in which part of the world they are. We inspire, motivate & encourage our students to give their best shot when the questions are of their career.  ","http://localserviceassets.blob.core.windows.net:80/businessphoto-t/1-15a506c0-54fc-4b77-84f3-0236650e7f27.png , http://localserviceassets.blob.core.windows.net:80/businessphoto-t/2-7e083c21-9889-4187-b5ef-46a2b9a615b6.png , http://localserviceassets.blob.core.windows.net:80/businessphoto-t/5-734a3561-9074-41c6-8293-3b7375562074.jpg , http://localserviceassets.blob.core.windows.net:80/businessphoto-t/6-2b93b2a0-091b-46fb-ab07-2c38aabeb1d6.jpg , http://localserviceassets.blob.core.windows.net:80/businessphoto-t/7-ca4bf88e-d4a9-4783-9418-f0bd41270b9d.jpg , http://localserviceassets.blob.core.windows.net:80/businessphoto-t/8-8986eefa-34e1-4cbb-89f5-033b9ddc78af.jpg , http://localserviceassets.blob.core.windows.net:80/businessphoto-t/k-65c44c44-9251-4221-aef2-493222f53d0b.jpeg , http://localserviceassets.blob.core.windows.net:80/businessphoto-t/kap%20add-5a52db1c-6e74-4def-afed-d1e0227e8c84.jpg , http://localserviceassets.blob.core.windows.net:80/businessphoto-t/Kap%20logo-8ec2b9ab-5f2b-4934-9d4e-a4aaabd1750f.jpg , http://localserviceassets.blob.core.windows.net:80/businessphoto-t/Kaplon%2060%20X%2024-78f4e9df-c3b5-4866-afaa-aa0964924393.jpg , http://localserviceassets.blob.core.windows.net:80/businessphoto-t/kaplon%20class%20room-4e754155-4b23-4acb-992f-0199f3fea1fd.jpg , http://localserviceassets.blob.core.windows.net:80/businessphoto-t/kaplon%20office-bd7da99f-7d28-4aae-8b57-d9402095bf11.jpeg , http://localserviceassets.blob.core.windows.net:80/businessphoto-t/Reception%20Dec-8809657e-8692-4b73-ae67-a2cc77d5b90e.jpg , http://localserviceassets.blob.core.windows.net:80/businessphoto-t/viral%20sir%20with%20susmita%20sen-fa7459b4-4e2c-4f4f-a4bf-97099ae1e338.jpg , http://localserviceassets.blob.core.windows.net:80/businessphoto-m/1-15a506c0-54fc-4b77-84f3-0236650e7f27.png , http://localserviceassets.blob.core.windows.net:80/businessphoto-m/2-7e083c21-9889-4187-b5ef-46a2b9a615b6.png , http://localserviceassets.blob.core.windows.net:80/businessphoto-m/5-734a3561-9074-41c6-8293-3b7375562074.jpg , http://localserviceassets.blob.core.windows.net:80/businessphoto-m/6-2b93b2a0-091b-46fb-ab07-2c38aabeb1d6.jpg , http://localserviceassets.blob.core.windows.net:80/businessphoto-m/7-ca4bf88e-d4a9-4783-9418-f0bd41270b9d.jpg , http://localserviceassets.blob.core.windows.net:80/businessphoto-m/8-8986eefa-34e1-4cbb-89f5-033b9ddc78af.jpg , http://localserviceassets.blob.core.windows.net:80/businessphoto-m/k-65c44c44-9251-4221-aef2-493222f53d0b.jpeg , http://localserviceassets.blob.core.windows.net:80/businessphoto-m/kap%20add-5a52db1c-6e74-4def-afed-d1e0227e8c84.jpg , http://localserviceassets.blob.core.windows.net:80/businessphoto-m/Kap%20logo-8ec2b9ab-5f2b-4934-9d4e-a4aaabd1750f.jpg , http://localserviceassets.blob.core.windows.net:80/businessphoto-m/Kaplon%2060%20X%2024-78f4e9df-c3b5-4866-afaa-aa0964924393.jpg , http://localserviceassets.blob.core.windows.net:80/businessphoto-m/kaplon%20class%20room-4e754155-4b23-4acb-992f-0199f3fea1fd.jpg , http://localserviceassets.blob.core.windows.net:80/businessphoto-m/kaplon%20office-bd7da99f-7d28-4aae-8b57-d9402095bf11.jpeg , http://localserviceassets.blob.core.windows.net:80/businessphoto-m/Reception%20Dec-8809657e-8692-4b73-ae67-a2cc77d5b90e.jpg , http://localserviceassets.blob.core.windows.net:80/businessphoto-m/viral%20sir%20with%20susmita%20sen-fa7459b4-4e2c-4f4f-a4bf-97099ae1e338.jpg , ","12th Open School Distance Education , 2D Animation Training , ACT Exam Coaching , B.A Distance Education , B.C.A. Distance Education , B.Com Distance Education , B.Ed. Distance Education , B.Sc. IT Distance Education , B.Tech. Distance Education , Banking Tuitions , BBA Distance Education , BCA Distance Education , Biology Tuitions (11th & 12th) , Call Center & BPO Job Training , Calligraphy Coaching , CBSE Accounts (11th & 12th ) Tuitions , Certification programs , Certified Financial Management Distance Education , Certified Public Accountant (CPA) Distance Education , Classroom Tuitions , Correspondence , Daily Classes , DBM ADBM Distance Education , Degree Programs , Diploma in Chemical Engineering Distance Education , Diploma in Civil Engineering Distance Education , Diploma in Electrical Engineering Distance Education , Diploma in Industrial Relation Course Distance Education , Diploma in IT Engineering Distance Education , Diploma Programs , Diploma Visual Effects (VFX) Training , Evening Classes , GRE Coaching , IAS Entrance Coaching , IBPS Bank Interview Coaching , IELTS Coaching , Industrial Management Distance Education , IT Program Distance Education , LLB Distance Education , M.A. Distance Education , M.B.A. Distance Education , M.C.A. Distance Education , M.Com Distance Education , M.Phil Distance Education , M.Sc. Botany Distance Education , M.Sc. Chemistry Distance Education , M.Sc. Mathematics Distance Education , M.Sc. Physics Distance Education , M.Sc. TQM Distance Education , M.Sc. Visual Communications Distance Education , M.Sc. Zoology Distance Education , M.Tech. Distance Education , MAF Distance Education , MBA Part Time Distance Education , MIF Distance Education , MSC IT , NEET Entrance Coaching , Online Homeopathy Distance Education , Online MBA , Open School for 10th class , P.H.D. Distance Education , Personality Development Training , PGDHHM Distance Education , PGDHIM Distance Education , PGDITM Distance Education , RRB Entrance Exam Coaching , SAT Coaching , SBI PO Training , Soft Skills Training , Spoken English Classes , SSB & NDA Coaching , SSC Entrance Exam Coaching , TOEFL Coaching , UPSC Coaching , "
169744,Endeavor Careers Pvt. Ltd.,0265 - 2341992, 9033725821, 9033100222,,,No. 316,Sama Road,390016,vadodara,India,info@endeavorcareers.com,http://www.endeavorcareers.com,Ujjwal Nagar,Monday - Sunday: 9.30 AM - 8 PM,"Law Entrance Coaching , CLAT Entrance Coaching , Common Management Aptitude Test (CMAT) Coaching , CAT Coaching , B.B.A. Entrance Coaching , GRE Coaching , MBA & BBA Coaching , TOEFL Coaching , GMAT Coaching , Placement Training , Aptitude Training , Online Test Series for Exam , Online CAT Preparation Coaching , XAT Entrance Coaching , ","Endeavor Careers Pvt. Ltd. an Ahmedabad based National Test Prep player established in 2004, is the fastest growing education services brand in India focused on delivering classroom and web-based education, counseling, creating educational content and developing software for testing and assessment, catering mainly to the high school and college segments.We specialize in imparting quality and result oriented training for Indian as well as Foreign entrance examinations like CAT, CMAT, MH-CET, GRE, GMAT, TOEFL, CLAT, BBA, Campus Recruitment Training, etc. We are headed by an experienced management team who are alumni from top B-Schools and have significant experience in test preparation and well supported by an experienced faculty team of around 100 people.We are proud of our state of art infrastructure, which includes large classrooms, fully equipped library, online testing lab, audio/visual training facility and dedicated reading room.We are currently catering to more than 10,000 students across our 15 centers based in Ahmedabad, Gandhinagar, Rajkot, Surat, Vadodara, Vallabh Vidyanagar - Anand, Borivali, Thane, Vashi, Vile Parle, Bangalore, Kanpur, Bhopal and Jaipur.  ","http://localserviceassets.blob.core.windows.net:80/businessphoto-t/vp_1-ab71ef1c-243d-4d3d-a456-111e942d537d.jpg , http://localserviceassets.blob.core.windows.net:80/businessphoto-t/vp_2-07329a60-3785-4da0-96ce-dd0e9f9486ca.jpg , http://localserviceassets.blob.core.windows.net:80/businessphoto-t/vp_3-a625e08a-9ef8-46ff-8dcc-4a11b979b662.jpg , http://localserviceassets.blob.core.windows.net:80/businessphoto-t/vp_4-f6bfeb71-9dd8-4b24-876a-a7afb55c1b66.jpg , http://localserviceassets.blob.core.windows.net:80/businessphoto-t/mp_12-989b320b-d7de-4f79-a08b-9afbc21e6d71.jpg , http://localserviceassets.blob.core.windows.net:80/businessphoto-t/mp_11-0421a822-89b5-44a6-ab36-2e1e98fbec78.jpg , http://localserviceassets.blob.core.windows.net:80/businessphoto-t/mp_13-ca75c227-b045-4a9f-b352-50d43305cafe.jpg , http://localserviceassets.blob.core.windows.net:80/businessphoto-t/mp_14-68dc20e1-4483-47f6-af71-4f469298788b.jpg , http://localserviceassets.blob.core.windows.net:80/businessphoto-t/mp_15-9dda08b9-ea55-4c8b-a0e6-8e8eaa4554fa.jpg , http://localserviceassets.blob.core.windows.net:80/businessphoto-m/vp_1-ab71ef1c-243d-4d3d-a456-111e942d537d.jpg , http://localserviceassets.blob.core.windows.net:80/businessphoto-m/vp_2-07329a60-3785-4da0-96ce-dd0e9f9486ca.jpg , http://localserviceassets.blob.core.windows.net:80/businessphoto-m/vp_3-a625e08a-9ef8-46ff-8dcc-4a11b979b662.jpg , http://localserviceassets.blob.core.windows.net:80/businessphoto-m/vp_4-f6bfeb71-9dd8-4b24-876a-a7afb55c1b66.jpg , http://localserviceassets.blob.core.windows.net:80/businessphoto-m/mp_12-989b320b-d7de-4f79-a08b-9afbc21e6d71.jpg , http://localserviceassets.blob.core.windows.net:80/businessphoto-m/mp_11-0421a822-89b5-44a6-ab36-2e1e98fbec78.jpg , http://localserviceassets.blob.core.windows.net:80/businessphoto-m/mp_13-ca75c227-b045-4a9f-b352-50d43305cafe.jpg , http://localserviceassets.blob.core.windows.net:80/businessphoto-m/mp_14-68dc20e1-4483-47f6-af71-4f469298788b.jpg , http://localserviceassets.blob.core.windows.net:80/businessphoto-m/mp_15-9dda08b9-ea55-4c8b-a0e6-8e8eaa4554fa.jpg , ","GMAT Coaching , GRE Coaching , MBA & BBA Coaching , Online CAT Preparation Coaching , Online Test Series for Exam , Placement Training , TOEFL Coaching , XAT Entrance Coaching , "
169745,Crystal Educare,8460286554,,,,,,Waghodia Road,390019,vadodara,India,crystaleducare@gmail.com,,Manager,Monday - Saturday: 8 AM - 8 PM,"Spoken English Classes , IELTS Coaching , ","Crystal Educare for Learning has immense experience in this business. We provide coaching for all boards. Our motto is to provide the best teaching to the students. We have a huge list of impressive success of students. We promise a better future for your children in higher education and knowledge. We make your life better and brighter. Education is a primary ingredient and also a key to success in any profession. With a booming economy and a young population, there is a tremendous need for the quality education to equip this population with skills to handle assignments that spring from such a growing economy like ours. Contact us for further details.  ",,
169746,Train My Brain,079309 37930,,,,,"No. H-512, Titanium City Center, 100 Feet Road",Prahlad Nagar,380015,vadodara,India,anishbaheti@trainmybrain.in,http://www.trainmybrain.in,Anish Baheti,Monday - Saturday: 9 AM - 7 PM,"Job Training , Corporate Training Providers , Personality Development Training , Leadership Management Training , Corporate Communication Skills Training , Soft Skills Training , Train the Trainer , Public Speaking Training , ","Anish is a Qualified Chartered Accountant (IND), an MBA in Accounting & Finance (AUS), a Certified Life Coach (AUS), and a Certified Trainer & Assessor (AUS). He is a Certified Practitioner for Brain Mapping (UK) and also an upcoming author. He is actively involved as an International Delegate in Australian Government trade missions to India in developing employability skills and has been selected as one amongst the 40 Australian Delegation participating at Vibrant Gujarat 2015.
As a Founder of Concepts Coach (AUSTRALIA) and Train My Brain (INDIA), Anish has more than 10 years of coaching experience in Australia & India, helping Students, Business Owners, Professionals, Senior Managers & CEO's. His key programs in India are:
?Building Global Employability Skills
?Faculty Development Program (FDP)
?Self-Discovery to Self-Excellence - Unlocking YOU!
?Brain Mapping assessment as an Emotional Intelligence tool 
?Start-up pitching skillsHe is on a mission to change and transform a million lives for good and his primary focus is to unlock human potential to excel & enhance productivity. His unique Concept Based Training pedagogy revolves around quality interaction, role plays, audio-visual aids, power talks and group think sessions. Message delivered create lasting impressions due to high level of interactions with participants which gets them thinking & learning at their deepest levels. Several high profile participants have experienced breakthrough in their lives, career and business using his awesome approach.He looks forward to meeting you in person in one of his life changing program!
Your exclusive chance to CATCH me LIVE: 
https://vimeo.com/150895293
(Skill development session at CII in Dec. 2015)  ",,
169747,Havish Internationals,0265 - 3928603, 9558818035, 9558818039,,,"Ground Floor, No.  41",Sayajigunj,390005,vadodara,India,havishinternational@gmail.com,http://www.havishinternational.com,Shikha Tanjorkar,Monday - Saturday: 9 AM - 8 PM,"Coaching & Tuitions , USA Education Consultants , UK Education Consultants , Australia Education Consultants , Canada Education Consultants , New Zealand Education Consultants , Poland Education Consultants , PTE Coaching , Germany Education Consultants , Singapore Education Consultants , Switzerland Education Consultants , IELTS Coaching , Ireland Education Consultants , Malaysia Education Consultants , ","Havish Internationals is one of the leading student visa and immigration consultants with our Head Quarters in Vadodara, Gujarat, India. We commenced our operations in the year 2006 and in more than 7 years, we have served hundreds of clients in fulfilling the dreams of migrating to a new country - be it as a Student, Skilled Worker, Investor/Business purpose, Spouse and all other applicable categories. Our clients have successfully settled in countries like Australia, New Zealand, Canada, United Kingdom, USA, Singapore, Germany etc. This is just a partial list of countries we have represented till date. Havish Internationals is a global educational consultant&rsquo;s organization dedicated towards providing services to Students in making educational avenues abroad accessible to them. Havish International, a global educational consultant is a SUPER MALL towards your Great Career. Our clients are getting full satisfaction due to our prompt service extended to them. Contact us for further details.Branch Address :F-8, Prathna Vihar Campus, Near Panchal Hall, Above Divine Dinning Restaurant, Anand-  380201  ","http://localserviceassets.blob.core.windows.net:80/businessphoto-t/1-20d79ac9-2c2d-40b8-80d6-1002fb271426.png , http://localserviceassets.blob.core.windows.net:80/businessphoto-t/3-93c69728-f4b0-4d97-a3a7-b7215f204931.png , http://localserviceassets.blob.core.windows.net:80/businessphoto-m/1-20d79ac9-2c2d-40b8-80d6-1002fb271426.png , http://localserviceassets.blob.core.windows.net:80/businessphoto-m/3-93c69728-f4b0-4d97-a3a7-b7215f204931.png , ","Classroom Tuitions , Daily Classes , Evening Classes , Malaysia Education Consultants , New Zealand Education Consultants , Online Tuitions , Poland Education Consultants , PTE Coaching , Singapore Education Consultants , Switzerland Education Consultants , UK Education Consultants , USA Education Consultants , "
169748,Shree Ram Spoken English Classes,7874303151, 9833988151,,,,"Flat No. A-401,""HARMONY"", 4th Floor,Parivar Char Rasta",Waghodia Road,390025,vadodara,India,triptimohatta@gmail.com,,Tripti Mohatta,"Monday - Saturday: 11 AM - 1 PM, Monday - Saturday: 4 PM - 6 PM","Spoken English Classes , ","Shree Ram Spoken English Classes  is an experienced service provider in the industry. We ensure that our candidates receive high quality and training. At Shree Ram Spoken English Classes we provide services such as Spoken English. We value the trust and beliefs vested in us by our customers and professional contacts, and give a dedicated service with an honest and direct approach in all our dealings.  Contact us for further information  ",,
169749,Soni Classes,9429928412, 8866276299,,,,No. 302,Sama Road,390012,vadodara,India,Chai.soni@yahoo.com,,Chaitali Soni,Monday - Saturday: 9 AM - 8 PM ( Lunch: 1 PM - 3 PM ),"Coaching & Tuitions , Home & Private Tuitions , Accounts Preparation / Book-Keeping Services , B.Com Home Tutors , Budget Preparation Services , Economics Home Tuitions , CA Home Tuitions , CACPT Coaching , Accounts Home Tutors for XI-XII , Accounting Home Tuitions , Commerce Tuitions (11th & 12th STD) , Income Tax Home Tuitions , Direct Tax Home Tuitions , Tax Law Home Tuitions , Financial Accounting Home Tuitions , Tax Return Services , Tax Consultants , IB Economics Home Tuitions , IB Accounts Home Tuitions , IB Business Studies Home Tuitions , Local Body Tax Consultants , IGCSE Economics Home Tuitions , IGCSE Accounts Home Tuitions , IGCSE Business Studies Home Tuitions , Chartered Accountant Coaching , Tax Audit Services , Economics Coaching Classes (11th & 12th STD) , B.Com Coaching , CBSE Accounts (11th & 12th ) Tuitions , ","Soni Classes is a renowned company known for its quality services and timelines. customers are always treated with courtesy and you can feel it when you are with us. At Soni Classes we conduct coaching such as B.Com Coaching,B.Com Entrance Exam Coaching,CBSE Accounts (11th & 12th ) Tuitions,Chartered Accountant Coaching,Commerce Tuitions (11th & 12th STD),M.Com Coaching. Contact us for further details  ",,"Budget Preparation Services , CA Home Tuitions , CACPT Coaching , CBSE Accounts (11th & 12th ) Tuitions , Chartered Accountant Coaching , Commerce Tuitions (11th & 12th STD) , Direct Tax Home Tuitions , Economics Coaching Classes (11th & 12th STD) , Economics Home Tuitions , Financial Accounting Home Tuitions , IB Accounts Home Tuitions , IB Business Studies Home Tuitions , IB Economics Home Tuitions , IGCSE Accounts Home Tuitions , IGCSE Business Studies Home Tuitions , IGCSE Economics Home Tuitions , Income Tax Home Tuitions , Local Body Tax Consultants , Tax Audit Services , Tax Consultants , Tax Law Home Tuitions , Tax Return Services , "
169750,Tayal Institute Pvt. Ltd.,+91 22 49432704,,,,,"No. 403, D- Definity, JP Nagar, Road No. 1",Goregaon East,400062,vadodara,India,sales@tayalinstitute.com,http://www.tayalsirvod.com,Rajesh Tayal,Monday - Sunday: 9 AM - 7 PM,"CS Coaching , CMA Coaching , Chartered Accountant Coaching , Chartered Financial Analyst (CFA) Coaching , ","Tayal Institute Private Limited is the first institute in India to provide coaching exclusively to CA Final students only. Another first for us is to give a choice to the students for selecting the subject they want to do with us instead of forcing them to join.The institute was founded by CS Prof. Rajesh Tayal, in the year 2004 and since then it has recorded growth year over years. Every time some of our students are placed in merit list.Our courses are built in partnership with technology leaders and are relevant to industry needs.  ","http://localserviceassets.blob.core.windows.net:80/businessphoto-t/12-11-2015%2012-55-43-f84c93fa-fd98-4134-9c4f-9b3abdf442c6.png , http://localserviceassets.blob.core.windows.net:80/businessphoto-t/12-11-2015%2012-55-52-407ad4c4-b749-4039-add0-bb8165549e5a.png , http://localserviceassets.blob.core.windows.net:80/businessphoto-t/12-11-2015%2012-55-58-5bd41ed0-3d4e-4bd7-bf24-edcf6d120f4c.png , http://localserviceassets.blob.core.windows.net:80/businessphoto-t/12-11-2015%2012-56-05-c39d720b-a59f-4dc2-b185-a2213d696199.png , http://localserviceassets.blob.core.windows.net:80/businessphoto-t/12-11-2015%2012-56-12-1a590e8e-38a2-4af7-82af-0375c4b4bc77.png , http://localserviceassets.blob.core.windows.net:80/businessphoto-t/12-11-2015%2012-56-19-7a1e10da-8ed1-4df1-a576-3d5090ca7c55.png , http://localserviceassets.blob.core.windows.net:80/businessphoto-t/12-11-2015%2012-56-26-f2c2731b-b550-427a-be55-4682b4e86802.png , http://localserviceassets.blob.core.windows.net:80/businessphoto-t/12-11-2015%2012-56-38-61214f67-4aa2-415e-9754-d8efcd3d00ec.png , http://localserviceassets.blob.core.windows.net:80/businessphoto-m/12-11-2015%2012-55-43-f84c93fa-fd98-4134-9c4f-9b3abdf442c6.png , http://localserviceassets.blob.core.windows.net:80/businessphoto-m/12-11-2015%2012-55-52-407ad4c4-b749-4039-add0-bb8165549e5a.png , http://localserviceassets.blob.core.windows.net:80/businessphoto-m/12-11-2015%2012-55-58-5bd41ed0-3d4e-4bd7-bf24-edcf6d120f4c.png , http://localserviceassets.blob.core.windows.net:80/businessphoto-m/12-11-2015%2012-56-05-c39d720b-a59f-4dc2-b185-a2213d696199.png , http://localserviceassets.blob.core.windows.net:80/businessphoto-m/12-11-2015%2012-56-12-1a590e8e-38a2-4af7-82af-0375c4b4bc77.png , http://localserviceassets.blob.core.windows.net:80/businessphoto-m/12-11-2015%2012-56-19-7a1e10da-8ed1-4df1-a576-3d5090ca7c55.png , http://localserviceassets.blob.core.windows.net:80/businessphoto-m/12-11-2015%2012-56-26-f2c2731b-b550-427a-be55-4682b4e86802.png , http://localserviceassets.blob.core.windows.net:80/businessphoto-m/12-11-2015%2012-56-38-61214f67-4aa2-415e-9754-d8efcd3d00ec.png , ",
169751,Expert Training Center,9638849998,,,,,"No. 302, 3rd Floor, Eagle Apartment",Fatehgunj,390002,vadodara,India,ecc.hardik@gmail.com,,Hardik Patel,Monday - Saturday: 10 AM - 6.30 PM,"SSC Entrance Exam Coaching , RRB Entrance Exam Coaching , Common Management Aptitude Test (CMAT) Coaching , UPSC Coaching , IBPS Bank Interview Coaching , Spoken English Classes , B.B.A. Entrance Coaching , ISC Tuitions for 11th & 12th , Economics Coaching Classes (9th & 10th STD) , Banking Tuitions , Economics Coaching Classes (11th & 12th STD) , Advanced Economics Coaching Classes (College level and above) , Insurance Exam Coaching , Aptitude Training , Online Test Series for Exam , ",Expert Training Center is here in this field for many years. We deal with Coaching & training. Your happiness is our satisfaction. We are experienced service providers catering to the requirements of our valuable clients. We assure that you will walk out with pleasurable experience as our customer. Contact us for your needs.  ,"http://localserviceassets.blob.core.windows.net:80/businessphoto-t/1124701%20(1)-ebc13683-f97e-4f14-8bab-06d1d978a67e.jpg , http://localserviceassets.blob.core.windows.net:80/businessphoto-t/1124701%20(2)-82b4bd74-1471-4d0f-934a-83f47c81cbc8.jpg , http://localserviceassets.blob.core.windows.net:80/businessphoto-t/1124701%20(3)-b56378e6-9a7e-4337-b20e-22203bd25044.jpg , http://localserviceassets.blob.core.windows.net:80/businessphoto-t/1124701%20(4)-b75022ab-0aad-46e7-8bb8-83427beada70.jpg , http://localserviceassets.blob.core.windows.net:80/businessphoto-m/1124701%20(1)-ebc13683-f97e-4f14-8bab-06d1d978a67e.jpg , http://localserviceassets.blob.core.windows.net:80/businessphoto-m/1124701%20(2)-82b4bd74-1471-4d0f-934a-83f47c81cbc8.jpg , http://localserviceassets.blob.core.windows.net:80/businessphoto-m/1124701%20(3)-b56378e6-9a7e-4337-b20e-22203bd25044.jpg , http://localserviceassets.blob.core.windows.net:80/businessphoto-m/1124701%20(4)-b75022ab-0aad-46e7-8bb8-83427beada70.jpg , ","Economics Coaching Classes (11th & 12th STD) , Economics Coaching Classes (9th & 10th STD) , IBPS Bank Interview Coaching , Insurance Exam Coaching , ISC Tuitions for 11th & 12th , Online Test Series for Exam , RRB Entrance Exam Coaching , Spoken English Classes , SSC Entrance Exam Coaching , UPSC Coaching , "
