EduID,Name,Phone1,Phone2,Phone3,Phone4,Phone5,Street Address,Locality,Pincode,City,Country,Mail,Website,Person to Contact,Working Hours,Services Offered,Details,Images URL,Keywords
181088,Statesman Academy,+91 172 3368830,,,,,"SCO Number 54-55, 2nd Floor",Sector 34A,160034,chandigarh,India,statesmanchd@gmail.com,http://www.statesmaneduac.com,Dr. Riddhima,Monday - Saturday: 9 AM - 7 PM,"UGC Net Coaching , Microbiology & Biotechnology Tuitions , UGC Net Management Coaching , UGC Net HR Coaching , Biochemistry Degree Tuitions , Botony Tuitions , UGC Net Commerce Coaching , CSIR UGC Net Exam Coaching , UGC Net Economics Coaching , UGC Net History Coaching , UGC Net English Literature Coaching , UGC Net Chemistry Coaching , MPPSC Entrance Exam Coaching , SSC Entrance Exam Coaching , CSIR UGC Net Life Sciences , CSIR UGC Net Environmental Sciences , RRB Entrance Exam Coaching , Computer Science Tuitions (11th & 12th STD) , UGC Net Geography Coaching , PTE Coaching , Physics Tuitions (11th & 12th) , CACPT Coaching , Common Management Aptitude Test (CMAT) Coaching , CS Coaching , Diploma in Banking & Finance (DBF) Coaching , Polytechnic Entrance Coaching , Certified Financial Executive (CFX) Coaching , SSC JE Entrance Coaching , Banking Tuitions , MBA & BBA Coaching , Chemistry Tuitions (11th & 12th) , Biology Tuitions (11th & 12th) , IIT JAM Coaching , Bioinformatics Training , MIF Coaching , REET Coaching , IGCSE Maths Tuitions , ICSE English Tuitions , MCA Entrance Coaching , Vis-com Entrance Coaching , Placement Training , Aptitude Training , CET Entrance Coaching , AIEEE Coaching , 10th STD Tuitions , MSC Entrance Exam Coaching , M.Com Entrance Exam Coaching , M.Com Coaching , B.A English Coaching , M.A English Coaching , Zoology Tuitions , IIT-JEE Coaching , IES Show less « , ","We are glad to have you in our profile page, may be you are a valued customer, a returning customer, an unsatisfied customer or just a first time visitor to our page, we would like to thank you for having us in your mind, Statesman Academy	  one of the leading service providers of Coaching & Tuitions and UGC Net Coaching. We are one of the reputed service providers and our strong presence in the industry is a proof for the same. Our customers are always treated with courtesy and you can feel it when you are with us. Our experience over many years is that this delivers the best performance and best return on investment for our customers. Call us to know more about us.  ","http://localserviceassets.blob.core.windows.net:80/businessphoto-t/21-12-2015%2017-58-23-dc221df4-3f7b-4cae-9127-53a7b09e3a47.png , http://localserviceassets.blob.core.windows.net:80/businessphoto-t/21-12-2015%2017-58-35-5b80cdd7-00d2-4695-917a-968d2d7b4b55.png , http://localserviceassets.blob.core.windows.net:80/businessphoto-t/21-12-2015%2017-58-45-3089a160-6a5e-4db3-8236-a941a5d1a4cf.png , http://localserviceassets.blob.core.windows.net:80/businessphoto-t/21-12-2015%2017-58-56-fcae6a76-b766-42b0-b559-847b7ba5ed8e.png , http://localserviceassets.blob.core.windows.net:80/businessphoto-t/21-12-2015%2017-59-19-927a19f4-a04a-431b-b925-c3bd7f81d023.png , http://localserviceassets.blob.core.windows.net:80/businessphoto-t/21-12-2015%2017-59-43-082550f8-23df-496f-a31a-17b261916e6d.png , http://localserviceassets.blob.core.windows.net:80/businessphoto-m/21-12-2015%2017-58-23-dc221df4-3f7b-4cae-9127-53a7b09e3a47.png , http://localserviceassets.blob.core.windows.net:80/businessphoto-m/21-12-2015%2017-58-35-5b80cdd7-00d2-4695-917a-968d2d7b4b55.png , http://localserviceassets.blob.core.windows.net:80/businessphoto-m/21-12-2015%2017-58-45-3089a160-6a5e-4db3-8236-a941a5d1a4cf.png , http://localserviceassets.blob.core.windows.net:80/businessphoto-m/21-12-2015%2017-58-56-fcae6a76-b766-42b0-b559-847b7ba5ed8e.png , http://localserviceassets.blob.core.windows.net:80/businessphoto-m/21-12-2015%2017-59-19-927a19f4-a04a-431b-b925-c3bd7f81d023.png , http://localserviceassets.blob.core.windows.net:80/businessphoto-m/21-12-2015%2017-59-43-082550f8-23df-496f-a31a-17b261916e6d.png , ","10th STD Tuitions , 9th STD Tuitions , AIEEE Coaching , All India Common Entrance Examination (AICEE) Coaching , Aptitude Training , B.A English Coaching , Banking Tuitions , Biochemistry Degree Tuitions , Bioinformatics Training , Biology Tuitions (11th & 12th) , Botony Tuitions , CACPT Coaching , Certified Financial Executive (CFX) Coaching , CET Entrance Coaching , Chartered Financial Analyst (CFA) Coaching , Chemistry Tuitions (11th & 12th) , Classroom Tuitions , Common Management Aptitude Test (CMAT) Coaching , Computer Science Tuitions (11th & 12th STD) , CS Coaching , CSIR UGC Net Environmental Sciences , CSIR UGC Net Exam Coaching , CSIR UGC Net Life Sciences , Daily Classes , IIT JAM Coaching , IIT-JEE Coaching , M.A English Coaching , M.Com Coaching , M.Com Entrance Exam Coaching , MBA & BBA Coaching , MCA Entrance Coaching , Microbiology & Biotechnology Tuitions , MIF Coaching , MPPSC Entrance Exam Coaching , MSC Entrance Exam Coaching , Online Tutoring for Schools & Colleges , Physics Tuitions (11th & 12th) , Placement Training , Polytechnic Entrance Coaching , Pre-Medical Test (PMT) Entrance Coaching , PTE Coaching , REET Coaching , RRB Entrance Exam Coaching , School Tuitions for Biology , SSB & NDA Coaching , SSC Entrance Exam Coaching , SSC JE Entrance Coaching , UGC Net Chemistry Coaching , UGC Net Commerce Coaching , UGC Net Economics Coaching , UGC Net English Literature Coaching , UGC Net Geography Coaching , UGC Net History Coaching , UGC Net HR Coaching , UGC Net Management Coaching , Vis-com Entrance Coaching , Zoology Tuitions , "
181089,New Cambridge College,+91 172 3368918,,,,,"SCO- 80, 81, 82, Top Floor",Sector 17D,160017,chandigarh,India,newcambridgecollege@gmail.com,http://www.newcambridgecollege.com,N.K. Dhamija,Monday - Saturday: 9 AM - 6 PM,"Job Training , Corporate Training Providers , Content Writers , Media & Mass Communication Colleges , Defence/Police Exam Coaching , Competitive Exams Online Coaching , Bachelor in Mass Communication Colleges , CDS Exam Coaching , IELTS Online Coaching , SEO Content Writing Services , XAT Online Coaching , CRPF Exam Coaching , BSF Exam Coaching , ITBP Exam Coaching , CPF Exam Coaching , IPS Entrance Exam Coaching , SSC Entrance Exam Coaching , SNAP Online Coaching , Online PTE Coaching , PTE Coaching , UPSC Coaching , Commerce Tuitions (11th & 12th STD) , CTET Coaching , IBPS Bank Interview Coaching , IAS Entrance Coaching , Spoken English Classes , PSAT Exam Coaching , GRE Coaching , SAT Coaching , SSC JE Entrance Coaching , Banking Tuitions , Mass Communication Training , Insurance Exam Coaching , IELTS Coaching , TOEFL Coaching , GMAT Coaching , SBI PO Training , Spoken English Training (Corporate) , Language Development Coaching , Aptitude Training , Diploma in Banking & Finance (DBF) Training , Public Speaking Training , IBPS Bank Exam Coaching , BJMC Coaching , CGL Exam Coaching , CHSL Exam Coaching , SSB & NDA Coaching , Vedic Maths Coaching , XAT Entrance Coaching , ","New Cambridge College for Learning has immense experience in this business. We provide coaching for GRE, GATE, SAT, GMAT, Spoken English, Personality Development, IELTS, and TOEFL. We also assist our students with their preparation for the jobs in government and banking sector. Our motto is to provide the best teaching to the students. We have a huge list of impressive success of students. We promise a better future for your children in higher education and knowledge. We make your life better and brighter. Education is a primary ingredient and also a key to success in any profession. There is a tremendous need for the quality education to equip this population with skills to handle assignments that spring from such a growing economy like ours. For more details contact us.  ","http://yellowpages.sulekha.com/photos/3970975/w1008-h567-no2.jpg , http://yellowpages.sulekha.com/photos/4469743/w1008-h567-no2.jpg , http://yellowpages.sulekha.com/photos/3970975/11.jpg , http://yellowpages.sulekha.com/photos/3970975/12.jpg , http://yellowpages.sulekha.com/photos/4469743/11.jpg , http://yellowpages.sulekha.com/photos/4469743/12.jpg , http://yellowpages.sulekha.com/photos/4469743/13.jpg , http://localserviceassets.blob.core.windows.net:80/businessphoto-t/12345-ce50a7f6-68e4-4917-8924-39c52a95b3ab.jpg , http://localserviceassets.blob.core.windows.net:80/businessphoto-t/12345-83c6c192-3582-45ac-bb6a-c4f178b6b787.jpg , http://localserviceassets.blob.core.windows.net:80/businessphoto-t/sulekha2016-01-0601572116807-3b02ad00-3846-46e1-a8fc-0839f5e341c2.png , http://localserviceassets.blob.core.windows.net:80/businessphoto-t/sulekha2016-01-060157211622650073-0b9e991e-b2c8-4323-bd75-e8b8a4ee26fa.png , http://localserviceassets.blob.core.windows.net:80/businessphoto-t/sulekha2016-01-060157211144108930-2f8dce17-680b-4cd5-98c1-e2039e132e53.png , http://yellowpages.sulekha.com/photos/3970975/w1008-h567-no2.jpg , http://yellowpages.sulekha.com/photos/4469743/w1008-h567-no2.jpg , http://yellowpages.sulekha.com/photos/3970975/11.jpg , http://yellowpages.sulekha.com/photos/3970975/12.jpg , http://yellowpages.sulekha.com/photos/4469743/11.jpg , http://yellowpages.sulekha.com/photos/4469743/12.jpg , http://yellowpages.sulekha.com/photos/4469743/13.jpg , http://localserviceassets.blob.core.windows.net:80/businessphoto-m/12345-ce50a7f6-68e4-4917-8924-39c52a95b3ab.jpg , http://localserviceassets.blob.core.windows.net:80/businessphoto-m/12345-83c6c192-3582-45ac-bb6a-c4f178b6b787.jpg , http://localserviceassets.blob.core.windows.net:80/businessphoto-m/sulekha2016-01-0601572116807-3b02ad00-3846-46e1-a8fc-0839f5e341c2.png , http://localserviceassets.blob.core.windows.net:80/businessphoto-m/sulekha2016-01-060157211622650073-0b9e991e-b2c8-4323-bd75-e8b8a4ee26fa.png , http://localserviceassets.blob.core.windows.net:80/businessphoto-m/sulekha2016-01-060157211144108930-2f8dce17-680b-4cd5-98c1-e2039e132e53.png , ","CDS Exam Coaching , CGL Exam Coaching , CHSL Exam Coaching , Commerce Tuitions (11th & 12th STD) , CPF Exam Coaching , CRPF Exam Coaching , CTET Coaching , Diploma in Banking & Finance (DBF) Training , GMAT Coaching , GRE Coaching , IAS Entrance Coaching , IBPS Bank Exam Coaching , IBPS Bank Interview Coaching , IELTS Coaching , IELTS Online Coaching , Insurance Exam Coaching , IPS Entrance Exam Coaching , ITBP Exam Coaching , Language Development Coaching , Mass Communication Training , Online PTE Coaching , PSAT Exam Coaching , PTE Coaching , Public Speaking Training , SAT Coaching , SBI PO Training , SEO Content Writing Services , SNAP Online Coaching , Spoken English Classes , Spoken English Training (Corporate) , SSB & NDA Coaching , SSC Entrance Exam Coaching , SSC JE Entrance Coaching , TOEFL Coaching , UPSC Coaching , Vedic Maths Coaching , XAT Entrance Coaching , XAT Online Coaching , "
181090,Hitech ILS Cloud Solutions Pvt. Ltd.,+91 172 3368913,,,,,"SCO 121-122-123, 4th Floor(Haryana Store Building)",Sector 34A,160022,chandigarh,India,enquiryiiht@gmail.com,,Pooja,Monday - Saturday: 8 AM - 8 PM,"Certification Courses Training , Computer Networking Training , Database Training , Ethical Hacking Training , Programming Languages Training , Web Technologies Training , Cloud Computing Training , Database Management Training , Advanced C Programming Training , Red Hat Cloud Training , Cloud Administration Training , Computer Hacking Forensic Investigation , AJAX Training , C, C++ Training , Basic Networking Training , Advanced Networking Training , C Sharp (C#) Training , ASP.Net Training , .Net Training , EJB Training , Citrix Cloud Training , Java & J2EE Training , DBA Mainframe Training , Perl Programming Training , Azure Cloud Training , Java Script Training , Vmware Cloud Training , Shell Scripting Training , Oracle 10g DBA Training , L2 & L3 Protocol Training , Oracle DBA Training , VB Script Training , A+ Certification Training , Ruby on Rails Training , Basic Language Training , SQL Server Training , N+ Certification Training , Web Logic Training , Python Programming Training , PHP & MySQL Training , Rich Internet Applications Training , Advanced Visual Basic Training , Database Testing Training , JMS Training , Computer Science Tuitions (11th & 12th STD) , Java Beans Training , RDBMS Training , CCC / BCC Course , Software Engineering with UML Training , Oracle 11g DBA Training , HADOOP Training , Socket Programming Training , WAP Training , MS Access Training , ","Hitech ILS Cloud Solutions Pvt. Ltd. has massive experience in this business. We teach students and train them for IT profession. Also, we help re-skilling IT professionals for better job performance. We have catered our training services to some of the renowned fortune companies. Our motto is to provide the best teaching to the students. We have a huge list of impressive success of students. We promise a better future for your children in higher education and knowledge. We make your life better and brighter. Our aim is to provide skilled manpower in the areas of hardware, networking, database management, security and storage management along with introducing students and professionals with the latest technology in IT industry. Contact us for further details.  ","http://localserviceassets.blob.core.windows.net:80/businessphoto-t/5722-56fd7967-21fd-47c8-8f75-d2df0945f8b1.jpg , http://localserviceassets.blob.core.windows.net:80/businessphoto-t/8082-f5829197-8fbf-42c7-b689-03194ef3cdd5.jpg , http://localserviceassets.blob.core.windows.net:80/businessphoto-t/4499-52e03a02-11e9-4c36-9d20-1d8a401efc37.jpg , http://localserviceassets.blob.core.windows.net:80/businessphoto-t/3216-e9530a90-555e-40c8-af78-7b2612c7e221.jpg , http://localserviceassets.blob.core.windows.net:80/businessphoto-t/3133-c574868f-aa6e-4c6e-a975-c7b2b2638e68.jpg , http://localserviceassets.blob.core.windows.net:80/businessphoto-t/9969-c07c9f81-7bc6-457b-913d-202de2ed9fb9.jpg , http://localserviceassets.blob.core.windows.net:80/businessphoto-t/3667-9b34f6ba-d913-4e47-b884-e7f64a63394c.jpg , http://localserviceassets.blob.core.windows.net:80/businessphoto-t/4753-1b3cf202-3ae6-4c2c-b738-2985bb785c23.jpg , http://localserviceassets.blob.core.windows.net:80/businessphoto-m/5722-56fd7967-21fd-47c8-8f75-d2df0945f8b1.jpg , http://localserviceassets.blob.core.windows.net:80/businessphoto-m/8082-f5829197-8fbf-42c7-b689-03194ef3cdd5.jpg , http://localserviceassets.blob.core.windows.net:80/businessphoto-m/4499-52e03a02-11e9-4c36-9d20-1d8a401efc37.jpg , http://localserviceassets.blob.core.windows.net:80/businessphoto-m/3216-e9530a90-555e-40c8-af78-7b2612c7e221.jpg , http://localserviceassets.blob.core.windows.net:80/businessphoto-m/3133-c574868f-aa6e-4c6e-a975-c7b2b2638e68.jpg , http://localserviceassets.blob.core.windows.net:80/businessphoto-m/9969-c07c9f81-7bc6-457b-913d-202de2ed9fb9.jpg , http://localserviceassets.blob.core.windows.net:80/businessphoto-m/3667-9b34f6ba-d913-4e47-b884-e7f64a63394c.jpg , http://localserviceassets.blob.core.windows.net:80/businessphoto-m/4753-1b3cf202-3ae6-4c2c-b738-2985bb785c23.jpg , ","AJAX Training , Apache Tomcat Training , ASP.Net Training , Azure Cloud Training , Basic Language Training , Basic Networking Training , Below Rs.1000 , Big Data Training , C Sharp (C#) Training , C, C++ Training , CCC / BCC Course , Citrix Cloud Training , Classroom Tuitions , Cloud Administration Training , Computer Hacking Forensic Investigation , Computer Science Tuitions (11th & 12th STD) , CSS Training , Database Management Training , Database Testing Training , DBA Mainframe Training , DHTML Training , Dreamweaver Training , EJB Training , HADOOP Training , HTML Training , Java & J2EE Training , Java Beans Training , Java Script Training , JMS Training , JQuery Training , JSP Training , L2 & L3 Protocol Training , Magento Training , More than Rs.20000 , MS Access Training , N+ Certification Training , Online Tuitions , Oracle 10g DBA Training , Oracle 11g DBA Training , Oracle DBA Training , Perl Programming Training , PHP & MySQL Training , Python Programming Training , RDBMS Training , Red Hat Cloud Training , Rich Internet Applications Training , Rs.10000-Rs.20000 , Rs.1000-Rs.5000 , Rs.5000-Rs.10000 , Ruby on Rails Training , Shell Scripting Training , Socket Programming Training , Software Engineering with UML Training , Spoken English Classes , SQL Server Training , VB Script Training , Vmware Cloud Training , WAP Training , Web Logic Training , "
181091,Brain Tree,+91 172 3368911,,,,,"No. SCO 80, 81 & 82, Top Floor",Sector 17D,160017,chandigarh,India,naveenpruthi44@yahoo.com,http://www.braintreeias.com,Naveen Pruthi,Monday - Sunday : 24 Hrs,"GATE Coaching , Law Entrance Coaching , GATE Biotechnology Coaching , GATE Civil Engineering Coaching , GATE Chemical Engineering Coaching , GATE Computer Science Coaching , GATE Chemistry Coaching , GATE Mathematics Coaching , CLAT Entrance Coaching , GATE Physics Coaching , IPS Entrance Exam Coaching , GATE Electronics Engineering Coaching , GATE Electrical Engineering Coaching , GATE Instrumental Engineering Coaching , GATE Mechanical Engineering Coaching , GATE Production Engineering Coaching , GATE Industrial Engineering Coaching , GATE Coaching for Other Subjects , UPSC Coaching , PSU Entrance Coaching , IAS Entrance Coaching , PCS Entrance Coaching , IES Coaching , SSB & NDA Coaching , ","Brain Tree is witnessing a new period of growth because of faith of student who believe us. We want our institute to be well managed to serve our students. We are committed to follow the highest and latest class of study material for our students. To serve better we have best teachers from different colleges and universities. Development and further expansion of students knowledge is our main aim in their respective courses. We will continue to support our students with the latest version of books and study material.Brain Tree is the best institute in Chandigarh, made for professional IAS (Indian Administrative Services) students. We are serving our students for more than 15 years in sector 17 D Chandigarh and earlier we have served them in sector 15 for 5 years so we have good track record of 20 years.  ","http://localserviceassets.blob.core.windows.net:80/businessphoto-t/1-03325dcc-0ea8-47b8-a153-a6fdd58f9a57.jpg , http://localserviceassets.blob.core.windows.net:80/businessphoto-t/2-c632305e-d667-48cf-a42c-9b86b34e74ba.jpg , http://localserviceassets.blob.core.windows.net:80/businessphoto-t/4-86915485-92de-4bc9-92ff-f53a375c793a.jpg , http://localserviceassets.blob.core.windows.net:80/businessphoto-m/1-03325dcc-0ea8-47b8-a153-a6fdd58f9a57.jpg , http://localserviceassets.blob.core.windows.net:80/businessphoto-m/2-c632305e-d667-48cf-a42c-9b86b34e74ba.jpg , http://localserviceassets.blob.core.windows.net:80/businessphoto-m/4-86915485-92de-4bc9-92ff-f53a375c793a.jpg , ","1 Year Program , 6 Months Program , Classroom Tuitions , CLAT Entrance Coaching , Daily Classes , Evening Classes , GATE Computer Science Coaching , GATE Electrical Engineering Coaching , GATE Electronics Engineering Coaching , GATE Industrial Engineering Coaching , GATE Instrumental Engineering Coaching , GATE Mathematics Coaching , GATE Mechanical Engineering Coaching , GATE Physics Coaching , GATE Production Engineering Coaching , Holiday Classes , IAS Entrance Coaching , IES Coaching , IPS Entrance Exam Coaching , More than Rs.20000 , PCS Entrance Coaching , PSU Entrance Coaching , SSB & NDA Coaching , Summer Classes , UPSC Coaching , Weekend Classes , "
181092,Robomate Plus,18002100009,,,,,All Offline & Online Courses Available,Mulund West,400036,chandigarh,India,robomateleads@mteducare.com,,Mehek Khan,Monday - Saturday: 9 AM - 8 PM,,"MT EduCare Ltd, we believe in facilitating an environment to excel in studies. We offer world class infrastructure in addition to curriculum taught by the subject matter experts of the highest caliber backed by well  researched content and customized evaluation systems. Our interactive and new age methodologies not only make learning as an enjoyable experience but also create motivated and energetic students ready to excel in their exams.. Contact us for further details.  ",,
181093,Regional Institute Of Science,+91 172 3368941,,,,,"SCO 87-88, First Floor, Sector 34-A",Chandigadh,160022,chandigarh,India,rise34info@gmail.com,http://www.regionalinstituteofscience.com,I J Sharma,"Monday - Saturday: 8 AM - 8 PM, Sunday: 9 AM - 5 PM","Physics Tuitions (11th & 12th) , BAMS Coaching , IIT Engineering Entrance Coaching , School Tuitions for Math, Physics, Chemistry , Medical Entrance Coaching , Chemistry Tuitions (11th & 12th) , Biology Tuitions (11th & 12th) , CBSE Tuitions for Maths , CBSE Tuitions for Physics , CBSE Tuitions for Chemistry , AIEEE Coaching , 10th STD Tuitions , JEE Advanced Coaching , IIT-JEE Coaching , Pre-Medical Test (PMT) Entrance Coaching , School Tuitions for Biology , ","Regional Faculties of Science, (RFS) Chandigarh was founded on 17th February 2011 with the vision of providing high-quality education along with training our next generation with rich moral values of Indian culture and society. We aim to develop the mind & soul of the child and build ideal citizens & good human beings. Contact us for further details.  ","http://localserviceassets.blob.core.windows.net:80/businessphoto-t/RISE%203-1b621232-2ec2-48f6-a477-099ec108a89c.png , http://localserviceassets.blob.core.windows.net:80/businessphoto-t/RISE%202-59d61f0e-610f-41a2-b2ac-60f5d7f2640a.png , http://localserviceassets.blob.core.windows.net:80/businessphoto-t/RISE-b2c1ea38-13f1-461c-87bb-25e67a97b474.png , http://localserviceassets.blob.core.windows.net:80/businessphoto-m/RISE%203-1b621232-2ec2-48f6-a477-099ec108a89c.png , http://localserviceassets.blob.core.windows.net:80/businessphoto-m/RISE%202-59d61f0e-610f-41a2-b2ac-60f5d7f2640a.png , http://localserviceassets.blob.core.windows.net:80/businessphoto-m/RISE-b2c1ea38-13f1-461c-87bb-25e67a97b474.png , ","CBSE Tuitions for Maths , CBSE Tuitions for Physics , Chemistry Tuitions (11th & 12th) , Classroom Tuitions , Daily Classes , Evening Classes , Holiday Classes , IIT Engineering Entrance Coaching , IIT-JEE Coaching , JEE Advanced Coaching , Medical Entrance Coaching , Physics Tuitions (11th & 12th) , Pre-Medical Test (PMT) Entrance Coaching , School Tuitions for Biology , School Tuitions for Math, Physics, Chemistry , Summer Classes , Weekend Classes , "
