EduID,Name,Phone1,Phone2,Phone3,Phone4,Phone5,Street Address,Locality,Pincode,City,Country,Mail,Website,Person to Contact,Working Hours,Services Offered,Details,Images URL,Keywords
166313,Saraswathi Musicals,9843864112,,,,,#10,Madurai Main Road,620008,trichy,India,,,,,"Enterprise Training , Home & Private Tuitions , Big Data Analytics Online Training , Engineering Tuitions , Law Entrance Coaching , Home Tutors for Class I-V , R Analytics Online Training , Mechanical Engineering Tuitions , SET Entrance Coaching , Aerospace Engineering Tuitions , Home Tutors for Class VI-X , B.Com Home Tutors , Biomedical Engineering Tuitions , Biomechanical Engineering Tuitions , B.Sc Home Tutors , BE Home Tuitions , Automotive Engineering Tuitions , Civil Engineering Tuitions , Biology Home Tuitions for school , Chemistry Home Tuitions for school , Architectural Engineering Tuitions , Electrical Engineering Tuitions , Hindi Home Tuitions , English Home Tuitions for school , IT & Computer Science Engineering Tuitions , Robotics Engineering Tuitions , Physics Home Tuitions for school , Economics Home Tuitions , Microelectronic Engineering Tuitions , Chemical Engineering Tuitions , BBA Home Tuitions , MBA Home Tuitions , Environmental Engineering Tuitions , Materials Science Engineering Tuitions , ICWA Home Tuitions , MCA Home Tuitions , Foreign Languages Coaching , Agricultural Engineering Tuitions , GMAT Private Tuitions , CA Home Tuitions , Maths Home Tuitions for school , Engineering Tuitions - Other Branches , Engineering Physics Tuitions , Biotechnology Engineering Tuitions , Genetic Engineering Tuitions , Engineering Chemistry Tuitions , Mechatronics Engineering Tuitions , Software Engineering Tuitions , Electronics & Communication Engineering Tuitions , Instrumentation Technology Engineering Tuitions , Telecommunication Engineering Tuitions , Industrial & Production Engineering Show less  , ",,,"B.Com Home Tutors , B.Sc Home Tutors , Banking Tuitions , BBA Home Tuitions , BE Home Tuitions , Biology Home Tuitions for school , Biomechanical Engineering Tuitions , Biomedical Engineering Tuitions , Biotechnology Engineering Tuitions , CA Home Tuitions , CAT Coaching , Chartered Accountant Coaching , Chemical Engineering Tuitions , Chemistry Home Tuitions for school , Civil Engineering Tuitions , College Tuitions for Accounts, Finance, Statistics , College Tuitions for Chemistry , College Tuitions for Maths , College Tuitions for Physics , Economics Home Tuitions , Electrical Engineering Tuitions , Electronics & Communication Engineering Tuitions , Engineering Chemistry Tuitions , Engineering Physics Tuitions , Engineering Tuitions - Other Branches , English Home Tuitions for school , Environmental Engineering Tuitions , Foreign Languages Coaching , Genetic Engineering Tuitions , GMAT Private Tuitions , GRE Coaching , Handwriting, Spelling & Reading Classes , Hindi Home Tuitions , Home Tutors for Class I-V , Home Tutors for Class VI-X , IAS Entrance Coaching , ICWA Home Tuitions , IIT Engineering Entrance Coaching , Industrial & Production Engineering Tuitions , Instrumentation Technology Engineering Tuitions , IT & Computer Science Engineering Tuitions , Mass Communication Training , Materials Science Engineering Tuitions , Maths Home Tuitions for school , MBA & BBA Coaching , MBA Home Tuitions , MCA Home Tuitions , Mechanical Engineering Tuitions , Mechatronics Engineering Tuitions , Medical Entrance Coaching , Microelectronic Engineering Tuitions , Music & Dance & Arts Classes , NIFT/NID/CEED/FDDI Training , Physics Home Tuitions for school , R Analytics Online Training , Robotics Engineering Tuitions , SAT Coaching , School Tuitions for Accounts, Finance, Statistics , School Tuitions for All Subjects , School Tuitions for Math, Physics, Chemistry , SET Entrance Coaching , Software Engineering Tuitions , Spoken English Classes , Spoken Hindi Classes , Telecommunication Engineering Tuitions , Tuitions for College Subjects , "
166314,Sathya Academy Coaching Centre,0431 - 2782332,,,,,#2,Vayalur Main Road,620017,trichy,India,,,R. Sathya Bama,,"Enterprise Training , Home & Private Tuitions , Big Data Analytics Online Training , Engineering Tuitions , Law Entrance Coaching , Home Tutors for Class I-V , R Analytics Online Training , Mechanical Engineering Tuitions , SET Entrance Coaching , Aerospace Engineering Tuitions , Home Tutors for Class VI-X , B.Com Home Tutors , Biomedical Engineering Tuitions , Biomechanical Engineering Tuitions , B.Sc Home Tutors , BE Home Tuitions , Automotive Engineering Tuitions , Civil Engineering Tuitions , Biology Home Tuitions for school , Chemistry Home Tuitions for school , Architectural Engineering Tuitions , Electrical Engineering Tuitions , Hindi Home Tuitions , English Home Tuitions for school , IT & Computer Science Engineering Tuitions , Robotics Engineering Tuitions , Physics Home Tuitions for school , Economics Home Tuitions , Microelectronic Engineering Tuitions , Chemical Engineering Tuitions , BBA Home Tuitions , MBA Home Tuitions , Environmental Engineering Tuitions , Materials Science Engineering Tuitions , ICWA Home Tuitions , MCA Home Tuitions , Agricultural Engineering Tuitions , Foreign Languages Coaching , GMAT Private Tuitions , CA Home Tuitions , Maths Home Tuitions for school , Engineering Tuitions - Other Branches , Engineering Physics Tuitions , Biotechnology Engineering Tuitions , Genetic Engineering Tuitions , Engineering Chemistry Tuitions , Mechatronics Engineering Tuitions , Software Engineering Tuitions , Electronics & Communication Engineering Tuitions , Instrumentation Technology Engineering Tuitions , Telecommunication Engineering Tuitions , Industrial & Production Engineering Show less  , ",,,"B.Com Home Tutors , B.Sc Home Tutors , Banking Tuitions , BBA Home Tuitions , BE Home Tuitions , Bioinformatics Training , Biology Home Tuitions for school , Biomechanical Engineering Tuitions , Biomedical Engineering Tuitions , Biotechnology Engineering Tuitions , CA Home Tuitions , CAT Coaching , Chartered Accountant Coaching , Chemical Engineering Tuitions , Chemistry Home Tuitions for school , Civil Engineering Tuitions , College Tuitions for Accounts, Finance, Statistics , College Tuitions for Chemistry , College Tuitions for Maths , College Tuitions for Physics , Economics Home Tuitions , Electrical Engineering Tuitions , Electronics & Communication Engineering Tuitions , Engineering Chemistry Tuitions , Engineering Physics Tuitions , Engineering Tuitions - Other Branches , English Home Tuitions for school , Environmental Engineering Tuitions , Foreign Languages Coaching , Genetic Engineering Tuitions , GMAT Coaching , GMAT Private Tuitions , GRE Coaching , Handwriting, Spelling & Reading Classes , Hindi Home Tuitions , Home Tutors for Class I-V , Home Tutors for Class VI-X , IAS Entrance Coaching , ICWA Home Tuitions , IIT Engineering Entrance Coaching , Industrial & Production Engineering Tuitions , Instrumentation Technology Engineering Tuitions , IT & Computer Science Engineering Tuitions , Mass Communication Training , Materials Science Engineering Tuitions , Maths Home Tuitions for school , MBA & BBA Coaching , MBA Home Tuitions , MCA Home Tuitions , Mechanical Engineering Tuitions , Mechatronics Engineering Tuitions , Medical Entrance Coaching , Microelectronic Engineering Tuitions , Music & Dance & Arts Classes , NIFT/NID/CEED/FDDI Training , Physics Home Tuitions for school , R Analytics Online Training , Robotics Engineering Tuitions , SAT Coaching , School Tuitions for Accounts, Finance, Statistics , School Tuitions for All Subjects , School Tuitions for Math, Physics, Chemistry , SET Entrance Coaching , Software Engineering Tuitions , Spoken English Classes , Spoken Hindi Classes , Telecommunication Engineering Tuitions , Tuitions for College Subjects , "
166315,Sundaraman N,0431 - 2793636,,,,,New #20N,Uraiyoor,620017,trichy,India,,,,,"Enterprise Training , Home & Private Tuitions , Big Data Analytics Online Training , Engineering Tuitions , Law Entrance Coaching , Home Tutors for Class I-V , R Analytics Online Training , Mechanical Engineering Tuitions , SET Entrance Coaching , Aerospace Engineering Tuitions , Home Tutors for Class VI-X , B.Com Home Tutors , Biomedical Engineering Tuitions , Biomechanical Engineering Tuitions , B.Sc Home Tutors , BE Home Tuitions , Automotive Engineering Tuitions , Civil Engineering Tuitions , Biology Home Tuitions for school , Chemistry Home Tuitions for school , Architectural Engineering Tuitions , Electrical Engineering Tuitions , Hindi Home Tuitions , English Home Tuitions for school , IT & Computer Science Engineering Tuitions , Robotics Engineering Tuitions , Physics Home Tuitions for school , Economics Home Tuitions , Microelectronic Engineering Tuitions , Chemical Engineering Tuitions , BBA Home Tuitions , MBA Home Tuitions , Environmental Engineering Tuitions , Materials Science Engineering Tuitions , ICWA Home Tuitions , MCA Home Tuitions , Agricultural Engineering Tuitions , Foreign Languages Coaching , GMAT Private Tuitions , CA Home Tuitions , Maths Home Tuitions for school , Engineering Tuitions - Other Branches , Engineering Physics Tuitions , Biotechnology Engineering Tuitions , Genetic Engineering Tuitions , Engineering Chemistry Tuitions , Mechatronics Engineering Tuitions , Software Engineering Tuitions , Electronics & Communication Engineering Tuitions , Instrumentation Technology Engineering Tuitions , Telecommunication Engineering Tuitions , Industrial & Production Engineering Show less  , ",,,"B.Com Home Tutors , B.Sc Home Tutors , Banking Tuitions , BBA Home Tuitions , BE Home Tuitions , Bioinformatics Training , Biology Home Tuitions for school , Biomechanical Engineering Tuitions , Biomedical Engineering Tuitions , Biotechnology Engineering Tuitions , CA Home Tuitions , CAT Coaching , Chartered Accountant Coaching , Chemical Engineering Tuitions , Chemistry Home Tuitions for school , Civil Engineering Tuitions , College Tuitions for Accounts, Finance, Statistics , College Tuitions for Chemistry , College Tuitions for Maths , College Tuitions for Physics , Economics Home Tuitions , Electrical Engineering Tuitions , Electronics & Communication Engineering Tuitions , Engineering Chemistry Tuitions , Engineering Physics Tuitions , Engineering Tuitions - Other Branches , English Home Tuitions for school , Environmental Engineering Tuitions , Foreign Languages Coaching , Genetic Engineering Tuitions , GMAT Coaching , GMAT Private Tuitions , GRE Coaching , Handwriting, Spelling & Reading Classes , Hindi Home Tuitions , Home Tutors for Class I-V , Home Tutors for Class VI-X , IAS Entrance Coaching , ICWA Home Tuitions , IIT Engineering Entrance Coaching , Industrial & Production Engineering Tuitions , Instrumentation Technology Engineering Tuitions , IT & Computer Science Engineering Tuitions , Mass Communication Training , Materials Science Engineering Tuitions , Maths Home Tuitions for school , MBA & BBA Coaching , MBA Home Tuitions , MCA Home Tuitions , Mechanical Engineering Tuitions , Mechatronics Engineering Tuitions , Medical Entrance Coaching , Microelectronic Engineering Tuitions , Music & Dance & Arts Classes , NIFT/NID/CEED/FDDI Training , Physics Home Tuitions for school , R Analytics Online Training , Robotics Engineering Tuitions , SAT Coaching , School Tuitions for Accounts, Finance, Statistics , School Tuitions for All Subjects , School Tuitions for Math, Physics, Chemistry , SET Entrance Coaching , Software Engineering Tuitions , Spoken English Classes , Spoken Hindi Classes , Telecommunication Engineering Tuitions , Tuitions for College Subjects , "
166316,EVA Stalin IAS Academy,+91 44 33054126,,,,,"No. 29, Phoenix Towers, Venkatesan Street,1st Floor",Tambaram West,600045,trichy,India,evastalin@gmail.com,http://www.evastaliniasacademy.in,Stalin,Monday - Sunday: 9 AM - 6.30 PM,"Competitive Exams Online Coaching , Civil Services Entrance Online Coaching , IPS Entrance Exam Coaching , UPSC Coaching , IBPS Bank Interview Coaching , IAS Entrance Coaching , Banking Tuitions , TANCET Entrance Coaching , TNPSC Entrance Coaching , ","Eva Stalin model a sure successHere is an institution that aspires to reshape the Indian administrative system by turning out successful candidates in the civil services exams. Eva Stalin IAS Academy is of the firm view that efficient and responsive administrative machinery is a must to meet the needs of a futuristic nation which is all set to join the league of developed world in the next few years.
Former President and Bharat Ratna APJ Abdul Kalam's grand vision of making India a developed nation by 2020 is very much possible if the youths are motivated to work hard for success. And to make the vision of Kalam a reality, the academy strives to give quality education that moulds the overall personality of students, besides improving their knowledge skills.  ","http://localserviceassets.blob.core.windows.net:80/businessphoto-t/FB_IMG_1442212258833-d3604df4-199b-454c-98a2-9340f792d2c1-7692cf4b-7057-423f-8450-20d9edd60023.jpg , http://localserviceassets.blob.core.windows.net:80/businessphoto-t/5514-f8aa3074-5510-489a-b6c1-9b8b1ce07377.jpg , http://localserviceassets.blob.core.windows.net:80/businessphoto-m/FB_IMG_1442212258833-d3604df4-199b-454c-98a2-9340f792d2c1-7692cf4b-7057-423f-8450-20d9edd60023.jpg , http://localserviceassets.blob.core.windows.net:80/businessphoto-m/5514-f8aa3074-5510-489a-b6c1-9b8b1ce07377.jpg , ","Classroom Tuitions , Daily Classes , Evening Classes , TANCET Entrance Coaching , TNPSC Entrance Coaching , UPSC Coaching , "
166317,Golden Academy,0431 - 2763676,,,,,,Uraiyoor,620003,trichy,India,,,,,,,,
166318,Venkkaiyamman Instititue,0431 - 2750664,,,,,#6,Uraiyoor,620003,trichy,India,,,,,,,,
166319,Varshan Tuition Centre,9944313155, 9488322275,,,,#31/1,Subramaniyapuram,620020,trichy,India,rangasty@gmail.com,,Ranganathan,,"School Tuitions for Math, Physics, Chemistry , School Tuitions for Accounts, Finance, Statistics , School Tuitions for All Subjects , ",,,
166320,Emmanuel Academy,0431 - 2780416, 9865172904,,,,No. 34,Puthur,620017,trichy,India,,,Rozario,,"School Tuitions for Math, Physics, Chemistry , School Tuitions for Accounts, Finance, Statistics , School Tuitions for All Subjects , Spoken English Classes , Spoken Hindi Classes , 2nd Year PUC Coaching , Advanced Level (A-Level) Maths Tuitions , Advanced Level (A-Level) Physics Tuitions , 1st Year PUC Coaching , 10th STD Tuitions , 9th STD Tuitions , ",,,"Advanced Level (A-Level) Physics Tuitions , School Tuitions for Accounts, Finance, Statistics , School Tuitions for All Subjects , School Tuitions for Math, Physics, Chemistry , Spoken English Classes , Spoken Hindi Classes , "
166321,Jaya Coaching Centre,9245189766,,,,,No. 42,Teppakulam,620002,trichy,India,,,Sundar,Monday - Saturday: 9.30 AM - 7 PM,"2nd Year PUC Coaching , 1st Year PUC Coaching , 10th STD Tuitions , ",,,
166322,A Com,0431 - 4023765, 0431 - 4023763,,,,No. 2,Thillai Nagar,620018,trichy,India,,,,,"School Tuitions for Math, Physics, Chemistry , School Tuitions for Accounts, Finance, Statistics , Spoken English Classes , Spoken Hindi Classes , 2nd Year PUC Coaching , Advanced Level (A-Level) Maths Tuitions , Advanced Level (A-Level) Physics Tuitions , 1st Year PUC Coaching , 10th STD Tuitions , 9th STD Tuitions , School Tuitions for Biology , ",,,"Advanced Level (A-Level) Physics Tuitions , School Tuitions for Accounts, Finance, Statistics , School Tuitions for Biology , School Tuitions for Math, Physics, Chemistry , Spoken English Classes , Spoken Hindi Classes , "
166323,GV Tuition Centre,9842402245, 9842403357,,,,No. 133/96,Teppakulam,620002,trichy,India,,,N. Vijay Kumar,Monday - Saturday: 10 AM - 8 PM,"2nd Year PUC Coaching , 1st Year PUC Coaching , 10th STD Tuitions , ",,,
166324,Omega Coaching Center,0431 - 2711864, 9043019193,,,,No. 68,Teppakulam,620002,trichy,India,,,"Rajasekaran, Chadrashekar",Monday - Sunday: 10 AM - 8 PM,"School Tuitions for Math, Physics, Chemistry , School Tuitions for Accounts, Finance, Statistics , 2nd Year PUC Coaching , 1st Year PUC Coaching , 10th STD Tuitions , 9th STD Tuitions , School Tuitions for Biology , ",,,"School Tuitions for Biology , School Tuitions for Math, Physics, Chemistry , "
166325,SEMA Spoken and Maths Academy,9244438428,,,,,"No. 36,",Uraiyoor,620003,trichy,India,harimaths3@gmail.com,,Hari Baskar,Monday - Sunday: 6 AM - 9.30 PM,"Spoken English Classes , Advanced Level (A-Level) Maths Tuitions , IGCSE Maths Tuitions , IB Maths Tuitions , ICSE Maths Tuitions , Maths Tuitions 11th &12th , Vedic Maths Coaching , ",,,"Spoken English Classes , Vedic Maths Coaching , "
166326,Parlez-Vous En Francais,0431 - 4021211, 9994338634,,,,No. 1/113,Vasanth Nagar,620001,trichy,India,abcvenkatesh@gmail.com,,Venkatesh Jayaraman,Monday - Saturday: 8.30 AM - 8.30 PM,"Spoken English Classes , 2nd Year PUC Coaching , Language Development Coaching , 1st Year PUC Coaching , 10th STD Tuitions , 9th STD Tuitions , ",,,
166327,Avenue-Venue for Global English and Maths,9790211222, 9894478784,,,,2nd Floor,Cantonment,620001,trichy,India,,http://www.avenuecbe.com,,Monday - Saturday: 9 AM - 6 PM,"2nd Year PUC Coaching , 1st Year PUC Coaching , 10th STD Tuitions , ",,,
166328,Olive Consultants,+91 44 33855314,,,,,"No. 356, Purasawakkam high road",Kellys,600010,trichy,India,olive@vsnl.com,http://www.olivegroup.org,Anand Manohar,"Monday - Friday: 9 AM - 8 PM, Saturday: 9 AM - 5 PM","Coaching & Tuitions , Immigration Consultants , Language Training , Middle East Immigration Consultants , Canada Immigration Consultants , French Language Training , German Language Training , Africa Immigration Consultants , USA Education Consultants , UK Education Consultants , Singapore Immigration Consultants , New Zealand Immigration Consultants , Australia Education Consultants , Canada Education Consultants , UAE Immigration Consultants , Australia South Pacific Immigration Consultants , New Zealand Education Consultants , Russia Education Consultants , Europe Immigration Consultants , Far East Immigration Consultants , Cyprus Education Consultants , Asia Immigration Consultants , America Immigration Consultants , Poland Education Consultants , PTE Coaching , South Korea Education Consultants , France Education Consultants , Germany Education Consultants , GRE Coaching , SAT Coaching , Singapore Education Consultants , Switzerland Education Consultants , IELTS Coaching , TOEFL Coaching , GMAT Coaching , Europe Education Consultants , Ireland Education Consultants , Sweden Education Consultants , Philippines Education Consultants , Malaysia Education Consultants , Dubai Education Consultants , ","Olive Consultants functioning since 1995 has been able to successfully penetrate the field of Immigration and Overseas Education. We have carved a niche in the market through our relentless commitment for high quality guidance and services.We have helped more than 1700 students obtain their admissions in Universities / Colleges (USA, Canada, Australia, United Kingdom, New Zealand, Singapore, Germany, Dubai, Malaysia, Ireland, Cyprus, Switzerland, Ireland, France, Sweden, Philippines,  etc.,). We represent over 700 Universities in different countries. We provide the initial counseling for the Prospective students who wish to study Overseas, helping them to choose the course and the best University relevant to them. We process admission, scholarships and student visas for the students. We also offer a lot of after landing services for students who wish to study abroad. We do not charge the students a service charge, since we are paid a commission by most of the Universities. We are trained constantly by the Universities overseas and also by the various visa offices and their staff. Our services are transparent and in line with the University norms and in line with the visa offices norms. Our visa success rate is nearly 100%.Contact us for further details.  ","http://localserviceassets.blob.core.windows.net:80/businessphoto-t/download-5d088ad8-eb89-4bc3-8319-f2d22bc56ebf.jpg , http://localserviceassets.blob.core.windows.net:80/businessphoto-t/download%20(1)-ac03fa3b-c9dc-41fb-8725-5a08d8e8b901.jpg , http://localserviceassets.blob.core.windows.net:80/businessphoto-t/download%20(2)-3e6a410e-8328-4213-ac7d-10c8c5089165.jpg , http://localserviceassets.blob.core.windows.net:80/businessphoto-t/download%20(3)-1ea8a54e-edc3-4b58-badd-e2f9efbc7dc1.jpg , http://localserviceassets.blob.core.windows.net:80/businessphoto-t/download%20(4)-3a225a32-1319-4a7f-8789-81855450f282.jpg , http://localserviceassets.blob.core.windows.net:80/businessphoto-t/images-db0b181b-8404-4efc-9911-02ca2ff2e286.jpg , http://localserviceassets.blob.core.windows.net:80/businessphoto-t/images%20(1)-c9f8d3a4-0215-4046-9e09-99786ac9a7ed.jpg , http://localserviceassets.blob.core.windows.net:80/businessphoto-t/images%20(2)-a0291c3f-e1ae-485e-b1d9-16c1737d7df8.jpg , http://localserviceassets.blob.core.windows.net:80/businessphoto-t/images%20(3)-ec29ab41-ee5f-45f4-93cf-0acdf5c12096.jpg , http://localserviceassets.blob.core.windows.net:80/businessphoto-t/images%20(4)-c83fbfa9-5ec8-4364-b8b8-a7e80df98340.jpg , http://localserviceassets.blob.core.windows.net:80/businessphoto-t/images%20(5)-fcd98d4c-bc1a-43cb-9be0-5a2121d22175.jpg , http://localserviceassets.blob.core.windows.net:80/businessphoto-t/images%20(6)-430ba50e-1d81-4d02-91e7-1f1b1015ebd7.jpg , http://localserviceassets.blob.core.windows.net:80/businessphoto-t/images%20(7)-2aaf8326-66d9-4a4b-bca6-689d721d21b9.jpg , http://localserviceassets.blob.core.windows.net:80/businessphoto-m/download-5d088ad8-eb89-4bc3-8319-f2d22bc56ebf.jpg , http://localserviceassets.blob.core.windows.net:80/businessphoto-m/download%20(1)-ac03fa3b-c9dc-41fb-8725-5a08d8e8b901.jpg , http://localserviceassets.blob.core.windows.net:80/businessphoto-m/download%20(2)-3e6a410e-8328-4213-ac7d-10c8c5089165.jpg , http://localserviceassets.blob.core.windows.net:80/businessphoto-m/download%20(3)-1ea8a54e-edc3-4b58-badd-e2f9efbc7dc1.jpg , http://localserviceassets.blob.core.windows.net:80/businessphoto-m/download%20(4)-3a225a32-1319-4a7f-8789-81855450f282.jpg , http://localserviceassets.blob.core.windows.net:80/businessphoto-m/images-db0b181b-8404-4efc-9911-02ca2ff2e286.jpg , http://localserviceassets.blob.core.windows.net:80/businessphoto-m/images%20(1)-c9f8d3a4-0215-4046-9e09-99786ac9a7ed.jpg , http://localserviceassets.blob.core.windows.net:80/businessphoto-m/images%20(2)-a0291c3f-e1ae-485e-b1d9-16c1737d7df8.jpg , http://localserviceassets.blob.core.windows.net:80/businessphoto-m/images%20(3)-ec29ab41-ee5f-45f4-93cf-0acdf5c12096.jpg , http://localserviceassets.blob.core.windows.net:80/businessphoto-m/images%20(4)-c83fbfa9-5ec8-4364-b8b8-a7e80df98340.jpg , http://localserviceassets.blob.core.windows.net:80/businessphoto-m/images%20(5)-fcd98d4c-bc1a-43cb-9be0-5a2121d22175.jpg , http://localserviceassets.blob.core.windows.net:80/businessphoto-m/images%20(6)-430ba50e-1d81-4d02-91e7-1f1b1015ebd7.jpg , http://localserviceassets.blob.core.windows.net:80/businessphoto-m/images%20(7)-2aaf8326-66d9-4a4b-bca6-689d721d21b9.jpg , ","Canada Education Consultants , Canada Immigration Consultants , Cyprus Education Consultants , Dubai Education Consultants , Europe Education Consultants , Europe Immigration Consultants , Far East Immigration Consultants , France Education Consultants , French Language Training , German Language Training , Germany Education Consultants , GMAT Coaching , GRE Coaching , IELTS Coaching , Ireland Education Consultants , Malaysia Education Consultants , Middle East Immigration Consultants , New Zealand Education Consultants , New Zealand Immigration Consultants , Philippines Education Consultants , Poland Education Consultants , PTE Coaching , Russia Education Consultants , SAT Coaching , Singapore Education Consultants , Singapore Immigration Consultants , South Korea Education Consultants , Sweden Education Consultants , Switzerland Education Consultants , TOEFL Coaching , UAE Immigration Consultants , UK Education Consultants , USA Education Consultants , "
166329,Care-Chemistry Tuition Centre,0431 - 2232291, 9842423229,,,,"No. 40, 2nd Floor",Cantonment,620001,trichy,India,dmuthamilselvan@yahoo.com,,Sangitha,Monday - Sunday : 24 Hrs,"2nd Year PUC Coaching , 1st Year PUC Coaching , 10th STD Tuitions , ",,,
166330,SRTC Tuition Centre,9791710968,,,,,,Srirangam,620006,trichy,India,,,,Monday - Saturday: 10 AM - 8.30 PM,"School Tuitions for Math, Physics, Chemistry , School Tuitions for All Subjects , Spoken English Classes , 2nd Year PUC Coaching , 1st Year PUC Coaching , 10th STD Tuitions , 9th STD Tuitions , ",,,"School Tuitions for Math, Physics, Chemistry , Spoken English Classes , "
166331,Sun Tuition Centre,0431 - 2302802,,,,,No. 37,Palakarai,620001,trichy,India,,,,Monday - Saturday: 9 AM - 8 PM,"School Tuitions for All Subjects , Spoken English Classes , 2nd Year PUC Coaching , 1st Year PUC Coaching , 10th STD Tuitions , 9th STD Tuitions , ",,,
