EduID,Name,Phone1,Phone2,Phone3,Phone4,Phone5,Street Address,Locality,Pincode,City,Country,Mail,Website,Person to Contact,Working Hours,Services Offered,Details,Images URL,Keywords
177180,Triumphant Institute of Management Education - TIME,0836 - 4254438, 9886132242,,,,"1st Floor, 80 Feet Road, Sirur Park",Vidya Nagar,580031,hubli,India,hubli@time4education.com,http://www.time4education.com,Akhil Kumar,Monday - Saturday: 10.30 AM - 7.30 PM,"SSC Entrance Exam Coaching , RRB Entrance Exam Coaching , CACPT Coaching , UPSC Coaching , IBPS Bank Interview Coaching , PSU Entrance Coaching , CAT Coaching , IAS Entrance Coaching , Spoken English Classes , GRE Coaching , Banking Tuitions , GMAT Coaching , SBI PO Training , MCA Entrance Coaching , Aptitude Training , MCA Entrance Exam Coaching , IBPS Bank Exam Coaching , Online CAT Preparation Coaching , KMAT Coaching , XAT Entrance Coaching , ","Triumphant Institute of Management Education - TIME are customer oriented & strongly believe in building a relationship based on trust with our customers. With an aim to capture customer loyalty through great value and exceptional performance, we believe in developing and maintaining lasting relationships with our customers by providing outstanding services. We are in touch with our customers through quality, performance, service and assistance. Contact us for further details.  ","http://localserviceassets.blob.core.windows.net:80/businessphoto-t/12-17-2015%2011-16-30%20AM-02e5cde3-aa88-4750-aa65-635e4c463496.png , http://localserviceassets.blob.core.windows.net:80/businessphoto-t/12-17-2015%2011-16-50%20AM-fcdf1085-571c-455b-a027-8dbf526dfca8.png , http://localserviceassets.blob.core.windows.net:80/businessphoto-t/12-17-2015%2011-17-05%20AM-1c16a5bf-eede-4dc7-8210-a9f38c0121c4.png , http://localserviceassets.blob.core.windows.net:80/businessphoto-t/12-17-2015%2011-17-39%20AM-3dfcf44d-cafa-411a-b710-acb620f97867.png , http://localserviceassets.blob.core.windows.net:80/businessphoto-t/12-17-2015%2011-17-47%20AM-b9903dc7-3073-4c56-988e-ec59fafd9fd5.png , http://localserviceassets.blob.core.windows.net:80/businessphoto-t/12-17-2015%2011-18-13%20AM-e51d9fc1-7856-41cb-8aea-15060286c6a7.png , http://localserviceassets.blob.core.windows.net:80/businessphoto-t/12-17-2015%2011-18-32%20AM-07c68356-6935-4c71-8d4e-0735d58cf633.png , http://localserviceassets.blob.core.windows.net:80/businessphoto-t/12-17-2015%2011-18-42%20AM-7be6ff2b-19a8-4b1e-8a37-039c6056626b.png , http://localserviceassets.blob.core.windows.net:80/businessphoto-t/12-17-2015%2011-18-47%20AM-24283506-ca65-4b57-a6bc-fadba2f4a183.png , http://localserviceassets.blob.core.windows.net:80/businessphoto-m/12-17-2015%2011-16-30%20AM-02e5cde3-aa88-4750-aa65-635e4c463496.png , http://localserviceassets.blob.core.windows.net:80/businessphoto-m/12-17-2015%2011-16-50%20AM-fcdf1085-571c-455b-a027-8dbf526dfca8.png , http://localserviceassets.blob.core.windows.net:80/businessphoto-m/12-17-2015%2011-17-05%20AM-1c16a5bf-eede-4dc7-8210-a9f38c0121c4.png , http://localserviceassets.blob.core.windows.net:80/businessphoto-m/12-17-2015%2011-17-39%20AM-3dfcf44d-cafa-411a-b710-acb620f97867.png , http://localserviceassets.blob.core.windows.net:80/businessphoto-m/12-17-2015%2011-17-47%20AM-b9903dc7-3073-4c56-988e-ec59fafd9fd5.png , http://localserviceassets.blob.core.windows.net:80/businessphoto-m/12-17-2015%2011-18-13%20AM-e51d9fc1-7856-41cb-8aea-15060286c6a7.png , http://localserviceassets.blob.core.windows.net:80/businessphoto-m/12-17-2015%2011-18-32%20AM-07c68356-6935-4c71-8d4e-0735d58cf633.png , http://localserviceassets.blob.core.windows.net:80/businessphoto-m/12-17-2015%2011-18-42%20AM-7be6ff2b-19a8-4b1e-8a37-039c6056626b.png , http://localserviceassets.blob.core.windows.net:80/businessphoto-m/12-17-2015%2011-18-47%20AM-24283506-ca65-4b57-a6bc-fadba2f4a183.png , ","GRE Coaching , IAS Entrance Coaching , IBPS Bank Exam Coaching , IBPS Bank Interview Coaching , KMAT Coaching , MCA Entrance Coaching , MCA Entrance Exam Coaching , Online CAT Preparation Coaching , PSU Entrance Coaching , RRB Entrance Exam Coaching , SBI PO Training , Spoken English Classes , SSC Entrance Exam Coaching , UPSC Coaching , XAT Entrance Coaching , "
177181,The Classic KAS & IAS Study Circle,9980552080, 9980552081,,,,"1st Floor, PB Road",Jubilee Circle,580001,hubli,India,classicnewunit@gmail.com,http://www.classicedu.in,Laxman S. Uppar,Monday - Sunday: 8 AM - 8 PM,,"Dharwad, regarded as cultural capital of Karnataka, is also well known for educational institutions. 18 years ago, the world was not as fast as today. Karnataka, particularly North-Karnataka, had no conducive atmosphere for competitive examinations as there was no awareness. Considering the hurdle, Mr Laxman S Uppar, an engineer by qualification, took the initiative of providing coaching for various competitive examinations. As a result, The Classic KAS & IAS Study Circle was started in February 1997 in Jayanagar of Dharwad.Started with a few aspirants of various services, now the Classic Study Circle is providing coaching for over a thousand candidates on regular basis. There are at least two to three batches, each batch of 100 students, preparing for exams like the IAS/IPS, KAS, PSI, Banking, teachers appointment, FDA, SDA, PDO, PC and others. So far as quality of teaching is concerned, the Classic Study Circle is unique in whole Karnataka as its faculty members are well trained and experienced in different subjects. The focused teaching, based on syllabus and previous questions of respective examinations, has been helping the candidates to gain knowledge required for the competitive examinations in shortest possible time  ",,
177182,Koti Tutorials,0836 - 4251796, 9886223701,,,,"No. 119, Vijaylakshmi, 2nd Cross, Siddeshwar Park",Vidya Nagar,580031,hubli,India,ashwin.koti@gmail.com,,Ashwinikumar V Koti,Monday - Saturday: 6 AM - 8 PM ( Lunch: 8 AM - 4 PM ),"School Tuitions for Math, Physics, Chemistry , Spoken English Classes , CBSE Tuitions for English , CBSE Tuitions for Maths , CBSE Tuitions for Physics , CBSE Tuitions for Chemistry , ICSE Maths Tuitions , ICSE Physics Tuitions , ICSE Chemistry Tuitions , ICSE Biology Tuitions , 10th STD Tuitions , 9th STD Tuitions , School Tuitions for Biology , ","Koti Tutorials provide coaching for all boards. Our motto is to provide the best teaching to the students. We have a huge list of impressive success of students. Koti Tutorials promise a better future for your children in higher education and knowledge. We make your life better and brighter. Education is a primary ingredient and also a key to success in any profession. With a booming economy and a young population, there is a tremendous need for the quality education to equip this population with skills to handle assignments that spring from such a growing economy like ours. Contact us for further details.  ","http://localserviceassets.blob.core.windows.net:80/businessphoto-t/12-14-2015%203-03-21%20PM-999da572-4061-441d-aa6d-9d6cfda6eca6.png , http://localserviceassets.blob.core.windows.net:80/businessphoto-t/12-14-2015%203-03-30%20PM-abde2e70-3486-46a1-ad3e-b1ffb90e47c0.png , http://localserviceassets.blob.core.windows.net:80/businessphoto-t/12-14-2015%203-03-42%20PM-c24cf917-5ede-44e2-868b-bb15fb7faa4a.png , http://localserviceassets.blob.core.windows.net:80/businessphoto-t/12-14-2015%203-03-53%20PM-9567b60c-4c3b-4892-a642-06aa3e9d0bc8.png , http://localserviceassets.blob.core.windows.net:80/businessphoto-t/12-14-2015%203-04-11%20PM-2e92820e-7332-4182-ba63-3e7ac0d4031d.png , http://localserviceassets.blob.core.windows.net:80/businessphoto-t/12-14-2015%203-04-32%20PM-8f347a89-89ef-4202-8af1-d945469140bc.png , http://localserviceassets.blob.core.windows.net:80/businessphoto-m/12-14-2015%203-03-21%20PM-999da572-4061-441d-aa6d-9d6cfda6eca6.png , http://localserviceassets.blob.core.windows.net:80/businessphoto-m/12-14-2015%203-03-30%20PM-abde2e70-3486-46a1-ad3e-b1ffb90e47c0.png , http://localserviceassets.blob.core.windows.net:80/businessphoto-m/12-14-2015%203-03-42%20PM-c24cf917-5ede-44e2-868b-bb15fb7faa4a.png , http://localserviceassets.blob.core.windows.net:80/businessphoto-m/12-14-2015%203-03-53%20PM-9567b60c-4c3b-4892-a642-06aa3e9d0bc8.png , http://localserviceassets.blob.core.windows.net:80/businessphoto-m/12-14-2015%203-04-11%20PM-2e92820e-7332-4182-ba63-3e7ac0d4031d.png , http://localserviceassets.blob.core.windows.net:80/businessphoto-m/12-14-2015%203-04-32%20PM-8f347a89-89ef-4202-8af1-d945469140bc.png , ","CBSE Tuitions for Physics , Classroom Tuitions , Daily Classes , Evening Classes , Holiday Classes , ICSE Biology Tuitions , ICSE Chemistry Tuitions , ICSE Maths Tuitions , ICSE Physics Tuitions , School Tuitions for Biology , School Tuitions for Math, Physics, Chemistry , Spoken English Classes , "
177183,Athani & Kolhar Classes,9886492571,,,,,"Jayaraj Complex, Prashanth Colony, Sirur Park Road",Vidya Nagar,580021,hubli,India,veereshathani77@gmail.com,,Athani,Monday - Sunday : 24 Hrs,"Botony Tuitions , SSC Entrance Exam Coaching , Computer Science Tuitions (11th & 12th STD) , PTE Coaching , Physics Tuitions (11th & 12th) , Commerce Tuitions (11th & 12th STD) , NEET Entrance Coaching , Medical EAMCET Coaching , Engineering EAMCET Coaching , Tuitions for College Subjects , School Tuitions for Math, Physics, Chemistry , School Tuitions for Accounts, Finance, Statistics , School Tuitions for All Subjects , ISC Tuitions for 11th & 12th , Economics Coaching Classes (9th & 10th STD) , Economics Coaching Classes (11th & 12th STD) , Advanced Economics Coaching Classes (College level and above) , Chemistry Tuitions (11th & 12th) , Biology Tuitions (11th & 12th) , 2nd Year PUC Coaching , CBSE Tuitions for English , CBSE Tuitions for Maths , CBSE Tuitions for Physics , CBSE Tuitions for Chemistry , IGCSE Accounts 11th & 12th , IGCSE Business Studies 11th & 12th , Zoology Tuitions , ","Athani & Kolhar Classes are customer oriented & strongly believe in building a relationship based on trust with our customers. With an aim to capture customer loyalty through great value and exceptional performance, we believe in developing and maintaining lasting relationships with our customers by providing outstanding services. We are in touch with our customers through quality, performance, service and assistance. Contact us for further details.
  ",,"CBSE Tuitions for English , CBSE Tuitions for Maths , CBSE Tuitions for Physics , Chemistry Tuitions (11th & 12th) , Commerce Tuitions (11th & 12th STD) , Computer Science Tuitions (11th & 12th STD) , Economics Coaching Classes (11th & 12th STD) , Economics Coaching Classes (9th & 10th STD) , Engineering EAMCET Coaching , IGCSE Accounts 11th & 12th , IGCSE Business Studies 11th & 12th , ISC Tuitions for 11th & 12th , Medical EAMCET Coaching , NEET Entrance Coaching , Physics Tuitions (11th & 12th) , PTE Coaching , School Tuitions for Accounts, Finance, Statistics , School Tuitions for All Subjects , School Tuitions for Math, Physics, Chemistry , SSC Entrance Exam Coaching , Tuitions for College Subjects , Zoology Tuitions , "
177184,Raj Tutorials,9945610240,,,,,,Hosur,580020,hubli,India,rajhbl.academy@gmail.com,,Basvaraj Belaganur,Monday - Saturday: 7.30 AM - 6 PM,"CACPT Coaching , Commerce Tuitions (11th & 12th STD) , College Tuitions for Accounts, Finance, Statistics , Tuitions for College Subjects , B.B.A. Entrance Coaching , MBA & BBA Coaching , 2nd Year PUC Coaching , B.Com Coaching , M.Com Coaching , Chartered Financial Analyst (CFA) Coaching , ","Raj Tutorials Learning has immense experience in this business. We provide coaching for all boards. Our motto is to provide the best teaching to the students. We have a huge list of impressive success of students. We promise a better future for your children in higher education and knowledge. We make your life better and brighter. Education is a primary ingredient and also a key to success in any profession. With a booming economy and a young population, there is a tremendous need for the quality education to equip this population with skills to handle assignments that spring from such a growing economy like ours. Contact us for further details.  ",,"1 Year Program , Classroom Tuitions , College Tuitions for Accounts, Finance, Statistics , Commerce Tuitions (11th & 12th STD) , Daily Classes , M.Com Coaching , MBA & BBA Coaching , Short Term , Tuitions for College Subjects , "
177185,Tayal Institute Pvt. Ltd.,+91 22 49432704,,,,,"No. 403, D- Definity, JP Nagar, Road No. 1",Goregaon East,400062,hubli,India,sales@tayalinstitute.com,http://www.tayalsirvod.com,Rajesh Tayal,Monday - Sunday: 9 AM - 7 PM,"CS Coaching , CMA Coaching , Chartered Accountant Coaching , Chartered Financial Analyst (CFA) Coaching , ","Tayal Institute Private Limited is the first institute in India to provide coaching exclusively to CA Final students only. Another first for us is to give a choice to the students for selecting the subject they want to do with us instead of forcing them to join.The institute was founded by CS Prof. Rajesh Tayal, in the year 2004 and since then it has recorded growth year over years. Every time some of our students are placed in merit list.Our courses are built in partnership with technology leaders and are relevant to industry needs.  ","http://localserviceassets.blob.core.windows.net:80/businessphoto-t/12-11-2015%2012-55-43-f84c93fa-fd98-4134-9c4f-9b3abdf442c6.png , http://localserviceassets.blob.core.windows.net:80/businessphoto-t/12-11-2015%2012-55-52-407ad4c4-b749-4039-add0-bb8165549e5a.png , http://localserviceassets.blob.core.windows.net:80/businessphoto-t/12-11-2015%2012-55-58-5bd41ed0-3d4e-4bd7-bf24-edcf6d120f4c.png , http://localserviceassets.blob.core.windows.net:80/businessphoto-t/12-11-2015%2012-56-05-c39d720b-a59f-4dc2-b185-a2213d696199.png , http://localserviceassets.blob.core.windows.net:80/businessphoto-t/12-11-2015%2012-56-12-1a590e8e-38a2-4af7-82af-0375c4b4bc77.png , http://localserviceassets.blob.core.windows.net:80/businessphoto-t/12-11-2015%2012-56-19-7a1e10da-8ed1-4df1-a576-3d5090ca7c55.png , http://localserviceassets.blob.core.windows.net:80/businessphoto-t/12-11-2015%2012-56-26-f2c2731b-b550-427a-be55-4682b4e86802.png , http://localserviceassets.blob.core.windows.net:80/businessphoto-t/12-11-2015%2012-56-38-61214f67-4aa2-415e-9754-d8efcd3d00ec.png , http://localserviceassets.blob.core.windows.net:80/businessphoto-m/12-11-2015%2012-55-43-f84c93fa-fd98-4134-9c4f-9b3abdf442c6.png , http://localserviceassets.blob.core.windows.net:80/businessphoto-m/12-11-2015%2012-55-52-407ad4c4-b749-4039-add0-bb8165549e5a.png , http://localserviceassets.blob.core.windows.net:80/businessphoto-m/12-11-2015%2012-55-58-5bd41ed0-3d4e-4bd7-bf24-edcf6d120f4c.png , http://localserviceassets.blob.core.windows.net:80/businessphoto-m/12-11-2015%2012-56-05-c39d720b-a59f-4dc2-b185-a2213d696199.png , http://localserviceassets.blob.core.windows.net:80/businessphoto-m/12-11-2015%2012-56-12-1a590e8e-38a2-4af7-82af-0375c4b4bc77.png , http://localserviceassets.blob.core.windows.net:80/businessphoto-m/12-11-2015%2012-56-19-7a1e10da-8ed1-4df1-a576-3d5090ca7c55.png , http://localserviceassets.blob.core.windows.net:80/businessphoto-m/12-11-2015%2012-56-26-f2c2731b-b550-427a-be55-4682b4e86802.png , http://localserviceassets.blob.core.windows.net:80/businessphoto-m/12-11-2015%2012-56-38-61214f67-4aa2-415e-9754-d8efcd3d00ec.png , ",
