EduID,Name,Phone1,Phone2,Phone3,Phone4,Phone5,Street Address,Locality,Pincode,City,Country,Mail,Website,Person to Contact,Working Hours,Services Offered,Details,Images URL,Keywords
185583,The Legend,8123999925, 9845399925,,,,No. 4,Father Mullers Road,575002,mangalore,India,thelegendielts@yahoo.in,http://www.thelegendielts.com,Allwyn Dmello,Monday - Saturday: 10 AM - 7 PM,"PTE Coaching , Foreign Languages Coaching , CAT Coaching , College Tuitions for Accounts, Finance, Statistics , Spoken English Classes , GRE Coaching , ISC Tuitions for 11th & 12th , Economics Coaching Classes (9th & 10th STD) , SAT Coaching , Banking Tuitions , Mass Communication Training , Economics Coaching Classes (11th & 12th STD) , Advanced Economics Coaching Classes (College level and above) , IELTS Coaching , TOEFL Coaching , GMAT Coaching , MAT coaching , Language Development Coaching , Aptitude Training , ","The Legend-IELTS was incorporated in the year 2005 with an aim to provide the best English Language training to aspirants who are willing to choose their career in various countries outside India. As we are living in the Global Age, English is becoming the Global language with a high demands among people living in various countries. MNCs also promote the culture where English is the dominating language over all others. We work with a mission to promote English Language and to vanish the phobia from minds of people that they cant be good in speaking English.Our Vision and MissionWe give utmost importance to student satisfaction by providing services which help our students in achieving their career objectives. Our quality services have enabled us in attaining vast client base. Our experts look into every possible error that can occur while rendering these services. We aim to achieve maximum satisfaction of our clients and students through our best-in class services. Our team of competent professionals works with the prime objective to provide the students with best suitable services. This helps in attaining the satisfaction of our clients that we are connected with.We also lay emphasis on personality development and conducts one on one Personality development programs for our students. Apart from IELTS and TOEFL we also provide programs for Spoken English, Spoken French, Migration and free counseling for study in CANADA /AUSTRALIA and Nursing Board Registration. We hold the Expertise in providing over the top English Speaking Training Programs.Our professionals work efficiently for the successful marketing of the services provided. They conduct workshops to make people aware of the courses offered by us. We suggest them the best options to meet their respective needs. Our teammates maintain coordination with the clients and offer personalized services to them.Further, we give prior importance to the queries and suggestions of our esteemed clients. We have appointed highly skilled and educated teaching experts. All our teachers and experts remain in one to one communication with every student to understand their weaknesses and guide them properly. For the benefit of our students and in order to enhance their skills, these professionals always remain ready to provide extra classes to our students. Furthermore, all our team members work with great enthusiasm towards the development of the student and the organization.  ","http://localserviceassets.blob.core.windows.net:80/businessphoto-t/14-11-2015%2015-40-17-b302d1bd-f72a-4e63-9bb6-9baad76cd8de.jpg , http://localserviceassets.blob.core.windows.net:80/businessphoto-t/14-11-2015%2015-40-35-6de6b049-2ac3-4776-95e1-8da091d8b6d1.jpg , http://localserviceassets.blob.core.windows.net:80/businessphoto-t/14-11-2015%2015-40-47-90d688b1-7912-4f1f-b0c5-776ece2d4d69.jpg , http://localserviceassets.blob.core.windows.net:80/businessphoto-t/14-11-2015%2015-40-57-55b82490-4273-4bf6-83a1-ac2976a96a0d.jpg , http://localserviceassets.blob.core.windows.net:80/businessphoto-t/14-11-2015%2015-41-06-e63ff23a-ad0e-46d3-ad93-5f17eb996243.jpg , http://localserviceassets.blob.core.windows.net:80/businessphoto-t/14-11-2015%2015-41-23-50b69fcc-e148-40b4-92f1-059a0a2985eb.jpg , http://localserviceassets.blob.core.windows.net:80/businessphoto-t/14-11-2015%2015-41-35-2e8ed8b2-b570-4cbc-abb5-e43672f60d85.jpg , http://localserviceassets.blob.core.windows.net:80/businessphoto-t/14-11-2015%2015-41-46-fdbc1d46-a0d7-455e-8bba-036b844a4b58.jpg , http://localserviceassets.blob.core.windows.net:80/businessphoto-m/14-11-2015%2015-40-17-b302d1bd-f72a-4e63-9bb6-9baad76cd8de.jpg , http://localserviceassets.blob.core.windows.net:80/businessphoto-m/14-11-2015%2015-40-35-6de6b049-2ac3-4776-95e1-8da091d8b6d1.jpg , http://localserviceassets.blob.core.windows.net:80/businessphoto-m/14-11-2015%2015-40-47-90d688b1-7912-4f1f-b0c5-776ece2d4d69.jpg , http://localserviceassets.blob.core.windows.net:80/businessphoto-m/14-11-2015%2015-40-57-55b82490-4273-4bf6-83a1-ac2976a96a0d.jpg , http://localserviceassets.blob.core.windows.net:80/businessphoto-m/14-11-2015%2015-41-06-e63ff23a-ad0e-46d3-ad93-5f17eb996243.jpg , http://localserviceassets.blob.core.windows.net:80/businessphoto-m/14-11-2015%2015-41-23-50b69fcc-e148-40b4-92f1-059a0a2985eb.jpg , http://localserviceassets.blob.core.windows.net:80/businessphoto-m/14-11-2015%2015-41-35-2e8ed8b2-b570-4cbc-abb5-e43672f60d85.jpg , http://localserviceassets.blob.core.windows.net:80/businessphoto-m/14-11-2015%2015-41-46-fdbc1d46-a0d7-455e-8bba-036b844a4b58.jpg , ","1 Month Program , 3 Months Program , Classroom Tuitions , Daily Classes , Economics Coaching Classes (11th & 12th STD) , Economics Coaching Classes (9th & 10th STD) , Evening Classes , Foreign Languages Coaching , GMAT Coaching , GRE Coaching , Holiday Classes , IELTS Coaching , ISC Tuitions for 11th & 12th , Language Development Coaching , Mass Communication Training , MAT coaching , PTE Coaching , SAT Coaching , Spoken English Classes , Summer Classes , TOEFL Coaching , Weekend Classes , "
185584,Trisha Classes,9945212302, 9740551602,,,,"5th Floor, Essel Towers, Bolar",Bunts Hostel Road,574323,mangalore,India,nsgopi77@hotmail.com,http://www.trishaclasses.com,Nagesh,Monday - Saturday: 8 AM - 8 PM,"Integrated Professional Competency (IPCC) Coaching , CACPT Coaching , Commerce Tuitions (11th & 12th STD) , CTET Coaching , CS Coaching , CAT Coaching , College Tuitions for Accounts, Finance, Statistics , Tuitions for College Subjects , School Tuitions for Accounts, Finance, Statistics , CMA Coaching , Chartered Accountant Coaching , 2nd Year PUC Coaching , 1st Year PUC Coaching , ACCA Training , CIMA Certification Coaching , ICWA Coaching , ACS Coaching , ","Quality Education; with this motto Trisha Classes was started in the year 1998 by Sri N.S. Gopala Krishna Bhat. Growing year after year, Trisha has never compromised on the quality of education.
By offering flawless, high quality educational inputs, the institution has positioned itself today as an institution that provides the best professional training to the students of various interests under Commerce and Management streams. The institution has emerged as one of the largest training institutions of its kind in South Karnataka region. The academy's single minded pursuit of excellence towards quality has lead to produce unbelievable results in CA & CS exams as well as all India ranks. The institution has an average result of more than 80% at foundation level and 70% at higher levels of CA and CS courses. The institution believes in innovation and experimentation in teaching methodologies.  ","http://localserviceassets.blob.core.windows.net:80/businessphoto-t/12-20-2015%201-05-53%20PM-b4c1ad0b-1663-4bc3-8959-66f1506590ca.png , http://localserviceassets.blob.core.windows.net:80/businessphoto-t/12-20-2015%201-06-12%20PM-d8d9844c-34b8-40e7-b7b0-077cce0ac3d1.png , http://localserviceassets.blob.core.windows.net:80/businessphoto-t/12-20-2015%201-06-31%20PM-52f93bdd-29b4-46bc-991f-b3e6d7021a9f.png , http://localserviceassets.blob.core.windows.net:80/businessphoto-t/12-20-2015%201-06-58%20PM-6e9cd014-53dd-45c5-9f34-7e0806dfbd03.png , http://localserviceassets.blob.core.windows.net:80/businessphoto-t/12-20-2015%201-08-33%20PM-98da8c44-6cb2-4bea-a9ec-2e35ce913805.png , http://localserviceassets.blob.core.windows.net:80/businessphoto-t/12-20-2015%201-08-53%20PM-0ee5d699-e06f-42fb-bd50-0fcca5459ec9.png , http://localserviceassets.blob.core.windows.net:80/businessphoto-m/12-20-2015%201-05-53%20PM-b4c1ad0b-1663-4bc3-8959-66f1506590ca.png , http://localserviceassets.blob.core.windows.net:80/businessphoto-m/12-20-2015%201-06-12%20PM-d8d9844c-34b8-40e7-b7b0-077cce0ac3d1.png , http://localserviceassets.blob.core.windows.net:80/businessphoto-m/12-20-2015%201-06-31%20PM-52f93bdd-29b4-46bc-991f-b3e6d7021a9f.png , http://localserviceassets.blob.core.windows.net:80/businessphoto-m/12-20-2015%201-06-58%20PM-6e9cd014-53dd-45c5-9f34-7e0806dfbd03.png , http://localserviceassets.blob.core.windows.net:80/businessphoto-m/12-20-2015%201-08-33%20PM-98da8c44-6cb2-4bea-a9ec-2e35ce913805.png , http://localserviceassets.blob.core.windows.net:80/businessphoto-m/12-20-2015%201-08-53%20PM-0ee5d699-e06f-42fb-bd50-0fcca5459ec9.png , ","CAT Coaching , Chartered Accountant Coaching , CIMA Certification Coaching , CMA Coaching , College Tuitions for Accounts, Finance, Statistics , Commerce Tuitions (11th & 12th STD) , CS Coaching , CTET Coaching , ICWA Coaching , Integrated Professional Competency (IPCC) Coaching , School Tuitions for Accounts, Finance, Statistics , Tuitions for College Subjects , "
185585,Cosmos Tutorials,9980462526, 9880042092,,,,"Sharjah Complex, Near Montero Textile, Milagres Cross Road",Hampankatta,575001,mangalore,India,nadeemp52@yahoo.com,,Mohammad Nadeem P,Monday - Sunday: 7.30 AM - 8 PM,"Foreign Languages Coaching , College Tuitions for Accounts, Finance, Statistics , School Tuitions for Accounts, Finance, Statistics , School Tuitions for All Subjects , Spoken English Classes , Spoken Hindi Classes , ","Cosmos Tutorials is a renowned company known for its quality services and timelines. We address your needs with utmost care and ensure your satisfaction in whatever we do. Give us an opportunity to serve you. We will gift you with a pleasant experience. customers are always treated with courtesy and you can feel it when you are with us. At Cosmos Tutorials we provide service such as Statistics,School Tuitions for All Subjects,Spoken English Classes,Foreign Languages Coaching,Spoken Hindi Classes .Contact us for further details.  ",,
185586,Tayal Institute Pvt. Ltd.,+91 22 49432704,,,,,"No. 403, D- Definity, JP Nagar, Road No. 1",Goregaon East,400062,mangalore,India,sales@tayalinstitute.com,http://www.tayalsirvod.com,Rajesh Tayal,Monday - Sunday: 9 AM - 7 PM,"CS Coaching , CMA Coaching , Chartered Accountant Coaching , Chartered Financial Analyst (CFA) Coaching , ","Tayal Institute Private Limited is the first institute in India to provide coaching exclusively to CA Final students only. Another first for us is to give a choice to the students for selecting the subject they want to do with us instead of forcing them to join.The institute was founded by CS Prof. Rajesh Tayal, in the year 2004 and since then it has recorded growth year over years. Every time some of our students are placed in merit list.Our courses are built in partnership with technology leaders and are relevant to industry needs.  ","http://localserviceassets.blob.core.windows.net:80/businessphoto-t/12-11-2015%2012-55-43-f84c93fa-fd98-4134-9c4f-9b3abdf442c6.png , http://localserviceassets.blob.core.windows.net:80/businessphoto-t/12-11-2015%2012-55-52-407ad4c4-b749-4039-add0-bb8165549e5a.png , http://localserviceassets.blob.core.windows.net:80/businessphoto-t/12-11-2015%2012-55-58-5bd41ed0-3d4e-4bd7-bf24-edcf6d120f4c.png , http://localserviceassets.blob.core.windows.net:80/businessphoto-t/12-11-2015%2012-56-05-c39d720b-a59f-4dc2-b185-a2213d696199.png , http://localserviceassets.blob.core.windows.net:80/businessphoto-t/12-11-2015%2012-56-12-1a590e8e-38a2-4af7-82af-0375c4b4bc77.png , http://localserviceassets.blob.core.windows.net:80/businessphoto-t/12-11-2015%2012-56-19-7a1e10da-8ed1-4df1-a576-3d5090ca7c55.png , http://localserviceassets.blob.core.windows.net:80/businessphoto-t/12-11-2015%2012-56-26-f2c2731b-b550-427a-be55-4682b4e86802.png , http://localserviceassets.blob.core.windows.net:80/businessphoto-t/12-11-2015%2012-56-38-61214f67-4aa2-415e-9754-d8efcd3d00ec.png , http://localserviceassets.blob.core.windows.net:80/businessphoto-m/12-11-2015%2012-55-43-f84c93fa-fd98-4134-9c4f-9b3abdf442c6.png , http://localserviceassets.blob.core.windows.net:80/businessphoto-m/12-11-2015%2012-55-52-407ad4c4-b749-4039-add0-bb8165549e5a.png , http://localserviceassets.blob.core.windows.net:80/businessphoto-m/12-11-2015%2012-55-58-5bd41ed0-3d4e-4bd7-bf24-edcf6d120f4c.png , http://localserviceassets.blob.core.windows.net:80/businessphoto-m/12-11-2015%2012-56-05-c39d720b-a59f-4dc2-b185-a2213d696199.png , http://localserviceassets.blob.core.windows.net:80/businessphoto-m/12-11-2015%2012-56-12-1a590e8e-38a2-4af7-82af-0375c4b4bc77.png , http://localserviceassets.blob.core.windows.net:80/businessphoto-m/12-11-2015%2012-56-19-7a1e10da-8ed1-4df1-a576-3d5090ca7c55.png , http://localserviceassets.blob.core.windows.net:80/businessphoto-m/12-11-2015%2012-56-26-f2c2731b-b550-427a-be55-4682b4e86802.png , http://localserviceassets.blob.core.windows.net:80/businessphoto-m/12-11-2015%2012-56-38-61214f67-4aa2-415e-9754-d8efcd3d00ec.png , ",
185587,Quick Academy,9964413012,,,,,"1st Floor,",Bejai,575001,mangalore,India,p69m73@yahoo.co.in,,Prerana Acharya,"Monday - Saturday: 10 AM - 7 PM, Sunday: 10 AM - 1 PM","Job Training , Corporate Training Providers , Tuitions for College Subjects , School Tuitions for Math, Physics, Chemistry , School Tuitions for Accounts, Finance, Statistics , School Tuitions for All Subjects , Spoken English Classes , Personality Development Training , 2nd Year PUC Coaching , Corporate Accent Training , Call Center & BPO Training , Interpersonal Skills Training , CBSE Tuitions for Hindi , CBSE Tuitions for English , Management Skills Training , CBSE Tuitions for Maths , Personality Development Training , Soft Skills Training , Stress Management Training , Team Building Training , Time Management Training , Voice Modulation Training , 10th STD Tuitions , B.Com Coaching , 9th STD Tuitions , ",,,"CBSE Tuitions for English , CBSE Tuitions for Hindi , CBSE Tuitions for Maths , Corporate Accent Training , Interpersonal Skills Training , Management Skills Training , Personality Development Training , School Tuitions for Accounts, Finance, Statistics , School Tuitions for All Subjects , School Tuitions for Math, Physics, Chemistry , Soft Skills Training , Spoken English Classes , Stress Management Training , Team Building Training , Time Management Training , Tuitions for College Subjects , Voice Modulation Training , "
185588,Nethravathi Career Training Institute,9481014969,,,,,"3rd Floor, Shalimar Complex",Kankanady,575002,mangalore,India,nethravathicareers@gmail.com,,Kantharaj,"Monday - Saturday: 10 AM - 6 PM, Sunday: 10 AM - 2 PM","Physics Tuitions (11th & 12th) , School Tuitions for Math, Physics, Chemistry , ISC Tuitions for 11th & 12th , Economics Coaching Classes (9th & 10th STD) , Banking Tuitions , Economics Coaching Classes (11th & 12th STD) , Advanced Economics Coaching Classes (College level and above) , 2nd Year PUC Coaching , College Tuitions for Maths , 1st Year PUC Coaching , CET Entrance Coaching , 10th STD Tuitions , 9th STD Tuitions , ","Nethravathi Career Training Institute, we have massive experience in this business. We deal with Coaching & Tuitions. Our motto has always been timely service, best quality and optimum cost. We are in touch with our Students through quality, performance, service and assistance. Bringing the best of value to our Students, we also care as much about our Students. We value the trust and beliefs vested in us by our clients and professional contacts and provide a dedicated service with an honest and direct approach in all our dealings. Contact us for further details.  ",,"Banking Tuitions , CET Entrance Coaching , Classroom Tuitions , College Tuitions for Maths , Daily Classes , Economics Coaching Classes (11th & 12th STD) , Economics Coaching Classes (9th & 10th STD) , Evening Classes , ISC Tuitions for 11th & 12th , Physics Tuitions (11th & 12th) , School Tuitions for Math, Physics, Chemistry , "
185589,Faans Consultant Pvt Ltd,9739363839,,,,,"#C6, Maximus Commercial Complex",Light House Hill Road,575001,mangalore,India,info@faans.in,,Wilsha Dmello,Monday - Friday: 9.30 AM - 5.30 PM,"Placement Consultancies , Overseas Education , Coaching & Tuitions , Job Training , Corporate Training Providers , Overseas Placement Consultants , Shipping Job Vacancies , Mauritius Education Consultants , Overseas Engineering Education Consultants , Corporate Job Consultants , IT Recruitment Consultants , USA Education Consultants , UK Education Consultants , Banking Job Vacancies , Australia Education Consultants , Canada Education Consultants , Insurance Job Vacancies , Event Security Guards , Financial Service Job Vacancies , New Zealand Education Consultants , Russia Education Consultants , FMCG Job Vacancies , Hospitality Security Guards , Cyprus Education Consultants , Austria Education Consultants , Poland Education Consultants , Computer Science Tuitions (11th & 12th STD) , Manned Security Services , Hotel Industry Job vacancies , BPO & Call Centre Job Vacancies , Parking Security Guards , Overseas MBA Education Consultants , Overseas Medical Education Consultants , Overseas Journalism Education Consultants , Physics Tuitions (11th & 12th) , Engineering Job Vacancies , Resume Writing Services , South Korea Education Consultants , Marketing & Sales Job Vacancies , Placement Consultants for Doctors , Placement Consultants for Nurse , Mechanical Engineering Job Vacancies , IT Engineering Job Vacancies , Electrical Engineering Job Vacancies , UPSC Coaching , Commerce Tuitions (11th & 12th STD) , Civil Engineering Job Vacancies , Architect Job Vacancies , Instrumentation Engineering Job Vacancies , Final Year Project Training , NEET Entrance Coaching , NIOS Coaching , France Education Consultants , ","We have been in this business for the past several years. We are well known for our services in the market and are happy to have you as our customer. Our bondage with you will always be ever-cherishing. We welcome you to experience the exemplary service of ours. We aim to meet up with every expectation of yours. . We address your needs with utmost care and ensure your satisfaction in whatever we do. Give us an opportunity to serve you. Our goal is to meet and exceed our customers aspirations with quality construction, an emphasis on designing, beauty with stability and compliance to codes and adherence to strict budgets has ensured that we deliver quality. We will gift you with a pleasant experience. Contact us for further details.  ",,"AC Maintenance Job Consultancies , Advanced Level (A-Level) Physics Tuitions , Aeronautical Engineering , AIEEE Coaching , AIPMT Coaching , Air Hostess Placement Consultancies , All India Common Entrance Examination (AICEE) Coaching , Aptitude Training , Architect Job Vacancies , Architectural Engineering , Armenia Education Consultants , Australia Education Consultants , Austria Education Consultants , B.Com Coaching , Bank Loan Assistance , Banking Job Vacancies , Biology Tuitions (11th & 12th) , BPO & Call Centre Job Vacancies , Call Center & BPO Training , Canada Education Consultants , CBSE Accounts (11th & 12th ) Tuitions , CBSE Tuitions for Hindi , CET Entrance Coaching , Chemistry Tuitions (11th & 12th) , China Education Consultants , Civil Engineering Job Vacancies , Classroom Tuitions , College Applications , College Tuitions for Chemistry , College Tuitions for Maths , College Tuitions for Physics , Commerce Tuitions (11th & 12th STD) , Computer Hardware Job  Consultancies , Computer Networking Job Consultancies , Computer Science Tuitions (11th & 12th STD) , Computer Software Engineer Job Consultancies , Corporate Accent Training , Corporate Communication Skills Training , Corporate Job Consultants , Corporate Security Guards , Counselling Overseas Education , Course Counseling , Cyprus Education Consultants , Daily Classes , Denmark Education Consultants , Dubai Education Consultants , Economics Coaching Classes (11th & 12th STD) , Electrical Engineering Job Vacancies , Engineering Job Vacancies , Europe Education Consultants , Evening Classes , Event Security Guards , Films and TV Job Consultancies , Final Year Project Training , Financial Service Job Vacancies , Finland Education Consultants , FMCG Job Vacancies , France Education Consultants , Germany Education Consultants , GMAT Coaching , GPSC Coaching , GRE Coaching , Holiday Classes , Hospitality Security Guards , Hotel Industry Job vacancies , Housekeeping Staff Job Consultancies , IAS Entrance Coaching , ICSE Hindi Tuitions , ICSE Maths Tuitions , IELTS Coaching , IGCSE Business Studies 11th & 12th , IGCSE Economics 11th & 12th , IIT Engineering Entrance Coaching , IIT HSEE Coaching , IIT JAM Coaching , Industrial Automation Job Consultancies , Instrumentation Engineering Job Vacancies , Insurance Job Vacancies , International Business , Ireland Education Consultants , ISC Tuitions for 11th & 12th , IT Engineering Job Vacancies , IT Recruitment Consultants , Italy Education Consultants , Leadership Management Training , Malaysia Education Consultants , Manned Security Services , Marketing & Sales Job Vacancies , Mauritius Education Consultants , Mechanical Engineering Job Vacancies , Medicine , MIF Coaching , NEET Entrance Coaching , New Zealand Education Consultants , NIOS Coaching , Norway Education Consultants , Overseas Aviation , Overseas Engineering Education Consultants , Overseas Journalism Education Consultants , Overseas MBA Education Consultants , Overseas Medical Education Consultants , Parking Security Guards , Part Time Job Consultancies , Personality Development Training , Philippines Education Consultants , Physics Tuitions (11th & 12th) , Placement Consultants for Doctors , Placement Consultants for Nurse , Placement Training , Poland Education Consultants , Public Speaking Training , Residential Security Guards , Resume Writing Services , Russia Education Consultants , Sales Boy Job Consultancies , Sales Girls Job Consultancies , Scholarships , Shipping Job Vacancies , Singapore Education Consultants , Soft Skills Training , South Korea Education Consultants , Spoken English Training (Corporate) , SSC JE Entrance Coaching , Summer Classes , Sweden Education Consultants , Switzerland Education Consultants , Teacher Training , Technical and Vocational Education and Training (TVET) , TOEFL Coaching , Travel and Accommodation Guidance , UK Education Consultants , Ukraine Education Consultants , UPSC Coaching , USA Education Consultants , USMLE Coaching , Visa Applications , Voice Modulation Training , Weekend Classes , "
185590,Synergy School of Business Skills,8197337703,,,,,"3rd Floor, Prime Towers, Opposite Mangalore Nursing Home, Dakshin Kannad",Bendoorwell,575002,mangalore,India,marketing@synergysbs.co.in,,Ganesan,Monday - Saturday: 9 AM - 6 PM,"Enterprise Training , Project Management Certification Training , Software Tools Training , Six Sigma Certification Training , Project Management Online Training , Primavera Training , Project Management Training , MS Office Training , PMP Certification Online Training , Advanced Primavera Training , PMI ACP Online Training , PMP Certification Training , Scrum Certification Training , CAPM Certification Training , MS Project Training , Asta Powerproject Certification Training , Six Sigma Green Belt Training , Six Sigma Black Belt Training , Kaizen Training , Tally Training , Placement Training , ","Synergy focuses on training individuals on project management concepts and software tools such as Microsoft Office Project, MSP Server, Primavera, and Primavera Complete, Asta Power Project. The courses will be offered in 70 locations across India and in 7 countries, as listed in its website. 
Synergy also trains on PMP Certification Preparatory module, and conducts PME (Project Management Expert) Certification for PM Aspirants. 
The training outcome with Project Management Skills include: Realistic Budgeting, Resource Estimation, Testing Methods, Better Communication, and Effective Risk Management that keep the pace of production high, both qualitatively and quantitatively. Synergy enrolls Students and Professionals of Management and Engineering specialization viz., Mechanical, Civil, Electrical, Electronics, Instrumentation, Business Administration & IT
Synergy offers training on Tally software, MS Office and Placement Training through its course called Master Diploma in Business Automation. 
The School will also help students find employment in the relevant corporate firms for the respective programs.
Branches: #206, 2Nd Floor, Sterling Chamber, Near Besant Women's College, Kalakunja Road, Kodialbail, Mangalore, Karnataka, 575003  ",,"Advanced Primavera Training , Asta Powerproject Certification Training , Classroom Tuitions , Evening Classes , PMI ACP Online Training , PMP Certification Online Training , PMP Certification Training , Project Management Training , Scrum Certification Training , Six Sigma Black Belt Training , Six Sigma Green Belt Training , Tally Training , "
