EduID,Name,Phone1,Phone2,Phone3,Phone4,Phone5,Street Address,Locality,Pincode,City,Country,Mail,Website,Person to Contact,Working Hours,Services Offered,Details,Images URL,Keywords
170426,N2K Technologies,+91 422 3304228,,,,,"No. 566, 2nd Floor, Dr. Nanjappa Road, JV Complex",Gandhipuram,641012,coimbatore,India,n2kcomputereducation@gmail.com,http://www.n2k.co.in,Karthikeyan,Monday - Sunday: 7 AM - 9 PM,"Job Training , Certification Courses Training , Computer Networking Training , Database Training , Enterprise Training , Ethical Hacking Training , Multimedia & Design Training , Networking & Cisco Training , Programming Languages Training , Project Management Certification Training , Software Tools Training , Software Testing Training , Web Technologies Training , Information Security Management Training , Big Data Analytics Online Training , Ethical Hacker Training , 2D Animation Training , Advanced C Programming Training , Web Designing Training , Project Management Training , R Analytics Online Training , Kali Linux Training , MS Office Training , AJAX Training , C, C++ Training , C Sharp (C#) Training , ASP.Net Training , .Net Training , Network Security Training , EJB Training , Java & J2EE Training , Java Script Training , Adobe Flex Training , Automation Tools Training , Manual Testing Training , Adobe Illustrator Training , CCNA Certification Training , VB Script Training , Adobe Photoshop Training , Oracle DBA Training , SQL Server Training , Basic Language Training , IEEE Computer Projects Training , Live Projects Training , Web Logic Training , PHP & MySQL Training , Advanced Visual Basic Training , Photography & Videography Training , Diploma in Advertising Design , Computer Science Tuitions (11th & 12th STD) , Academic Projects Training , Flash Action Effects Training , Graphic Designing Training , ","N2K Technology is a software development and Training provider company from Coimbatore, India offers IT Services, web service, and Consultant services globally started in 2008. N2K is now expanding its canvas and coming up with new offices at many places. N2K Technology is interested in hearing from you if you are creative, talented, experienced, professional in a career on website and software services and technology.Send your updated resume to hr@n2k.co.in  ","http://localserviceassets.blob.core.windows.net:80/businessphoto-t/5319_719810224722469_253022469108390879_n-7823e818-ee14-4ffa-b1fa-7c8b6c1d7406.jpg , http://localserviceassets.blob.core.windows.net:80/businessphoto-t/421312_441155989254562_1796378187_n-613e0c92-feef-43c7-a440-e5684718df18.jpg , http://localserviceassets.blob.core.windows.net:80/businessphoto-t/1959914_815331635170327_2474826903607861498_n-4e616c41-8457-48ff-aa3b-10f9121609ce.jpg , http://localserviceassets.blob.core.windows.net:80/businessphoto-t/10153723_669995829703909_2087750933_n-717f10a9-058a-40db-a59b-d244d2262f6e.jpg , http://localserviceassets.blob.core.windows.net:80/businessphoto-t/10382874_719810321389126_1737645262393280250_n-edd6c5dd-5ca9-4c35-98b3-9bda64a96e91.jpg , http://localserviceassets.blob.core.windows.net:80/businessphoto-t/10491198_719798044723687_7996505194964133984_n-c67f3f8c-8ba1-4ecd-9598-2ca8babcf9fd.jpg , http://localserviceassets.blob.core.windows.net:80/businessphoto-t/10947188_818400161530141_4362020607918158307_n-63ff035d-fb46-463a-8016-b4d327a4c206.jpg , http://localserviceassets.blob.core.windows.net:80/businessphoto-t/20140719_121338-9e27d3bb-7036-4c4e-8698-e3b914edebbf.jpg , http://localserviceassets.blob.core.windows.net:80/businessphoto-t/Gift%20voucher-de2ab984-4540-4a14-817b-9ca58d7d911f.jpg , http://localserviceassets.blob.core.windows.net:80/businessphoto-t/mm%20gf-bced0f01-9ba6-49a0-b075-a30760fde151.jpg , http://localserviceassets.blob.core.windows.net:80/businessphoto-t/sw%20gv-cad4883d-2f71-452b-9a77-9122e8f8c589.jpg , http://localserviceassets.blob.core.windows.net:80/businessphoto-m/5319_719810224722469_253022469108390879_n-7823e818-ee14-4ffa-b1fa-7c8b6c1d7406.jpg , http://localserviceassets.blob.core.windows.net:80/businessphoto-m/421312_441155989254562_1796378187_n-613e0c92-feef-43c7-a440-e5684718df18.jpg , http://localserviceassets.blob.core.windows.net:80/businessphoto-m/1959914_815331635170327_2474826903607861498_n-4e616c41-8457-48ff-aa3b-10f9121609ce.jpg , http://localserviceassets.blob.core.windows.net:80/businessphoto-m/10153723_669995829703909_2087750933_n-717f10a9-058a-40db-a59b-d244d2262f6e.jpg , http://localserviceassets.blob.core.windows.net:80/businessphoto-m/10382874_719810321389126_1737645262393280250_n-edd6c5dd-5ca9-4c35-98b3-9bda64a96e91.jpg , http://localserviceassets.blob.core.windows.net:80/businessphoto-m/10491198_719798044723687_7996505194964133984_n-c67f3f8c-8ba1-4ecd-9598-2ca8babcf9fd.jpg , http://localserviceassets.blob.core.windows.net:80/businessphoto-m/10947188_818400161530141_4362020607918158307_n-63ff035d-fb46-463a-8016-b4d327a4c206.jpg , http://localserviceassets.blob.core.windows.net:80/businessphoto-m/20140719_121338-9e27d3bb-7036-4c4e-8698-e3b914edebbf.jpg , http://localserviceassets.blob.core.windows.net:80/businessphoto-m/Gift%20voucher-de2ab984-4540-4a14-817b-9ca58d7d911f.jpg , http://localserviceassets.blob.core.windows.net:80/businessphoto-m/mm%20gf-bced0f01-9ba6-49a0-b075-a30760fde151.jpg , http://localserviceassets.blob.core.windows.net:80/businessphoto-m/sw%20gv-cad4883d-2f71-452b-9a77-9122e8f8c589.jpg , ","Adobe Flex Training , Adobe Illustrator Training , Adobe Indesign Training , Adobe Photoshop Training , Adobe Premiere Training , Advanced C Programming Training , Advanced Visual Basic Training , AJAX Training , Aptitude Training , ASP.Net Training , Audio & Video Editing Training , Automation Tools Training , Basic Language Training , C Sharp (C#) Training , C, C++ Training , CBSE Tuitions for Chemistry , CBSE Tuitions for Maths , CBSE Tuitions for Physics , CCNA Certification Training , CCTV Installation Training , College Tuitions for Accounts, Finance, Statistics , Computer Hardware Job Training , Computer Science Tuitions (11th & 12th STD) , CSS Training , Diploma in Advertising Design , Diploma in Fashion Designing Coaching , Diploma Visual Effects (VFX) Training , Dreamweaver Training , DTP Training , EJB Training , Ethical Hacker Training , Fashion Designing Training , Flash Action Effects Training , Graphic Designing Training , Handwriting, Spelling & Reading Classes , HTML Training , IEEE Computer Projects Training , IELTS Coaching , IGCSE Accounts 11th & 12th , Interior Design Training , Java & J2EE Training , Java Script Training , JQuery Training , JSP Training , Kali Linux Training , Language Development Coaching , Live Projects Training , Manual Testing Training , MS Access Training , MS Office Training , Network Security Training , Oracle DBA Training , Personality Development Training , Photography & Videography Training , PHP & MySQL Training , Project Management Training , R Analytics Online Training , School Tuitions for Accounts, Finance, Statistics , School Tuitions for All Subjects , School Tuitions for Math, Physics, Chemistry , Spoken English Classes , SQL Server Training , Tally Training , TOEFL Coaching , Tuitions for College Subjects , VB Script Training , Web Designing Training , Web Development Training , Web Logic Training , "
170427,Neelaruns Institute of Confidence,+91 422 3304373,,,,,"No. 31-A, AARPEE Centre",Saibaba Colony,641011,coimbatore,India,neelaruns.pooja@gmail.com,http://www.neelaruns.com,Pooja Pasricha,"Monday - Saturday: 9.30 AM - 2 PM, Monday - Saturday: 5 PM - 8.30 PM","PTE Coaching , Foreign Languages Coaching , Spoken English Classes , GRE Coaching , SAT Coaching , IELTS Coaching , TOEFL Coaching , GMAT Coaching , Language Development Coaching , Placement Training , Aptitude Training , ","Neelaruns Institute of confidence holds several years of experience in the industry and possess renowned professionals who can provide you with the finest service. At Neelaruns Institute of confidence we provide services such as IELTS & TOEFL Coaching, Spoken English Classes, GRE Coaching, SAT Coaching, Spoken Hindi Classes, GMAT Coaching, Language Development Coaching, Aptitude Training. Contact us for further information.  ","http://localserviceassets.blob.core.windows.net:80/businessphoto-t/gses-da689c44-ae46-4888-87fb-8bcd4b86d065.jpg , http://localserviceassets.blob.core.windows.net:80/businessphoto-t/jgyh-c0be4b06-d05e-4616-abac-a5cee53c62f1.jpg , http://localserviceassets.blob.core.windows.net:80/businessphoto-t/ju6tf-2f285033-ed3e-468d-ab29-ca8b0d73b6ad.jpg , http://localserviceassets.blob.core.windows.net:80/businessphoto-t/jyg-6630f28b-6345-42b9-b874-f060c81f78ee.jpg , http://localserviceassets.blob.core.windows.net:80/businessphoto-t/yhtr-a980d1c9-9734-49e1-9508-84b7d4776b0b.jpg , http://localserviceassets.blob.core.windows.net:80/businessphoto-t/nggr-e1f826e0-dd10-4fbf-a3c1-46e0f094d1c1.jpg , http://localserviceassets.blob.core.windows.net:80/businessphoto-t/hjtf-9923e6e2-1317-46b3-84b2-22dfbf4510b6.jpg , http://localserviceassets.blob.core.windows.net:80/businessphoto-t/2222-6a9a9b24-dd83-4c4d-8a6b-174165848963.jpg , http://localserviceassets.blob.core.windows.net:80/businessphoto-t/11111-c2ffde06-6e66-4cc4-9d7b-106a7bc9fe07.jpg , http://localserviceassets.blob.core.windows.net:80/businessphoto-t/333333-66616e1e-f4c2-4fb0-bc33-0c66d627ddd3.jpg , http://localserviceassets.blob.core.windows.net:80/businessphoto-t/000-1a64c92a-e312-492b-b318-517d97831926.jpg , http://localserviceassets.blob.core.windows.net:80/businessphoto-t/111-e187274d-7614-4622-b35a-aaec467e9ddc.jpg , http://localserviceassets.blob.core.windows.net:80/businessphoto-t/222-4f31d390-78f0-48ab-8356-bf3c48402903.jpg , http://localserviceassets.blob.core.windows.net:80/businessphoto-t/01-8edfc10a-f1a6-43ef-a4df-a10a1b5d0e94.jpg , http://localserviceassets.blob.core.windows.net:80/businessphoto-t/02-2c0adf2b-3ab6-4dd1-96c8-c40243623f66.jpg , http://localserviceassets.blob.core.windows.net:80/businessphoto-t/03-ba6d34f6-bc8f-457c-a4d4-d6d2233ff6b4.jpg , http://localserviceassets.blob.core.windows.net:80/businessphoto-t/04-d8ee29da-7160-47f0-a1d0-387aed09a09e.jpg , http://localserviceassets.blob.core.windows.net:80/businessphoto-t/9857-9311d4ee-9f9c-45b7-a73c-2204dce52ad5-9036b963-45c4-4cef-b7d7-4d5a919eee7a.jpg , http://localserviceassets.blob.core.windows.net:80/businessphoto-t/4019-217f326c-eefb-4b5a-ab6d-c910164d88bd-6241e260-bbe3-44d5-b980-3a6df0184c78.jpg , http://localserviceassets.blob.core.windows.net:80/businessphoto-m/gses-da689c44-ae46-4888-87fb-8bcd4b86d065.jpg , http://localserviceassets.blob.core.windows.net:80/businessphoto-m/jgyh-c0be4b06-d05e-4616-abac-a5cee53c62f1.jpg , http://localserviceassets.blob.core.windows.net:80/businessphoto-m/ju6tf-2f285033-ed3e-468d-ab29-ca8b0d73b6ad.jpg , http://localserviceassets.blob.core.windows.net:80/businessphoto-m/jyg-6630f28b-6345-42b9-b874-f060c81f78ee.jpg , http://localserviceassets.blob.core.windows.net:80/businessphoto-m/yhtr-a980d1c9-9734-49e1-9508-84b7d4776b0b.jpg , http://localserviceassets.blob.core.windows.net:80/businessphoto-m/nggr-e1f826e0-dd10-4fbf-a3c1-46e0f094d1c1.jpg , http://localserviceassets.blob.core.windows.net:80/businessphoto-m/hjtf-9923e6e2-1317-46b3-84b2-22dfbf4510b6.jpg , http://localserviceassets.blob.core.windows.net:80/businessphoto-m/2222-6a9a9b24-dd83-4c4d-8a6b-174165848963.jpg , http://localserviceassets.blob.core.windows.net:80/businessphoto-m/11111-c2ffde06-6e66-4cc4-9d7b-106a7bc9fe07.jpg , http://localserviceassets.blob.core.windows.net:80/businessphoto-m/333333-66616e1e-f4c2-4fb0-bc33-0c66d627ddd3.jpg , http://localserviceassets.blob.core.windows.net:80/businessphoto-m/000-1a64c92a-e312-492b-b318-517d97831926.jpg , http://localserviceassets.blob.core.windows.net:80/businessphoto-m/111-e187274d-7614-4622-b35a-aaec467e9ddc.jpg , http://localserviceassets.blob.core.windows.net:80/businessphoto-m/222-4f31d390-78f0-48ab-8356-bf3c48402903.jpg , http://localserviceassets.blob.core.windows.net:80/businessphoto-m/01-8edfc10a-f1a6-43ef-a4df-a10a1b5d0e94.jpg , http://localserviceassets.blob.core.windows.net:80/businessphoto-m/02-2c0adf2b-3ab6-4dd1-96c8-c40243623f66.jpg , http://localserviceassets.blob.core.windows.net:80/businessphoto-m/03-ba6d34f6-bc8f-457c-a4d4-d6d2233ff6b4.jpg , http://localserviceassets.blob.core.windows.net:80/businessphoto-m/04-d8ee29da-7160-47f0-a1d0-387aed09a09e.jpg , http://localserviceassets.blob.core.windows.net:80/businessphoto-m/9857-9311d4ee-9f9c-45b7-a73c-2204dce52ad5-9036b963-45c4-4cef-b7d7-4d5a919eee7a.jpg , http://localserviceassets.blob.core.windows.net:80/businessphoto-m/4019-217f326c-eefb-4b5a-ab6d-c910164d88bd-6241e260-bbe3-44d5-b980-3a6df0184c78.jpg , ","Aptitude Training , Classroom Tuitions , Daily Classes , Placement Training , PTE Coaching , Rs.5000-Rs.10000 , SAT Coaching , Spoken English Classes , TOEFL Coaching , "
170428,Astros Educational Institute,+91 422 3382838,,,,,"No. 850/1, Dr. Veeran Towers, Sathy Road",Gandhipuram,641012,coimbatore,India,astroseducation@gmail.com,http://www.astroseducation.in,Prabhu,,"Engineering Design Training , GATE Coaching , ANSYS Training , GATE Civil Engineering Coaching , ANSYS Meshing Training , ANSYS Workbench Training , GATE Electronics Engineering Coaching , GATE Electrical Engineering Coaching , SSC Entrance Exam Coaching , GATE Mechanical Engineering Coaching , Common Management Aptitude Test (CMAT) Coaching , UPSC Coaching , CTET Coaching , CATIA Training , IBPS Bank Interview Coaching , HyperMesh (HM) Training , CAT Coaching , IAS Entrance Coaching , Spoken English Classes , GRE Coaching , SAT Coaching , Banking Tuitions , Insurance Exam Coaching , GMAT Coaching , SBI PO Training , MAT coaching , Placement Training , Aptitude Training , IBPS Bank Exam Coaching , IES Coaching , TANCET Entrance Coaching , TNPSC Entrance Coaching , XAT Entrance Coaching , ","ASTROS EDUCATIONAL INSTITUTE has massive experience in this business. Our motto has always been timely service, best quality and optimum cost. We are in touch with our customers through quality, performance, service and assistance. Bringing the best of value to our customers, we also care as much about our customers. We value the trust and beliefs vested in us by our clients and professional contacts and provide a dedicated service with an honest and direct approach in all our dealings. We deal in Coaching & Training Services. Contact us for further details.  ","http://localserviceassets.blob.core.windows.net:80/businessphoto-t/9303-77bc05ff-f2f4-4d72-8f71-89c880cd1311.jpg , http://localserviceassets.blob.core.windows.net:80/businessphoto-t/6430-f6a3af56-7a43-48f7-a374-31d48da66deb.jpg , http://localserviceassets.blob.core.windows.net:80/businessphoto-t/4894-ffdc97eb-8526-40a6-b9d1-5b47a04c3c7f.jpg , http://localserviceassets.blob.core.windows.net:80/businessphoto-t/4272-94660507-5b78-4f20-a1c0-b4c16ec16b9c.jpg , http://localserviceassets.blob.core.windows.net:80/businessphoto-m/9303-77bc05ff-f2f4-4d72-8f71-89c880cd1311.jpg , http://localserviceassets.blob.core.windows.net:80/businessphoto-m/6430-f6a3af56-7a43-48f7-a374-31d48da66deb.jpg , http://localserviceassets.blob.core.windows.net:80/businessphoto-m/4894-ffdc97eb-8526-40a6-b9d1-5b47a04c3c7f.jpg , http://localserviceassets.blob.core.windows.net:80/businessphoto-m/4272-94660507-5b78-4f20-a1c0-b4c16ec16b9c.jpg , ","CATIA Training , Common Management Aptitude Test (CMAT) Coaching , CTET Coaching , GATE Civil Engineering Coaching , GATE Electrical Engineering Coaching , GATE Electronics Engineering Coaching , GATE Mechanical Engineering Coaching , GMAT Coaching , GRE Coaching , HyperMesh (HM) Training , IAS Entrance Coaching , IBPS Bank Exam Coaching , IBPS Bank Interview Coaching , IES Coaching , Insurance Exam Coaching , MAT coaching , Placement Training , SAT Coaching , SBI PO Training , Spoken English Classes , SSC Entrance Exam Coaching , TANCET Entrance Coaching , TNPSC Entrance Coaching , UPSC Coaching , XAT Entrance Coaching , "
170429,Brocade Educational Consultancy,+91 422 3382962,,,,,"62, 1st Floor, Sir Shanmugam Road",R.S. Puram,641002,coimbatore,India,grecoachingcbe@gmail.com,,R. Sudha,"Monday - Sunday: 10 AM - 2 PM, Monday - Sunday: 5 AM - 8 PM","GRE Coaching , IELTS Coaching , TOEFL Coaching , GMAT Coaching , ","Brocade Educational Consultancy for Learning has immense experience in this business. We provide GMAT Coaching, GRE Coaching, IELTS Coaching & TOEFL Coaching Etc. Our motto is to provide the best teaching to the students. We have a huge list of impressive success of students. We make your life better and brighter. Education is a primary ingredient and also a key to success in any profession. There is a tremendous need for the quality education to equip this population with skills to handle assignments that spring from such a growing economy like ours. Contact us for further details.  ",,"Daily Classes , Evening Classes , "
170430,Ramsun Educational Institution,+91 422 3304119,,,,,"No. 24, 1st Floor",Thudiyalur,641034,coimbatore,India,ramsun1997@gmail.com,,Jayakumar,Monday - Saturday: 9 AM - 8.30 PM,"Coaching & Tuitions , Enterprise Training , Multimedia & Design Training , Datastage Certification Training , Adobe Photoshop Training , RRB Entrance Exam Coaching , Computer Science Tuitions (11th & 12th STD) , IBM Websphere Application Training , Common Management Aptitude Test (CMAT) Coaching , Industrial Management Distance Education , Diploma in Banking & Finance (DBF) Coaching , IBPS Bank Interview Coaching , BizTalk Server Training , College Tuitions for Accounts, Finance, Statistics , Tuitions for College Subjects , School Tuitions for Math, Physics, Chemistry , School Tuitions for Accounts, Finance, Statistics , School Tuitions for All Subjects , Spoken English Classes , PSAT Exam Coaching , Spoken Hindi Classes , Banking Tuitions , SBI PO Training , Advanced Level (A-Level) Maths Tuitions , CBSE Tuitions for Hindi , CBSE Tuitions for English , CBSE Tuitions for Maths , Language Development Coaching , Aptitude Training , Tamil Tuitions , 10th STD Tuitions , B.Com Coaching , CBSE Accounts (11th & 12th ) Tuitions , IBPS Bank Exam Coaching , 9th STD Tuitions , ","Ramsun Educational Institution, we have massive experience in this business for more than 18 Years. We deal with Distance Education, Tuitions for 10th and 12th, Tutorial Classes for 8th, 10th and 12th and Spoken Classes for Hindi, English and French. Bringing the best of value to our customers, we also care as much about our customers. We value the trust and beliefs vested in us by our clients and professional contacts and provide a dedicated service with an honest and direct approach in all our dealings. Contact us for further details.  ",,"B.Com Coaching , Banking Tuitions , BizTalk Server Training , CBSE Accounts (11th & 12th ) Tuitions , CBSE Tuitions for English , CBSE Tuitions for Hindi , CBSE Tuitions for Maths , College Tuitions for Accounts, Finance, Statistics , Common Management Aptitude Test (CMAT) Coaching , Computer Science Tuitions (11th & 12th STD) , Datastage Certification Training , Diploma in Banking & Finance (DBF) Coaching , IBM Websphere Application Training , IBPS Bank Exam Coaching , IBPS Bank Interview Coaching , Industrial Management Distance Education , Language Development Coaching , PSAT Exam Coaching , RRB Entrance Exam Coaching , SBI PO Training , School Tuitions for Accounts, Finance, Statistics , School Tuitions for All Subjects , School Tuitions for Math, Physics, Chemistry , Spoken English Classes , Spoken Hindi Classes , Tamil Tuitions , Tuitions for College Subjects , "
170431,Karka Kasadara Tuition Centre,+91 422 3382839,,,,,"No. 480, Kamaraj Road, Varadarajapuram",Singanallur,641015,coimbatore,India,gurusaravanan1980@gmail.com,,Saravana Kannan G.,Monday - Sunday : 24 Hrs,"Commerce Tuitions (11th & 12th STD) , School Tuitions for Math, Physics, Chemistry , School Tuitions for Accounts, Finance, Statistics , School Tuitions for All Subjects , Advanced Level (A-Level) Maths Tuitions , CBSE Tuitions for Maths , College Tuitions for Maths , IGCSE Maths Tuitions , IB Maths Tuitions , ICSE Maths Tuitions , 10th STD Tuitions , 9th STD Tuitions , School Tuitions for Biology , ","Karka Kasadara Tuition Centre is been in this business for the past several years. We deal with School Tuitions, Home Base Tuition & Online Tuition.CBSE,ICSE Taken form 6 Grade to 12 Grade, 6th To 10th    - All Subjects, +11 & +12     - Maths, Physics, Chemistry, Business Maths, Computer Science, Accountancy. Special Maths Class Will Be Taken For Diploma, Engineering / Arts & Science Students, We provide Home Tuition for all Subjects. KIndly contact us for further information.  ",,"Advanced Level (A-Level) Maths Tuitions , CBSE Tuitions for Maths , Classroom Tuitions , College Tuitions for Maths , Commerce Tuitions (11th & 12th STD) , Daily Classes , More than Rs.20000 , Online Tuitions , Rs.10000-Rs.20000 , Rs.1000-Rs.5000 , Rs.5000-Rs.10000 , School Tuitions for Accounts, Finance, Statistics , School Tuitions for All Subjects , School Tuitions for Biology , School Tuitions for Math, Physics, Chemistry , "
170432,Explore Academy,+91 422 3382401,,,,,"No. 722, Shakthi Main Road, Next to Ananda's Hotel",Gandhi Puram,641012,coimbatore,India,exploreacademyy@gmail.com,,Karthiga,Monday - Sunday: 9.30 AM - 9 PM,"SSC Entrance Exam Coaching , RRB Entrance Exam Coaching , IBPS Bank Interview Coaching , SSC JE Entrance Coaching , Banking Tuitions , Insurance Exam Coaching , SBI PO Training , Aptitude Training , IBPS Bank Exam Coaching , TNPSC Entrance Coaching , ","Explore Academy is one of the leading service providers in Mumbai. We provide services in SSC Entrance Exam Coaching, RRB Entrance Exam Coaching, IBPS Bank Interview Coaching, Banking Tuitions, Insurance Exam Coaching, Aptitude Training and Placement Training. We are one of the reputed service providers and our strong presence in the industry is a proof for the same.Our customers are always treated with courtesy and you can feel it when you are with us. We believe that the quality of work provided by us, low prices, and diversity and quality of the products we work with are some of the prime elements that will prompt many of you into becoming our clients. Our goal is to supply only top quality products from reputable suppliers. Our experience over many years is that this delivers the best performance and best return on investment for our customers. Call us to know more about us.  ",,"3 Months Program , 6 Months Program , Aptitude Training , Banking Tuitions , Daily Classes , Evening Classes , SSC Entrance Exam Coaching , SSC JE Entrance Coaching , TNPSC Entrance Coaching , Weekend Classes , "
170433,IES - Gate Academy,+91 422 3382832,,,,,"Door No. 401-E, 2nd Floor, Bhoopal Complex, Cross Cut Road",Gandhipuram,641012,coimbatore,India,iesgateacademycovai@gmail.com,http://www.iesgateonlinetest.com,Venubabu,Monday - Sunday: 9 AM - 8 PM,"GATE Coaching , GATE Biotechnology Coaching , GATE Civil Engineering Coaching , GATE Electronics Engineering Coaching , GATE Electrical Engineering Coaching , SSC Entrance Exam Coaching , GATE Instrumental Engineering Coaching , GATE Mechanical Engineering Coaching , GATE Production Engineering Coaching , GATE Industrial Engineering Coaching , UPSC Coaching , PSU Entrance Coaching , IES Coaching , Online Test Series for Exam , ","IES-Gate Academy is a premier Institute in Chennai providing coaching for IES,GATE &PSUs with excellent Result. TheIES-Gate Academy established in Chennai with Good Gate coaching Institute aim to provide All India Level Competitive Exams Awareness to Energetic Engineering Graduates through Intensive Class Room Coaching at various places throughout India by Our Team of Experts from Chennai in different Engineering Disciplines. Contact us for more details.  ","http://localserviceassets.blob.core.windows.net:80/businessphoto-t/4-5aaba4c9-fa69-42e6-96b3-c308f34bf429.jpg , http://localserviceassets.blob.core.windows.net:80/businessphoto-m/4-5aaba4c9-fa69-42e6-96b3-c308f34bf429.jpg , ","GATE Instrumental Engineering Coaching , GATE Mechanical Engineering Coaching , GATE Production Engineering Coaching , IES Coaching , Online Test Series for Exam , PSU Entrance Coaching , SSC Entrance Exam Coaching , UPSC Coaching , "
