EduID,Name,Phone1,Phone2,Phone3,Phone4,Phone5,Street Address,Locality,Pincode,City,Country,Mail,Website,Person to Contact,Working Hours,Services Offered,Details,Images URL,Keywords
166402,Intraword,0265 - 3067199, 0265 - 3074883, 9016527086, 9723815238,,"No. 136, VIP Road",Karelibaug,390018,amritsar,India,info@intraword.com,http://www.intraword.com,Vikash Jha,Monday - Sunday: 8.30 AM - 8 PM,"Translators & Interpreters , Spoken English Classes , German Language Translators , Spanish Language Translators , French Language Translators , Italian Language Translators , Chinese Language Translators , Japanese Language Translators , Russian Translators , Tamil Language Translators , Portuguese Language Translators , Korean Language Translators , Dutch Language Translators , Malaysian Language Translators , IELTS Coaching , English Language Translators , Hindi Language Translators , Arabic Language Translators , Marathi Translators , Sanskrit Translations , Gujarati Language Translators , Oriya Language Translators , Nepali Language Translators , Bengali Language Translators , Urdu Language Translators , Malayalam Language Translators , Telugu Language Translators , Punjabi Language Translators , Kannada Language Translators , ","Intraword, a comprehensive language services provider company, is specialized in various aspects of language services like Foreign language training, translation, interpretation, English and soft skill training and Market research. With unique and innovative services coupled with dynamic and dedicated team, we at Intraword aimed to help every individual and corporate organization to develop their language skill and personality.We offer enormous services like foreign language training, Translation, Interpretation, soft skill training and market research to enhance your skill to achieve great height in career or to improve business expansion. Knowing more language and outstanding personal skill can bring infinite opportunity to start or advancement of your present career.Owing to long years of experience, perfect hiring of instructor, their dedication, we offers competent and professional language training along with translation, interpreter, soft skill training and market research services to our learners. The atmosphere at Intraword is absolutely relaxing, calming and work oriented. Our sincere, motivated and talented instructors put their every feasible effort to teach their learner in an exceptional way. They have come from varied background whose experience is channeled into conferring innovative and excellent services.In our foreign language training programs, students develop their skills in listening, speaking, reading and writing in their language of choice in a proficient manner. We serve language training and interpreter services for all popular international languages like French, Chinese, German, Italian, Spanish, Portuguese and etc.Translation services in Vadodara are designed for all International and regional languages. This engages the learners in the global exchange of ideas and facilitates intercultural communication.Besides offering complete banquet of language services, we also offer soft skill services in order to improve your personality building. Personality development is an important to enhance your talent to face the world of challenge.Our soft skill training programs includes services like Personality Development, Self Development, Anger Management, Self Confidence, Communication skill, Conflict resolution, Thinking & problem solving skill, Leadership skills, Time Management, and many more. Another service of Market research has also been added to our organization to offer authentic and accurate research services to the organization.  ","http://yellowpages.sulekha.com/photos/2938603/Image1.jpg , http://yellowpages.sulekha.com/photos/2938603/Image2.jpg , http://yellowpages.sulekha.com/photos/2938603/Image3.jpg , http://yellowpages.sulekha.com/photos/2938603/Image4.jpg , http://yellowpages.sulekha.com/photos/2938603/Image5.jpg , http://yellowpages.sulekha.com/photos/2938603/Image1.jpg , http://yellowpages.sulekha.com/photos/2938603/Image2.jpg , http://yellowpages.sulekha.com/photos/2938603/Image3.jpg , http://yellowpages.sulekha.com/photos/2938603/Image4.jpg , http://yellowpages.sulekha.com/photos/2938603/Image5.jpg , ","French Language Translators , German Language Translators , Gujarati Language Translators , Hindi Language Translators , IELTS Coaching , Italian Language Translators , Japanese Language Translators , Kannada Language Translators , Korean Language Translators , Malayalam Language Translators , Malaysian Language Translators , Marathi Translators , Nepali Language Translators , Oriya Language Translators , Portuguese Language Translators , Punjabi Language Translators , Russian Translators , Sanskrit Translations , Spanish Language Translators , Spoken English Classes , Tamil Language Translators , Telugu Language Translators , Urdu Language Translators , "
166403,Career Launcher,0183 - 6545354, 9888125354,,,,No. 96C,White Avenue,143001,amritsar,India,amritsar.cl@careerlauncher.com,http://www.careerlauncher.com,Nitin Aggarwal,Monday - Saturday: 7.30 AM - 7 PM,"Law Entrance Coaching , CLAT Entrance Coaching , SAT Coaching , GMAT Coaching , ",,,
166404,IMS Learning Resource Pvt. Ltd.,0183 - 2402089, 9855708995,,,,No. 355/C,Mall Road,143001,amritsar,India,,,,Monday - Sunday : 24 Hrs,"Computer Science Tuitions (11th & 12th STD) , School Tuitions for All Subjects , MBA & BBA Coaching , ",,,
166405,Triumphant Institute of Management Education Pvt. Ltd.,0183 - 2401818, 9781331333,,,,"No. 9/AB, 1st Floor",White Avenue,143001,amritsar,India,,,,,"GATE Coaching , Big Data Analytics Online Training , Engineering Tuitions , GATE Biotechnology Coaching , R Analytics Online Training , Mechanical Engineering Tuitions , Aerospace Engineering Tuitions , GATE Civil Engineering Coaching , GATE Chemical Engineering Coaching , Biomedical Engineering Tuitions , Biomechanical Engineering Tuitions , GATE Computer Science Coaching , GATE Chemistry Coaching , Automotive Engineering Tuitions , Civil Engineering Tuitions , GATE Mathematics Coaching , GATE Physics Coaching , Architectural Engineering Tuitions , Electrical Engineering Tuitions , GATE Electronics Engineering Coaching , GATE Electrical Engineering Coaching , IT & Computer Science Engineering Tuitions , Robotics Engineering Tuitions , GATE Instrumental Engineering Coaching , GATE Mechanical Engineering Coaching , Microelectronic Engineering Tuitions , Chemical Engineering Tuitions , GATE Production Engineering Coaching , GATE Industrial Engineering Coaching , Environmental Engineering Tuitions , Materials Science Engineering Tuitions , GATE Coaching for Other Subjects , Agricultural Engineering Tuitions , Common Management Aptitude Test (CMAT) Coaching , Engineering Tuitions - Other Branches , Engineering Physics Tuitions , Biotechnology Engineering Tuitions , Genetic Engineering Tuitions , Engineering Chemistry Tuitions , Mechatronics Engineering Tuitions , Software Engineering Tuitions , Electronics & Communication Engineering Tuitions , Instrumentation Technology Engineering Tuitions , Telecommunication Engineering Tuitions , Industrial & Production Engineering Tuitions , CAT Coaching , School Tuitions for All Subjects , ",,,"Biomechanical Engineering Tuitions , Biomedical Engineering Tuitions , Biotechnology Engineering Tuitions , CAT Coaching , Chemical Engineering Tuitions , Civil Engineering Tuitions , Common Management Aptitude Test (CMAT) Coaching , Electrical Engineering Tuitions , Electronics & Communication Engineering Tuitions , Engineering Chemistry Tuitions , Engineering Physics Tuitions , Engineering Tuitions - Other Branches , Environmental Engineering Tuitions , GATE Biotechnology Coaching , GATE Chemical Engineering Coaching , GATE Chemistry Coaching , GATE Civil Engineering Coaching , GATE Coaching for Other Subjects , GATE Computer Science Coaching , GATE Electrical Engineering Coaching , GATE Electronics Engineering Coaching , GATE Industrial Engineering Coaching , GATE Instrumental Engineering Coaching , GATE Mathematics Coaching , GATE Mechanical Engineering Coaching , GATE Physics Coaching , GATE Production Engineering Coaching , Genetic Engineering Tuitions , IIT-JEE Coaching , Industrial & Production Engineering Tuitions , Instrumentation Technology Engineering Tuitions , IT & Computer Science Engineering Tuitions , Materials Science Engineering Tuitions , MBA & BBA Coaching , MCA Entrance Coaching , Mechanical Engineering Tuitions , Mechatronics Engineering Tuitions , Microelectronic Engineering Tuitions , R Analytics Online Training , Robotics Engineering Tuitions , School Tuitions for All Subjects , Software Engineering Tuitions , Telecommunication Engineering Tuitions , "
166406,PT Education,0183 - 3222957,,,,,No. 52,Sant Nagar,143001,amritsar,India,,,Virender Gupta,,"MBA & BBA Coaching , ",,,
166407,Aakash Educational Services Ltd.,0183 - 5051033,,,,,"SCO No. 11, 1st & 2nd Floor",Ranjit Avenue,143001,amritsar,India,medical@aesl.in,,,,"IIT Engineering Entrance Coaching , Medical Entrance Coaching , 2nd Year PUC Coaching , 1st Year PUC Coaching , 10th STD Tuitions , IIT-JEE Coaching , 9th STD Tuitions , ",,,"IIT-JEE Coaching , Medical Entrance Coaching , "
166408,IBT Institute,9888710660,,,,,,Rani Ka Bagh,143001,amritsar,India,headoffice@ibtindia.com,http://www.ibtindia.com,Pradeep/Sahil,Monday - Saturday: 9:00 am - 9:00 pm,"UGC Net Coaching , UGC Net Economics Coaching , Banking Tuitions , SBI PO Training , ","The Institute of Banking Training is highly reputed Institute for Banking P.O. and Clerical Exam Training in India. The institute has given excellent results particularly in all banking and other competitive exams. The institute's commitment till the success of its students is a unique feature which gives consistent motivation, support, practice and latest notes/study materials.Persons of the institute are a team of successful intellectuals meticulously selected and groomed according to the mission of the institute. We continuously try to seek, mould, polish and develop the inherent talents of candidates and this in turn helps them to get adapted in the industry in a better manner. The mission of the institute is to develop professionally qualified and competent bankers and finance professionals primarily through a process of education, consultancy/counseling and continuing professional development programs.
""OUR AIM IS TO DELIVER THE BEST BY TAKING CARE OF EVERY STUDENT..........""IBT has created a history by having more than 6000+ in a year. IBT provides life time membership card to ensure 100% training guarantee till selection.  ","http://localserviceassets.blob.core.windows.net:80/businessphoto-t/11-cc272240-faa3-4e30-912e-56b441044099.jpg , http://localserviceassets.blob.core.windows.net:80/businessphoto-t/22-ab469f1d-0675-4145-8d8c-c2c822a66bcf.jpg , http://localserviceassets.blob.core.windows.net:80/businessphoto-t/33-7ffdfb64-2632-4858-ae32-2e5fe714d4a3.jpg , http://localserviceassets.blob.core.windows.net:80/businessphoto-t/ab-9efeb949-1f79-4a3d-803d-7da59472abab.jpg , http://localserviceassets.blob.core.windows.net:80/businessphoto-m/11-cc272240-faa3-4e30-912e-56b441044099.jpg , http://localserviceassets.blob.core.windows.net:80/businessphoto-m/22-ab469f1d-0675-4145-8d8c-c2c822a66bcf.jpg , http://localserviceassets.blob.core.windows.net:80/businessphoto-m/33-7ffdfb64-2632-4858-ae32-2e5fe714d4a3.jpg , http://localserviceassets.blob.core.windows.net:80/businessphoto-m/ab-9efeb949-1f79-4a3d-803d-7da59472abab.jpg , ",
166409,Davesar College,0183 - 2275455, 0183 - 6451289, 9814315346, 9814317127,,"288, F-7, Aare Wali Gali Kashmir Avenue",Kashmir Avenue,143001,amritsar,India,hardesh1000@gmail.com,,Hardesh,All days: 24 hours,"Big Data Analytics Online Training , R Analytics Online Training , Spoken English Classes , ","On the behalf of Davesar Consultants it is my heartiest pleasure to welcome you. Davesar Consultants are always committed to provide excellent services to the most valuable clients. We always have endeavored to cater to rapidly changing world. We Davesar Consultants, leave no stone unturned to make our students reach the desired destination. At Davesar you will also have an opportunity to meet and talk our other students, so that you can get knowledge about various aspects of Australia and Australian education.Once again, I welcome to all our prospective students. We will be more than happy to reply all your queries. 
  ",,
166410,Cavalier India,9417581715,,,,,,,,amritsar,India,cavalierindia.chandigarh@yahoo.com,http://www.cavalierindia.com,Col Diwan,All days: 9:00 am - 6:00 pm,"SSB & NDA Coaching , ",,,
166411,Third Axis Institute of Competitive Exams,9646673683,,,,,"SCO 32, Top Floor ",Amritsar Bus Stand Road,143001,amritsar,India,3rdaxis.asr@gmail.com,,Kawaljit Singh,,"CAT Coaching , IAS Entrance Coaching , ACT Exam Coaching , Banking Tuitions , CBSE Tuitions for Chemistry , BSC Entrance Exam Coaching , ","We are customer oriented & strongly believe in building a relationship based on trust with our customers. With an aim to capture customer loyalty through great value and exceptional performance, we believe in developing and maintaining lasting relationships with our customers by providing outstanding services.  ",,
166412,Omsai Net English Literature,8400439635,,,,,,Hamidpur,226004,amritsar,India,net.eng126@gmail.com,,Aggarwal,Monday - Sunday: 24 hours,"UGC Net Coaching , UGC Net Management Coaching , UGC Net HR Coaching , UGC Net Commerce Coaching , CSIR UGC Net Exam Coaching , UGC Net Economics Coaching , UGC Net History Coaching , ",,,
166413,Talen Thub education,9216666890,,,,,No. 7,Rani Ka Bagh,143001,amritsar,India,talenthubeducation@gmail.com,http://https://www.talenthubeducation.com,Simardeep Singh,Monday - Saturday: 9 AM - 7 PM,,,,
166414,Radical Institute,0183 - 2220708,,,,,Plot No. 718,Rani Ka Bagh,143001,amritsar,India,,,Aji Aroda,Monday - Saturday: 2 PM - 7 PM,"2nd Year PUC Coaching , 1st Year PUC Coaching , ",,,
166415,Radical,0183 - 2563465,,,,,No. 718,INA Colony,143001,amritsar,India,,,,Monday - Sunday : 24 Hrs,"Biochemistry Degree Tuitions , School Tuitions for Math, Physics, Chemistry , CBSE Tuitions for Maths , CBSE Tuitions for Physics , CBSE Tuitions for Chemistry , College Tuitions for Maths , College Tuitions for Physics , College Tuitions for Chemistry , ",,,"College Tuitions for Maths , College Tuitions for Physics , School Tuitions for Math, Physics, Chemistry , "
166416,Toris,8427980813,,,,,,Rani Ka Bagh,143001,amritsar,India,,,,Monday - Saturday: 9 AM - 6 PM,"Big Data Analytics Online Training , R Analytics Online Training , Spoken English Classes , ",,,
166417,Dhyeya IAS Training Centre,9988998901,,,,,"No. 118/120, 1st Floor",Ranjit Avenue,143001,amritsar,India,,,,,"IAS Entrance Coaching , ",,,
166418,I Best - Institute of Banking Entrance & Selection Training,9855142233, 9216252600,,,,"No. 30-A, 1st Floor",Rani Ka Bagh,143001,amritsar,India,ibestinstitute@gmail.com,http://www.ibestindia.com,Mukesh Gupt,Monday - Saturday: 9 AM - 7 PM,"RRB Entrance Exam Coaching , Banking Tuitions , ","Welcome to the global world of iBEST. It is a resource center for Competitive & Entrance Exams. iBEST is for candidates preparing for the various competitive examinations and individuals who want to enhance their knowledge.
No matter how hard you study for your Entrance Examinations, you can never be too sure of your efforts. But, now you can put all those doubts to rest with the help of iBEST.
iBEST is the No.1 leading institute for Bank Exam & others govt. jobs competitive exams Preparation. iBEST provides best Bank PO, Bank Clerical, IBPS CWE Coaching, CWE PO, CWE Clerical, SBI PO, SBI Clerical, RBI Coaching, IBPS Specialist Officers & other public sector bank exams Coaching.
Also, iBEST through its quality guidance and standard approach have made a remarkable name in providing best SSC Graduate Level Coaching, SSC 12th level Coaching.  ",,
166419,Synergy IAS Academy,+91 172 3368929,,,,,"SCO - 153, Top Floor",Sector 24D,160023,amritsar,India,krdinesh24@gmail.com,http://www.synergyiasacademychandigarh.com,Dinesh Kumar,Monday - Saturday: 7 AM - 8 AM,"Engineering Tuitions , Law Entrance Coaching , Mechanical Engineering Tuitions , SET Entrance Coaching , Aerospace Engineering Tuitions , Biomedical Engineering Tuitions , Biomechanical Engineering Tuitions , Automotive Engineering Tuitions , Civil Engineering Tuitions , CLAT Entrance Coaching , Architectural Engineering Tuitions , IPS Entrance Exam Coaching , Electrical Engineering Tuitions , IT & Computer Science Engineering Tuitions , SSC Entrance Exam Coaching , RRB Entrance Exam Coaching , Robotics Engineering Tuitions , Microelectronic Engineering Tuitions , Chemical Engineering Tuitions , Environmental Engineering Tuitions , Materials Science Engineering Tuitions , Agricultural Engineering Tuitions , Common Management Aptitude Test (CMAT) Coaching , Engineering Tuitions - Other Branches , Engineering Physics Tuitions , Biotechnology Engineering Tuitions , UPSC Coaching , Genetic Engineering Tuitions , Engineering Chemistry Tuitions , CTET Coaching , Mechatronics Engineering Tuitions , Software Engineering Tuitions , Electronics & Communication Engineering Tuitions , Instrumentation Technology Engineering Tuitions , NEET Entrance Coaching , Telecommunication Engineering Tuitions , Industrial & Production Engineering Tuitions , IBPS Bank Interview Coaching , PSU Entrance Coaching , CAT Coaching , IIT Engineering Entrance Coaching , IAS Entrance Coaching , School Tuitions for Math, Physics, Chemistry , Spoken English Classes , B.B.A. Entrance Coaching , GRE Coaching , Banking Tuitions , MBA & BBA Coaching , ","An employment in the civil services is much more than an average white-collar job. In fact, the Civil Services offer a unique career opportunity combined with constructive challenges and high growth prospects. By getting into the civil services, you will not only be associated with the decision-makers and implementers of policies & programmes but you will also be a crucial contributor as policy maker to the development of the nation as a whole. The decision to join the civil services is not that of going for yet another lucrative job for livelihood. In fact, it is an opportunity to serve the country. Moreover, the varied nature of assignments attached with the services gives an opportunity for the maximum utilization of one's potential.Synergy IAS Academy was established with a mission that students of this academy should lead the list of successful candidate in the UPSC examination and join the administrative services. Synergy IAS Academy has successfully organized several workshops and seminar for students and presents in Chandigarh & nearby area to enlighten them about the UPSC and UPPSC examination with the help of publicity from media.The students who showed interest were offered rigorous training and coaching by Synergy IAS Academy combined with guidance from excellent professors and tutors, test series and a well equipped library.  ","http://localserviceassets.blob.core.windows.net:80/businessphoto-t/08-01-2016%2013-15-49-913336da-fb9f-4d0b-886a-eac3417be9fa.png , http://localserviceassets.blob.core.windows.net:80/businessphoto-t/08-01-2016%2013-16-00-2c682c7d-b40f-41fe-9086-5b5330495354.png , http://localserviceassets.blob.core.windows.net:80/businessphoto-t/08-01-2016%2013-16-06-13cedd3a-a649-4746-b983-a8b3dbe835a8.png , http://localserviceassets.blob.core.windows.net:80/businessphoto-t/08-01-2016%2013-16-12-069d8a6a-1724-425c-81ff-f4bde33ff4a4.png , http://localserviceassets.blob.core.windows.net:80/businessphoto-t/08-01-2016%2013-16-21-375678c0-9424-4d2d-85ac-5c3441e70f81.png , http://localserviceassets.blob.core.windows.net:80/businessphoto-t/08-01-2016%2013-16-28-de516113-d8e9-4ca5-a7b6-53685da36e6f.png , http://localserviceassets.blob.core.windows.net:80/businessphoto-m/08-01-2016%2013-15-49-913336da-fb9f-4d0b-886a-eac3417be9fa.png , http://localserviceassets.blob.core.windows.net:80/businessphoto-m/08-01-2016%2013-16-00-2c682c7d-b40f-41fe-9086-5b5330495354.png , http://localserviceassets.blob.core.windows.net:80/businessphoto-m/08-01-2016%2013-16-06-13cedd3a-a649-4746-b983-a8b3dbe835a8.png , http://localserviceassets.blob.core.windows.net:80/businessphoto-m/08-01-2016%2013-16-12-069d8a6a-1724-425c-81ff-f4bde33ff4a4.png , http://localserviceassets.blob.core.windows.net:80/businessphoto-m/08-01-2016%2013-16-21-375678c0-9424-4d2d-85ac-5c3441e70f81.png , http://localserviceassets.blob.core.windows.net:80/businessphoto-m/08-01-2016%2013-16-28-de516113-d8e9-4ca5-a7b6-53685da36e6f.png , ","Aptitude Training , Architectural Engineering Tuitions , Automotive Engineering Tuitions , B.B.A. Entrance Coaching , Banking Tuitions , Biomechanical Engineering Tuitions , Biomedical Engineering Tuitions , Biotechnology Engineering Tuitions , CAT Coaching , CET Entrance Coaching , Chemical Engineering Tuitions , Civil Engineering Tuitions , CLAT Entrance Coaching , College Tuitions for Chemistry , College Tuitions for Maths , College Tuitions for Physics , Common Management Aptitude Test (CMAT) Coaching , CTET Coaching , Electrical Engineering Tuitions , Electronics & Communication Engineering Tuitions , Engineering Chemistry Tuitions , Engineering Physics Tuitions , Engineering Tuitions - Other Branches , Environmental Engineering Tuitions , Genetic Engineering Tuitions , GMAT Coaching , GRE Coaching , IAS Entrance Coaching , IB Maths Tuitions , IB Physics Tuitions , IBPS Bank Interview Coaching , IGCSE Maths Tuitions , IGCSE Physics Tuitions , IIT Engineering Entrance Coaching , IIT-JEE Coaching , Industrial & Production Engineering Tuitions , Instrumentation Technology Engineering Tuitions , IPS Entrance Exam Coaching , IT & Computer Science Engineering Tuitions , JEE Advanced Coaching , Materials Science Engineering Tuitions , MBA & BBA Coaching , MCA Entrance Coaching , Mechanical Engineering Tuitions , Mechatronics Engineering Tuitions , Microelectronic Engineering Tuitions , National Talent Search Exam (NTSE) Coaching , NEET Entrance Coaching , Online Test Series for Exam , PCS Entrance Coaching , PSU Entrance Coaching , Robotics Engineering Tuitions , RRB Entrance Exam Coaching , School Tuitions for Math, Physics, Chemistry , SET Entrance Coaching , Software Engineering Tuitions , Spoken English Classes , SSB & NDA Coaching , SSC Entrance Exam Coaching , Telecommunication Engineering Tuitions , UPSC Coaching , Vedic Maths Coaching , "
