EduID,Name,Phone1,Phone2,Phone3,Phone4,Phone5,Street Address,Locality,Pincode,City,Country,Mail,Website,Person to Contact,Working Hours,Services Offered,Details,Images URL,Keywords
182043,RBM Classes,9876729637,,,,,No. 32,Sector 20D,160020,chandigarh,India,,,,,"2nd Year PUC Coaching , SBI PO Training , CBSE Tuitions for Maths , 1st Year PUC Coaching , 10th STD Tuitions , 9th STD Tuitions , ",,,
182044,RN Commerce Classes,9988888203, 9988430263,,,,No. 179,Sector 37C,160037,chandigarh,India,,,,,"Commerce Tuitions (11th & 12th STD) , ",,,
182045,Sinha Institute of Mathematics,9216080000,,,,,"SCO No. 215, Top Floor",Sector 37C,160037,chandigarh,India,,,,,"CBSE Tuitions for Maths , CBSE Tuitions for Physics , CBSE Tuitions for Chemistry , College Tuitions for Maths , College Tuitions for Physics , College Tuitions for Chemistry , IGCSE Maths Tuitions , IGCSE Physics Tuitions , IB Maths Tuitions , IB Physics Tuitions , ",,,"College Tuitions for Physics , IB Maths Tuitions , IB Physics Tuitions , IGCSE Maths Tuitions , IGCSE Physics Tuitions , "
182046,Srivastavas Physics Foundation,9216543210,,,,,"SCO No. 18, Top Floor",Sector 20D,160020,chandigarh,India,,,,,"Physics Tuitions (11th & 12th) , School Tuitions for Math, Physics, Chemistry , CBSE Tuitions for Maths , CBSE Tuitions for Physics , CBSE Tuitions for Chemistry , College Tuitions for Maths , College Tuitions for Physics , College Tuitions for Chemistry , IGCSE Maths Tuitions , IGCSE Physics Tuitions , IB Maths Tuitions , IB Physics Tuitions , ",,,"College Tuitions for Physics , IB Maths Tuitions , IB Physics Tuitions , IGCSE Maths Tuitions , IGCSE Physics Tuitions , Physics Tuitions (11th & 12th) , School Tuitions for Math, Physics, Chemistry , "
182047,Versace Coaching & Home Tuition,9888777547,,,,,No. 45/46,Sector 45,160047,chandigarh,India,,,Vijay Kumar Verma,Monday - Saturday: 4 PM - 7 PM,"School Tuitions for Math, Physics, Chemistry , 10th STD Tuitions , 9th STD Tuitions , ",,,
182048,KP Institutes of Physics,9872887878,,,,,No. 25,Sector 15,160015,chandigarh,India,,,,,"Physics Tuitions (11th & 12th) , School Tuitions for Math, Physics, Chemistry , 2nd Year PUC Coaching , CBSE Tuitions for Maths , College Tuitions for Maths , IGCSE Maths Tuitions , 1st Year PUC Coaching , 10th STD Tuitions , ",,,"IGCSE Maths Tuitions , Physics Tuitions (11th & 12th) , School Tuitions for Math, Physics, Chemistry , "
182049,Ganesh Physics Classes,9855522065, 9888351483,,,,No. 145,Sector 40C,160036,chandigarh,India,,,K. Ganeshan,Monday - Saturday: 10 AM - 7 PM,"Physics Tuitions (11th & 12th) , School Tuitions for Math, Physics, Chemistry , 2nd Year PUC Coaching , SBI PO Training , CBSE Tuitions for Maths , College Tuitions for Maths , IGCSE Maths Tuitions , IB Maths Tuitions , 1st Year PUC Coaching , 10th STD Tuitions , 9th STD Tuitions , ",,,"College Tuitions for Maths , IB Maths Tuitions , IGCSE Maths Tuitions , Physics Tuitions (11th & 12th) , SBI PO Training , School Tuitions for Math, Physics, Chemistry , "
182050,Physics Techniques,9815971242,,,,,"No. 156, Top Floor",Sector 24,160024,chandigarh,India,,,,,"Physics Tuitions (11th & 12th) , School Tuitions for Math, Physics, Chemistry , CBSE Tuitions for Maths , College Tuitions for Maths , IGCSE Maths Tuitions , IB Maths Tuitions , 10th STD Tuitions , 9th STD Tuitions , ",,,"IGCSE Maths Tuitions , Physics Tuitions (11th & 12th) , School Tuitions for Math, Physics, Chemistry , "
182051,Kheras Coaching Classes,9417224321,,,,,No. 2409/10,Sector 22,160022,chandigarh,India,,,Meena,Monday - Sunday: 7.30 AM - 7.30 PM,"Microbiology & Biotechnology Tuitions , CBSE Tuitions for Maths , 10th STD Tuitions , 9th STD Tuitions , ",,,
182052,EduGaps,9217873534,,,,,"SCO No. 210, 1st Floor",Sector 36,160036,chandigarh,India,,,,,"CBSE Tuitions for English , CBSE Tuitions for Maths , CBSE Tuitions for Physics , CBSE Tuitions for Chemistry , ICSE English Tuitions , ICSE Hindi Tuitions , 10th STD Tuitions , 9th STD Tuitions , ",,,"CBSE Tuitions for Physics , ICSE English Tuitions , ICSE Hindi Tuitions , "
182053,Engineering Solutions,9878449595,,,,,SCO No. 167,Sector 37C,160036,chandigarh,India,,,Rajesh,Monday - Sunday: 10 AM - 8 PM ( Lunch: 1.30 PM - 2 PM ),"Engineering Tuitions , Mechanical Engineering Tuitions , Aeronautics Engineering Tuitions , Diploma in Mechanical Engineering , IIT Engineering Entrance Coaching , ACT Exam Coaching , Actuarial Science Coaching , Advanced Economics Coaching Classes (College level and above) , 2nd Year PUC Coaching , Advanced Level (A-Level) Physics Tuitions , Advanced Level (A-Level) Chemistry Tuitions , 1st Year PUC Coaching , 10th STD Tuitions , 9th STD Tuitions , ACCA Training , ACS Coaching , ",,,"ACS Coaching , ACT Exam Coaching , Actuarial Science Coaching , Advanced Economics Coaching Classes (College level and above) , Advanced Level (A-Level) Chemistry Tuitions , Advanced Level (A-Level) Physics Tuitions , Aeronautics Engineering Tuitions , Diploma in Mechanical Engineering , IIT Engineering Entrance Coaching , Mechanical Engineering Tuitions , "
182054,Gurus Commerce Academy,9316017516,,,,,No. 382,Sector 37D,160037,chandigarh,India,,,,,"Commerce Tuitions (11th & 12th STD) , College Tuitions for Accounts, Finance, Statistics , School Tuitions for Accounts, Finance, Statistics , ",,,
182055,Indian Academy,9815843710,,,,,No. 12,Manimajra,160101,chandigarh,India,,,,,"2nd Year PUC Coaching , CBSE Tuitions for English , CBSE Tuitions for Maths , ICSE Hindi Tuitions , 1st Year PUC Coaching , 10th STD Tuitions , 9th STD Tuitions , ",,,"CBSE Tuitions for Maths , ICSE Hindi Tuitions , "
182056,Institutes of Excellence,9877473343,,,,,SCO No. 153,Sector 24,160024,chandigarh,India,,,,,"CBSE Tuitions for English , CBSE Tuitions for Maths , CBSE Tuitions for Physics , CBSE Tuitions for Chemistry , ICSE English Tuitions , ICSE Hindi Tuitions , 10th STD Tuitions , 9th STD Tuitions , ",,,"CBSE Tuitions for Physics , ICSE English Tuitions , ICSE Hindi Tuitions , "
182057,Chaudhary Tutorial,9417512942, 9465215022,,,,No. 63,Sector 40,160040,chandigarh,India,,,Omkar Chaudhary ,Monday - Sunday: 9 AM - 7 PM,"2nd Year PUC Coaching , CBSE Tuitions for English , CBSE Tuitions for Maths , ICSE Hindi Tuitions , 1st Year PUC Coaching , 10th STD Tuitions , 9th STD Tuitions , ",,,"CBSE Tuitions for Maths , ICSE Hindi Tuitions , "
182058,Mehtas English Academy,9872600694,,,,,No. 168,Sector 37,160036,chandigarh,India,,,Mehtas,Monday - Saturday: 9 AM - 7 PM,"Spoken English Classes , ",,,
182059,PI Scholastics,0172 - 6544444, 9216144327,,,,No. 16/17,Sector 20D,160020,chandigarh,India,info@pischolastics.com,http://www.piescholastics.org,,,"AIEEE Coaching , WBJEE Coaching , JEE Advanced Coaching , IIT-JEE Coaching , ",,,
182060,Ranjeet Shahi Chemistry Classes,0 - 2725748, 9417524948, 8591196653,,,No. 48,Sector 20C,160020,chandigarh,India,,http://www.rscc.in,Ranjeet Shahi,Monday - Sunday: 2.30 PM - 4.30 PM,"Chemistry Tuitions (11th & 12th) , 2nd Year PUC Coaching , College Tuitions for Chemistry , Advanced Level (A-Level) Chemistry Tuitions , 1st Year PUC Coaching , ",,,
182061,Sanjay Singh Mathematics Classes,9888228231, 9888946883,,,,No. 14,Sector 23C,160020,chandigarh,India,,http://www.ssmconline.com,Sanjay Singh,Monday - Sunday: 10 AM - 8.30 PM,"Advanced Level (A-Level) Maths Tuitions , CBSE Tuitions for Maths , College Tuitions for Maths , IB Maths Tuitions , ICSE Maths Tuitions , ",,,
182062,JK Physics,0172 - 2727097,,,,,No. 1097,Sector 15,160015,chandigarh,India,,,,,"2nd Year PUC Coaching , College Tuitions for Physics , 1st Year PUC Coaching , ",,,
182063,BS Institute,9815971606, 9216871606,,,,No. 185,Sector 37C,160036,chandigarh,India,bsinstitute.37@gmail.com,,Basant Singh,Monday - Saturday: 2.30 PM - 8 PM,"2nd Year PUC Coaching , 1st Year PUC Coaching , 10th STD Tuitions , 9th STD Tuitions , ",,,
182064,City Commerce Academy,0172 - 5015015, 9316017917,,,,No. 83,Sector 39,160038,chandigarh,India,info@citycommerceacademy.org,http://www.citycommerceacademy.com,Amarjit Singh,Monday - Saturday: 8 AM - 2 PM,"CS Coaching , College Tuitions for Accounts, Finance, Statistics , Chartered Accountant Coaching , 2nd Year PUC Coaching , 1st Year PUC Coaching , ",,,
182065,European Institute of Professional Studies,+91 172 3368683,,,,,No. 251,Panchkula,134104,chandigarh,India,europeanpkl@gmail.com,http://https://www.europeanpkl.com,Neelam,Monday - Saturday: 8 AM - 8 PM,"Coaching & Tuitions , UK Education Consultants , Australia Education Consultants , Canada Education Consultants , SSC Entrance Exam Coaching , PTE Coaching , Spoken English Classes , IELTS Coaching , TOEFL Coaching , ","The International English Language Testing System (IELTS) examination is often a requirement if you plan to emigrate, study or work overseas. The course will develop the strategies required to improve your score in all four parts of the test. It teaches the complete range of language skills needed to improve your band score. Our expert trainers will help you improve your language proficiency throughout the course by providing input and practice
Everybody interested in overseas study or immigration and in some cases while applying for international jobs, may be required to undergo an IELTS test. The IELTS score is required to get admission into many renowned universities across the world and a majority of immigration destinations demand their applicants to take IELTS test in order to qualify for the eligibility criteria. In fact, in certain immigration programs, such as Australia General Skilled Migration program, both the principal applicant and their spouse are required to appear for the IELTS test.Contact us for further details.  ","http://localserviceassets.blob.core.windows.net:80/businessphoto-t/download%20(1)-59f62ad3-90c0-403e-a224-e3a60c498a0b.jpg , http://localserviceassets.blob.core.windows.net:80/businessphoto-t/download%20(2)-21c53b82-5e77-4d95-8ade-fa2a98371cf1.jpg , http://localserviceassets.blob.core.windows.net:80/businessphoto-t/download-08f807e0-b9c0-45c0-a2a2-2e11d12716a9.jpg , http://localserviceassets.blob.core.windows.net:80/businessphoto-t/download-97eebfd9-af58-45f3-a9e9-142f7ff889e6.png , http://localserviceassets.blob.core.windows.net:80/businessphoto-t/images-94b758b8-52f8-4628-96b6-8c601cfabfa7.jpg , http://localserviceassets.blob.core.windows.net:80/businessphoto-t/13-01-2016%2017-49-09-1c86c370-c600-45d3-9c6e-4305bc9e4963.png , http://localserviceassets.blob.core.windows.net:80/businessphoto-t/13-01-2016%2017-49-20-4c724318-99b1-48ab-a40d-94ab231b306f.png , http://localserviceassets.blob.core.windows.net:80/businessphoto-t/13-01-2016%2017-49-31-8b8e272e-b763-484a-95ff-01cf2fdddbbe.png , http://localserviceassets.blob.core.windows.net:80/businessphoto-t/13-01-2016%2017-49-42-86c3720e-b8b8-497d-86ad-746bbea2e63b.png , http://localserviceassets.blob.core.windows.net:80/businessphoto-t/13-01-2016%2017-49-51-36f57324-15c4-4d36-b414-76b637053de8.png , http://localserviceassets.blob.core.windows.net:80/businessphoto-t/13-01-2016%2017-50-01-4037937b-f442-4bda-9301-a1fa01957e80.png , http://localserviceassets.blob.core.windows.net:80/businessphoto-t/13-01-2016%2017-50-11-3247b55f-2d43-4e2e-a20c-3e44862da733.png , http://localserviceassets.blob.core.windows.net:80/businessphoto-m/download%20(1)-59f62ad3-90c0-403e-a224-e3a60c498a0b.jpg , http://localserviceassets.blob.core.windows.net:80/businessphoto-m/download%20(2)-21c53b82-5e77-4d95-8ade-fa2a98371cf1.jpg , http://localserviceassets.blob.core.windows.net:80/businessphoto-m/download-08f807e0-b9c0-45c0-a2a2-2e11d12716a9.jpg , http://localserviceassets.blob.core.windows.net:80/businessphoto-m/download-97eebfd9-af58-45f3-a9e9-142f7ff889e6.png , http://localserviceassets.blob.core.windows.net:80/businessphoto-m/images-94b758b8-52f8-4628-96b6-8c601cfabfa7.jpg , http://localserviceassets.blob.core.windows.net:80/businessphoto-m/13-01-2016%2017-49-09-1c86c370-c600-45d3-9c6e-4305bc9e4963.png , http://localserviceassets.blob.core.windows.net:80/businessphoto-m/13-01-2016%2017-49-20-4c724318-99b1-48ab-a40d-94ab231b306f.png , http://localserviceassets.blob.core.windows.net:80/businessphoto-m/13-01-2016%2017-49-31-8b8e272e-b763-484a-95ff-01cf2fdddbbe.png , http://localserviceassets.blob.core.windows.net:80/businessphoto-m/13-01-2016%2017-49-42-86c3720e-b8b8-497d-86ad-746bbea2e63b.png , http://localserviceassets.blob.core.windows.net:80/businessphoto-m/13-01-2016%2017-49-51-36f57324-15c4-4d36-b414-76b637053de8.png , http://localserviceassets.blob.core.windows.net:80/businessphoto-m/13-01-2016%2017-50-01-4037937b-f442-4bda-9301-a1fa01957e80.png , http://localserviceassets.blob.core.windows.net:80/businessphoto-m/13-01-2016%2017-50-11-3247b55f-2d43-4e2e-a20c-3e44862da733.png , ","SSC Entrance Exam Coaching , TOEFL Coaching , UK Education Consultants , "
182066,Biology Coaching Classes,9814906941, 9988071753,,,,No. 3018,Sector 27,160019,chandigarh,India,,,,,"Biology Tuitions (11th & 12th) , 2nd Year PUC Coaching , 1st Year PUC Coaching , School Tuitions for Biology , ",,,
182067,Excellent Result Oriented Coaching,9316227837,,,,,No. 48,Sector 16,160015,chandigarh,India,,,,,"Botony Tuitions , Commerce Tuitions (11th & 12th STD) , College Tuitions for Accounts, Finance, Statistics , Biology Tuitions (11th & 12th) , 2nd Year PUC Coaching , CBSE Tuitions for English , CBSE Tuitions for Maths , College Tuitions for Maths , 1st Year PUC Coaching , 10th STD Tuitions , Zoology Tuitions , 9th STD Tuitions , ",,,"Botony Tuitions , CBSE Tuitions for English , CBSE Tuitions for Maths , College Tuitions for Accounts, Finance, Statistics , College Tuitions for Maths , Commerce Tuitions (11th & 12th STD) , Zoology Tuitions , "
182068,Mangala Institute of Chemistry,9417202669,,,,,No. 205,Sector 36,160017,chandigarh,India,,,,,"Chemistry Tuitions (11th & 12th) , ",,,
182069,Intelligence Academy,9041166742,,,,,No. 16 ,Mohali,160059,chandigarh,India,iramohali@gmail.com,,,,"Banking Tuitions , 2nd Year PUC Coaching , 1st Year PUC Coaching , ",,,
182070,Espilon Coaching Centre,9041494531,,,,,No. 1048,Hallo Majra,160002,chandigarh,India,,,,,"Botony Tuitions , Common Management Aptitude Test (CMAT) Coaching , Commerce Tuitions (11th & 12th STD) , College Tuitions for Accounts, Finance, Statistics , Certified Financial Executive (CFX) Coaching , Biology Tuitions (11th & 12th) , 2nd Year PUC Coaching , CBSE Tuitions for English , CBSE Tuitions for Maths , CBSE Tuitions for Physics , CBSE Tuitions for Chemistry , College Tuitions for Maths , College Tuitions for Physics , College Tuitions for Chemistry , 1st Year PUC Coaching , 10th STD Tuitions , Zoology Tuitions , 9th STD Tuitions , ",,,"Botony Tuitions , CBSE Tuitions for Chemistry , CBSE Tuitions for English , CBSE Tuitions for Maths , CBSE Tuitions for Physics , Certified Financial Executive (CFX) Coaching , College Tuitions for Accounts, Finance, Statistics , College Tuitions for Chemistry , College Tuitions for Maths , College Tuitions for Physics , Commerce Tuitions (11th & 12th STD) , Common Management Aptitude Test (CMAT) Coaching , Zoology Tuitions , "
182071,Tuition Classes,9872836581,,,,,No. 3136,Sector 35,160023,chandigarh,India,,,,,"CBSE Tuitions for English , CBSE Tuitions for Maths , CBSE Tuitions for Physics , CBSE Tuitions for Chemistry , 10th STD Tuitions , 9th STD Tuitions , ",,,
182072,Anoop Coaching Centre,7837218200,,,,,No.921/D,Naya Gaon,160103,chandigarh,India,,,Anoop,,"Law Entrance Coaching , CLAT Entrance Coaching , Foreign Languages Coaching , Diploma in Banking & Finance (DBF) Coaching , Engineering EAMCET Coaching , B.B.A. Entrance Coaching , Calligraphy Coaching , Banking Tuitions , SBI PO Training , Fashion Design Entrance Coaching , Diploma in Fashion Designing Coaching , Architecture Entrance Coaching , All India Common Entrance Examination (AICEE) Coaching , ",,,"CLAT Entrance Coaching , Diploma in Banking & Finance (DBF) Coaching , Diploma in Fashion Designing Coaching , Engineering EAMCET Coaching , Fashion Design Entrance Coaching , Foreign Languages Coaching , SBI PO Training , "
182073,Synergy Coaching Centre,8054369091,,,,,No. 140,Sector 24-B,160017,chandigarh,India,,,,,"Commerce Tuitions (11th & 12th STD) , College Tuitions for Accounts, Finance, Statistics , Economics Coaching Classes (9th & 10th STD) , Economics Coaching Classes (11th & 12th STD) , Chemistry Tuitions (11th & 12th) , Biology Tuitions (11th & 12th) , 2nd Year PUC Coaching , CBSE Tuitions for English , CBSE Tuitions for Maths , College Tuitions for Maths , 1st Year PUC Coaching , 10th STD Tuitions , 9th STD Tuitions , ",,,"CBSE Tuitions for English , CBSE Tuitions for Maths , Chemistry Tuitions (11th & 12th) , College Tuitions for Accounts, Finance, Statistics , College Tuitions for Maths , Commerce Tuitions (11th & 12th STD) , Economics Coaching Classes (11th & 12th STD) , Economics Coaching Classes (9th & 10th STD) , "
182074,KM Coaching Institute,8699876455,,,,,Ground Floor,Manimajra,160101,chandigarh,India,,,,,"2nd Year PUC Coaching , 1st Year PUC Coaching , 10th STD Tuitions , 9th STD Tuitions , ",,,
182075,Best Gate Coaching Institiute,7087489139,,,,,No. SCO-94-95 ,Sector 34,160022,chandigarh,India,,http://www.gatelauncher.com,,,"Botony Tuitions , Commerce Tuitions (11th & 12th STD) , College Tuitions for Accounts, Finance, Statistics , Economics Coaching Classes (9th & 10th STD) , Economics Coaching Classes (11th & 12th STD) , Chemistry Tuitions (11th & 12th) , Biology Tuitions (11th & 12th) , 2nd Year PUC Coaching , CBSE Tuitions for English , CBSE Tuitions for Maths , CBSE Tuitions for Physics , CBSE Tuitions for Chemistry , College Tuitions for Maths , College Tuitions for Physics , College Tuitions for Chemistry , 1st Year PUC Coaching , 10th STD Tuitions , Zoology Tuitions , 9th STD Tuitions , ",,,"Botony Tuitions , CBSE Tuitions for Chemistry , CBSE Tuitions for English , CBSE Tuitions for Maths , CBSE Tuitions for Physics , Chemistry Tuitions (11th & 12th) , College Tuitions for Accounts, Finance, Statistics , College Tuitions for Chemistry , College Tuitions for Maths , College Tuitions for Physics , Commerce Tuitions (11th & 12th STD) , Economics Coaching Classes (11th & 12th STD) , Economics Coaching Classes (9th & 10th STD) , Zoology Tuitions , "
182076,Sandeep Patwal,9316889968,,,,,No. 157,Sector 48,160047,chandigarh,India,,,Sandeep,Monday - Sunday: 8 AM - 6 PM,"IPS Entrance Exam Coaching , IAS Entrance Coaching , ",,,
182077,Nav Coaching Centre,9988098988,,,,,No. 369,Sector 44D,160047,chandigarh,India,,,,,"Botony Tuitions , Computer Science Tuitions (11th & 12th STD) , Commerce Tuitions (11th & 12th STD) , Matriculation Tuitions for Hindi & English , College Tuitions for Accounts, Finance, Statistics , Economics Coaching Classes (9th & 10th STD) , Economics Coaching Classes (11th & 12th STD) , Chemistry Tuitions (11th & 12th) , Biology Tuitions (11th & 12th) , 2nd Year PUC Coaching , CBSE Tuitions for English , CBSE Tuitions for Maths , College Tuitions for Maths , 1st Year PUC Coaching , 10th STD Tuitions , Zoology Tuitions , 9th STD Tuitions , ",,,"Botony Tuitions , CBSE Tuitions for English , CBSE Tuitions for Maths , Chemistry Tuitions (11th & 12th) , College Tuitions for Accounts, Finance, Statistics , College Tuitions for Maths , Commerce Tuitions (11th & 12th STD) , Computer Science Tuitions (11th & 12th STD) , Economics Coaching Classes (11th & 12th STD) , Economics Coaching Classes (9th & 10th STD) , Matriculation Tuitions for Hindi & English , Zoology Tuitions , "
182078,Unique Coaching Center,8283051193, 9357507755,,,,No. 16,Zirakpur,140603,chandigarh,India,manishthapar18@gmail.com,,Balvinder,Monday - Sunday: 3 PM - 9 PM,"2nd Year PUC Coaching , 1st Year PUC Coaching , 10th STD Tuitions , 9th STD Tuitions , ",,,
182079,Universal Coaching Centre,9878977596, 9569393389,,,,No. 2193/14A,Manimajra,160101,chandigarh,India,,,Vishnu,Monday - Sunday: 9 AM - 9 PM,"Computer Science Tuitions (11th & 12th STD) , 2nd Year PUC Coaching , College Tuitions for Maths , 1st Year PUC Coaching , 10th STD Tuitions , 9th STD Tuitions , ",,,
182080,Surinders Coaching Center,9815739625, 9876145987,,,,No. 18,Ram Darbar,160002,chandigarh,India,,,Surinder Slathia,Monday - Sunday: 4 PM - 9.30 PM ( Lunch: 2 PM - 3 PM ),"Physics Tuitions (11th & 12th) , School Tuitions for All Subjects , Chemistry Tuitions (11th & 12th) , CBSE Tuitions for English , CBSE Tuitions for Maths , 10th STD Tuitions , 9th STD Tuitions , ",,,"Physics Tuitions (11th & 12th) , School Tuitions for All Subjects , "
182081,Pabbi Coaching Institute,9316000676,,,,,No. 1690,Sector 49-B,160047,chandigarh,India,,,,,"Banking Tuitions , 2nd Year PUC Coaching , SBI PO Training , Aptitude Training , 1st Year PUC Coaching , AIEEE Coaching , 10th STD Tuitions , 9th STD Tuitions , ",,,"Aptitude Training , Banking Tuitions , SBI PO Training , "
182082,AIT Campus,8727000636,,,,,3rd Floor,Mohali,160016,chandigarh,India,,http://www.aitmohali.in,Karanvir Singh,Monday - Saturday: 9 AM - 6 PM,"MBA & BBA Coaching , B.Com Coaching , M.Com Coaching , B.A English Coaching , M.A English Coaching , ",,,
182083,Bright Commerce Classes,9872356233,,,,,No. 238,Mohali,160055,chandigarh,India,,,,,"Commerce Tuitions (11th & 12th STD) , CS Coaching , School Tuitions for Math, Physics, Chemistry , Chartered Accountant Coaching , ",,,
182084,Education Hub,9317360009,,,,,No. 58,Sector 34,160001,chandigarh,India,,,,Monday - Sunday : 24 Hrs,"Spoken English Classes , ",,,
182085,Educators,9815078888,,,,,No. 266,Sector 44C,160044,chandigarh,India,,,,Monday - Sunday : 24 Hrs,"Spoken English Classes , IELTS Coaching , ",,,
182086,Brilliance Chemistry Academy,+91 172 3368225,,,,,No. 72,Sector 20C,160020,chandigarh,India,,,Ajay Kaushal,Monday - Saturday: 2 PM - 8 PM,"Chemistry Tuitions (11th & 12th) , CBSE Tuitions for Chemistry , College Tuitions for Chemistry , Advanced Level (A-Level) Chemistry Tuitions , ",,,
182087,Arora Tutorials,9876009525,,,,,Ground Floor,Panchkula,134109,chandigarh,India,,,,,"School Tuitions for Math, Physics, Chemistry , 1st Year PUC Coaching , 10th STD Tuitions , 9th STD Tuitions , ",,,
182088,Sky Hawks,9779149016,,,,,No. 405-406,Sector 35C,160035,chandigarh,India,,,,,"Spoken English Classes , ",,,
182089,Ankur Sharma,9888523601,,,,,No. 1483,Sector 50-D,160001,chandigarh,India,,,,,"Engineering Tuitions , Electrical Engineering Tuitions , Electronics & Communication Engineering Tuitions , Engineering Graphics Tuitions , IIT Engineering Entrance Coaching , ",,,
182090,Aims Tutorials,9988354509,,,,,No. 171/172,Sector 17,160017,chandigarh,India,,,,,"School Tuitions for Math, Physics, Chemistry , Banking Tuitions , 2nd Year PUC Coaching , SBI PO Training , 1st Year PUC Coaching , 10th STD Tuitions , 9th STD Tuitions , ",,,"SBI PO Training , School Tuitions for Math, Physics, Chemistry , "
182091,Career Campus,9780463709,,,,,No. 206,Sector 35D,160002,chandigarh,India,,,,,"School Tuitions for Math, Physics, Chemistry , IIT HSEE Coaching , 1st Year PUC Coaching , 10th STD Tuitions , 9th STD Tuitions , ",,,
182092,Career Makers,9855510502,,,,,Ground Floor,Mohali,160055,chandigarh,India,,,,Monday - Sunday : 24 Hrs,"School Tuitions for Math, Physics, Chemistry , College Tuitions for Maths , College Tuitions for Physics , College Tuitions for Chemistry , ",,,
182093,Bans Rao Tutorials,9915508633,,,,,No. 63,Mohali,160055,chandigarh,India,,,,,"10th STD Tuitions , 9th STD Tuitions , ",,,
182094,Eminent,9915774576,,,,,No. 68,Mohali,160055,chandigarh,India,,,,,"Spoken English Classes , 10th STD Tuitions , ",,,
182095,Chaudhary Tutorial,9465215022,,,,,No. 63,Sector 40B,160036,chandigarh,India,,,Onkar Chaudhary,Monday - Sunday: 2 PM - 8 PM,"Physics Tuitions (11th & 12th) , School Tuitions for Math, Physics, Chemistry , Polytechnic Entrance Coaching , CBSE Tuitions for Maths , College Tuitions for Maths , IIT HSEE Coaching , 10th STD Tuitions , 9th STD Tuitions , ",,,"Physics Tuitions (11th & 12th) , Polytechnic Entrance Coaching , School Tuitions for Math, Physics, Chemistry , "
182096,Chandan,8699208467,,,,,,Sector 12,160011,chandigarh,India,,,,Monday - Sunday : 24 Hrs,"School Tuitions for Math, Physics, Chemistry , ",,,
182097,Deac Pvt. Ltd.,9888036699,,,,,No. 2425-2426 ,Sector 22C,160022,chandigarh,India,,http://Www.daffodillslearning.com,,Monday - Sunday : 24 Hrs,,,,
182098,Aarzoo,9779077730,,,,,Ground Floor,Sector 35,160017,chandigarh,India,,,,,"School Tuitions for Math, Physics, Chemistry , 2nd Year PUC Coaching , 1st Year PUC Coaching , 10th STD Tuitions , 9th STD Tuitions , ",,,
182099,Rahul Sharma,9646590511,,,,,No. 158,Sector 19,160017,chandigarh,India,,,Rahul Sharma,Monday - Saturday: 9 AM - 6 PM,"2nd Year PUC Coaching , 1st Year PUC Coaching , 10th STD Tuitions , ",,,
182100,Pratiyogita Kendra,9216077790,,,,,No. 8,Panchkula,134109,chandigarh,India,,,,,"Medical EAMCET Coaching , Medical Entrance Coaching , Biomedical Tuitions , 1st Year PUC Coaching , 10th STD Tuitions , ",,,
182101,Ruchi Arya,9888697677,,,,,No. 306,Zirakpur,140105,chandigarh,India,,,,,"Spoken English Classes , 2nd Year PUC Coaching , 1st Year PUC Coaching , 9th STD Tuitions , ",,,
182102,MIC Academy,9888153625,,,,,No. 11,Mohali,160055,chandigarh,India,,,,,"School Tuitions for Math, Physics, Chemistry , College Tuitions for Maths , CET Entrance Coaching , ",,,
182103,Rishwa Sharda,9464305710,,,,,No. 3206,Sector 28,160002,chandigarh,India,,,,,"School Tuitions for Math, Physics, Chemistry , 2nd Year PUC Coaching , 1st Year PUC Coaching , 10th STD Tuitions , 9th STD Tuitions , ",,,
182104,Sahil Kamboj,7355229989, 9464315675,,,,No. 2,Panchkula,134117,chandigarh,India,,,Sahil Kamboj,Monday - Sunday: 10 AM - 7 PM,"SSC Entrance Exam Coaching , UPSC Coaching , CMA Coaching , SSC JE Entrance Coaching , Banking Tuitions , GMAT Coaching , ",,,
182105,Patwal English Classes,9216240666,,,,,Ground Floor,Sector 44C,160047,chandigarh,India,,,,,"Spoken English Classes , ",,,
