EduID,Name,Phone1,Phone2,Phone3,Phone4,Phone5,Street Address,Locality,Pincode,City,Country,Mail,Website,Person to Contact,Working Hours,Services Offered,Details,Images URL,Keywords
185577,Royale Academy,9880215199, 7795505566,,,,"1st Floor, Ideal Towers",Hampankatta,575001,mangalore,India,royaleacademy15@gmail.com,http://www.royaleacademy.co.in,Reetesh,,"IPS Entrance Exam Coaching , SSC Entrance Exam Coaching , RRB Entrance Exam Coaching , Physics Tuitions (11th & 12th) , CACPT Coaching , Common Management Aptitude Test (CMAT) Coaching , UPSC Coaching , CS Coaching , IBPS Bank Interview Coaching , CAT Coaching , IIT Engineering Entrance Coaching , IAS Entrance Coaching , School Tuitions for All Subjects , Spoken English Classes , PSAT Exam Coaching , GRE Coaching , SAT Coaching , Chartered Accountant Coaching , Banking Tuitions , IELTS Coaching , TOEFL Coaching , GMAT Coaching , SBI PO Training , CBSE Tuitions for Maths , CBSE Tuitions for Physics , CBSE Tuitions for Chemistry , 10th STD Tuitions , B.Com Coaching , ACS Coaching , ","Royale Academy for Learning has immense experience in this business. We provide coaching for all boards. Our motto is to provide the best teaching to the students. We have a huge list of impressive success of students. We promise a better future for your children in higher education and knowledge. We make your life better and brighter. Education is a primary ingredient and also a key to success in any profession. With a booming economy and a young population, there is a tremendous need for the quality education to equip this population with skills to handle assignments that spring from such a growing economy like ours. Contact us for further details. ROYALE ACADEMY, 1ST FLOOR IDEAL TOWERS, OPP SHARAUV TEMPLE, ABOVE IDEAL CAFE, HAMPANKATTA, MANGALORE. PH: 9880215199 OFFICE: 0824 4260066 AND ROYALE ACADEMY, 1ST FLOOR, OM PLAZA, OPP TOWN BANK, CARSTREET, MANGALORE PH: 9880215199 0FFICE: 0824 4270066  ","http://localserviceassets.blob.core.windows.net:80/businessphoto-t/2x3-dad40f8e-da93-4abd-bb39-77d4cacdb0f5.png , http://localserviceassets.blob.core.windows.net:80/businessphoto-t/Royale%20Academy%20Logo-94d56f42-de38-4f75-8115-370d87f02759.png , http://localserviceassets.blob.core.windows.net:80/businessphoto-t/Visiting%20crad%20Backnew-7db7cf9e-0b10-4227-9f14-f399f8fcc127.png , http://localserviceassets.blob.core.windows.net:80/businessphoto-t/2016-02-16%2023.43.19-88bd4818-784d-4562-8d46-5f49d0a83f77.jpg , http://localserviceassets.blob.core.windows.net:80/businessphoto-t/Banking%20Group%2020160303_220027-49887719-8419-454a-a842-b0a19ff91388.jpg , http://localserviceassets.blob.core.windows.net:80/businessphoto-t/5203-aacfbcab-f4d3-4f22-8598-8f1fac17eabf.jpg , http://localserviceassets.blob.core.windows.net:80/businessphoto-t/7935-68f8ee25-c061-4cde-8570-dd0ce747b706.jpg , http://localserviceassets.blob.core.windows.net:80/businessphoto-m/2x3-dad40f8e-da93-4abd-bb39-77d4cacdb0f5.png , http://localserviceassets.blob.core.windows.net:80/businessphoto-m/Royale%20Academy%20Logo-94d56f42-de38-4f75-8115-370d87f02759.png , http://localserviceassets.blob.core.windows.net:80/businessphoto-m/Visiting%20crad%20Backnew-7db7cf9e-0b10-4227-9f14-f399f8fcc127.png , http://localserviceassets.blob.core.windows.net:80/businessphoto-m/2016-02-16%2023.43.19-88bd4818-784d-4562-8d46-5f49d0a83f77.jpg , http://localserviceassets.blob.core.windows.net:80/businessphoto-m/Banking%20Group%2020160303_220027-49887719-8419-454a-a842-b0a19ff91388.jpg , http://localserviceassets.blob.core.windows.net:80/businessphoto-m/5203-aacfbcab-f4d3-4f22-8598-8f1fac17eabf.jpg , http://localserviceassets.blob.core.windows.net:80/businessphoto-m/7935-68f8ee25-c061-4cde-8570-dd0ce747b706.jpg , ","10th STD Tuitions , ACS Coaching , B.Com Coaching , Banking Tuitions , CACPT Coaching , CAT Coaching , CBSE Tuitions for Chemistry , CBSE Tuitions for Maths , CBSE Tuitions for Physics , Chartered Accountant Coaching , Classroom Tuitions , Common Management Aptitude Test (CMAT) Coaching , CS Coaching , Daily Classes , Evening Classes , IIT Engineering Entrance Coaching , IPS Entrance Exam Coaching , Physics Tuitions (11th & 12th) , PSAT Exam Coaching , RRB Entrance Exam Coaching , SAT Coaching , SBI PO Training , School Tuitions for All Subjects , Spoken English Classes , SSC Entrance Exam Coaching , TOEFL Coaching , UPSC Coaching , Weekend Classes , "
185578,Manya Abroad - The Princeton Review,0824 - 4279100, 8884560008,,,,3rd Floor,Balmatta,575002,mangalore,India,tprmangalore@gmail.com,http://www.manyagroup.com,Shuchi Joshi,Monday - Sunday: 10 AM - 7 PM,"Coaching & Tuitions , Mauritius Education Consultants , Overseas Engineering Education Consultants , USA Education Consultants , UK Education Consultants , Australia Education Consultants , Canada Education Consultants , New Zealand Education Consultants , Russia Education Consultants , Cyprus Education Consultants , Austria Education Consultants , Poland Education Consultants , Overseas MBA Education Consultants , Overseas Medical Education Consultants , Overseas Journalism Education Consultants , South Korea Education Consultants , France Education Consultants , Germany Education Consultants , CAT Coaching , GRE Coaching , SAT Coaching , Banking Tuitions , Singapore Education Consultants , Switzerland Education Consultants , IELTS Coaching , TOEFL Coaching , GMAT Coaching , Ukraine Education Consultants , Europe Education Consultants , Italy Education Consultants , Placement Training , Ireland Education Consultants , Sweden Education Consultants , Norway Education Consultants , Finland Education Consultants , Philippines Education Consultants , Malaysia Education Consultants , Armenia Education Consultants , Dubai Education Consultants , Denmark Education Consultants , China Education Consultants , ","Manya Abroad - The Princeton Review is a foreign education admissions service provider to Indian students for over a decade and is also a provider of Test Preparation for GMAT, GRE, SAT, ACT, AP, PSAT, IELTS & TOEFL with  20 years experience in the international higher education domain and is a trusted partner for hundreds of higher education institutions worldwide. This partnership extends our connectivity with students and parents as we assist them in their journey towards studying abroad. Please contact for further information.  ","http://localserviceassets.blob.core.windows.net:80/businessphoto-t/1-217e4957-5a2c-4777-a310-6cfd56d681d4.jpg , http://localserviceassets.blob.core.windows.net:80/businessphoto-t/2-f55d4515-8ee4-4f78-b5a3-1f925707ed7a.jpg , http://localserviceassets.blob.core.windows.net:80/businessphoto-t/3-141187f7-03e5-4b55-a2d8-7456ee9a0ba9.jpg , http://localserviceassets.blob.core.windows.net:80/businessphoto-t/banner-c855381d-12b0-4407-a596-5453e6f01b9e.jpg , http://localserviceassets.blob.core.windows.net:80/businessphoto-t/banner1-d1b6e6fe-30bb-438c-beff-10e5140726b5.jpg , http://localserviceassets.blob.core.windows.net:80/businessphoto-t/gmat_add-408caa52-f3c4-450a-af3a-77a1e73d2c64.png , http://localserviceassets.blob.core.windows.net:80/businessphoto-t/main_gre_banner-37c455a6-df08-4eb1-a66a-1e4e7730d7b9.png , http://localserviceassets.blob.core.windows.net:80/businessphoto-m/1-217e4957-5a2c-4777-a310-6cfd56d681d4.jpg , http://localserviceassets.blob.core.windows.net:80/businessphoto-m/2-f55d4515-8ee4-4f78-b5a3-1f925707ed7a.jpg , http://localserviceassets.blob.core.windows.net:80/businessphoto-m/3-141187f7-03e5-4b55-a2d8-7456ee9a0ba9.jpg , http://localserviceassets.blob.core.windows.net:80/businessphoto-m/banner-c855381d-12b0-4407-a596-5453e6f01b9e.jpg , http://localserviceassets.blob.core.windows.net:80/businessphoto-m/banner1-d1b6e6fe-30bb-438c-beff-10e5140726b5.jpg , http://localserviceassets.blob.core.windows.net:80/businessphoto-m/gmat_add-408caa52-f3c4-450a-af3a-77a1e73d2c64.png , http://localserviceassets.blob.core.windows.net:80/businessphoto-m/main_gre_banner-37c455a6-df08-4eb1-a66a-1e4e7730d7b9.png , ","CAT Coaching , China Education Consultants , Cyprus Education Consultants , Denmark Education Consultants , Dubai Education Consultants , Europe Education Consultants , Finland Education Consultants , France Education Consultants , Germany Education Consultants , GMAT Coaching , GRE Coaching , IELTS Coaching , Ireland Education Consultants , Italy Education Consultants , Malaysia Education Consultants , Mauritius Education Consultants , New Zealand Education Consultants , Norway Education Consultants , Overseas Engineering Education Consultants , Overseas Journalism Education Consultants , Overseas MBA Education Consultants , Overseas Medical Education Consultants , Philippines Education Consultants , Placement Training , Poland Education Consultants , Russia Education Consultants , SAT Coaching , Singapore Education Consultants , South Korea Education Consultants , Sweden Education Consultants , Switzerland Education Consultants , TOEFL Coaching , UK Education Consultants , Ukraine Education Consultants , USA Education Consultants , "
185579,Robomate Plus,18002100009,,,,,All Offline & Online Courses Available,Mulund West,400036,mangalore,India,robomateleads@mteducare.com,,Mehek Khan,Monday - Saturday: 9 AM - 8 PM,,"MT EduCare Ltd, we believe in facilitating an environment to excel in studies. We offer world class infrastructure in addition to curriculum taught by the subject matter experts of the highest caliber backed by well  researched content and customized evaluation systems. Our interactive and new age methodologies not only make learning as an enjoyable experience but also create motivated and energetic students ready to excel in their exams.. Contact us for further details.  ",,
185580,Sacred Heart Group of Institutions,8971896074,,,,,2nd Floor,Surathkal,575001,mangalore,India,sacredheart.mng@gmail.com,http://www.sacredhearts.net,Sujitha Shankarlingam,"Monday - Saturday: 8 AM - 8 PM, Sunday: 9 AM - 2 PM","Language Training , Microbiology & Biotechnology Tuitions , Biochemistry Degree Tuitions , French Language Training , German Language Training , Botony Tuitions , Italian Language Training , Computer Science Tuitions (11th & 12th STD) , Physics Tuitions (11th & 12th) , Foreign Languages Coaching , UPSC Coaching , Commerce Tuitions (11th & 12th STD) , Final Year Project Training , Diploma in Banking & Finance (DBF) Coaching , Matriculation Tuitions for Hindi & English , Navodaya Vidyalaya Entrance Coaching , College Tuitions for Accounts, Finance, Statistics , School Tuitions for Accounts, Finance, Statistics , School Tuitions for All Subjects , Spoken English Classes , ISC Tuitions for 11th & 12th , Economics Coaching Classes (9th & 10th STD) , Banking Tuitions , Economics Coaching Classes (11th & 12th STD) , Chemistry Tuitions (11th & 12th) , Biology Tuitions (11th & 12th) , 2nd Year PUC Coaching , CBSE Tuitions for English , CBSE Tuitions for Maths , CBSE Tuitions for Physics , CBSE Tuitions for Chemistry , College Tuitions for Maths , College Tuitions for Physics , College Tuitions for Chemistry , ICSE English Tuitions , IB Maths Tuitions , IGCSE Economics 11th & 12th , IGCSE Accounts 11th & 12th , IGCSE Business Studies 11th & 12th , ICSE Maths Tuitions , 1st Year PUC Coaching , 10th STD Tuitions , 9th STD Tuitions , School Tuitions for Biology , ","Sacred Heart Group of Institutions for Learning has immense experience in this business. We provide coaching for all boards. Our motto is to provide the best teaching to the students. We have a huge list of impressive success of students. We promise a better future for your children in higher education and knowledge. We make your life better and brighter. Education is a primary ingredient and also a key to success in any profession. With a booming economy and a young population, there is a tremendous need for the quality education to equip this population with skills to handle assignments that spring from such a growing economy like ours. Contact us for further details.  ","http://localserviceassets.blob.core.windows.net:80/businessphoto-t/th1-c3a57ac1-2e0a-4142-881c-b53e68b95702.jpg , http://localserviceassets.blob.core.windows.net:80/businessphoto-t/th2-c6a35369-3227-4cd1-aa06-e759e500e82e.jpg , http://localserviceassets.blob.core.windows.net:80/businessphoto-t/th3-b1d878b7-85d5-4a66-b997-5bc8f806a692.jpg , http://localserviceassets.blob.core.windows.net:80/businessphoto-t/th4-3b098016-1b85-41e5-85b3-721f75d6a7e1.jpg , http://localserviceassets.blob.core.windows.net:80/businessphoto-t/th5-c90c52ab-5a60-4d1f-a015-e5ac4d96a3ea.jpg , http://localserviceassets.blob.core.windows.net:80/businessphoto-t/th6-1da63ceb-5146-4a96-9091-020e7897d33b.jpg , http://localserviceassets.blob.core.windows.net:80/businessphoto-t/th7-a78f2902-aaee-465a-948f-333d60b46cf6.jpg , http://localserviceassets.blob.core.windows.net:80/businessphoto-t/th8-c28b4bf2-2751-41cd-8222-548c5530715a.jpg , http://localserviceassets.blob.core.windows.net:80/businessphoto-t/th9-be2a726c-893b-4c7a-9bc2-8c9591a65145.jpg , http://localserviceassets.blob.core.windows.net:80/businessphoto-t/th10-593473c3-307a-4904-8ba2-9e6d149232f6.jpg , http://localserviceassets.blob.core.windows.net:80/businessphoto-t/th11-fe3b7914-1d5e-4ea5-b79e-53b33b5bc4d0.jpg , http://localserviceassets.blob.core.windows.net:80/businessphoto-t/th12-2ed1b0d3-6bd9-4a7e-b30f-bc855e5fecf9.jpg , http://localserviceassets.blob.core.windows.net:80/businessphoto-t/th13-837028cc-48bd-4bf6-9a5d-da9eda5e8292.jpg , http://localserviceassets.blob.core.windows.net:80/businessphoto-t/th14-7ab03f3c-7f92-43c8-845b-ad8e4a4dfd77.jpg , http://localserviceassets.blob.core.windows.net:80/businessphoto-t/th15-ac933a66-7d0c-4bb5-9df4-bb32bfc30fb7.jpg , http://localserviceassets.blob.core.windows.net:80/businessphoto-t/th16-4b8c544c-cd0f-4727-9584-4b1c1b5b8700.jpg , http://localserviceassets.blob.core.windows.net:80/businessphoto-t/th18-29bd065a-ef76-482c-90ac-4c49751ea1e2.jpg , http://localserviceassets.blob.core.windows.net:80/businessphoto-t/th19-eeecd700-50c8-443a-af57-1346ee947ef9.jpg , http://localserviceassets.blob.core.windows.net:80/businessphoto-t/th21-0c8fd0db-339c-4586-885e-9a2aacc27070.jpg , http://localserviceassets.blob.core.windows.net:80/businessphoto-t/th22-5728741d-784d-414c-881e-cb2d887fd884.jpg , http://localserviceassets.blob.core.windows.net:80/businessphoto-t/th23-9efb64c8-6282-4b64-a411-e0efbd99f44b.jpg , http://localserviceassets.blob.core.windows.net:80/businessphoto-t/th24-5aad7f6a-29f7-4e55-bc94-0a4fa1086bf9.jpg , http://localserviceassets.blob.core.windows.net:80/businessphoto-t/th25-0d3f0560-3a8f-4757-9126-721dd35501e7.jpg , http://localserviceassets.blob.core.windows.net:80/businessphoto-t/th26-ec3a23b1-9d29-445a-980a-397baf4d576e.jpg , http://localserviceassets.blob.core.windows.net:80/businessphoto-t/th27-ba35a4fd-40ec-450f-8e8b-a6bdec4906cb.jpg , http://localserviceassets.blob.core.windows.net:80/businessphoto-m/th1-c3a57ac1-2e0a-4142-881c-b53e68b95702.jpg , http://localserviceassets.blob.core.windows.net:80/businessphoto-m/th2-c6a35369-3227-4cd1-aa06-e759e500e82e.jpg , http://localserviceassets.blob.core.windows.net:80/businessphoto-m/th3-b1d878b7-85d5-4a66-b997-5bc8f806a692.jpg , http://localserviceassets.blob.core.windows.net:80/businessphoto-m/th4-3b098016-1b85-41e5-85b3-721f75d6a7e1.jpg , http://localserviceassets.blob.core.windows.net:80/businessphoto-m/th5-c90c52ab-5a60-4d1f-a015-e5ac4d96a3ea.jpg , http://localserviceassets.blob.core.windows.net:80/businessphoto-m/th6-1da63ceb-5146-4a96-9091-020e7897d33b.jpg , http://localserviceassets.blob.core.windows.net:80/businessphoto-m/th7-a78f2902-aaee-465a-948f-333d60b46cf6.jpg , http://localserviceassets.blob.core.windows.net:80/businessphoto-m/th8-c28b4bf2-2751-41cd-8222-548c5530715a.jpg , http://localserviceassets.blob.core.windows.net:80/businessphoto-m/th9-be2a726c-893b-4c7a-9bc2-8c9591a65145.jpg , http://localserviceassets.blob.core.windows.net:80/businessphoto-m/th10-593473c3-307a-4904-8ba2-9e6d149232f6.jpg , http://localserviceassets.blob.core.windows.net:80/businessphoto-m/th11-fe3b7914-1d5e-4ea5-b79e-53b33b5bc4d0.jpg , http://localserviceassets.blob.core.windows.net:80/businessphoto-m/th12-2ed1b0d3-6bd9-4a7e-b30f-bc855e5fecf9.jpg , http://localserviceassets.blob.core.windows.net:80/businessphoto-m/th13-837028cc-48bd-4bf6-9a5d-da9eda5e8292.jpg , http://localserviceassets.blob.core.windows.net:80/businessphoto-m/th14-7ab03f3c-7f92-43c8-845b-ad8e4a4dfd77.jpg , http://localserviceassets.blob.core.windows.net:80/businessphoto-m/th15-ac933a66-7d0c-4bb5-9df4-bb32bfc30fb7.jpg , http://localserviceassets.blob.core.windows.net:80/businessphoto-m/th16-4b8c544c-cd0f-4727-9584-4b1c1b5b8700.jpg , http://localserviceassets.blob.core.windows.net:80/businessphoto-m/th18-29bd065a-ef76-482c-90ac-4c49751ea1e2.jpg , http://localserviceassets.blob.core.windows.net:80/businessphoto-m/th19-eeecd700-50c8-443a-af57-1346ee947ef9.jpg , http://localserviceassets.blob.core.windows.net:80/businessphoto-m/th21-0c8fd0db-339c-4586-885e-9a2aacc27070.jpg , http://localserviceassets.blob.core.windows.net:80/businessphoto-m/th22-5728741d-784d-414c-881e-cb2d887fd884.jpg , http://localserviceassets.blob.core.windows.net:80/businessphoto-m/th23-9efb64c8-6282-4b64-a411-e0efbd99f44b.jpg , http://localserviceassets.blob.core.windows.net:80/businessphoto-m/th24-5aad7f6a-29f7-4e55-bc94-0a4fa1086bf9.jpg , http://localserviceassets.blob.core.windows.net:80/businessphoto-m/th25-0d3f0560-3a8f-4757-9126-721dd35501e7.jpg , http://localserviceassets.blob.core.windows.net:80/businessphoto-m/th26-ec3a23b1-9d29-445a-980a-397baf4d576e.jpg , http://localserviceassets.blob.core.windows.net:80/businessphoto-m/th27-ba35a4fd-40ec-450f-8e8b-a6bdec4906cb.jpg , ","1 Month Program , 1 Week Program , 1 Year Program , 2 Weeks Programs , 3 Months Program , 6 Months Program , Below Rs.1000 , Biochemistry Degree Tuitions , Biology Tuitions (11th & 12th) , Botony Tuitions , CBSE Tuitions for Chemistry , CBSE Tuitions for English , CBSE Tuitions for Maths , CBSE Tuitions for Physics , Chemistry Tuitions (11th & 12th) , Classroom Tuitions , College Tuitions for Accounts, Finance, Statistics , College Tuitions for Chemistry , College Tuitions for Maths , College Tuitions for Physics , Commerce Tuitions (11th & 12th STD) , Computer Science Tuitions (11th & 12th STD) , Daily Classes , Diploma in Banking & Finance (DBF) Coaching , Economics Coaching Classes (11th & 12th STD) , Economics Coaching Classes (9th & 10th STD) , Evening Classes , Final Year Project Training , Foreign Languages Coaching , French Language Training , German Language Training , IB Maths Tuitions , ICSE English Tuitions , ICSE Maths Tuitions , IGCSE Accounts 11th & 12th , IGCSE Business Studies 11th & 12th , IGCSE Economics 11th & 12th , ISC Tuitions for 11th & 12th , Italian Language Training , Matriculation Tuitions for Hindi & English , Microbiology & Biotechnology Tuitions , More than Rs.20000 , Navodaya Vidyalaya Entrance Coaching , Physics Tuitions (11th & 12th) , Rs.10000-Rs.20000 , Rs.1000-Rs.5000 , Rs.5000-Rs.10000 , School Tuitions for Accounts, Finance, Statistics , School Tuitions for All Subjects , School Tuitions for Biology , Short Term , Spoken English Classes , UPSC Coaching , Weekend Classes , "
185581,ISC  Indian School of Commerce,080436 91443,,,,,"4th Floor, Lakshmi Narayan Complex",Vasanth Nagar,560052,mangalore,India,admissions@isc.edu.in,http://www.isc.edu.in,Swetha,Monday - Sunday: 9 AM - 5 PM,"ACCA Training , CIMA Certification Coaching , International Financial Reporting Standards (IFRS) Coaching , ","ISC Indian School of Commerce is an initiative of ISDC - International Skill Development Corporation (A Company Registered under the Companies Act of England and Wales, 2006) which has taken over the operations of leading Indian Education Company called Shadwells. It imparts Education of International Standard through holistic approach, producing exorbitant quality output to cater the current professional demand. ISC extends complete education solution setting it apart as the forefront Education Company first of its kind in India. The portfolio of services capitalizes in new generation programs catering the education and employment habitat. ISC' rigorous cutting edge training of the students creates a definitive winning mark depicted of its kind in the new generation course environment at various educational platforms. Its core competency is sharpening the student's output, also empowering education service providers and Institutions with effectiveness to manifest. ISC bridges the gap between the Knowledge starving and the resources with optimal delivery of Quality Education.  ","http://localserviceassets.blob.core.windows.net:80/businessphoto-t/1-644f13fc-125a-4d93-9255-b99fb921cf3a.jpg , http://localserviceassets.blob.core.windows.net:80/businessphoto-m/1-644f13fc-125a-4d93-9255-b99fb921cf3a.jpg , ","6 Months Program , Classroom Tuitions , Daily Classes , "
185582,Career Line Education Foundation,0824 - 4256476, 8197051444,,,,"07, 1st Floor, Crystal Arc, Balmatta Road",Balmatta,575101,mangalore,India,manglore@careerline.org,http://www.careerline.org,Prabodh Pandya,Monday - Sunday: 9 AM - 7 PM,"PTE Coaching , Foreign Languages Coaching , GRE Coaching , SAT Coaching , IELTS Coaching , TOEFL Coaching , GMAT Coaching , Language Development Coaching , Aptitude Training , ","We are an international education advising organization, involved in placing students in prestigious colleges and universities across the globe. Backed by a strong knowledge and skill base, earned in more than a decade of established achievements, we provide a wide range of services to students looking for dream educational and career options abroad.
Team CAREERLINE comprises of highly experienced and trained professionals with multiple achievements in various verticals of international student recruitment and marketing. We are driven by a strong urge to succeed through perfection and consistency of actions.  ","http://localserviceassets.blob.core.windows.net:80/businessphoto-t/1-d7a7aa11-ab66-4be0-836a-9ceb6c2b258c.png , http://localserviceassets.blob.core.windows.net:80/businessphoto-t/10-2b2922e6-8145-4e62-8637-135082527b3f.png , http://localserviceassets.blob.core.windows.net:80/businessphoto-t/6-6920ac7d-3f88-409e-87c5-19b68eafe58f.jpg , http://localserviceassets.blob.core.windows.net:80/businessphoto-t/7-01549161-1988-4495-83d2-93948caba106.jpg , http://localserviceassets.blob.core.windows.net:80/businessphoto-t/9-641d03b8-f8c8-4f0f-aab3-67f152af264d.png , http://localserviceassets.blob.core.windows.net:80/businessphoto-m/1-d7a7aa11-ab66-4be0-836a-9ceb6c2b258c.png , http://localserviceassets.blob.core.windows.net:80/businessphoto-m/10-2b2922e6-8145-4e62-8637-135082527b3f.png , http://localserviceassets.blob.core.windows.net:80/businessphoto-m/6-6920ac7d-3f88-409e-87c5-19b68eafe58f.jpg , http://localserviceassets.blob.core.windows.net:80/businessphoto-m/7-01549161-1988-4495-83d2-93948caba106.jpg , http://localserviceassets.blob.core.windows.net:80/businessphoto-m/9-641d03b8-f8c8-4f0f-aab3-67f152af264d.png , ","Classroom Tuitions , Daily Classes , Evening Classes , Holiday Classes , Language Development Coaching , PTE Coaching , SAT Coaching , Summer Classes , TOEFL Coaching , Weekend Classes , "
