EduID,Name,Phone1,Phone2,Phone3,Phone4,Phone5,Street Address,Locality,Pincode,City,Country,Mail,Website,Person to Contact,Working Hours,Services Offered,Details,Images URL,Keywords
166332,Truematics Overseas Education Consultancy,+91 44 33054591,,,,,"No. 16/21, 2nd Floor, Cenotaph 1st Street",Teynampet,600018,trichy,India,truematics@gmail.com,http://www.pathtostudy.com,Suresh Kumar,"Monday - Friday: 10 AM - 6 PM, Saturday: 10 AM - 4 PM","Coaching & Tuitions , Mauritius Education Consultants , Overseas Engineering Education Consultants , USA Education Consultants , UK Education Consultants , Australia Education Consultants , Canada Education Consultants , New Zealand Education Consultants , Russia Education Consultants , Cyprus Education Consultants , Austria Education Consultants , Poland Education Consultants , Overseas MBA Education Consultants , PTE Coaching , Overseas Medical Education Consultants , Overseas Journalism Education Consultants , South Korea Education Consultants , France Education Consultants , Germany Education Consultants , Singapore Education Consultants , Switzerland Education Consultants , IELTS Coaching , Ukraine Education Consultants , Europe Education Consultants , Italy Education Consultants , Ireland Education Consultants , Sweden Education Consultants , Norway Education Consultants , Finland Education Consultants , Philippines Education Consultants , Malaysia Education Consultants , Armenia Education Consultants , Dubai Education Consultants , Denmark Education Consultants , China Education Consultants , ","TruematicsOverseas Education Consultancyis a leading overseas educational consultancy in India. We provide admission and visa guidance for studying in UK, Singapore, Malaysia, Ukraine and Switzerland. Truematics Consultancy Services is dedicated towards providing education consultancy services to Indian students in making educational avenues abroad accessible to them. From helping students define their goals to fulfill their chances of obtaining admission, Truematics seeks to help students at various stages of admission process. Truematics unique method of processing and guiding students to study abroad makes it very simple. Our expert counselors are very well educated, travelled across the world and enormous international exposure. These experts in our concern make truematics to be leader in abroad education consultancy services. Truematics Consulting Team, with their prior knowledge in working with foreign universities and also the requirements of Indian students can correlate and give proper higher education advice on the exact location and course to be taken up. Contact us for further details @ 9789978816.  ","http://localserviceassets.blob.core.windows.net:80/businessphoto-t/download%20(2)-5fc18fa2-e63e-4c04-857c-39def9a3bda1.jpg , http://localserviceassets.blob.core.windows.net:80/businessphoto-t/download%20(3)-9f2c69dc-ca98-43dc-84ee-393075a4bfbc.jpg , http://localserviceassets.blob.core.windows.net:80/businessphoto-t/download%20(4)-38a2187c-f369-4a42-ad11-71323454775a.jpg , http://localserviceassets.blob.core.windows.net:80/businessphoto-t/download%20(5)-d32b13b8-e059-4afb-890e-47b9793ffd9f.jpg , http://localserviceassets.blob.core.windows.net:80/businessphoto-t/images-e9ae5d2a-fdbb-4dde-818c-46d6f3200389.jpg , http://localserviceassets.blob.core.windows.net:80/businessphoto-t/images%20(1)-57e19357-5614-48f8-8eaa-a3c32193ed7b.jpg , http://localserviceassets.blob.core.windows.net:80/businessphoto-t/images%20(2)-a935a2c9-5c3c-4732-8b0f-d6ae61b5c4f3.jpg , http://localserviceassets.blob.core.windows.net:80/businessphoto-t/images%20(3)-090a0e25-890e-4b00-bf4f-29ff92589caa.jpg , http://localserviceassets.blob.core.windows.net:80/businessphoto-t/images%20(4)-11868d57-03ec-4d28-b055-f10b3611e076.jpg , http://localserviceassets.blob.core.windows.net:80/businessphoto-t/images%20(5)-b6e7abbb-04e9-4c9b-84f4-dac368244556.jpg , http://localserviceassets.blob.core.windows.net:80/businessphoto-t/images%20(6)-a1ac74ce-a964-401f-a9ed-9ebb1087c922.jpg , http://localserviceassets.blob.core.windows.net:80/businessphoto-t/images%20(7)-5cbb92d9-adf3-478b-9081-edf8bfd9fa47.jpg , http://localserviceassets.blob.core.windows.net:80/businessphoto-t/download-2b4ac8d3-9789-4c16-bd75-570135a7af5c.jpg , http://localserviceassets.blob.core.windows.net:80/businessphoto-t/download%20(1)-3031a212-ac4b-4cc9-925b-16fedaa03aa8.jpg , http://localserviceassets.blob.core.windows.net:80/businessphoto-t/download%20(2)-5df7aa14-dfbc-4cb9-a4ab-3a2d6c8a40a6.jpg , http://localserviceassets.blob.core.windows.net:80/businessphoto-t/download%20(3)-ca1fb5dd-47f5-42de-b4a2-5d4ea56b4118.jpg , http://localserviceassets.blob.core.windows.net:80/businessphoto-t/download%20(4)-4d0421c9-b096-43a0-85a6-41969aaf879a.jpg , http://localserviceassets.blob.core.windows.net:80/businessphoto-t/download%20(5)-b27ce5ea-6bb7-446f-b5f6-8f4250c0750c.jpg , http://localserviceassets.blob.core.windows.net:80/businessphoto-t/images-008deb1f-89d7-4990-aa1f-35b48640c123.jpg , http://localserviceassets.blob.core.windows.net:80/businessphoto-t/images%20(1)-56fbf725-b75e-4e02-adac-8e40efa1b398.jpg , http://localserviceassets.blob.core.windows.net:80/businessphoto-t/images%20(2)-6d2b6922-3973-4baf-a689-c285948af72b.jpg , http://localserviceassets.blob.core.windows.net:80/businessphoto-t/images%20(4)-766d7af6-719a-4b03-837a-d60b6fd3167a.jpg , http://localserviceassets.blob.core.windows.net:80/businessphoto-t/images%20(5)-57e5c693-d3e8-46d7-8ddc-f55954361756.jpg , http://localserviceassets.blob.core.windows.net:80/businessphoto-t/images%20(6)-1861c890-0ec7-496b-be18-3685ee329545.jpg , http://localserviceassets.blob.core.windows.net:80/businessphoto-t/images%20(7)-b9ed66ef-40bc-4fad-81c9-96ab886743d8.jpg , http://localserviceassets.blob.core.windows.net:80/businessphoto-m/download%20(2)-5fc18fa2-e63e-4c04-857c-39def9a3bda1.jpg , http://localserviceassets.blob.core.windows.net:80/businessphoto-m/download%20(3)-9f2c69dc-ca98-43dc-84ee-393075a4bfbc.jpg , http://localserviceassets.blob.core.windows.net:80/businessphoto-m/download%20(4)-38a2187c-f369-4a42-ad11-71323454775a.jpg , http://localserviceassets.blob.core.windows.net:80/businessphoto-m/download%20(5)-d32b13b8-e059-4afb-890e-47b9793ffd9f.jpg , http://localserviceassets.blob.core.windows.net:80/businessphoto-m/images-e9ae5d2a-fdbb-4dde-818c-46d6f3200389.jpg , http://localserviceassets.blob.core.windows.net:80/businessphoto-m/images%20(1)-57e19357-5614-48f8-8eaa-a3c32193ed7b.jpg , http://localserviceassets.blob.core.windows.net:80/businessphoto-m/images%20(2)-a935a2c9-5c3c-4732-8b0f-d6ae61b5c4f3.jpg , http://localserviceassets.blob.core.windows.net:80/businessphoto-m/images%20(3)-090a0e25-890e-4b00-bf4f-29ff92589caa.jpg , http://localserviceassets.blob.core.windows.net:80/businessphoto-m/images%20(4)-11868d57-03ec-4d28-b055-f10b3611e076.jpg , http://localserviceassets.blob.core.windows.net:80/businessphoto-m/images%20(5)-b6e7abbb-04e9-4c9b-84f4-dac368244556.jpg , http://localserviceassets.blob.core.windows.net:80/businessphoto-m/images%20(6)-a1ac74ce-a964-401f-a9ed-9ebb1087c922.jpg , http://localserviceassets.blob.core.windows.net:80/businessphoto-m/images%20(7)-5cbb92d9-adf3-478b-9081-edf8bfd9fa47.jpg , http://localserviceassets.blob.core.windows.net:80/businessphoto-m/download-2b4ac8d3-9789-4c16-bd75-570135a7af5c.jpg , http://localserviceassets.blob.core.windows.net:80/businessphoto-m/download%20(1)-3031a212-ac4b-4cc9-925b-16fedaa03aa8.jpg , http://localserviceassets.blob.core.windows.net:80/businessphoto-m/download%20(2)-5df7aa14-dfbc-4cb9-a4ab-3a2d6c8a40a6.jpg , http://localserviceassets.blob.core.windows.net:80/businessphoto-m/download%20(3)-ca1fb5dd-47f5-42de-b4a2-5d4ea56b4118.jpg , http://localserviceassets.blob.core.windows.net:80/businessphoto-m/download%20(4)-4d0421c9-b096-43a0-85a6-41969aaf879a.jpg , http://localserviceassets.blob.core.windows.net:80/businessphoto-m/download%20(5)-b27ce5ea-6bb7-446f-b5f6-8f4250c0750c.jpg , http://localserviceassets.blob.core.windows.net:80/businessphoto-m/images-008deb1f-89d7-4990-aa1f-35b48640c123.jpg , http://localserviceassets.blob.core.windows.net:80/businessphoto-m/images%20(1)-56fbf725-b75e-4e02-adac-8e40efa1b398.jpg , http://localserviceassets.blob.core.windows.net:80/businessphoto-m/images%20(2)-6d2b6922-3973-4baf-a689-c285948af72b.jpg , http://localserviceassets.blob.core.windows.net:80/businessphoto-m/images%20(4)-766d7af6-719a-4b03-837a-d60b6fd3167a.jpg , http://localserviceassets.blob.core.windows.net:80/businessphoto-m/images%20(5)-57e5c693-d3e8-46d7-8ddc-f55954361756.jpg , http://localserviceassets.blob.core.windows.net:80/businessphoto-m/images%20(6)-1861c890-0ec7-496b-be18-3685ee329545.jpg , http://localserviceassets.blob.core.windows.net:80/businessphoto-m/images%20(7)-b9ed66ef-40bc-4fad-81c9-96ab886743d8.jpg , ","Aeronautical Engineering , Bank Loan Assistance , College Applications , Counselling Overseas Education , Course Counseling , Cyprus Education Consultants , Denmark Education Consultants , Dubai Education Consultants , Europe Education Consultants , Finland Education Consultants , France Education Consultants , Germany Education Consultants , IELTS Coaching , International Business , Ireland Education Consultants , Italy Education Consultants , Malaysia Education Consultants , Mauritius Education Consultants , Medicine , New Zealand Education Consultants , Norway Education Consultants , Overseas Engineering Education Consultants , Overseas Journalism Education Consultants , Overseas MBA Education Consultants , Overseas Medical Education Consultants , Philippines Education Consultants , Poland Education Consultants , PTE Coaching , Russia Education Consultants , Singapore Education Consultants , South Korea Education Consultants , Sweden Education Consultants , Switzerland Education Consultants , UK Education Consultants , Ukraine Education Consultants , USA Education Consultants , Visa Applications , "
166333,3i Infosoft Pvt. Ltd.,0431 - 4250502, 9442772142,,,,2nd Floor,Chathiram,620002,trichy,India,3iinfosoftmail@gmail.com,,,Monday - Saturday: 10 AM - 8 PM,"Coaching & Tuitions , Programming Languages Training , Software Tools Training , Web Technologies Training , C, C++ Training , MS Office Training , IT Recruitment Consultants , .Net Training , Java & J2EE Training , Spoken English Classes , ",,,"C, C++ Training , Industrial Automation Job Consultancies , "
166334,Everonn World,0431 - 2742477,,,,,,Thillai Nagar,620018,trichy,India,s.nivedita@everonnworld.com,http://www.everonnworld.com,Nivedita,All days: 9:00 am - 9:00 pm,"Distance Education , Coaching & Tuitions , Big Data Analytics Online Training , R Analytics Online Training , M.B.A. Distance Education , USA Education Consultants , UK Education Consultants , Australia Education Consultants , Canada Education Consultants , France Education Consultants , Germany Education Consultants , CAT Coaching , Spoken English Classes , Singapore Education Consultants , Switzerland Education Consultants , Europe Education Consultants , Italy Education Consultants , IIT HSEE Coaching , AIEEE Coaching , AIPMT Coaching , Sweden Education Consultants , IIT-JEE Coaching , National Talent Search Exam (NTSE) Coaching , All India Common Entrance Examination (AICEE) Coaching , ",Everonn has brought the best education to over 80 lakhs student from 27 states across India. Everonn is focus on providing 100% learning. Everonn world makes learning interesting and memorable. Everonn uses advanced technology that enhances access to the best teacher in the nation. Its knowledge resource teams ensure course content stays job-specific. While updated multi-media and online content take you beyond the textbox to prepare you for success in the real world  ,,"CAT Coaching , Europe Education Consultants , France Education Consultants , Germany Education Consultants , IIT HSEE Coaching , IIT-JEE Coaching , Italy Education Consultants , M.B.A. Distance Education , National Talent Search Exam (NTSE) Coaching , R Analytics Online Training , Singapore Education Consultants , Spoken English Classes , Sweden Education Consultants , Switzerland Education Consultants , UK Education Consultants , USA Education Consultants , "
166335,T.E.S.,0471 - 2444402, 9387839871,,,,"67, Vrindavan Gardens, Pattam, Trivandrum -695004",,,trichy,India,vallaths.tes@gmail.com,http://www.vallathstes.co.in,Kalyani Vallath,All days: 10:00 am - 4:00 pm,"UGC Net Coaching , UGC Net Management Coaching , UGC Net HR Coaching , UGC Net Commerce Coaching , CSIR UGC Net Exam Coaching , UGC Net Economics Coaching , UGC Net History Coaching , ","&nbsp;A complete in-depth free counseling on one to one basis for students to chart out their career path for education abroad, right from institution selection to taking the flight. We are one of the best Institutes providing Training for UGC NET &amp; JRF, SET/SLET, Commonwealth Literature, British Literature, American Literature, Indian Writing in English, Structuralism, Poststructuralism, Postmodernism, Postcolonialism, Ecocriticism, ELT, Personality Development &amp; Public Speaking, Lectureship Exam, English Literature, Civil Service English Main, Interview Training and Soft Skill Training. Kindly contact us for further details.  ",,
166336,TIME,0431 - 3299097,,,,,2nd Floor,Thillai Nagar,620018,trichy,India,,http://www.time4education.com,,,"CAT Coaching , CBSE Tuitions for Maths , CBSE Tuitions for Physics , CBSE Tuitions for Chemistry , Aptitude Training , ",,,
166337,Intraword,0265 - 3067199, 0265 - 3074883, 9016527086, 9723815238,,"No. 136, VIP Road",Karelibaug,390018,trichy,India,info@intraword.com,http://www.intraword.com,Vikash Jha,Monday - Sunday: 8.30 AM - 8 PM,"Translators & Interpreters , Spoken English Classes , German Language Translators , Spanish Language Translators , French Language Translators , Italian Language Translators , Chinese Language Translators , Japanese Language Translators , Russian Translators , Tamil Language Translators , Portuguese Language Translators , Korean Language Translators , Dutch Language Translators , Malaysian Language Translators , IELTS Coaching , English Language Translators , Hindi Language Translators , Arabic Language Translators , Marathi Translators , Sanskrit Translations , Gujarati Language Translators , Oriya Language Translators , Nepali Language Translators , Bengali Language Translators , Urdu Language Translators , Malayalam Language Translators , Telugu Language Translators , Punjabi Language Translators , Kannada Language Translators , ","Intraword, a comprehensive language services provider company, is specialized in various aspects of language services like Foreign language training, translation, interpretation, English and soft skill training and Market research. With unique and innovative services coupled with dynamic and dedicated team, we at Intraword aimed to help every individual and corporate organization to develop their language skill and personality.We offer enormous services like foreign language training, Translation, Interpretation, soft skill training and market research to enhance your skill to achieve great height in career or to improve business expansion. Knowing more language and outstanding personal skill can bring infinite opportunity to start or advancement of your present career.Owing to long years of experience, perfect hiring of instructor, their dedication, we offers competent and professional language training along with translation, interpreter, soft skill training and market research services to our learners. The atmosphere at Intraword is absolutely relaxing, calming and work oriented. Our sincere, motivated and talented instructors put their every feasible effort to teach their learner in an exceptional way. They have come from varied background whose experience is channeled into conferring innovative and excellent services.In our foreign language training programs, students develop their skills in listening, speaking, reading and writing in their language of choice in a proficient manner. We serve language training and interpreter services for all popular international languages like French, Chinese, German, Italian, Spanish, Portuguese and etc.Translation services in Vadodara are designed for all International and regional languages. This engages the learners in the global exchange of ideas and facilitates intercultural communication.Besides offering complete banquet of language services, we also offer soft skill services in order to improve your personality building. Personality development is an important to enhance your talent to face the world of challenge.Our soft skill training programs includes services like Personality Development, Self Development, Anger Management, Self Confidence, Communication skill, Conflict resolution, Thinking & problem solving skill, Leadership skills, Time Management, and many more. Another service of Market research has also been added to our organization to offer authentic and accurate research services to the organization.  ","http://yellowpages.sulekha.com/photos/2938603/Image1.jpg , http://yellowpages.sulekha.com/photos/2938603/Image2.jpg , http://yellowpages.sulekha.com/photos/2938603/Image3.jpg , http://yellowpages.sulekha.com/photos/2938603/Image4.jpg , http://yellowpages.sulekha.com/photos/2938603/Image5.jpg , http://yellowpages.sulekha.com/photos/2938603/Image1.jpg , http://yellowpages.sulekha.com/photos/2938603/Image2.jpg , http://yellowpages.sulekha.com/photos/2938603/Image3.jpg , http://yellowpages.sulekha.com/photos/2938603/Image4.jpg , http://yellowpages.sulekha.com/photos/2938603/Image5.jpg , ","French Language Translators , German Language Translators , Gujarati Language Translators , Hindi Language Translators , IELTS Coaching , Italian Language Translators , Japanese Language Translators , Kannada Language Translators , Korean Language Translators , Malayalam Language Translators , Malaysian Language Translators , Marathi Translators , Nepali Language Translators , Oriya Language Translators , Portuguese Language Translators , Punjabi Language Translators , Russian Translators , Sanskrit Translations , Spanish Language Translators , Spoken English Classes , Tamil Language Translators , Telugu Language Translators , Urdu Language Translators , "
166338,Gateforum Educational Services Pvt. Ltd.,0431 - 4542013, 7667369058, 8608946145,,,No. 112/C,Thillai Nagar,620018,trichy,India,trichy@gateforum.com,http://www.gateforum.com,,,"GATE Coaching , GATE Biotechnology Coaching , GATE Civil Engineering Coaching , GATE Chemical Engineering Coaching , GATE Computer Science Coaching , GATE Chemistry Coaching , GATE Mathematics Coaching , GATE Physics Coaching , GATE Electronics Engineering Coaching , GATE Electrical Engineering Coaching , GATE Instrumental Engineering Coaching , GATE Mechanical Engineering Coaching , GATE Production Engineering Coaching , GATE Industrial Engineering Coaching , GATE Coaching for Other Subjects , Chartered Accountant Coaching , IES Coaching , ",,,"GATE Coaching for Other Subjects , GATE Computer Science Coaching , GATE Electrical Engineering Coaching , GATE Electronics Engineering Coaching , GATE Industrial Engineering Coaching , GATE Instrumental Engineering Coaching , GATE Mathematics Coaching , GATE Mechanical Engineering Coaching , GATE Physics Coaching , GATE Production Engineering Coaching , IES Coaching , "
166339,Achievers Training Academy,0431 - 2406060,,,,,No. 3,Subramaniyapuram,620020,trichy,India,,,,,"Coaching & Tuitions , Job Training , Bharatanatiyam Dance Classes , Tailoring Classes , Spoken English Classes , Spoken Hindi Classes , ",,,
166340,IMS Learning Resource Pvt. Ltd.,0431 - 2742002, 0431 - 2742003,,,,"No. A-6, 2nd Floor",Thillai Nagar,620018,trichy,India,,,,,"MBA & BBA Coaching , ",,,
166341,Veta,9364377770,,,,,"No.14/2, 1st Floor",Manapparai,621306,trichy,India,info@vetaglobal.com,http://www.veta.in,Arumugam,Monday - Saturday: 9.30 AM - 6 PM,"Corporate Training Providers , Spoken English Classes , Corporate Communication Skills Training , ",,,
166342,SRM Gateway,0431 - 4210350, 9942222222,,,,"No. 75-C, 1st Floor",Tiruchirapalli,620018,trichy,India,,http://www.srmgateway.com,,Monday - Saturday: 10 AM - 8.30 PM,"School Tuitions for Math, Physics, Chemistry , School Tuitions for Accounts, Finance, Statistics , School Tuitions for All Subjects , Medical Entrance Coaching , 10th STD Tuitions , 9th STD Tuitions , School Tuitions for Biology , ",,,"Below Rs.1000 , Daily Classes , Medical Entrance Coaching , School Tuitions for Math, Physics, Chemistry , Short Term , "
166343,Wisdom Maths Academy,9841744146, 9842444146,,,,No. 65,Samayapuram,621112,trichy,India,denniskmr@yahoo.co.in,,Dennis,Monday - Sunday: 9 AM - 9 PM,"Tuitions for College Subjects , School Tuitions for All Subjects , Handwriting, Spelling & Reading Classes , 2nd Year PUC Coaching , 1st Year PUC Coaching , 10th STD Tuitions , 9th STD Tuitions , ",,,"1 Year Program , Daily Classes , Evening Classes , Rs.1000-Rs.5000 , School Tuitions for All Subjects , Summer Classes , Tuitions for College Subjects , Weekend Classes , "
166344,Viswa School of Banking,7402587727,,,,,No. 6,Thillai Nagar,620018,trichy,India,viswaschoolofbanking@gmail.com,http://www.gklab.info,Ramamoorthy,Monday - Sunday: 10 AM - 8 PM,"Banking Tuitions , TANCET Entrance Coaching , TNPSC Entrance Coaching , ","We believe that through continued and dedicated training we can create highly motivated and committed individuals who have the desire to excel. We aim to train students to make them highly competitive and achievers in all spheres of life. We provide coaching such as Banking tuitions, RRB Entrance Exam Coaching, TNPSC Entrance Coaching and SSC Entrance Exam Coaching. Contact us for more details.  ",,
166345,Storm Overseas Education Group,9600089999,,,,,"No. 174, 10th Cross West",Thillai Nagar,620002,trichy,India,trichy@scsedu.com,http://www.stormgroup.in,Ganesh Kumar,Monday - Saturday: 9.30 AM - 6.30 PM,"Coaching & Tuitions , Big Data Analytics Online Training , R Analytics Online Training , USA Education Consultants , UK Education Consultants , Australia Education Consultants , Canada Education Consultants , New Zealand Education Consultants , Russia Education Consultants , Cyprus Education Consultants , Austria Education Consultants , Poland Education Consultants , France Education Consultants , Germany Education Consultants , Singapore Education Consultants , Switzerland Education Consultants , IELTS Coaching , TOEFL Coaching , Ukraine Education Consultants , Europe Education Consultants , Italy Education Consultants , Ireland Education Consultants , Sweden Education Consultants , Norway Education Consultants , Finland Education Consultants , Philippines Education Consultants , Malaysia Education Consultants , Armenia Education Consultants , Dubai Education Consultants , Denmark Education Consultants , China Education Consultants , ","Established in 2003, Storm Group is one of the most successful international student recruitment companies in the India today. With over 35+ branches we have one of the largest networks of company owned offices all across India. We also provide IELTS & TOEFL Coaching.
We represent over 250 leading education institutions around the world. We offer end to end services to students; right from identifying the right course to the right destination. We have been instrumental in helping many students realize their dream of studying abroad come true.  ","http://localserviceassets.blob.core.windows.net:80/businessphoto-t/banner5-d044c3ea-5647-44af-a258-967374f1219b.jpg , http://localserviceassets.blob.core.windows.net:80/businessphoto-t/logo-new-eeabfb1f-0137-4652-aece-e64885f7b385.png , http://localserviceassets.blob.core.windows.net:80/businessphoto-m/banner5-d044c3ea-5647-44af-a258-967374f1219b.jpg , http://localserviceassets.blob.core.windows.net:80/businessphoto-m/logo-new-eeabfb1f-0137-4652-aece-e64885f7b385.png , ","Cyprus Education Consultants , Denmark Education Consultants , Dubai Education Consultants , Europe Education Consultants , Finland Education Consultants , France Education Consultants , Germany Education Consultants , IELTS Coaching , Ireland Education Consultants , Italy Education Consultants , Malaysia Education Consultants , New Zealand Education Consultants , Norway Education Consultants , Philippines Education Consultants , Poland Education Consultants , R Analytics Online Training , Russia Education Consultants , Singapore Education Consultants , Sweden Education Consultants , Switzerland Education Consultants , TOEFL Coaching , UK Education Consultants , Ukraine Education Consultants , USA Education Consultants , "
