EduID,Name,Phone1,Phone2,Phone3,Phone4,Phone5,Street Address,Locality,Pincode,City,Country,Mail,Website,Person to Contact,Working Hours,Services Offered,Details,Images URL,Keywords
166286,"IDEAS - Institute to Develop English, Attitude and Soft Skills",7305881072, 9487581072,,,,"No. 4, 1st Floor, All Saints Jubilee Complex",Puthur,620017,trichy,India,training@ideastrichy.com,http://www.ideastrichy.com,Ruby Stephen/Julie,Monday - Sunday: 9.30 AM - 8 PM,"IPS Entrance Exam Coaching , SSC Entrance Exam Coaching , RRB Entrance Exam Coaching , IBPS Bank Interview Coaching , IIT Engineering Entrance Coaching , IAS Entrance Coaching , School Tuitions for Math, Physics, Chemistry , School Tuitions for All Subjects , Spoken English Classes , Banking Tuitions , IELTS Coaching , TOEFL Coaching , Placement Training , Aptitude Training , TNPSC Entrance Coaching , ","IDEAS - Institute to Develop English, Attitude and Soft skills)have vast experience in the field. We provide Training for Financial Modelling, Technical Analysis, Stock Market Training, CFA- Chartered Financial Analyst and Derivative Training. All our faculties are highly qualified and experiences persons. For more details kindly contact us.  ","http://localserviceassets.blob.core.windows.net:80/businessphoto-t/21-12-2015%2014-28-03-9e712238-aeef-4275-accf-4d1d15a9640e.png , http://localserviceassets.blob.core.windows.net:80/businessphoto-t/21-12-2015%2014-28-18-e1e9c512-51e7-4f44-a5a8-2f5542ddaf2b.png , http://localserviceassets.blob.core.windows.net:80/businessphoto-t/21-12-2015%2014-28-34-6592dd30-bcd3-4883-9df2-1c9b077fda56.png , http://localserviceassets.blob.core.windows.net:80/businessphoto-t/21-12-2015%2014-28-45-9ea84746-63d3-4b69-830c-5e35e655390a.png , http://localserviceassets.blob.core.windows.net:80/businessphoto-t/21-12-2015%2014-29-32-40f6c7ee-8b15-4017-9f9d-aefe4e0085c0.png , http://localserviceassets.blob.core.windows.net:80/businessphoto-t/21-12-2015%2014-29-51-987ccdcd-fdd2-4747-a6a6-3148603d2cce.png , http://localserviceassets.blob.core.windows.net:80/businessphoto-m/21-12-2015%2014-28-03-9e712238-aeef-4275-accf-4d1d15a9640e.png , http://localserviceassets.blob.core.windows.net:80/businessphoto-m/21-12-2015%2014-28-18-e1e9c512-51e7-4f44-a5a8-2f5542ddaf2b.png , http://localserviceassets.blob.core.windows.net:80/businessphoto-m/21-12-2015%2014-28-34-6592dd30-bcd3-4883-9df2-1c9b077fda56.png , http://localserviceassets.blob.core.windows.net:80/businessphoto-m/21-12-2015%2014-28-45-9ea84746-63d3-4b69-830c-5e35e655390a.png , http://localserviceassets.blob.core.windows.net:80/businessphoto-m/21-12-2015%2014-29-32-40f6c7ee-8b15-4017-9f9d-aefe4e0085c0.png , http://localserviceassets.blob.core.windows.net:80/businessphoto-m/21-12-2015%2014-29-51-987ccdcd-fdd2-4747-a6a6-3148603d2cce.png , ","Aptitude Training , Banking Tuitions , Classroom Tuitions , Daily Classes , Evening Classes , Placement Training , RRB Entrance Exam Coaching , School Tuitions for All Subjects , School Tuitions for Math, Physics, Chemistry , Spoken English Classes , SSC Entrance Exam Coaching , TNPSC Entrance Coaching , TOEFL Coaching , "
166287,Aspire Educational Hub,9043362862, 9486169068,,,,"No. 6, Jailania Main Street",Subramaniyapuram,620020,trichy,India,mohanraajan@gmail.com,http://www.aspiretrichy.com,Mohan Rajan,Monday - Sunday: 6 AM - 9 PM,"Engineering Tuitions , Mechanical Engineering Tuitions , Aerospace Engineering Tuitions , Biomedical Engineering Tuitions , Biomechanical Engineering Tuitions , Automotive Engineering Tuitions , Civil Engineering Tuitions , Architectural Engineering Tuitions , Electrical Engineering Tuitions , IT & Computer Science Engineering Tuitions , SSC Entrance Exam Coaching , RRB Entrance Exam Coaching , Robotics Engineering Tuitions , Microelectronic Engineering Tuitions , Computer Science Tuitions (11th & 12th STD) , Chemical Engineering Tuitions , Environmental Engineering Tuitions , Materials Science Engineering Tuitions , Physics Tuitions (11th & 12th) , Agricultural Engineering Tuitions , Marine Engineering Tuitions , CACPT Coaching , Common Management Aptitude Test (CMAT) Coaching , Equity Research Coaching , Engineering Tuitions - Other Branches , Engineering Physics Tuitions , Biotechnology Engineering Tuitions , UPSC Coaching , Commerce Tuitions (11th & 12th STD) , Genetic Engineering Tuitions , Engineering Chemistry Tuitions , Mechatronics Engineering Tuitions , Software Engineering Tuitions , CS Coaching , Electronics & Communication Engineering Tuitions , Instrumentation Technology Engineering Tuitions , NEET Entrance Coaching , Telecommunication Engineering Tuitions , Industrial & Production Engineering Tuitions , Engineering Maths Tuitions , IBPS Bank Interview Coaching , Medical EAMCET Coaching , CAT Coaching , IIT Engineering Entrance Coaching , School Tuitions for Math, Physics, Chemistry , School Tuitions for Accounts, Finance, Statistics , School Tuitions for All Subjects , Spoken English Classes , B.B.A. Entrance Show less  , ","Aspire Educational Hub are customer oriented & strongly believe in building a relationship based on trust with our customers. With an aim to capture customer loyalty through great value and exceptional performance, we believe in developing and maintaining lasting relationships with our customers by providing outstanding services. We are in touch with our customers through quality, performance, service and assistance. Contact us for further details.  ","http://localserviceassets.blob.core.windows.net:80/businessphoto-t/2-850563ba-105f-4b59-ae78-bf00d859a4db.jpg , http://localserviceassets.blob.core.windows.net:80/businessphoto-t/3-577c595c-67d0-4bc3-a1c9-a60c31b26238.jpg , http://localserviceassets.blob.core.windows.net:80/businessphoto-t/4-1df2626b-0a58-4bbc-9471-0dd44a48e65b.jpg , http://localserviceassets.blob.core.windows.net:80/businessphoto-t/5-ca884785-35cb-46b5-b9c3-3928147f0b7a.jpg , http://localserviceassets.blob.core.windows.net:80/businessphoto-t/AspireEH-1-c03f6003-86f0-43f0-bf56-e00a2b3ba9a2.jpg , http://localserviceassets.blob.core.windows.net:80/businessphoto-t/Pic-1-bfa4d76c-369b-4c86-9a09-2b426939a6bb.jpg , http://localserviceassets.blob.core.windows.net:80/businessphoto-t/Pic-2-d3313a26-0c7e-43ba-b1a2-77afb2786bcd.jpg , http://localserviceassets.blob.core.windows.net:80/businessphoto-t/Pic-3-58697916-7bec-4c55-b72d-db98413830b8.jpg , http://localserviceassets.blob.core.windows.net:80/businessphoto-t/Pic-4-fb51bfc5-b4ed-4010-88a4-fd2a43655c01.jpg , http://localserviceassets.blob.core.windows.net:80/businessphoto-t/Pic-5-e9803f19-df78-4907-b390-6c21ddd3af63.jpg , http://localserviceassets.blob.core.windows.net:80/businessphoto-t/Pic-6-064c2ad9-267d-4078-a7d4-eb3f9c4d82a4.jpg , http://localserviceassets.blob.core.windows.net:80/businessphoto-m/2-850563ba-105f-4b59-ae78-bf00d859a4db.jpg , http://localserviceassets.blob.core.windows.net:80/businessphoto-m/3-577c595c-67d0-4bc3-a1c9-a60c31b26238.jpg , http://localserviceassets.blob.core.windows.net:80/businessphoto-m/4-1df2626b-0a58-4bbc-9471-0dd44a48e65b.jpg , http://localserviceassets.blob.core.windows.net:80/businessphoto-m/5-ca884785-35cb-46b5-b9c3-3928147f0b7a.jpg , http://localserviceassets.blob.core.windows.net:80/businessphoto-m/AspireEH-1-c03f6003-86f0-43f0-bf56-e00a2b3ba9a2.jpg , http://localserviceassets.blob.core.windows.net:80/businessphoto-m/Pic-1-bfa4d76c-369b-4c86-9a09-2b426939a6bb.jpg , http://localserviceassets.blob.core.windows.net:80/businessphoto-m/Pic-2-d3313a26-0c7e-43ba-b1a2-77afb2786bcd.jpg , http://localserviceassets.blob.core.windows.net:80/businessphoto-m/Pic-3-58697916-7bec-4c55-b72d-db98413830b8.jpg , http://localserviceassets.blob.core.windows.net:80/businessphoto-m/Pic-4-fb51bfc5-b4ed-4010-88a4-fd2a43655c01.jpg , http://localserviceassets.blob.core.windows.net:80/businessphoto-m/Pic-5-e9803f19-df78-4907-b390-6c21ddd3af63.jpg , http://localserviceassets.blob.core.windows.net:80/businessphoto-m/Pic-6-064c2ad9-267d-4078-a7d4-eb3f9c4d82a4.jpg , ","1 Month Program , 1 Week Program , 1 Year Program , 10th STD Tuitions , 1st Year PUC Coaching , 2 Weeks Programs , 2nd Year PUC Coaching , 3 Months Program , 6 Months Program , AIEEE Coaching , AIPMT Coaching , All India Common Entrance Examination (AICEE) Coaching , Aptitude Training , Architectural Engineering Tuitions , Architecture Entrance Coaching , Automotive Engineering Tuitions , B.Arch Coaching Classes , B.B.A. Entrance Coaching , Banking Tuitions , Below Rs.1000 , Biomechanical Engineering Tuitions , Biomedical Engineering Tuitions , Biotechnology Engineering Tuitions , BSC Entrance Exam Coaching , CACPT Coaching , CAT Coaching , CBSE Tuitions for Chemistry , CBSE Tuitions for Maths , CBSE Tuitions for Physics , Chartered Accountant Coaching , Chartered Financial Analyst (CFA) Coaching , Chemical Engineering Tuitions , Civil Engineering Tuitions , Classroom Tuitions , College Tuitions for Chemistry , College Tuitions for Maths , College Tuitions for Physics , Commerce Tuitions (11th & 12th STD) , Common Management Aptitude Test (CMAT) Coaching , Computer Science Tuitions (11th & 12th STD) , CS Coaching , Daily Classes , Economics Coaching Classes (11th & 12th STD) , Electrical Engineering Tuitions , Electronics & Communication Engineering Tuitions , Engineering Chemistry Tuitions , Engineering Maths Tuitions , Engineering Physics Tuitions , Engineering Tuitions - Other Branches , Environmental Engineering Tuitions , Equity Research Coaching , Evening Classes , Fashion Design Entrance Coaching , Genetic Engineering Tuitions , GMAT Coaching , GRE Coaching , Handwriting, Spelling & Reading Classes , Holiday Classes , Hotel Management Entrance Coaching , IBPS Bank Exam Coaching , IBPS Bank Interview Coaching , IELTS Coaching , IGCSE Accounts 11th & 12th , IGCSE Business Studies 11th & 12th , IGCSE Economics 11th & 12th , IIT Engineering Entrance Coaching , IIT-JEE Coaching , Industrial & Production Engineering Tuitions , Instrumentation Technology Engineering Tuitions , Insurance Exam Coaching , ISC Tuitions for 11th & 12th , IT & Computer Science Engineering Tuitions , JEE Advanced Coaching , Marine Engineering Tuitions , MAT coaching , Materials Science Engineering Tuitions , MBA & BBA Coaching , MBA in IT Coaching , Mechanical Engineering Tuitions , Mechatronics Engineering Tuitions , Medical EAMCET Coaching , Medical Entrance Coaching , Microelectronic Engineering Tuitions , More than Rs.20000 , NATA Coaching , NCHMCT JEE Coaching , NEET Entrance Coaching , NIFT/NID/CEED/FDDI Training , Online Tuitions , Physics Tuitions (11th & 12th) , Pre-Medical Test (PMT) Entrance Coaching , PSAT Exam Coaching , Robotics Engineering Tuitions , RRB Entrance Exam Coaching , Rs.10000-Rs.20000 , Rs.1000-Rs.5000 , Rs.5000-Rs.10000 , SAT Coaching , School Tuitions for Accounts, Finance, Statistics , School Tuitions for All Subjects , School Tuitions for Math, Physics, Chemistry , Short Term , Software Engineering Tuitions , Spoken English Classes , Spoken Hindi Classes , SSB & NDA Coaching , SSC Entrance Exam Coaching , SSC JE Entrance Coaching , Summer Classes , TANCET Entrance Coaching , Telecommunication Engineering Tuitions , TNPSC Entrance Coaching , TOEFL Coaching , UPSC Coaching , Weekend Classes , "
166288,Wisdom Math Tuition Centre,9787886665,,,,,"No. 65, North Andar Street, chathram bus stand.",Teppakulam,620002,trichy,India,wisdommathtuition@gmail.com,,Subramani,Sunday - Saturday: 06.00 AM - 09.33 PM,"Home & Private Tuitions , GATE Coaching , Engineering Tuitions , Mechanical Engineering Tuitions , Home Tutors for Class VI-X , BE Home Tuitions , Civil Engineering Tuitions , Electrical Engineering Tuitions , IT & Computer Science Engineering Tuitions , Robotics Engineering Tuitions , Physics Home Tuitions for school , GATE Mechanical Engineering Coaching , Chemical Engineering Tuitions , Physics Tuitions (11th & 12th) , Maths Home Tuitions for school , Engineering Physics Tuitions , Engineering Chemistry Tuitions , Mechatronics Engineering Tuitions , Electronics & Communication Engineering Tuitions , Engineering Maths Tuitions , Diploma in IT Engineering , Diploma in Mechanical Engineering , Physics Home Tuitions 11th & 12th , Maths Home Tuitions 11th & 12th , Engineering Graphics Tuitions , Tuitions for College Subjects , School Tuitions for Math, Physics, Chemistry , School Tuitions for All Subjects , Banking Tuitions , Chemistry Tuitions (11th & 12th) , Biology Tuitions (11th & 12th) , Advanced Level (A-Level) Physics Tuitions , CBSE Tuitions for Maths , CBSE Tuitions for Physics , CBSE Tuitions for Chemistry , College Tuitions for Maths , College Tuitions for Physics , Aptitude Training , ICSE Maths Tuitions , ICSE Physics Tuitions , ICSE Chemistry Tuitions , ICSE Biology Tuitions , AIEEE Coaching , 10th STD Tuitions , JEE Advanced Coaching , Maths Tuitions 11th &12th , 9th STD Tuitions , ",,"http://localserviceassets.blob.core.windows.net:80/businessphoto-t/3764-6c3457f7-96bb-47bd-bc8d-192cbd9b03dd.jpg , http://localserviceassets.blob.core.windows.net:80/businessphoto-t/6448-35dca644-f57b-42ee-969e-b71673142811.jpg , http://localserviceassets.blob.core.windows.net:80/businessphoto-m/3764-6c3457f7-96bb-47bd-bc8d-192cbd9b03dd.jpg , http://localserviceassets.blob.core.windows.net:80/businessphoto-m/6448-35dca644-f57b-42ee-969e-b71673142811.jpg , ","Banking Tuitions , BE Home Tuitions , Biology Tuitions (11th & 12th) , CBSE Tuitions for Chemistry , CBSE Tuitions for Maths , CBSE Tuitions for Physics , Chemical Engineering Tuitions , Chemistry Tuitions (11th & 12th) , Civil Engineering Tuitions , Classroom Tuitions , College Tuitions for Maths , College Tuitions for Physics , Daily Classes , Diploma in IT Engineering , Diploma in Mechanical Engineering , Electrical Engineering Tuitions , Electronics & Communication Engineering Tuitions , Engineering Chemistry Tuitions , Engineering Graphics Tuitions , Engineering Maths Tuitions , Engineering Physics Tuitions , Evening Classes , GATE Mechanical Engineering Coaching , Home Tutors for Class VI-X , ICSE Biology Tuitions , ICSE Chemistry Tuitions , ICSE Maths Tuitions , ICSE Physics Tuitions , IT & Computer Science Engineering Tuitions , JEE Advanced Coaching , Maths Home Tuitions 11th & 12th , Maths Home Tuitions for school , Maths Tuitions 11th &12th , Mechanical Engineering Tuitions , Mechatronics Engineering Tuitions , Physics Home Tuitions 11th & 12th , Physics Home Tuitions for school , Physics Tuitions (11th & 12th) , Robotics Engineering Tuitions , School Tuitions for All Subjects , School Tuitions for Math, Physics, Chemistry , Short Term , Tuitions for College Subjects , "
166289,Tayal Institute Pvt. Ltd.,+91 22 49432704,,,,,"No. 403, D- Definity, JP Nagar, Road No. 1",Goregaon East,400062,trichy,India,sales@tayalinstitute.com,http://www.tayalsirvod.com,Rajesh Tayal,Monday - Sunday: 9 AM - 7 PM,"CS Coaching , CMA Coaching , Chartered Accountant Coaching , Chartered Financial Analyst (CFA) Coaching , ","Tayal Institute Private Limited is the first institute in India to provide coaching exclusively to CA Final students only. Another first for us is to give a choice to the students for selecting the subject they want to do with us instead of forcing them to join.The institute was founded by CS Prof. Rajesh Tayal, in the year 2004 and since then it has recorded growth year over years. Every time some of our students are placed in merit list.Our courses are built in partnership with technology leaders and are relevant to industry needs.  ","http://localserviceassets.blob.core.windows.net:80/businessphoto-t/12-11-2015%2012-55-43-f84c93fa-fd98-4134-9c4f-9b3abdf442c6.png , http://localserviceassets.blob.core.windows.net:80/businessphoto-t/12-11-2015%2012-55-52-407ad4c4-b749-4039-add0-bb8165549e5a.png , http://localserviceassets.blob.core.windows.net:80/businessphoto-t/12-11-2015%2012-55-58-5bd41ed0-3d4e-4bd7-bf24-edcf6d120f4c.png , http://localserviceassets.blob.core.windows.net:80/businessphoto-t/12-11-2015%2012-56-05-c39d720b-a59f-4dc2-b185-a2213d696199.png , http://localserviceassets.blob.core.windows.net:80/businessphoto-t/12-11-2015%2012-56-12-1a590e8e-38a2-4af7-82af-0375c4b4bc77.png , http://localserviceassets.blob.core.windows.net:80/businessphoto-t/12-11-2015%2012-56-19-7a1e10da-8ed1-4df1-a576-3d5090ca7c55.png , http://localserviceassets.blob.core.windows.net:80/businessphoto-t/12-11-2015%2012-56-26-f2c2731b-b550-427a-be55-4682b4e86802.png , http://localserviceassets.blob.core.windows.net:80/businessphoto-t/12-11-2015%2012-56-38-61214f67-4aa2-415e-9754-d8efcd3d00ec.png , http://localserviceassets.blob.core.windows.net:80/businessphoto-m/12-11-2015%2012-55-43-f84c93fa-fd98-4134-9c4f-9b3abdf442c6.png , http://localserviceassets.blob.core.windows.net:80/businessphoto-m/12-11-2015%2012-55-52-407ad4c4-b749-4039-add0-bb8165549e5a.png , http://localserviceassets.blob.core.windows.net:80/businessphoto-m/12-11-2015%2012-55-58-5bd41ed0-3d4e-4bd7-bf24-edcf6d120f4c.png , http://localserviceassets.blob.core.windows.net:80/businessphoto-m/12-11-2015%2012-56-05-c39d720b-a59f-4dc2-b185-a2213d696199.png , http://localserviceassets.blob.core.windows.net:80/businessphoto-m/12-11-2015%2012-56-12-1a590e8e-38a2-4af7-82af-0375c4b4bc77.png , http://localserviceassets.blob.core.windows.net:80/businessphoto-m/12-11-2015%2012-56-19-7a1e10da-8ed1-4df1-a576-3d5090ca7c55.png , http://localserviceassets.blob.core.windows.net:80/businessphoto-m/12-11-2015%2012-56-26-f2c2731b-b550-427a-be55-4682b4e86802.png , http://localserviceassets.blob.core.windows.net:80/businessphoto-m/12-11-2015%2012-56-38-61214f67-4aa2-415e-9754-d8efcd3d00ec.png , ",
166290,UNIK Global Services Pvt. Ltd.,+91 44 30046084,,,,,"No. C2, 2nd Floor, KH Road",Nungambakkam,600006,trichy,India,unikglobalservices@gmail.com,http://www.unikglobalservices.com,Ramesh,Monday - Saturday: 10 AM - 7 PM,"Coaching & Tuitions , Overseas Engineering Education Consultants , USA Education Consultants , UK Education Consultants , Australia Education Consultants , Canada Education Consultants , New Zealand Education Consultants , Overseas MBA Education Consultants , France Education Consultants , Germany Education Consultants , IELTS Coaching , TOEFL Coaching , Europe Education Consultants , Italy Education Consultants , Norway Education Consultants , ","If you are confused about which Career to choose then ""UNIK Global Services"" guides you through the maze of questions to find solutions best suited to your profile and / or parameters ensuring you choose the best Career Path. Applying for higher education abroad is a huge decision, both financially and emotionally. It is mandatory to invest adequate time and effort in order to make the right decision.
UNIK Global Services has trained and well experienced staffs, helps to identify the professional goals, enabling the student to take a wiser academic decision, and gives Personal Guidance to help choose courses that perfectly fit your Career or Personal GoalsUNIK Global Services was started in the year 2009 in UK with the ultimate purpose to provide dissertation support and technical training for the UK students. UNIK Global Services is the one stop solution for all your Education needs. The core activity lies in assisting students to make the right choice with regard to pursuing education in Overseas Educational Institutions. UNIK Global Services provides information regarding higher education in various Countries. Contact us for your needs.   ","http://localserviceassets.blob.core.windows.net:80/businessphoto-t/1-897a1581-246b-4c1f-8235-4c7a335724f1.JPG , http://localserviceassets.blob.core.windows.net:80/businessphoto-t/2-007f78ea-77f3-4734-a208-7416be743930.JPG , http://localserviceassets.blob.core.windows.net:80/businessphoto-t/3-75aae978-f39d-4219-9079-09caa625aa0a.JPG , http://localserviceassets.blob.core.windows.net:80/businessphoto-t/4-05bf106c-c3bb-416c-b4de-d4896cda8fe9.JPG , http://localserviceassets.blob.core.windows.net:80/businessphoto-t/5-ab0f91f7-baf2-457d-8a5a-90e41797cfb5.JPG , http://localserviceassets.blob.core.windows.net:80/businessphoto-t/6-f04d236e-3e68-4167-81e5-1baadf00d522.JPG , http://localserviceassets.blob.core.windows.net:80/businessphoto-m/1-897a1581-246b-4c1f-8235-4c7a335724f1.JPG , http://localserviceassets.blob.core.windows.net:80/businessphoto-m/2-007f78ea-77f3-4734-a208-7416be743930.JPG , http://localserviceassets.blob.core.windows.net:80/businessphoto-m/3-75aae978-f39d-4219-9079-09caa625aa0a.JPG , http://localserviceassets.blob.core.windows.net:80/businessphoto-m/4-05bf106c-c3bb-416c-b4de-d4896cda8fe9.JPG , http://localserviceassets.blob.core.windows.net:80/businessphoto-m/5-ab0f91f7-baf2-457d-8a5a-90e41797cfb5.JPG , http://localserviceassets.blob.core.windows.net:80/businessphoto-m/6-f04d236e-3e68-4167-81e5-1baadf00d522.JPG , ","Bank Loan Assistance , College Applications , Course Counseling , IELTS Coaching , Italy Education Consultants , New Zealand Education Consultants , Norway Education Consultants , Overseas Engineering Education Consultants , Overseas MBA Education Consultants , Scholarships , TOEFL Coaching , Travel and Accommodation Guidance , UK Education Consultants , USA Education Consultants , Visa Applications , "
166291,Shree Vari Professional Academy,9003659987, 9566627888,,,,"M.R.S. Shreekanth Tower, No. 63/4, Chittoor Highway Chengutti",Katpadi,632007,trichy,India,,http://www.shreevariacademy.com,Thangaraj,Monday - Saturday: 9 AM - 6 PM,"Home & Private Tuitions , CA Home Tuitions , CS Coaching , CMA Coaching , Chartered Accountant Coaching , ICWA Coaching , ACS Coaching , ","As career advisors, Shreevari professional academy is actively involved in its students strategic decision making. As a proactive advocate for its students, we are committed to providing every possible advantage to help candidates meet their goals. We understand the value of your time and money, hence, we provide the best tutorials in the industry with our concept oriented coaching & unique modules system. This gives CA aspirants a proper tracking of their routine and timely updating on it.Shreevari professional academy has an edge over other firms because we work in conjunction with the best known names in the industry. Our list of faculties range from top rated Charted Accountants to industry specific trainers. We also believe in equipping our candidates with powerful soft skill like leadership, corporate behaviour and effective exam preparation in our module, hence moulding them to challenge the competition in the market place.  ",,"ICWA Coaching , "
166292,Synergy School of Business Skills,9841097019,,,,,"No. 6, 4th Floor, Periyaswamy Tower",Chathiram Bus Stand,620002,trichy,India,marketing@synergysbs.co.in,http://www.synergysbs.co.in,Ganesan,Monday - Saturday: 9 AM - 6 PM,"Enterprise Training , Project Management Certification Training , Software Tools Training , Six Sigma Certification Training , Project Management Online Training , Primavera Training , Project Management Training , MS Office Training , PMP Certification Online Training , Advanced Primavera Training , PMI ACP Online Training , PMP Certification Training , Scrum Certification Training , CAPM Certification Training , MS Project Training , Asta Powerproject Certification Training , Six Sigma Green Belt Training , Six Sigma Black Belt Training , Kaizen Training , Tally Training , Placement Training , ","Synergy focuses on training individuals on project management concepts and software tools such as Microsoft Office Project, MSP Server, Primavera, and Primavera Complete, Asta Power Project. The courses will be offered in 70 locations across India and in 7 countries, as listed in its website. 
Synergy also trains on PMP Certification Preparatory module, and conducts PME (Project Management Expert) Certification for PM Aspirants. 
The training outcome with Project Management Skills include: Realistic Budgeting, Resource Estimation, Testing Methods, Better Communication, and Effective Risk Management that keep the pace of production high, both qualitatively and quantitatively. Synergy enrolls Students and Professionals of Management and Engineering specialization viz., Mechanical, Civil, Electrical, Electronics, Instrumentation, Business Administration & IT
Synergy offers training on Tally software, MS Office and Placement Training through its course called Master Diploma in Business Automation. 
The School will also help students find employment in the relevant corporate firms for the respective programs.  ",,"1 Month Program , 3 Months Program , 6 Months Program , Advanced Primavera Training , Asta Powerproject Certification Training , Classroom Tuitions , Evening Classes , PMI ACP Online Training , PMP Certification Online Training , PMP Certification Training , Project Management Training , Scrum Certification Training , Six Sigma Black Belt Training , Six Sigma Green Belt Training , Tally Training , "
166293,Stellas IAS Academy,0431 - 2773835, 9500970703, 9500970704,,,"No. B-70,1st Main Road, Ramalinga Nagar,Woraiyur",Uraiyoor,620003,trichy,India,,,Farklin,Monday - Sunday: 9 AM - 9 PM,"Coaching & Tuitions , IAS Entrance Coaching , Medical Entrance Coaching , Banking Tuitions , TNPSC Entrance Coaching , Railway Lawyers , ",,,
166294,Shakthi Tuition Centre,9345129898, 9361229898,,,,No. 3G,Tennur,620017,trichy,India,astc.shakthi@gmail.com,http://www.shakthituitioncentre.co.in,Arunachalam,Monday - Saturday: 8.30 AM - 5 PM,"2nd Year PUC Coaching , 1st Year PUC Coaching , AIEEE Coaching , 10th STD Tuitions , ",,,
166295,Orator,9786188430, 9843497444,,,,"No. 17/1,",Srirangam,620006,trichy,India,rangan_ranganathan@yahoo.co.in,,Ranganathan,Monday - Sunday: 10 AM - 1 PM ( Lunch: 5 PM - 8 PM ),"Engineering Design Training , Abaqus Training , Spoken English Classes , ",,,
