EduID,Name,Phone1,Phone2,Phone3,Phone4,Phone5,Street Address,Locality,Pincode,City,Country,Mail,Website,Person to Contact,Working Hours,Services Offered,Details,Images URL,Keywords
170389,International Student Way,+91 422 3304393,,,,,"No. 360, 100 Feet Road",Gandhipuram,641012,coimbatore,India,cbe-enq@isw-india.com,http://www.isw-india.com,Hamsavardhiny,Monday - Sunday: 10 AM - 8 PM,"PTE Coaching , Common Management Aptitude Test (CMAT) Coaching , Spoken English Classes , ACT Exam Coaching , GRE Coaching , SAT Coaching , IELTS Coaching , TOEFL Coaching , GMAT Coaching , MAT coaching , Language Development Coaching , Placement Training , Aptitude Training , TANCET Entrance Coaching , Online CAT Preparation Coaching , KMAT Coaching , XAT Entrance Coaching , ","We are a UK and India based global talent solutions and consulting company specialized in Training, Employability skills and Student Counseling for admission in colleges and universities in India and international countries. We are part of London based educational institute and associated with various colleges and universities in USA, Canada, UK, Europe, Singapore, Malaysia, New Zealand and Australia. All under one roof, our service includes preparing perspectives students for international education through our specialized language trainer, assist them for international education across the world, guiding on availability of scholarships / financial assistance for international education and placement assistant to succeed their career path during and post study. Contact us for your needs.  ","http://localserviceassets.blob.core.windows.net:80/businessphoto-t/ISW-Ph6-70598dc5-2691-4886-bb63-bd950c7c45a7.jpg , http://localserviceassets.blob.core.windows.net:80/businessphoto-t/ISW-Ph5-f634d151-769a-4e05-930a-467c0ca43b4e.jpg , http://localserviceassets.blob.core.windows.net:80/businessphoto-t/ISW-Ph4-dd2700b0-7d3d-4392-a671-cf3dac815a11.jpg , http://localserviceassets.blob.core.windows.net:80/businessphoto-t/ISW-Ph3-15c91243-0833-4cb2-ab54-5e4237c753cf.jpg , http://localserviceassets.blob.core.windows.net:80/businessphoto-t/ISW-Ph8-6c3d7ecb-449c-4e86-bf89-fea2ce7f3c3a.jpg , http://localserviceassets.blob.core.windows.net:80/businessphoto-t/ISW-Ph2-b9c89742-eeee-40f9-a0b7-acb24664a11b.jpg , http://localserviceassets.blob.core.windows.net:80/businessphoto-t/ISW-Fl6-4f302b04-ce6c-4d17-9acf-7d79a7a15c1b.jpg , http://localserviceassets.blob.core.windows.net:80/businessphoto-t/ISW-Fl5-6fb1839c-41dc-4d96-b2c5-172f9e036437.jpg , http://localserviceassets.blob.core.windows.net:80/businessphoto-t/ISW-Fl4-dd9a2292-4e43-4838-9568-c91a7b260702.jpg , http://localserviceassets.blob.core.windows.net:80/businessphoto-t/ISW-Fl3-fd92bc5d-f770-44a6-8477-70feea523f34.jpg , http://localserviceassets.blob.core.windows.net:80/businessphoto-t/ISW-Fl1-381a7535-835e-4f65-8e47-2ba4fd4559b8.jpg , http://localserviceassets.blob.core.windows.net:80/businessphoto-t/ISW-F2-710d678f-0a52-42da-a0c7-97877db34050.jpg , http://localserviceassets.blob.core.windows.net:80/businessphoto-m/ISW-Ph6-70598dc5-2691-4886-bb63-bd950c7c45a7.jpg , http://localserviceassets.blob.core.windows.net:80/businessphoto-m/ISW-Ph5-f634d151-769a-4e05-930a-467c0ca43b4e.jpg , http://localserviceassets.blob.core.windows.net:80/businessphoto-m/ISW-Ph4-dd2700b0-7d3d-4392-a671-cf3dac815a11.jpg , http://localserviceassets.blob.core.windows.net:80/businessphoto-m/ISW-Ph3-15c91243-0833-4cb2-ab54-5e4237c753cf.jpg , http://localserviceassets.blob.core.windows.net:80/businessphoto-m/ISW-Ph8-6c3d7ecb-449c-4e86-bf89-fea2ce7f3c3a.jpg , http://localserviceassets.blob.core.windows.net:80/businessphoto-m/ISW-Ph2-b9c89742-eeee-40f9-a0b7-acb24664a11b.jpg , http://localserviceassets.blob.core.windows.net:80/businessphoto-m/ISW-Fl6-4f302b04-ce6c-4d17-9acf-7d79a7a15c1b.jpg , http://localserviceassets.blob.core.windows.net:80/businessphoto-m/ISW-Fl5-6fb1839c-41dc-4d96-b2c5-172f9e036437.jpg , http://localserviceassets.blob.core.windows.net:80/businessphoto-m/ISW-Fl4-dd9a2292-4e43-4838-9568-c91a7b260702.jpg , http://localserviceassets.blob.core.windows.net:80/businessphoto-m/ISW-Fl3-fd92bc5d-f770-44a6-8477-70feea523f34.jpg , http://localserviceassets.blob.core.windows.net:80/businessphoto-m/ISW-Fl1-381a7535-835e-4f65-8e47-2ba4fd4559b8.jpg , http://localserviceassets.blob.core.windows.net:80/businessphoto-m/ISW-F2-710d678f-0a52-42da-a0c7-97877db34050.jpg , ","Classroom Tuitions , Daily Classes , GMAT Coaching , GRE Coaching , Language Development Coaching , MAT coaching , Online CAT Preparation Coaching , Online Tuitions , Placement Training , PTE Coaching , Rs.10000-Rs.20000 , SAT Coaching , Spoken English Classes , TANCET Entrance Coaching , TOEFL Coaching , XAT Entrance Coaching , "
170390,Race Institute,+91 44 33054029,,,,,"No. 30, Burkit Road",T. Nagar,600017,coimbatore,India,bharath.sman@gmail.com,http://www.raceinstitute.in,Bharath,Monday - Sunday: 6.30 AM - 8.30 PM,"SSC Entrance Exam Coaching , RRB Entrance Exam Coaching , Diploma in Banking & Finance (DBF) Coaching , IBPS Bank Interview Coaching , Banking Tuitions , Placement Training , Aptitude Training , TANCET Entrance Coaching , XAT Entrance Coaching , ","RACE (Rapid Academy of Competitive Exams) is an ISO 9001:2008 certified coaching institution. Like ISO 9001-2008s, our motto is Right first time, right every time. We provide coaching classes for all competitive examinations for the selection of bank probationary officers, clerks, specialist officers, central government staff, insurance officers and railway staff.We are a four-year-old institution with a lot of experience in the teaching field. With an unparalleled quality in education at affordable fees, we have proved ourselves to be the best institute in South India.We provide classes under the instruction of ex-Reserve Bank of India POs, IIM and IIT alumni and field experts, with aseparate mentor for everyone. We use unconventional methods when it comes to teaching like Vedic Maths as shortcuts and mind calculations for smart guessing. We have nineteen study materials, twelve classes for bank exams, and eightclasses for lessons on current affairs. To help our students sail through interviews, we even organize mock interviews (one-on-one) with IBPS current panel members. As part of our curriculum, we conduct daily offline exams. Our fees are Rs. 10,500/- for banking course, and Rs. 12,000/- for SSC.Our students have called our training courses very effective and intellectual and that it has motivated them towards attaining their goal.Apply at our institute soon!  ","http://localserviceassets.blob.core.windows.net:80/businessphoto-t/RCP-6-6c63ee8a-62c2-46a5-a0de-ce51a5868930.jpg , http://localserviceassets.blob.core.windows.net:80/businessphoto-t/RCP-8-e152ce76-0ffe-432e-a13d-b796515e1159.jpg , http://localserviceassets.blob.core.windows.net:80/businessphoto-t/RCP-9-3d426549-36d0-4fd8-ae1a-42e2ddfbdb5f.jpg , http://localserviceassets.blob.core.windows.net:80/businessphoto-t/RCP-10-d47ee0cc-c301-4a6d-a055-cce5b1668579.jpg , http://localserviceassets.blob.core.windows.net:80/businessphoto-t/RCP-11-6ed2a1c9-340f-4f3e-aaa4-1cb584a4f352.jpg , http://localserviceassets.blob.core.windows.net:80/businessphoto-t/RCP-12-1ba597dd-683c-4b63-8f03-dd2cededd189.jpg , http://localserviceassets.blob.core.windows.net:80/businessphoto-t/RCP-13-5062f2e3-1c1d-409f-9c75-ef5c1919720d.jpg , http://localserviceassets.blob.core.windows.net:80/businessphoto-t/RCP-14-2c2a5887-4521-4222-8bbf-64a543561e99.jpg , http://localserviceassets.blob.core.windows.net:80/businessphoto-t/RCP-15-23942f5d-b367-4d80-8205-39c9322c5d37.jpg , http://localserviceassets.blob.core.windows.net:80/businessphoto-t/RCP-16-d9b403a8-82f7-4c15-8eee-03832e8a7fd4.jpg , http://localserviceassets.blob.core.windows.net:80/businessphoto-m/RCP-6-6c63ee8a-62c2-46a5-a0de-ce51a5868930.jpg , http://localserviceassets.blob.core.windows.net:80/businessphoto-m/RCP-8-e152ce76-0ffe-432e-a13d-b796515e1159.jpg , http://localserviceassets.blob.core.windows.net:80/businessphoto-m/RCP-9-3d426549-36d0-4fd8-ae1a-42e2ddfbdb5f.jpg , http://localserviceassets.blob.core.windows.net:80/businessphoto-m/RCP-10-d47ee0cc-c301-4a6d-a055-cce5b1668579.jpg , http://localserviceassets.blob.core.windows.net:80/businessphoto-m/RCP-11-6ed2a1c9-340f-4f3e-aaa4-1cb584a4f352.jpg , http://localserviceassets.blob.core.windows.net:80/businessphoto-m/RCP-12-1ba597dd-683c-4b63-8f03-dd2cededd189.jpg , http://localserviceassets.blob.core.windows.net:80/businessphoto-m/RCP-13-5062f2e3-1c1d-409f-9c75-ef5c1919720d.jpg , http://localserviceassets.blob.core.windows.net:80/businessphoto-m/RCP-14-2c2a5887-4521-4222-8bbf-64a543561e99.jpg , http://localserviceassets.blob.core.windows.net:80/businessphoto-m/RCP-15-23942f5d-b367-4d80-8205-39c9322c5d37.jpg , http://localserviceassets.blob.core.windows.net:80/businessphoto-m/RCP-16-d9b403a8-82f7-4c15-8eee-03832e8a7fd4.jpg , ","1 Month Program , 3 Months Program , Classroom Tuitions , Daily Classes , Evening Classes , Holiday Classes , Online Tuitions , RRB Entrance Exam Coaching , Rs.5000-Rs.10000 , SSC Entrance Exam Coaching , Summer Classes , TANCET Entrance Coaching , Weekend Classes , XAT Entrance Coaching , "
170391,Avenue Resources,+91 422 3304238,,,,,"No. 27, PSG Hudco Colony, Avinashi Road",Peelamedu,641004,coimbatore,India,avenueresourcescbe@gmail.com,http://www.avenueresources.in,Vijith Anand,Monday - Sunday: 10 AM - 8 PM,"Law Entrance Coaching , SET Entrance Coaching , CLAT Entrance Coaching , CAT Coaching , Spoken English Classes , GRE Coaching , SAT Coaching , Banking Tuitions , MBA & BBA Coaching , IELTS Coaching , TOEFL Coaching , GMAT Coaching , MAT coaching , Placement Training , Aptitude Training , Online Tutoring for Schools & Colleges , Online Test Series for Exam , TANCET Entrance Coaching , ","Avenue ResourcesTo strive endlessly to provide world class training.To constantly produce first class results.
To ensure full student satisfaction.We offer premier training and consulting services for National and International level tests helping students to enhance their language and quants skills on par with international standards.Our programs are offered on a Monthly/ Hourly basis. Customized modules are available for On- Campus services for Educational institutions  ","http://localserviceassets.blob.core.windows.net:80/businessphoto-t/2-12-2016%2010-10-31%20AM-582e9ae9-b6fa-45c4-a4ff-fa82898d528f.png , http://localserviceassets.blob.core.windows.net:80/businessphoto-t/2-12-2016%2010-10-38%20AM-8130221d-0858-40be-93d3-3397a5c21e98.png , http://localserviceassets.blob.core.windows.net:80/businessphoto-t/2-12-2016%2010-10-45%20AM-d87711e9-b0f2-425b-8ebe-d35c10df7039.png , http://localserviceassets.blob.core.windows.net:80/businessphoto-t/4b501d9ebd7e6e67a3b4805e97431540-716476fc-320c-4864-8f15-dd859546f6da.jpg , http://localserviceassets.blob.core.windows.net:80/businessphoto-m/2-12-2016%2010-10-31%20AM-582e9ae9-b6fa-45c4-a4ff-fa82898d528f.png , http://localserviceassets.blob.core.windows.net:80/businessphoto-m/2-12-2016%2010-10-38%20AM-8130221d-0858-40be-93d3-3397a5c21e98.png , http://localserviceassets.blob.core.windows.net:80/businessphoto-m/2-12-2016%2010-10-45%20AM-d87711e9-b0f2-425b-8ebe-d35c10df7039.png , http://localserviceassets.blob.core.windows.net:80/businessphoto-m/4b501d9ebd7e6e67a3b4805e97431540-716476fc-320c-4864-8f15-dd859546f6da.jpg , ","GRE Coaching , IELTS Coaching , MAT coaching , MBA & BBA Coaching , Online Test Series for Exam , Online Tutoring for Schools & Colleges , Placement Training , SAT Coaching , SET Entrance Coaching , Spoken English Classes , TANCET Entrance Coaching , TOEFL Coaching , "
170392,Right Accountancy,+91 422 3304192,,,,,Ambara Enclave,Avinashi Road,641018,coimbatore,India,surioutsource@gmail.com,http://www.rightaccountancy.com,Suryanarayanan,"Monday - Saturday: 9 AM - 7 PM, Sunday: 10 AM - 12 PM","Integrated Professional Competency (IPCC) Coaching , CACPT Coaching , Diploma in Banking & Finance (DBF) Coaching , College Tuitions for Accounts, Finance, Statistics , School Tuitions for Accounts, Finance, Statistics , Chartered Accountant Coaching , Banking Tuitions , M.Com Entrance Exam Coaching , B.Com Coaching , M.Com Coaching , ICWA Coaching , ACS Coaching , ","Right Accountancy carefully selected and collected a panel of highly qualified, experienced and accomplished faculty for coaching. The faculties have taught a large number of students and produced several rank holders. The class room environment is student friendly, and well qualified coordinators assist students in the classes when ever required. The students are continuously assessed and informed about their inclass and outofclass performance. Regular feedback is given by the faculty and academic team to students on their progress. The students can schedule special class when they miss some classes, especially relevant when traveling for audit assignments at outlocation. An Academic help desk facility addresses student queries through email. Inclass, conceptual understanding of the students is tested by the teacher through MCQs. Kindly contact us for more details.  ","http://localserviceassets.blob.core.windows.net:80/businessphoto-t/download-bfb3bf4f-0b68-41c9-bb53-16e5dee5e844.jpg , http://localserviceassets.blob.core.windows.net:80/businessphoto-t/download%20(1)-b946cf95-82ac-41bf-b5a6-51351c1514c2.jpg , http://localserviceassets.blob.core.windows.net:80/businessphoto-t/download%20(2)-e533afdb-7101-44f4-afd8-e779f162d98a.jpg , http://localserviceassets.blob.core.windows.net:80/businessphoto-t/images-311c81fe-4c1b-44f8-b0e8-f6bcdb64bfe2.jpg , http://localserviceassets.blob.core.windows.net:80/businessphoto-t/images%20(1)-5a23ce7b-fd3b-46a5-bde7-4abbc13f471f.jpg , http://localserviceassets.blob.core.windows.net:80/businessphoto-t/images%20(2)-9f8a0a44-5baa-41ee-91b0-ef8e88a9edbb.jpg , http://localserviceassets.blob.core.windows.net:80/businessphoto-t/images%20(3)-7c70ec99-246e-4e28-a2b1-a0288dde3361.jpg , http://localserviceassets.blob.core.windows.net:80/businessphoto-t/images%20(4)-48f5cf14-95cb-46dc-9842-2c7b6c6f6a7f.jpg , http://localserviceassets.blob.core.windows.net:80/businessphoto-t/images%20(5)-ef25b068-0b97-422d-b701-1bece961bf6f.jpg , http://localserviceassets.blob.core.windows.net:80/businessphoto-t/images%20(6)-b8f0e8a8-8b32-4369-b5f7-1b59a17fa4ba.jpg , http://localserviceassets.blob.core.windows.net:80/businessphoto-t/images%20(7)-697707c5-3255-4d4d-91c5-179bc6066095.jpg , http://localserviceassets.blob.core.windows.net:80/businessphoto-t/images%20(8)-f4fb5314-251b-445f-9e4f-d155004060f4.jpg , http://localserviceassets.blob.core.windows.net:80/businessphoto-m/download-bfb3bf4f-0b68-41c9-bb53-16e5dee5e844.jpg , http://localserviceassets.blob.core.windows.net:80/businessphoto-m/download%20(1)-b946cf95-82ac-41bf-b5a6-51351c1514c2.jpg , http://localserviceassets.blob.core.windows.net:80/businessphoto-m/download%20(2)-e533afdb-7101-44f4-afd8-e779f162d98a.jpg , http://localserviceassets.blob.core.windows.net:80/businessphoto-m/images-311c81fe-4c1b-44f8-b0e8-f6bcdb64bfe2.jpg , http://localserviceassets.blob.core.windows.net:80/businessphoto-m/images%20(1)-5a23ce7b-fd3b-46a5-bde7-4abbc13f471f.jpg , http://localserviceassets.blob.core.windows.net:80/businessphoto-m/images%20(2)-9f8a0a44-5baa-41ee-91b0-ef8e88a9edbb.jpg , http://localserviceassets.blob.core.windows.net:80/businessphoto-m/images%20(3)-7c70ec99-246e-4e28-a2b1-a0288dde3361.jpg , http://localserviceassets.blob.core.windows.net:80/businessphoto-m/images%20(4)-48f5cf14-95cb-46dc-9842-2c7b6c6f6a7f.jpg , http://localserviceassets.blob.core.windows.net:80/businessphoto-m/images%20(5)-ef25b068-0b97-422d-b701-1bece961bf6f.jpg , http://localserviceassets.blob.core.windows.net:80/businessphoto-m/images%20(6)-b8f0e8a8-8b32-4369-b5f7-1b59a17fa4ba.jpg , http://localserviceassets.blob.core.windows.net:80/businessphoto-m/images%20(7)-697707c5-3255-4d4d-91c5-179bc6066095.jpg , http://localserviceassets.blob.core.windows.net:80/businessphoto-m/images%20(8)-f4fb5314-251b-445f-9e4f-d155004060f4.jpg , ","College Tuitions for Accounts, Finance, Statistics , Daily Classes , Diploma in Banking & Finance (DBF) Coaching , Evening Classes , Holiday Classes , ICWA Coaching , Integrated Professional Competency (IPCC) Coaching , M.Com Coaching , M.Com Entrance Exam Coaching , School Tuitions for Accounts, Finance, Statistics , Summer Classes , Weekend Classes , "
170393,ARA Education,+91 422 3382096,,,,,"No. 2, 3rd Floor, Durga Complex,6th Street, Cross Cut Road",Gandhipuram,641012,coimbatore,India,araeducationcoimbatore@gmail.com,http://www.araeducation.in,Rajkumar,", Monday - Saturday: 6.30 AM - 8.30 PM","Job Training , Educational Consultants , Law Entrance Coaching , SET Entrance Coaching , KLSAT Entrance Coaching , ULSAT Entrance Coaching , LSAT Entrance Coaching , AILET Entrance Coaching , CLAT Entrance Coaching , LLB Entrance Exam , SSC Entrance Exam Coaching , RRB Entrance Exam Coaching , Integrated Professional Competency (IPCC) Coaching , CACPT Coaching , Common Management Aptitude Test (CMAT) Coaching , UPSC Coaching , CTET Coaching , CS Coaching , NEET Entrance Coaching , IBPS Bank Interview Coaching , Engineering EAMCET Coaching , PWD/CPWD Entrance Coaching , CAT Coaching , IIT Engineering Entrance Coaching , College Tuitions for Accounts, Finance, Statistics , Tuitions for College Subjects , Liberal Studies Entrance Coaching , B.B.A. Entrance Coaching , Hotel Management Entrance Coaching , CMA Coaching , DMRC Entrance Coaching , SAT Coaching , Medical Entrance Coaching , SSC JE Entrance Coaching , Chartered Accountant Coaching , Banking Tuitions , MBA & BBA Coaching , TRANSCO Coaching , IIT JAM Coaching , GMAT Coaching , SBI PO Training , College Tuitions for Maths , Certified Financial Planner (CFP) Coaching , MAT coaching , IIT HSEE Coaching , MCA Entrance Coaching , Aptitude Training , Share Marketing Training , Diploma in Banking & Finance (DBF) Training , MBA in IT Coaching , MBA in Retail Management Coaching , Tamil Tuitions , Export Import Management Courses , CET Entrance Coaching , AIEEE Coaching Show less « , ","Professionalism, it's something we all aspire to in our careers. Being a professional gets you noticed, it earns you respect and can help you to climb the career ladder.""ARA"" is created with the objective of offering the new age career aspirants highly prestigious and globally demanded career options in Professionalism by providing internationally recognised bench-marked professional courses.""All Birds find shelter during a rain. But Eagle avoids rain by flying above the Clouds.""  Dr. A.P.J Abdul Kalam""All of us do not have equal talent. But, all of us have an equal opportunity to develop our talents.""  Dr. A.P.J Abdul Kalam""ARA"" is the place where virtual teachings and online education enlighten you and build your knowledge deep inside your mind saving your time, money, and energyYou get an internationally recognised professional qualification
You can earn while you learn through flexible distance learning
Get one-on-one tutor support of your choice as per your convenience and plan your learning schedule
Enjoy a classroom environment, join alumni chat rooms and share your thoughts with your fellow students
Many of these professional courses are delivered by online. Therefore, you can earn an international qualification from the comfort of your home.
""ARA"" is your one-stop shop for searching, finding and comparing international vocational courses to earn professional qualifications that will help you display the skills you possess, get a promotion, or start a new career.""ARA"" provides independent information on courses and professional qualifications, delivered by study overseas and by distance learning in India. We are expanding our course list continuously, In addition, our carefully[selected] list's integrated courses help to enrich your guaranteed career[Future].We give guidance and explain what employers are really looking for in[INDIA] and internationally indeed.  ","http://localserviceassets.blob.core.windows.net:80/businessphoto-t/2889-5a0e2006-0833-484a-8690-c6e6f4f23c18.jpg , http://localserviceassets.blob.core.windows.net:80/businessphoto-t/2b-3e4e0a11-5b8e-4c06-959e-601db6e212c6.jpg , http://localserviceassets.blob.core.windows.net:80/businessphoto-t/2a-f7433f32-2404-4a74-aa08-5b5648e37a57.jpg , http://localserviceassets.blob.core.windows.net:80/businessphoto-t/1-1-7a02176d-38fb-4e87-8f2b-a8ba000807c1.jpg , http://localserviceassets.blob.core.windows.net:80/businessphoto-t/2-45351616-9496-4031-a373-b70e5cdb74c4.jpg , http://localserviceassets.blob.core.windows.net:80/businessphoto-t/ARA%20-SULEKHA%20BANNER1%20(2)-d2c80228-635c-4fb5-a0c9-e7dd5088767f.jpg , http://localserviceassets.blob.core.windows.net:80/businessphoto-t/2c-87522b28-55c3-4939-a12c-897261f3ae96.jpg , http://localserviceassets.blob.core.windows.net:80/businessphoto-t/IMG-20151129-WA0003-efc9dfdd-e52e-46ce-aadc-acdd98048ded.jpg , http://localserviceassets.blob.core.windows.net:80/businessphoto-t/IMG-20160123-WA0009-d21ae659-2fdc-42ea-be4f-7462943cfd83.jpg , http://localserviceassets.blob.core.windows.net:80/businessphoto-m/2889-5a0e2006-0833-484a-8690-c6e6f4f23c18.jpg , http://localserviceassets.blob.core.windows.net:80/businessphoto-m/2b-3e4e0a11-5b8e-4c06-959e-601db6e212c6.jpg , http://localserviceassets.blob.core.windows.net:80/businessphoto-m/2a-f7433f32-2404-4a74-aa08-5b5648e37a57.jpg , http://localserviceassets.blob.core.windows.net:80/businessphoto-m/1-1-7a02176d-38fb-4e87-8f2b-a8ba000807c1.jpg , http://localserviceassets.blob.core.windows.net:80/businessphoto-m/2-45351616-9496-4031-a373-b70e5cdb74c4.jpg , http://localserviceassets.blob.core.windows.net:80/businessphoto-m/ARA%20-SULEKHA%20BANNER1%20(2)-d2c80228-635c-4fb5-a0c9-e7dd5088767f.jpg , http://localserviceassets.blob.core.windows.net:80/businessphoto-m/2c-87522b28-55c3-4939-a12c-897261f3ae96.jpg , http://localserviceassets.blob.core.windows.net:80/businessphoto-m/IMG-20151129-WA0003-efc9dfdd-e52e-46ce-aadc-acdd98048ded.jpg , http://localserviceassets.blob.core.windows.net:80/businessphoto-m/IMG-20160123-WA0009-d21ae659-2fdc-42ea-be4f-7462943cfd83.jpg , ","ACCA Training , ACS Coaching , AIEEE Coaching , AILET Entrance Coaching , AIPMT Coaching , All India Common Entrance Examination (AICEE) Coaching , AMIE Coaching , Aptitude Training , B.B.A. Entrance Coaching , B.Com Coaching , B.Com Entrance Exam Coaching , Banking Tuitions , CACPT Coaching , CAT Coaching , Certified Financial Planner (CFP) Coaching , Certified Public Accountant (CPA) Coaching , CET Entrance Coaching , Chartered Accountant Coaching , Chartered Financial Analyst (CFA) Coaching , CIMA Certification Coaching , CLAT Entrance Coaching , CMA Coaching , College Tuitions for Accounts, Finance, Statistics , College Tuitions for Maths , Common Management Aptitude Test (CMAT) Coaching , CS Coaching , CTET Coaching , Daily Classes , GMAT Coaching , Hotel Management Entrance Coaching , IBPS Bank Exam Coaching , IBPS Bank Interview Coaching , ICWA Coaching , IES Coaching , IIT Engineering Entrance Coaching , IIT HSEE Coaching , IIT JAM Coaching , IIT-JEE Coaching , Integrated Professional Competency (IPCC) Coaching , International Financial Reporting Standards (IFRS) Coaching , JEE Advanced Coaching , KLSAT Entrance Coaching , KMAT Coaching , Liberal Studies Entrance Coaching , LLB Entrance Exam , LSAT Entrance Coaching , M.Com Coaching , M.Com Entrance Exam Coaching , MAT coaching , MBA & BBA Coaching , MBA in IT Coaching , MBA in Retail Management Coaching , MCA Entrance Coaching , MCA Entrance Exam Coaching , Medical Entrance Coaching , NEET Entrance Coaching , PWD/CPWD Entrance Coaching , RRB Entrance Exam Coaching , SAT Coaching , SBI PO Training , SET Entrance Coaching , Share Marketing Training , Spoken Tamil Classes , SSB & NDA Coaching , SSC Entrance Exam Coaching , SSC JE Entrance Coaching , Tamil Tuitions , TANCET Entrance Coaching , TNPSC Entrance Coaching , TRANSCO Coaching , Tuitions for College Subjects , ULSAT Entrance Coaching , UPSC Coaching , US CMA Coaching , US CPA Coaching , "
