EduID,Name,Phone1,Phone2,Phone3,Phone4,Phone5,Street Address,Locality,Pincode,City,Country,Mail,Website,Person to Contact,Working Hours,Services Offered,Details,Images URL,Keywords
169730,BIT - Baroda Institute of Technology,0265 - 2225711, 9327219987,,,,B-208,Sayajigunj,390005,vadodara,India,vaibhavpradhan4@yahoo.com,http://www.bitbaroda.com,Vaibhav Pradhan,"Monday - Saturday: 7 AM - 9 PM, Sunday: 7 AM - 3 PM","Coaching & Tuitions , Database Training , Engineering Design Training , Enterprise Training , Microsoft Training , Multimedia & Design Training , Oracle Training , Programming Languages Training , Software Tools Training , Web Technologies Training , SAP Training , CompTIA Training , MBA Part Time Distance Education , Advanced C Programming Training , Web Designing Training , CompTIA A+ Training , CompTIA Security+ Training , MS Office Training , AJAX Training , C, C++ Training , M.B.A. Distance Education , Online UK Distance Education , C Sharp (C#) Training , ASP.Net Training , 3D Studio Max Training , CompTIA Network+ Training , SAP ABAP Training , .Net Training , M.Sc. TQM Distance Education , M.Sc. Physics Distance Education , Java & J2EE Training , DBA Mainframe Training , SAP BI Training , Toon Boom Animation Training , Oracle Certification Training , Advanced MS Excel Training , SAP BO Training , Java Script Training , M.Sc. Botany Distance Education , M.Sc. Zoology Distance Education , IPS Entrance Exam Coaching , M.Sc. Mathematics Distance Education , Oracle DBA Training , MS Project Training , SQL Server Training , Basic Language Training , SSC Entrance Exam Coaching , RRB Entrance Exam Coaching , PHP & MySQL Training , Advanced Visual Basic Training , Database Testing Training , SAP FICO Training , Silverlight Training , RDBMS Training , CCC / BCC Course , PTE Coaching , M.Sc. Chemistry Distance Educati Show less « , ",,"http://localserviceassets.blob.core.windows.net:80/businessphoto-t/11%20JOB%20CUM%20TRA%20WEBSITE%20IMAGE-6deace2a-9ce4-4cc4-890c-c2d24a913e7f.jpg , http://localserviceassets.blob.core.windows.net:80/businessphoto-t/Banner1-24e4d4d7-0b0d-4219-a883-2cdcdb6a440a.jpg , http://localserviceassets.blob.core.windows.net:80/businessphoto-t/Banner2-f3bfb770-4f2d-458a-b958-4be4d49fe007.jpg , http://localserviceassets.blob.core.windows.net:80/businessphoto-t/bit_logo-86ce4b15-b427-4fef-9798-26d4965b35d9.png , http://localserviceassets.blob.core.windows.net:80/businessphoto-t/JOB%20CUM%20TRA%20WEBSITE%20IMAGE%20home%20page%20-ca876660-1859-46f9-8f53-18d417ebd20a.jpg , http://localserviceassets.blob.core.windows.net:80/businessphoto-m/11%20JOB%20CUM%20TRA%20WEBSITE%20IMAGE-6deace2a-9ce4-4cc4-890c-c2d24a913e7f.jpg , http://localserviceassets.blob.core.windows.net:80/businessphoto-m/Banner1-24e4d4d7-0b0d-4219-a883-2cdcdb6a440a.jpg , http://localserviceassets.blob.core.windows.net:80/businessphoto-m/Banner2-f3bfb770-4f2d-458a-b958-4be4d49fe007.jpg , http://localserviceassets.blob.core.windows.net:80/businessphoto-m/bit_logo-86ce4b15-b427-4fef-9798-26d4965b35d9.png , http://localserviceassets.blob.core.windows.net:80/businessphoto-m/JOB%20CUM%20TRA%20WEBSITE%20IMAGE%20home%20page%20-ca876660-1859-46f9-8f53-18d417ebd20a.jpg , ","Advanced C++ Training , Advanced JAVA Training , Advanced MS Excel Training , Advanced PHP Training , Advanced VBScript Training , Advanced Visual Basic Training , Advanced Web Design Training , AIEEE Coaching , AIPMT Coaching , AJAX Training , All India Common Entrance Examination (AICEE) Coaching , Apache Tomcat Training , Aptitude Training , ASP.Net Training , Autocad Training , B.A Distance Education , B.B.A. Entrance Coaching , B.C.A. Distance Education , B.Com Distance Education , B.Ed. Distance Education , B.Sc. IT Distance Education , B.Tech. Distance Education , Banking Tuitions , Basic Language Training , BBA Distance Education , BCA Distance Education , BCA Entrance Exam Coaching , C Sharp (C#) Training , C, C++ Training , CACPT Coaching , CAT Coaching , CCC / BCC Course , Certified Financial Management Distance Education , Certified Public Accountant (CPA) Distance Education , CET Entrance Coaching , Chartered Accountant Coaching , Chartered Financial Analyst (CFA) Distance Education , CMA Coaching , College Tuitions for Accounts, Finance, Statistics , Common Management Aptitude Test (CMAT) Coaching , CompTIA A+ Training , CompTIA Network+ Training , CompTIA Security+ Training , CS Coaching , CTET Coaching , Database Testing Training , DBA Mainframe Training , DBM ADBM Distance Education , DHTML Training , Diploma in Banking & Finance (DBF) Coaching , Diploma in Chemical Engineering Distance Education , Diploma in Civil Engineering Distance Education , Diploma in Electrical Engineering Distance Education , Diploma in Industrial Relation Course Distance Education , Diploma in IT Engineering Distance Education , Dreamweaver Training , DTP Training , Executive BBA Distance Education , Executive MBA Distance Education , Final Year Project Training , GMAT Coaching , Graphic Designing Training , GRE Coaching , Hotel Management Entrance Coaching , HTML Training , IBPS Bank Interview Coaching , IELTS Coaching , IES Coaching , IIT Engineering Entrance Coaching , IIT HSEE Coaching , IIT JAM Coaching , IIT-JEE Coaching , Industrial Management Distance Education , IPS Entrance Exam Coaching , IT Program Distance Education , Java & J2EE Training , Java Script Training , JDBC Training , JQuery Training , JSP Training , LLB Distance Education , M.A. Distance Education , M.B.A. Distance Education , M.C.A. Distance Education , M.Com Distance Education , M.Phil Distance Education , M.Sc. Botany Distance Education , M.Sc. Chemistry Distance Education , M.Sc. Mathematics Distance Education , M.Sc. Physics Distance Education , M.Sc. TQM Distance Education , M.Sc. Visual Communications Distance Education , M.Sc. Zoology Distance Education , M.Tech. Distance Education , MAF Distance Education , MBA & BBA Coaching , MBA Part Time Distance Education , MCA Entrance Coaching , MCA Entrance Exam Coaching , Medical Entrance Coaching , MIF Distance Education , MPSC Coaching , MS Access Training , MS Office Training , MS Project Training , MSC IT , Multimedia & Animation Training , NEET Entrance Coaching , Online Homeopathy Distance Education , Online MBA , Online UK Distance Education , Open School for 10th class , Oracle Certification Training , Oracle DBA Training , P.H.D. Distance Education , PCS Entrance Coaching , PGDCR Distance Education , PGDHHM Distance Education , PGDHIM Distance Education , PGDITM Distance Education , PGDMLS Distance Education , PHP & MySQL Training , Pre-Medical Test (PMT) Entrance Coaching , PSAT Exam Coaching , PSU Entrance Coaching , PTE Coaching , Public Speaking Training , RDBMS Training , REET Coaching , RRB Entrance Exam Coaching , SAP ABAP Training , SAP BASIS Training , SAP BI Training , SAP BO Training , SAP FICO Training , SAP MM Training , SAT Coaching , SBI PO Training , School Tuitions for All Subjects , Share Marketing Training , Silverlight Training , Sound Forge Training , Spoken English Classes , SQL Server Training , SSB & NDA Coaching , SSC Entrance Exam Coaching , Tally Training , TOEFL Coaching , Toon Boom Animation Training , TRANSCO Coaching , Tuitions for College Subjects , UPSC Coaching , Web 2.0 Training , Web Designing Training , Web Development Training , Word Press Training , XAT Entrance Coaching , XHTML Training , "
169731,RnC,0265 - 2432819, 0265 - 2458819, 9898075852,,,,Kothi,390001,vadodara,India,info@rnc-brd.com,http://www.rnc-brd.com,Jay Ruparel,Monday - Saturday: 8 AM - 8 PM,"Coaching & Tuitions , Visa Consultants , Canada Visa Consultants , Africa Visa Consultants , Singapore Visa Consultants , USA Education Consultants , UK Education Consultants , New Zealand Visa Consultants , UAE Visa Consultants , Australia Education Consultants , Canada Education Consultants , Australia South Pacific Visa Consultants , Europe Visa Consultants , New Zealand Education Consultants , Far East Visa Consultants , Asia Visa Consultants , America Visa Consultants , Middle East Visa Consultants , PTE Coaching , Singapore Education Consultants , Switzerland Education Consultants , IELTS Coaching , TOEFL Coaching , ","At RnC you find a new look out for yourself and a one stop solution for all. The founders of Ruparel & Co. have a far sighted ardor. With sincere hard efforts, we are committed to provide efficient & result oriented consulting services to clients be it overseas education, immigration and the like.We look forward to provide our services to our clientele purely on the basis of our professionalism, friendly relations with our clients & creating homely environment for them, strong research and success rate by providing them with knowledgeable and experienced counselors, who offer high quality career counseling for free.Our experienced and dedicated staff ensures that the policies and aims at Ruparel & Co. are adhered to and standards set are complied with absolute hard work. The organization setup is such that there are specialized departments for all the services delivered by us. Ruparel & Co. open the floodgates of opportunities for clients and their dependents with a global qualification.  ","http://localserviceassets.blob.core.windows.net:80/businessphoto-t/1-42436c9b-f20f-4042-a65f-5e27741b639f.png , http://localserviceassets.blob.core.windows.net:80/businessphoto-m/1-42436c9b-f20f-4042-a65f-5e27741b639f.png , ","Canada Education Consultants , Canada Visa Consultants , Europe Visa Consultants , Far East Visa Consultants , IELTS Coaching , Middle East Visa Consultants , New Zealand Education Consultants , New Zealand Visa Consultants , PTE Coaching , Singapore Education Consultants , Singapore Visa Consultants , Switzerland Education Consultants , TOEFL Coaching , UAE Visa Consultants , UK Education Consultants , USA Education Consultants , "
169732,Compusoft Computer Education,9879509135,,,,,"No. 135, 1st Floor",Sayajigunj,390005,vadodara,India,compu_softas2009@yahoo.in,http://www.compusofteducation.com,Ashish,"Monday - Saturday: 8 AM - 8 PM, Saturday: 9 AM - 7 PM","Database Training , Engineering Design Training , Enterprise Training , Mobile Development Training , Multimedia & Design Training , Programming Languages Training , Project Management Certification Training , Software Tools Training , Web Technologies Training , Six Sigma Certification Training , ANSYS Training , Primavera Training , PPM Training , Android Application Development Training , Project Management Training , Web Designing Training , ANSYS CFD Training , Basic Primavera Training , Advanced Primavera Training , C, C++ Training , ANSYS Fluent Training , MS Office Training , ANSYS Meshing Training , 3D Studio Max Training , ANSYS Workbench Training , ANSYS DesignModeler Training , Mobile Application Development Training , Java & J2EE Training , Advanced MS Excel Training , Adobe Illustrator Training , Adobe Photoshop Training , MS Project Training , CAD & CAM Training , 3D CAD Training , CorelDRAW Training , PHP & MySQL Training , Diploma in Advertising Design , E-Publishing Courses , CCC / BCC Course , Six Sigma Green Belt Training , Flash Action Effects Training , Graphic Designing Training , PLC Training , MS Access Training , Pro E Training , Solidworks Training , SCADA Training , Unigraphic Software Training , Autocad Training , Adobe Indesign Training , Word Press Training , DTP Training , Electrical CAD Training , Civil CAD Training , Web Development Training , Tally Training , ","Compusoft is one of the leading computer education center. We have years of experience since 1996. This experience has gained us a list of satisfied students. All students gained education from our center have reached to good heights in their career. We believe in practical as well application knowledge. Just learning can never earn this career. We explain the concepts to the depths. Our wide range of courses provide various options to students. We have flexible timings which makes earning with learning possible. Our innovative ideas of teaching has helped students to grasp the concept soon and hence apply them in best ways. We are providing Training in the field of Computerized ( Office Automation, Accounting, Graphic Designing, Web Designing, Interior Designing, Civil CAD, Electrical CAD, Marcanical CAD, Piping Designing, Piping Engineering, Industrial Automation, Project Management & Planning, Programming)  ","http://localserviceassets.blob.core.windows.net:80/businessphoto-t/1-816e7b52-2f13-45a3-9ef1-41ad87960b91.jpg , http://localserviceassets.blob.core.windows.net:80/businessphoto-t/2-cd0860a7-601b-4c50-a614-ded247a57392.jpg , http://localserviceassets.blob.core.windows.net:80/businessphoto-t/2688-180ca598-4bd3-4173-b7fe-1514bc32acb4.jpg , http://localserviceassets.blob.core.windows.net:80/businessphoto-m/1-816e7b52-2f13-45a3-9ef1-41ad87960b91.jpg , http://localserviceassets.blob.core.windows.net:80/businessphoto-m/2-cd0860a7-601b-4c50-a614-ded247a57392.jpg , http://localserviceassets.blob.core.windows.net:80/businessphoto-m/2688-180ca598-4bd3-4173-b7fe-1514bc32acb4.jpg , ","1 Year Program , Adobe PageMaker Training , Adobe Photoshop Training , Advanced MS Excel Training , Advanced Primavera Training , Advanced Web Design Training , Android Application Development Training , ANSYS CFD Training , ANSYS DesignModeler Training , ANSYS Fluent Training , ANSYS Meshing Training , ANSYS Workbench Training , Autocad Training , Basic Primavera Training , C, C++ Training , CAD & CAM Training , CATIA Training , CCC / BCC Course , Civil CAD Training , Classroom Tuitions , CorelDRAW Training , CREO Training , Daily Classes , Diploma in Advertising Design , DTP Training , Electrical CAD Training , E-Publishing Courses , Evening Classes , Flash Action Effects Training , Graphic Designing Training , Holiday Classes , Industrial Automation Training , Java & J2EE Training , Mechanical CAD Training , Mobile Application Development Training , More than Rs.20000 , MS Access Training , MS Office Training , MS Project Training , Online Tuitions , PHP & MySQL Training , Piping Stress Analysis Coaching , Plant Design Piping Coaching , Plant Design Piping Training , PLC Training , PPM Training , Pro E Training , Project Management Training , Revit Architecture Training , SCADA Training , Six Sigma Green Belt Training , Solidworks Training , STAAD Pro Training , Summer Classes , Tally Training , Unigraphic Software Training , Web Designing Training , Web Development Training , Weekend Classes , Word Press Training , "
169733,Ique Ideas Pvt. Ltd.,079331 06229,,,,,"C-1, Sonarika Apartments, IIM Road",Ambawadi,380015,vadodara,India,mohitmangal1@gmail.com,http://www.iqueideas.com,Swati Shah,Monday - Sunday: 10 AM - 6.30 PM,"Law Entrance Coaching , SET Entrance Coaching , ULSAT Entrance Coaching , LSAT Entrance Coaching , AILET Entrance Coaching , CLAT Entrance Coaching , Common Management Aptitude Test (CMAT) Coaching , IBPS Bank Interview Coaching , IIT Engineering Entrance Coaching , Liberal Studies Entrance Coaching , B.B.A. Entrance Coaching , Hotel Management Entrance Coaching , Banking Tuitions , Mass Communication Training , SBI PO Training , IIT HSEE Coaching , Aptitude Training , GUJCET Coaching , AIPMT Coaching , IBPS Bank Exam Coaching , IIT-JEE Coaching , Pre-Medical Test (PMT) Entrance Coaching , ","iQue ideas is a successful Coaching and Training institute, training children for non- traditional entrance Exams for career options after 12th like: 1. LAW (CLAT, AILET, LSAT, Symbiosis Univ., Christ Univ., IP Univ.) 2. Hotel Management (IHM-JEE, IHM-Aurangabad (Taj Group), Welcome Group, Oberoi Group, Christ Univ., IP Univ.) 3. BBA / Integrated MBA (UGAT, NPAT, IPM-IIM-Indore, Symbiosis Univ., Christ Univ.) 4. Liberal Studies (PDPU, Symbiosis Univ., Amity Univ., Jindal Univ., Ashoka Univ.) 5. Mass Communication (Symbiosis Univ., Whistling Woods International, St. Xaviers Mumbai, Christ Univ., Amity Univ.) 6. Economics (Hons.) (Symbiosis Univ., Narsee Monjee, Amity Univ., Presidency Univ. Kolkata) 7. Social Sciences (HSEE-IIT Madras, TISS, SPU-Jodhpur, Univ. Of Hyderabad) among others.  ","http://localserviceassets.blob.core.windows.net:80/businessphoto-t/Pic27-715e7738-0597-4342-ba77-887c9bd3cfd2.jpg , http://localserviceassets.blob.core.windows.net:80/businessphoto-t/Pic41-2b39047b-ea17-4b6c-8fae-e91fd1da977f.jpg , http://localserviceassets.blob.core.windows.net:80/businessphoto-t/iQueid-1-d891d638-db0a-48ba-a22b-e8ec8ee04c01.jpg , http://localserviceassets.blob.core.windows.net:80/businessphoto-t/iQueid-2-8e5b3059-03e9-454b-bea7-9b984eadf47e.jpg , http://localserviceassets.blob.core.windows.net:80/businessphoto-t/iQueid-3-cf7466b4-bc79-4aee-ba20-5064e8ee8da8.jpg , http://localserviceassets.blob.core.windows.net:80/businessphoto-t/iQueid-4-20904e06-d86c-4f76-b364-92d457d1d071.jpg , http://localserviceassets.blob.core.windows.net:80/businessphoto-t/iQueid-5-166b8f0d-10d8-48c5-bb98-1aad6e8e46a4.jpg , http://localserviceassets.blob.core.windows.net:80/businessphoto-t/iQueid-6-cb9cfa6d-d8ba-437f-a909-268d1d0ab710.jpg , http://localserviceassets.blob.core.windows.net:80/businessphoto-m/Pic27-715e7738-0597-4342-ba77-887c9bd3cfd2.jpg , http://localserviceassets.blob.core.windows.net:80/businessphoto-m/Pic41-2b39047b-ea17-4b6c-8fae-e91fd1da977f.jpg , http://localserviceassets.blob.core.windows.net:80/businessphoto-m/iQueid-1-d891d638-db0a-48ba-a22b-e8ec8ee04c01.jpg , http://localserviceassets.blob.core.windows.net:80/businessphoto-m/iQueid-2-8e5b3059-03e9-454b-bea7-9b984eadf47e.jpg , http://localserviceassets.blob.core.windows.net:80/businessphoto-m/iQueid-3-cf7466b4-bc79-4aee-ba20-5064e8ee8da8.jpg , http://localserviceassets.blob.core.windows.net:80/businessphoto-m/iQueid-4-20904e06-d86c-4f76-b364-92d457d1d071.jpg , http://localserviceassets.blob.core.windows.net:80/businessphoto-m/iQueid-5-166b8f0d-10d8-48c5-bb98-1aad6e8e46a4.jpg , http://localserviceassets.blob.core.windows.net:80/businessphoto-m/iQueid-6-cb9cfa6d-d8ba-437f-a909-268d1d0ab710.jpg , ","1 Year Program , 6 Months Program , AILET Entrance Coaching , AIPMT Coaching , Aptitude Training , B.B.A. Entrance Coaching , Banking Tuitions , Classroom Tuitions , IBPS Bank Interview Coaching , IIT Engineering Entrance Coaching , IIT HSEE Coaching , IIT-JEE Coaching , Liberal Studies Entrance Coaching , LSAT Entrance Coaching , Mass Communication Training , Pre-Medical Test (PMT) Entrance Coaching , SBI PO Training , SET Entrance Coaching , ULSAT Entrance Coaching , Weekend Classes , "
