EduID,Name,Phone1,Phone2,Phone3,Phone4,Phone5,Street Address,Locality,Pincode,City,Country,Mail,Website,Person to Contact,Working Hours,Services Offered,Details,Images URL,Keywords
177188,Seed Learnopedia,0836 - 2272368, 7676021133,,,,"GK Avenue, 3rd Floor",Vidya Nagar,580021,hubli,India,hubli@learnopedia.co.in,http://www.learnopedia.co.in,Anand Karajagi,Monday - Saturday: 7.30 AM - 8.30 PM,"SSC Entrance Exam Coaching , RRB Entrance Exam Coaching , Common Management Aptitude Test (CMAT) Coaching , IBPS Bank Interview Coaching , MBA & BBA Coaching , SBI PO Training , Aptitude Training , CET Entrance Coaching , IBPS Bank Exam Coaching , ","SEED Infotech Ltd is the second largest vocational IT Training company having 50+ Training centers across India. SEED offers IT training programs to Individuals, Institutions and Corporate segment in Software Development, Software Testing, IT Infrastructure Management Services and ERP (SAP). Servicing 300+ reputed clients across the globe, SEED creates 50000+ job opportunities every year through 500+ recruitment partners. SEED has trained 650000+ students and professionals till date.
Headquartered in Pune, ENCYCLOPEDIA is an indigenous and professionally run organization, established with an aim to prepare students to become Future Managers. We prepare students for Competitive Exams such as Bank PO, IBPS PO, Clerk, SBI PO, Specialist Officers, Staff Selection Commission, Railways, LIC, NICL and MBA CMAT, MAT.  ",,"Classroom Tuitions , Daily Classes , Evening Classes , MBA & BBA Coaching , RRB Entrance Exam Coaching , SBI PO Training , SSC Entrance Exam Coaching , "
177189,Daksha Insight Complete Educational Services,7795009932,,,,,Akalwadi Mansion,Vidya Nagar,580020,hubli,India,shivakumarmullatti@yahoo.in,http://www.dakshainsight.com,Shiva Kumar/ Pradeep,Monday - Saturday: 8 AM - 8 PM,"Integrated Professional Competency (IPCC) Coaching , CACPT Coaching , CMA Coaching , ICWA Coaching , ","Daksha Insight Complete Educational Services has immense experience in this business. We provide coaching for all boards. Our motto is to provide the best teaching to the students. We have a huge list of impressive success of students. We promise a better future for your children in higher education and knowledge. We make your life better and brighter. Education is a primary ingredient and also a key to success in any profession. With a booming economy and a young population, there is a tremendous need for the quality education to equip this population with skills to handle assignments that spring from such a growing economy like ours. Contact us for further details.  ","http://localserviceassets.blob.core.windows.net:80/businessphoto-t/24-12-2015%2015-45-08-b768722d-7cf0-45cc-b0f8-42f5860eb5cf.png , http://localserviceassets.blob.core.windows.net:80/businessphoto-t/24-12-2015%2015-45-14-c8318ba0-a608-4259-9eea-531cf683b629.png , http://localserviceassets.blob.core.windows.net:80/businessphoto-t/24-12-2015%2015-45-33-e27840d1-1384-417c-8df6-b0d8836a7a30.png , http://localserviceassets.blob.core.windows.net:80/businessphoto-t/24-12-2015%2015-45-47-06018015-308b-41b7-a71a-53de5220932f.png , http://localserviceassets.blob.core.windows.net:80/businessphoto-t/18-12-2015%2011-14-31-5fffc546-3094-4bc9-87c9-ed7e3eb82ca4.png , http://localserviceassets.blob.core.windows.net:80/businessphoto-t/18-12-2015%2011-14-59-35181a3c-9237-4f32-9fc3-fef7657bee9a.png , http://localserviceassets.blob.core.windows.net:80/businessphoto-m/24-12-2015%2015-45-08-b768722d-7cf0-45cc-b0f8-42f5860eb5cf.png , http://localserviceassets.blob.core.windows.net:80/businessphoto-m/24-12-2015%2015-45-14-c8318ba0-a608-4259-9eea-531cf683b629.png , http://localserviceassets.blob.core.windows.net:80/businessphoto-m/24-12-2015%2015-45-33-e27840d1-1384-417c-8df6-b0d8836a7a30.png , http://localserviceassets.blob.core.windows.net:80/businessphoto-m/24-12-2015%2015-45-47-06018015-308b-41b7-a71a-53de5220932f.png , http://localserviceassets.blob.core.windows.net:80/businessphoto-m/18-12-2015%2011-14-31-5fffc546-3094-4bc9-87c9-ed7e3eb82ca4.png , http://localserviceassets.blob.core.windows.net:80/businessphoto-m/18-12-2015%2011-14-59-35181a3c-9237-4f32-9fc3-fef7657bee9a.png , ",
177190,Vidya Tutorials,0836 - 2334958, 9480324958, 9482245510,,,"No. 83, 1st Phase,  Sirur Park Road, Laxmi nagar",Akshay Colony,580030,hubli,India,kumakagenelli@yahoo.com,,Uma Shekar,"Monday - Saturday: 4.30 AM - 8.30 AM, Monday - Saturday: 4.30 PM - 8.30 PM","Engineering Tuitions , Computer Science Tuitions (11th & 12th STD) , Commerce Tuitions (11th & 12th STD) , Diploma in Banking & Finance (DBF) Coaching , Engineering Maths Tuitions , Matriculation Tuitions for Hindi & English , Navodaya Vidyalaya Entrance Coaching , School Tuitions for Math, Physics, Chemistry , School Tuitions for Accounts, Finance, Statistics , School Tuitions for All Subjects , Spoken English Classes , Polytechnic Entrance Coaching , ISC Tuitions for 11th & 12th , Spoken Hindi Classes , Handwriting, Spelling & Reading Classes , Biology Tuitions (11th & 12th) , 2nd Year PUC Coaching , Advanced Level (A-Level) Maths Tuitions , CBSE Tuitions for Hindi , CBSE Tuitions for Maths , CBSE Tuitions for Chemistry , Diploma in Fashion Designing Coaching , 1st Year PUC Coaching , CET Entrance Coaching , 10th STD Tuitions , Online School Coaching Classes , Diploma CET Coaching , 9th STD Tuitions , Vedic Maths Coaching , Spoken Kannada Classes , ","Vidya Tutorials for Learning has immense experience in this business. We provide coaching for all boards. Our motto is to provide the best teaching to the students. We have a huge list of impressive success of students. We promise a better future for your children in higher education and knowledge. We make your life better and brighter. Education is a primary ingredient and also a key to success in any profession. With a booming economy and a young population, there is a tremendous need for the quality education to equip this population with skills to handle assignments that spring from such a growing economy like ours. Contact us for further details.  ",,"Biology Tuitions (11th & 12th) , CBSE Tuitions for Chemistry , CBSE Tuitions for Hindi , CBSE Tuitions for Maths , CET Entrance Coaching , Commerce Tuitions (11th & 12th STD) , Computer Science Tuitions (11th & 12th STD) , Diploma CET Coaching , Diploma in Banking & Finance (DBF) Coaching , Diploma in Fashion Designing Coaching , Engineering Maths Tuitions , Handwriting, Spelling & Reading Classes , ISC Tuitions for 11th & 12th , Matriculation Tuitions for Hindi & English , Navodaya Vidyalaya Entrance Coaching , Online School Coaching Classes , Polytechnic Entrance Coaching , School Tuitions for Accounts, Finance, Statistics , School Tuitions for All Subjects , School Tuitions for Math, Physics, Chemistry , Spoken English Classes , Spoken Hindi Classes , Spoken Kannada Classes , Vedic Maths Coaching , "
177191,Nakshatra Technologies,0836 - 2257865, 9448110341,,,,"No. 3, Pooja Arcade",Deshpande Nagar,580029,hubli,India,nakshatraedu@yahoo.com,,Anwar,"Monday - Friday: 8 AM - 8 PM, Saturday: 8 AM - 7 PM","Office Automation System Providers , Computer Networking Training , Engineering Design Training , Enterprise Training , Hardware Training , Multimedia & Design Training , Oracle Training , Programming Languages Training , Web Technologies Training , SAP Training , Chip Level Service Training ( Laptop & Desktop ) , 2D Animation Training , Advanced C Programming Training , Web Designing Training , C, C++ Training , Basic Networking Training , Advanced Networking Training , ASP.Net Training , .Net Training , Java & J2EE Training , Oracle Certification Training , Adobe Photoshop Training , Autodesk MAYA Training , Basic Language Training , SAP ERP Training , CorelDRAW Training , Advanced Visual Basic Training , SAP Functional Modules Training , Multimedia & Animation Training , Autocad Training , DTP Training , Tally Training , Spoken English Classes , ","Nakshatra Technologies, we have massive experience in this business. We deal with Computer Training. Our motto has always been timely service, best quality and optimum cost. We are in touch with our Students through quality, performance, service and assistance. Bringing the best of value to our Students, we also care as much about our Students. We value the trust and beliefs vested in us by our clients and professional contacts and provide a dedicated service with an honest and direct approach in all our dealings. Contact us for further details.  ",,"Advanced Visual Basic Training , ASP.Net Training , Autocad Training , Autodesk MAYA Training , Basic Language Training , Basic Networking Training , C, C++ Training , Chip Level Service Training ( Laptop & Desktop ) , CorelDRAW Training , DTP Training , Java & J2EE Training , Multimedia & Animation Training , Oracle Certification Training , SAP ERP Training , SAP Functional Modules Training , Spoken English Classes , Tally Training , Web Designing Training , "
177192,Logic Computer Centre,9731822984, 9845284576,,,,3rd Floor,Vidya Nagar,580021,hubli,India,raghu_khode@yahoo.com,,Raghu/Santhosh,Monday - Sunday: 8 AM - 8 PM,"Coaching & Tuitions , Database Training , Engineering Design Training , Enterprise Training , Ethical Hacking Training , Hardware Training , MainFrame Training , Microsoft Training , Multimedia & Design Training , Networking & Cisco Training , Operating System Training , Oracle Training , Programming Languages Training , Project Management Certification Training , Software Tools Training , Software Testing Training , Web Technologies Training , SAP Training , ISO Certification Training , Cloud Computing Training , ANSYS Training , Primavera Training , Chip Level Service Training ( Laptop & Desktop ) , Database Management Training , IBM MainFrame Training , 2D Animation Training , CCSP Certification Training , Ethical Hacker Training , Advanced Solaris Training , Oracle BPM Training , Web Designing Training , Advanced C Programming Training , MS Exchange Training , ANSYS CFD Training , Basic Primavera Training , Cloud Administration Training , ANSYS Fluent Training , MS Office Training , C, C++ Training , AJAX Training , Oracle ADF Training , Computer Hacking Forensic Investigation , CCVP Certification Training , 3D/2D Animation Services , MS Certification Training , IT Governance & Operations Management Training , Chip Level Repair Course , M.B.A. Distance Education , CNC Programming Training , CAE Training , Embedded Systems Training , MCSA Certification Training , 3D Studio Max Training , CCNP Certification Training , Oracle OAF Training , ASP.Net Training , SAP ABAP Training , C Sharp (C#) Training , ","We are into complete computerized business accounting program, since a decade in Northern part of Karnataka with the name of LOGIC COMPUTER CENTRE, with the certification of ISO 9001-2000, having wings across Karnataka ( BIJAPUR, DHARWAD, GADAG, HUBLI ).We are transforming industrious and meritorious candidates and updated training by our industry experts & career advisors.Our Domain training is on latest versions of SAP and we deserve the credit of launching END USER TRAINING IN NORTHERN PART OF KARNATAKA as per current industry requirement. We are already providing industrious candidates to reputed companies like IBM, Capgemini, and other industries existing in Northern part of Karnataka.Contact us for further details.  ",,"3D/2D Animation Services , Abaqus Training , Adobe Flex Training , Adobe Illustrator Training , Adobe Photoshop Training , Adobe Premiere Training , Adobe Robohelp Training , Advanced C Programming Training , Advanced MS Excel Training , Advanced Solaris Training , Advanced Visual Basic Training , AJAX Training , Allegro Training , Altera FPGA Training , ANSA Training , ANSYS CFD Training , ANSYS Fluent Training , Archicad Training , Architectural Desktop Training , Architectural Visualization Training , Arduino Training , ARM Cortex Training , ASP.Net Training , AutoCad Civil 3D Training , Autocad Training , Autodesk Alias Training , Autodesk InfraWorks Training , Autodesk Inventor Training , Autodesk MAYA Training , Autodesk Revit MEP Training , Automation Tools Training , B.A Distance Education , B.C.A. Distance Education , B.Com Coaching , B.Com Distance Education , Basic Primavera Training , BS OHSAS 18001 Training , C Sharp (C#) Training , C, C++ Training , CAD & CAM Training , CAD Pro-Mold Training , CAE Training , CCIE Certification Training , CCNA Certification Training , CCNP Certification Training , CCSP Certification Training , CCVP Certification Training , Chip Level Repair Course , Chip Level Service Training ( Laptop & Desktop ) , Civil CAD Training , Cloud Administration Training , CNC Programming Training , Computational Fluid Dynamics Training , Computer Hacking Forensic Investigation , CorelDRAW Training , CREO Training , CSS Training , Database Management Training , Database Testing Training , Del CAM Training , Delcam Software Training , DHTML Training , Diploma in Chemical Engineering Distance Education , Diploma in Civil Engineering Distance Education , Diploma in Electrical Engineering Distance Education , Diploma in Industrial Relation Course Distance Education , Diploma in IT Engineering Distance Education , Dreamweaver Training , DSP Training , DTP Training , EJB Training , Electrical CAD Training , Embedded Applications Training , Embedded C Training , Embedded Controller Training , Embedded Database Training , Embedded Development Training , Embedded Hardware Training , Embedded Programming Training , Embedded QT Training , Embedded Systems Training , Emerson DeltaV DCS Training , E-Publishing Courses , ETABS Training , Ethical Hacker Training , Exchange Server Certification Training , Executive BBA Distance Education , Flash Action Effects Training , Graphic Designing Training , HADOOP Training , HMI Training , HTML Training , IBM MainFrame Training , IBPS Bank Interview Coaching , IT Governance & Operations Management Training , Java & J2EE Training , Java Script Training , JSF Training , JSP Training , LAMP Pro Training , Linux Embedded Systems Training , Linux Training , M.B.A. Distance Education , M.C.A. Distance Education , M.Com Distance Education , M.Tech. Distance Education , Mastercam Training , MATLAB Training , MCITP Certification Training , MCSA Certification Training , MCSE Certification Training , Microsoft Certified Applications Developer (MCAD) Training , MS Access Training , MS Certification Training , MS Exchange Training , MS Office Training , MS Project Training , Multimedia & Animation Training , Oracle 11g DBA Training , Oracle 9i Training , Oracle ADF Training , Oracle Application Training , Oracle BPM Training , Oracle Business Intelligence Training , Oracle Finance Training , Oracle OAF Training , Oracle PL Training , Oracle SQL Training , ORCAD Training , PCB designing Training , Perl Programming Training , PHP & MySQL Training , PLC Designing Training , PLC Training , Prince2 Certification Training , Pro E Training , QA Testing Training , QTP Certification Training , Revit Architecture Training , Rich Internet Applications Training , RRB Entrance Exam Coaching , Ruby on Rails Training , SAP ABAP Training , SAP APO Training , SAP BI Training , SAP BO Training , SAP BW Training , SAP CRM Training , SAP EP Training , SAP ERP Training , SAP FICO Training , SAP Functional Modules Training , SAP HR Training , SAP MDM Training , SAP MM Training , SAP Netweaver Training , SAP PM Training , SAP PP Training , SCADA Training , Software Engineering with UML Training , Solidworks Training , Spring Training , SQL Server Training , Struts Training , SystemVerilog Training , Tally Training , Toon Boom Animation Training , Unigraphic Software Training , Unix Training , VB Script Training , Web 2.0 Training , Web Designing Training , Windows 2008 Server Certification Training , XHTML Training , "
177193,Abhyudaya Tutorials,0836 - 2745087, 9945377557,,,,,Station Road,580007,hubli,India,,,Ghanshayam,Monday - Saturday: 9.30 AM - 5 PM,"2nd Year PUC Coaching , 1st Year PUC Coaching , 10th STD Tuitions , 9th STD Tuitions , ",,,
177194,Athani & Kolhar`s Classes,0836 - 4251409, 9886312269,,,,,Kalidash Nagar,580021,hubli,India,,,Kolhar,,"Enterprise Training , Home & Private Tuitions , Big Data Analytics Online Training , Engineering Tuitions , Law Entrance Coaching , Home Tutors for Class I-V , R Analytics Online Training , Mechanical Engineering Tuitions , SET Entrance Coaching , Aerospace Engineering Tuitions , Home Tutors for Class VI-X , B.Com Home Tutors , Biomedical Engineering Tuitions , Biomechanical Engineering Tuitions , B.Sc Home Tutors , BE Home Tuitions , Automotive Engineering Tuitions , Civil Engineering Tuitions , Biology Home Tuitions for school , Chemistry Home Tuitions for school , Architectural Engineering Tuitions , Electrical Engineering Tuitions , Hindi Home Tuitions , English Home Tuitions for school , IT & Computer Science Engineering Tuitions , Robotics Engineering Tuitions , Physics Home Tuitions for school , Economics Home Tuitions , Microelectronic Engineering Tuitions , Chemical Engineering Tuitions , BBA Home Tuitions , MBA Home Tuitions , Environmental Engineering Tuitions , Materials Science Engineering Tuitions , ICWA Home Tuitions , MCA Home Tuitions , Agricultural Engineering Tuitions , Foreign Languages Coaching , GMAT Private Tuitions , CA Home Tuitions , Maths Home Tuitions for school , Engineering Tuitions - Other Branches , Engineering Physics Tuitions , Biotechnology Engineering Tuitions , Genetic Engineering Tuitions , Engineering Chemistry Tuitions , Mechatronics Engineering Tuitions , Software Engineering Tuitions , Electronics & Communication Engineering Tuitions , Instrumentation Technology Engineering Tuitions , Telecommunication Engineering Tuitions , Industrial & Production Engineering Tuitions , Show less  , ",,,"B.Com Home Tutors , B.Sc Home Tutors , Banking Tuitions , BBA Home Tuitions , BE Home Tuitions , Bioinformatics Training , Biology Home Tuitions for school , Biomechanical Engineering Tuitions , Biomedical Engineering Tuitions , Biotechnology Engineering Tuitions , CA Home Tuitions , CAT Coaching , Certified Financial Planner (CFP) Coaching , Chartered Accountant Coaching , Chemical Engineering Tuitions , Chemistry Home Tuitions for school , Civil Engineering Tuitions , College Tuitions for Accounts, Finance, Statistics , College Tuitions for Chemistry , College Tuitions for Maths , College Tuitions for Physics , Economics Home Tuitions , Electrical Engineering Tuitions , Electronics & Communication Engineering Tuitions , Engineering Chemistry Tuitions , Engineering Physics Tuitions , Engineering Tuitions - Other Branches , English Home Tuitions for school , Environmental Engineering Tuitions , Foreign Languages Coaching , Genetic Engineering Tuitions , GMAT Coaching , GMAT Private Tuitions , GRE Coaching , Handwriting, Spelling & Reading Classes , Hindi Home Tuitions , Home Tutors for Class I-V , Home Tutors for Class VI-X , IAS Entrance Coaching , ICWA Home Tuitions , IIT Engineering Entrance Coaching , Industrial & Production Engineering Tuitions , Instrumentation Technology Engineering Tuitions , IT & Computer Science Engineering Tuitions , Mass Communication Training , Materials Science Engineering Tuitions , Maths Home Tuitions for school , MBA & BBA Coaching , MBA Home Tuitions , MCA Home Tuitions , Mechanical Engineering Tuitions , Mechatronics Engineering Tuitions , Medical Entrance Coaching , Microelectronic Engineering Tuitions , Music & Dance & Arts Classes , NIFT/NID/CEED/FDDI Training , Physics Home Tuitions for school , R Analytics Online Training , Robotics Engineering Tuitions , SAT Coaching , School Tuitions for Accounts, Finance, Statistics , School Tuitions for All Subjects , School Tuitions for Math, Physics, Chemistry , SET Entrance Coaching , Software Engineering Tuitions , Spoken English Classes , Spoken Hindi Classes , Telecommunication Engineering Tuitions , Tuitions for College Subjects , "
177195,Institute For Competitive Examinations,0836 - 2742020, 0836 - 2742525, 9243200505,,,,Vidya Nagar,580021,hubli,India,,,Jothi,,"Enterprise Training , Home & Private Tuitions , Big Data Analytics Online Training , Engineering Tuitions , Law Entrance Coaching , Home Tutors for Class I-V , R Analytics Online Training , Mechanical Engineering Tuitions , SET Entrance Coaching , Aerospace Engineering Tuitions , Home Tutors for Class VI-X , B.Com Home Tutors , Biomedical Engineering Tuitions , Biomechanical Engineering Tuitions , B.Sc Home Tutors , BE Home Tuitions , Automotive Engineering Tuitions , Civil Engineering Tuitions , Biology Home Tuitions for school , Chemistry Home Tuitions for school , Architectural Engineering Tuitions , Electrical Engineering Tuitions , Hindi Home Tuitions , English Home Tuitions for school , IT & Computer Science Engineering Tuitions , Robotics Engineering Tuitions , Physics Home Tuitions for school , Economics Home Tuitions , Microelectronic Engineering Tuitions , Chemical Engineering Tuitions , BBA Home Tuitions , MBA Home Tuitions , Environmental Engineering Tuitions , Materials Science Engineering Tuitions , ICWA Home Tuitions , MCA Home Tuitions , Agricultural Engineering Tuitions , Foreign Languages Coaching , GMAT Private Tuitions , CA Home Tuitions , Maths Home Tuitions for school , Engineering Tuitions - Other Branches , Engineering Physics Tuitions , Biotechnology Engineering Tuitions , Genetic Engineering Tuitions , Engineering Chemistry Tuitions , Mechatronics Engineering Tuitions , Software Engineering Tuitions , Electronics & Communication Engineering Tuitions , Instrumentation Technology Engineering Tuitions , Telecommunication Engineering Tuitions , Industrial & Production Engineering Tuitions , Show less  , ",,,"B.Com Home Tutors , B.Sc Home Tutors , Banking Tuitions , BBA Home Tuitions , BE Home Tuitions , Bioinformatics Training , Biology Home Tuitions for school , Biomechanical Engineering Tuitions , Biomedical Engineering Tuitions , Biotechnology Engineering Tuitions , CA Home Tuitions , CAT Coaching , Certified Financial Planner (CFP) Coaching , Chartered Accountant Coaching , Chemical Engineering Tuitions , Chemistry Home Tuitions for school , Civil Engineering Tuitions , College Tuitions for Accounts, Finance, Statistics , College Tuitions for Chemistry , College Tuitions for Maths , College Tuitions for Physics , Economics Home Tuitions , Electrical Engineering Tuitions , Electronics & Communication Engineering Tuitions , Engineering Chemistry Tuitions , Engineering Physics Tuitions , Engineering Tuitions - Other Branches , English Home Tuitions for school , Environmental Engineering Tuitions , Foreign Languages Coaching , Genetic Engineering Tuitions , GMAT Coaching , GMAT Private Tuitions , GRE Coaching , Handwriting, Spelling & Reading Classes , Hindi Home Tuitions , Home Tutors for Class I-V , Home Tutors for Class VI-X , IAS Entrance Coaching , ICWA Home Tuitions , IIT Engineering Entrance Coaching , Industrial & Production Engineering Tuitions , Instrumentation Technology Engineering Tuitions , IT & Computer Science Engineering Tuitions , Mass Communication Training , Materials Science Engineering Tuitions , Maths Home Tuitions for school , MBA & BBA Coaching , MBA Home Tuitions , MCA Home Tuitions , Mechanical Engineering Tuitions , Mechatronics Engineering Tuitions , Medical Entrance Coaching , Microelectronic Engineering Tuitions , Music & Dance & Arts Classes , NIFT/NID/CEED/FDDI Training , Physics Home Tuitions for school , R Analytics Online Training , Robotics Engineering Tuitions , SAT Coaching , School Tuitions for Accounts, Finance, Statistics , School Tuitions for All Subjects , School Tuitions for Math, Physics, Chemistry , SET Entrance Coaching , Software Engineering Tuitions , Spoken English Classes , Spoken Hindi Classes , Telecommunication Engineering Tuitions , Tuitions for College Subjects , "
177196,Vishwanath Tuition Classes,9986428850,,,,,,Vidya Nagar,580031,hubli,India,,,Vishwanath,,"Foreign Languages Coaching , CAT Coaching , IIT Engineering Entrance Coaching , School Tuitions for Math, Physics, Chemistry , School Tuitions for Accounts, Finance, Statistics , School Tuitions for All Subjects , Music & Dance & Arts Classes , GRE Coaching , Medical Entrance Coaching , Spoken Hindi Classes , NIFT/NID/CEED/FDDI Training , Banking Tuitions , Mass Communication Training , MBA & BBA Coaching , 2nd Year PUC Coaching , College Tuitions for Maths , College Tuitions for Physics , College Tuitions for Chemistry , 10th STD Tuitions , 9th STD Tuitions , ",,,"College Tuitions for Chemistry , College Tuitions for Maths , College Tuitions for Physics , Foreign Languages Coaching , GRE Coaching , IIT Engineering Entrance Coaching , Mass Communication Training , MBA & BBA Coaching , Medical Entrance Coaching , Music & Dance & Arts Classes , NIFT/NID/CEED/FDDI Training , School Tuitions for Accounts, Finance, Statistics , School Tuitions for All Subjects , School Tuitions for Math, Physics, Chemistry , Spoken Hindi Classes , "
