EduID,Name,Phone1,Phone2,Phone3,Phone4,Phone5,Street Address,Locality,Pincode,City,Country,Mail,Website,Person to Contact,Working Hours,Services Offered,Details,Images URL,Keywords
166272,Campus UK,9566473300,,,,,"No. 11A, 3rd Floor, Periyasamy Towers",Annamalai Nagar,560040,trichy,India,trichy@campusuk.com,http://www.campusuk.com,Manzoor,"Monday - Saturday: 9 AM - 6 PM, Sunday: 10 AM - 12.30 PM","Language Training , French Language Training , German Language Training , Spoken English Classes , Spoken Hindi Classes , IELTS Coaching , TOEFL Coaching , ","CampusUK Ltd is a leading education consultancy which specialises in providing professional and free counselling service to students in India to pursue their higher studies in UK, Canada, Singapore, New Zealand and Australia. CampusUK offers services to the students through its offices located in Chennai, Trichy, Coimbatore and Cochin.CampusUK started by professionals who have graduated and worked in India and have set up successful businesses in the UK. We have an in-depth understanding and experience of both British and Indian culture, lifestyle, education, work experience and social values.With this experience in hand, we can proudly say that we are in a unique position to guide the students to acquire world-class educational qualification by giving the right services. We can assure that our definite presence and first-hand experience in the UK for over two decades will bring a new dimension to the overseas education promotion in India.CampusUKcounsellors understand the individual requirements of the student and recommend suitable courses to study at the Universities by taking the academic strength, finance and subject interest of the students into consideration. We also appropriately advise on the availability of scholarships to various Universities and encourage the students to apply for these scholarships with our guidance. Our counsellors can help to deal with any financial constraints the student may have.  ","http://localserviceassets.blob.core.windows.net:80/businessphoto-t/campusuk_himg5-03950525-9a3f-4bb4-b2d4-9b21faead9f1.jpg , http://localserviceassets.blob.core.windows.net:80/businessphoto-t/campusuk_himg6-89a506cc-f48b-4905-9e13-019b486b2bc2.jpg , http://localserviceassets.blob.core.windows.net:80/businessphoto-t/team-support-908670cb-7b2f-4cf3-bb36-cd5f86a5a879.png , http://localserviceassets.blob.core.windows.net:80/businessphoto-t/campusukoffices-d627f705-0f87-4bf6-9307-74af6b6d910c.jpg , http://localserviceassets.blob.core.windows.net:80/businessphoto-t/French%20Language%20Flyer-36dd2099-17e2-4205-9da1-285d2da39404.png , http://localserviceassets.blob.core.windows.net:80/businessphoto-t/IELTS-Keep%20Calm-553f2f0e-faf5-45d8-8a55-074966014b41.jpg , http://localserviceassets.blob.core.windows.net:80/businessphoto-t/IELTS-Top%20scorers-1993446d-28c6-4e08-8587-54d455546b25.jpg , http://localserviceassets.blob.core.windows.net:80/businessphoto-t/keep%20calm%20study%20english-69c22d58-c878-4fca-a00c-ea557944fdfd.jpg , http://localserviceassets.blob.core.windows.net:80/businessphoto-t/Students-8561869b-a8ba-4825-9154-a93545755e4b.jpg , http://localserviceassets.blob.core.windows.net:80/businessphoto-m/campusuk_himg5-03950525-9a3f-4bb4-b2d4-9b21faead9f1.jpg , http://localserviceassets.blob.core.windows.net:80/businessphoto-m/campusuk_himg6-89a506cc-f48b-4905-9e13-019b486b2bc2.jpg , http://localserviceassets.blob.core.windows.net:80/businessphoto-m/team-support-908670cb-7b2f-4cf3-bb36-cd5f86a5a879.png , http://localserviceassets.blob.core.windows.net:80/businessphoto-m/campusukoffices-d627f705-0f87-4bf6-9307-74af6b6d910c.jpg , http://localserviceassets.blob.core.windows.net:80/businessphoto-m/French%20Language%20Flyer-36dd2099-17e2-4205-9da1-285d2da39404.png , http://localserviceassets.blob.core.windows.net:80/businessphoto-m/IELTS-Keep%20Calm-553f2f0e-faf5-45d8-8a55-074966014b41.jpg , http://localserviceassets.blob.core.windows.net:80/businessphoto-m/IELTS-Top%20scorers-1993446d-28c6-4e08-8587-54d455546b25.jpg , http://localserviceassets.blob.core.windows.net:80/businessphoto-m/keep%20calm%20study%20english-69c22d58-c878-4fca-a00c-ea557944fdfd.jpg , http://localserviceassets.blob.core.windows.net:80/businessphoto-m/Students-8561869b-a8ba-4825-9154-a93545755e4b.jpg , ","Classroom Tuitions , Daily Classes , Evening Classes , TOEFL Coaching , "
166273,PTC Aviation Academy,+91 44 33230207,,,,,"No. 16/29, 1st Main Road",Chromepet,600044,trichy,India,hrnova@worldptc.com,http://www.worldptc.com,Nova/Joseph,"Monday - Friday: 9 AM - 6 PM, Saturday: 9 AM - 1 PM","Coaching & Tuitions , Job Training , Shipping & Logistic Training , Aviation Industry Job Vacancies , Pilot Training , Airhostess Job Training , Airport Ground Staff Training , Flight Dispatcher Training , Presentations Skills Training , Aviation Management Training , IATA UFTTA Job Training , Spoken English Classes , Personality Development Training , Cabin Crew Job Training , Galileo GDS Job Training , Mass Communication Training , IELTS Coaching , TOEFL Coaching , Aircraft Maintenance Engineering (AME) Coaching , Travel & Tourism Job Training , Diploma in Pilot Training , Diploma in Air Hostess Training , Diploma in Airport Ground Staff Training , Diploma in Flight Dispatch Operations Training , Diploma in Aviation Management Training , Diploma in IATA UFTTA Job Training , Diploma in Galileo GDS Training , Language Development Coaching , Diploma in Travel & Tourism Training , Diploma in Hospitality Training , Aptitude Training , Diploma in Air Ticketing Training , Diploma in Banking & Finance (DBF) Training , Diploma in Fashion Designing Coaching , Public Speaking Training , ","PTC Aviation Academy, CHENNAI, is led by a professional team of enthusiasts with leading airline backgrounds. We specialize in training & development for airline personnel in various departments such as Ground crew, CSA, Ground staff, Documentation staff in Cargo until Airport Managers. We also specialize in recruitment for airlines & Cargo services. PTC - Aviation Academy is initiated and managed by Airline Professionals and a highly enterprising and motivated team. A premiere Aviation Academy offering courses in Ground Crew Training, Customer Services, Hospitality, and Travel & Tourism Training, Soft skill and English Fluency training. Contact us for your needs.  ","http://localserviceassets.blob.core.windows.net:80/businessphoto-t/PTCAC-1-047c9faf-52a7-4411-9a31-30d6f19ae3ba.jpg , http://localserviceassets.blob.core.windows.net:80/businessphoto-t/PTCAC-2-c3bbc0f8-b332-42e4-86f8-6ea0c574e7c2.jpg , http://localserviceassets.blob.core.windows.net:80/businessphoto-t/PTCAC-3-fcaba1e9-a5e8-4339-b986-e6f8ecb9860e.jpg , http://localserviceassets.blob.core.windows.net:80/businessphoto-t/PTCAC-4-91750188-2862-40a4-8cae-ed3a3d4fa199.jpg , http://localserviceassets.blob.core.windows.net:80/businessphoto-t/PTCAC-5-35d168a7-1f0e-4235-a0d0-15e18d2953a5.jpg , http://localserviceassets.blob.core.windows.net:80/businessphoto-t/Placement01-9ea8a301-82b1-4ff3-8e09-472fb4850feb.jpg , http://localserviceassets.blob.core.windows.net:80/businessphoto-t/Placement02-ebcf4cce-0496-4571-827b-6dd937dc39b9.jpg , http://localserviceassets.blob.core.windows.net:80/businessphoto-t/placemnent03-105bb34c-d21f-4d96-a473-bd379e099a88.jpg , http://localserviceassets.blob.core.windows.net:80/businessphoto-t/1-0f211369-c317-4697-ae8c-2c107860ab27.jpg , http://localserviceassets.blob.core.windows.net:80/businessphoto-t/2-fd823521-2c09-4bad-99c6-9ffb15431148.jpg , http://localserviceassets.blob.core.windows.net:80/businessphoto-t/3-a894d595-d3b9-4ac3-803f-4994ee3bbea6.jpg , http://localserviceassets.blob.core.windows.net:80/businessphoto-t/4-a0aa35d0-aa20-4080-aff0-9a156d327177.jpg , http://localserviceassets.blob.core.windows.net:80/businessphoto-t/5-cc0fdc3a-2132-4ee9-9dfc-7e786336c502.jpg , http://localserviceassets.blob.core.windows.net:80/businessphoto-t/6-e85615cd-51b4-475d-82d2-c2748608738b.jpg , http://localserviceassets.blob.core.windows.net:80/businessphoto-m/PTCAC-1-047c9faf-52a7-4411-9a31-30d6f19ae3ba.jpg , http://localserviceassets.blob.core.windows.net:80/businessphoto-m/PTCAC-2-c3bbc0f8-b332-42e4-86f8-6ea0c574e7c2.jpg , http://localserviceassets.blob.core.windows.net:80/businessphoto-m/PTCAC-3-fcaba1e9-a5e8-4339-b986-e6f8ecb9860e.jpg , http://localserviceassets.blob.core.windows.net:80/businessphoto-m/PTCAC-4-91750188-2862-40a4-8cae-ed3a3d4fa199.jpg , http://localserviceassets.blob.core.windows.net:80/businessphoto-m/PTCAC-5-35d168a7-1f0e-4235-a0d0-15e18d2953a5.jpg , http://localserviceassets.blob.core.windows.net:80/businessphoto-m/Placement01-9ea8a301-82b1-4ff3-8e09-472fb4850feb.jpg , http://localserviceassets.blob.core.windows.net:80/businessphoto-m/Placement02-ebcf4cce-0496-4571-827b-6dd937dc39b9.jpg , http://localserviceassets.blob.core.windows.net:80/businessphoto-m/placemnent03-105bb34c-d21f-4d96-a473-bd379e099a88.jpg , http://localserviceassets.blob.core.windows.net:80/businessphoto-m/1-0f211369-c317-4697-ae8c-2c107860ab27.jpg , http://localserviceassets.blob.core.windows.net:80/businessphoto-m/2-fd823521-2c09-4bad-99c6-9ffb15431148.jpg , http://localserviceassets.blob.core.windows.net:80/businessphoto-m/3-a894d595-d3b9-4ac3-803f-4994ee3bbea6.jpg , http://localserviceassets.blob.core.windows.net:80/businessphoto-m/4-a0aa35d0-aa20-4080-aff0-9a156d327177.jpg , http://localserviceassets.blob.core.windows.net:80/businessphoto-m/5-cc0fdc3a-2132-4ee9-9dfc-7e786336c502.jpg , http://localserviceassets.blob.core.windows.net:80/businessphoto-m/6-e85615cd-51b4-475d-82d2-c2748608738b.jpg , ","1 Month Program , 1 Week Program , 1 Year Program , 2 Weeks Programs , 3 Months Program , 6 Months Program , Aircraft Maintenance Engineering (AME) Coaching , Airhostess Job Training , Airport Ground Staff Training , Aptitude Training , Aviation Industry Job Vacancies , Aviation Management Training , Below Rs.1000 , Cabin Crew Job Training , Classroom Tuitions , Daily Classes , Diploma in Fashion Designing Coaching , Diploma in Flight Dispatch Operations Training , Diploma in Galileo GDS Training , Diploma in Hospitality Training , Diploma in IATA UFTTA Job Training , Diploma in Pilot Training , Diploma in Travel & Tourism Training , Flight Dispatcher Training , Galileo GDS Job Training , IATA UFTTA Job Training , IELTS Coaching , Language Development Coaching , Mass Communication Training , More than Rs.20000 , Personality Development Training , Pilot Training , Presentations Skills Training , Public Speaking Training , Rs.10000-Rs.20000 , Rs.1000-Rs.5000 , Rs.5000-Rs.10000 , Shipping & Logistic Training , Spoken English Classes , TOEFL Coaching , Travel & Tourism Job Training , "
166274,Gateway Finishing School,9943555655,,,,,"No. 73/12, Annamalai Nagar",Salai Road,620018,trichy,India,akselvaraj@gmail.com,http://www.svsbfs.in,Selvaraj,Monday - Sunday: 9.30 AM - 7 PM,"IBPS Bank Interview Coaching , CAT Coaching , IIT Engineering Entrance Coaching , IAS Entrance Coaching , SAT Coaching , Spoken Hindi Classes , NIFT/NID/CEED/FDDI Training , Banking Tuitions , MBA & BBA Coaching , GMAT Coaching , Certified Financial Planner (CFP) Coaching , Piping Stress Analysis Coaching , Plant Design Piping Coaching , IIT HSEE Coaching , MCA Entrance Coaching , Fashion Design Entrance Coaching , Placement Training , Aptitude Training , CET Entrance Coaching , AIEEE Coaching , AIPMT Coaching , JEE Advanced Coaching , B.Com Coaching , IIT-JEE Coaching , ","GEMS Trust & TIMS Gateway for Entrepreneurship & Management Studies Trust and Trichy Institute of Management Studies Pvt. Ltd., is situated in the prime happening places in the heart of the city at No. 73/12, I & II Floor, Annamalai Nagar, Salai Road, Trichy - 620 018.The Physical infrastructure includes 3600 sq ft + 3600 sq ft carpet area in two floors. GEMS Trust & TIMS is well equipped with spacious Classrooms, Computer labs, Library, Student waiting lounge, Faculty cabins, Administrative cabins, Counseling cabins, Marketing cabins, Vehicle parking and Rest rooms. Contact us for more details.  ","http://localserviceassets.blob.core.windows.net:80/businessphoto-t/21-01-2016%2018-31-34-c452dae2-e33f-4be1-9179-444e3ce6516f.png , http://localserviceassets.blob.core.windows.net:80/businessphoto-t/21-01-2016%2018-31-44-a1343297-edfe-4f4c-94ea-0030d0c9b50d.png , http://localserviceassets.blob.core.windows.net:80/businessphoto-t/21-01-2016%2018-32-17-36e7ee17-a456-4d37-b652-95dd9fd6a130.png , http://localserviceassets.blob.core.windows.net:80/businessphoto-t/21-01-2016%2018-32-26-4de606ff-d738-49b0-a83d-9aac28a652c0.png , http://localserviceassets.blob.core.windows.net:80/businessphoto-t/21-01-2016%2018-32-48-cb40dbf8-5074-4c85-9146-65248921b122.png , http://localserviceassets.blob.core.windows.net:80/businessphoto-m/21-01-2016%2018-31-34-c452dae2-e33f-4be1-9179-444e3ce6516f.png , http://localserviceassets.blob.core.windows.net:80/businessphoto-m/21-01-2016%2018-31-44-a1343297-edfe-4f4c-94ea-0030d0c9b50d.png , http://localserviceassets.blob.core.windows.net:80/businessphoto-m/21-01-2016%2018-32-17-36e7ee17-a456-4d37-b652-95dd9fd6a130.png , http://localserviceassets.blob.core.windows.net:80/businessphoto-m/21-01-2016%2018-32-26-4de606ff-d738-49b0-a83d-9aac28a652c0.png , http://localserviceassets.blob.core.windows.net:80/businessphoto-m/21-01-2016%2018-32-48-cb40dbf8-5074-4c85-9146-65248921b122.png , ","1 Month Program , 3 Months Program , CAT Coaching , Certified Financial Planner (CFP) Coaching , CET Entrance Coaching , Classroom Tuitions , Daily Classes , Evening Classes , Fashion Design Entrance Coaching , GMAT Coaching , Holiday Classes , IAS Entrance Coaching , IBPS Bank Interview Coaching , IIT Engineering Entrance Coaching , IIT HSEE Coaching , IIT-JEE Coaching , JEE Advanced Coaching , MBA & BBA Coaching , MCA Entrance Coaching , NIFT/NID/CEED/FDDI Training , Piping Stress Analysis Coaching , Placement Training , Plant Design Piping Coaching , Rs.5000-Rs.10000 , SAT Coaching , Spoken Hindi Classes , Summer Classes , Weekend Classes , "
166275,Dexter Academy,8940400211,,,,,"4 th Floor Lakkshmi Arcade, Thillainagar 11th Cross ",Thillai Nagar,620018,trichy,India,contact@dexteracademy.in,http://www.dexteracademy.in,Ram Prakash,Sunday - Saturday: 6 AM - 9 PM,"SSC Entrance Exam Coaching , RRB Entrance Exam Coaching , IBPS Bank Interview Coaching , PSU Entrance Coaching , PWD/CPWD Entrance Coaching , DMRC Entrance Coaching , SSC JE Entrance Coaching , Banking Tuitions , MBA & BBA Coaching , Insurance Exam Coaching , SBI PO Training , MAT coaching , MCA Entrance Coaching , Placement Training , Aptitude Training , MBA in IT Coaching , MBA in Retail Management Coaching , MCA Entrance Exam Coaching , IBPS Bank Exam Coaching , Online Test Series for Exam , TANCET Entrance Coaching , National Talent Search Exam (NTSE) Coaching , TNPSC Entrance Coaching , Vedic Maths Coaching , XAT Entrance Coaching , ",,"http://localserviceassets.blob.core.windows.net:80/businessphoto-t/1-815b984c-8ee3-4871-a970-13550c67805a.jpg , http://localserviceassets.blob.core.windows.net:80/businessphoto-t/10-c14846df-6b34-4e5a-9825-7af12a6d0221.png , http://localserviceassets.blob.core.windows.net:80/businessphoto-t/2-833218ad-d518-428b-afaa-48d3336b6192.jpg , http://localserviceassets.blob.core.windows.net:80/businessphoto-t/3-3f8b0e01-53a7-42f5-b6d0-a7e3fbd2b3dc.jpg , http://localserviceassets.blob.core.windows.net:80/businessphoto-t/4-d3134c43-d1c6-4a5d-acc3-bd9a5db6a32f.jpg , http://localserviceassets.blob.core.windows.net:80/businessphoto-t/5-d0cddf1e-927a-4cc2-8ce7-0098713cfc2a.png , http://localserviceassets.blob.core.windows.net:80/businessphoto-t/6-c0348628-7c94-4487-b504-a6f5c508ca48.png , http://localserviceassets.blob.core.windows.net:80/businessphoto-t/7-cc869f04-a648-48d8-b644-0d90681c94dc.png , http://localserviceassets.blob.core.windows.net:80/businessphoto-t/8-452b73ea-aa9e-4119-a7ca-d2bfa38a1f73.png , http://localserviceassets.blob.core.windows.net:80/businessphoto-t/9-d90aa6e7-3567-4f7f-a569-29d68f974f48.png , http://localserviceassets.blob.core.windows.net:80/businessphoto-m/1-815b984c-8ee3-4871-a970-13550c67805a.jpg , http://localserviceassets.blob.core.windows.net:80/businessphoto-m/10-c14846df-6b34-4e5a-9825-7af12a6d0221.png , http://localserviceassets.blob.core.windows.net:80/businessphoto-m/2-833218ad-d518-428b-afaa-48d3336b6192.jpg , http://localserviceassets.blob.core.windows.net:80/businessphoto-m/3-3f8b0e01-53a7-42f5-b6d0-a7e3fbd2b3dc.jpg , http://localserviceassets.blob.core.windows.net:80/businessphoto-m/4-d3134c43-d1c6-4a5d-acc3-bd9a5db6a32f.jpg , http://localserviceassets.blob.core.windows.net:80/businessphoto-m/5-d0cddf1e-927a-4cc2-8ce7-0098713cfc2a.png , http://localserviceassets.blob.core.windows.net:80/businessphoto-m/6-c0348628-7c94-4487-b504-a6f5c508ca48.png , http://localserviceassets.blob.core.windows.net:80/businessphoto-m/7-cc869f04-a648-48d8-b644-0d90681c94dc.png , http://localserviceassets.blob.core.windows.net:80/businessphoto-m/8-452b73ea-aa9e-4119-a7ca-d2bfa38a1f73.png , http://localserviceassets.blob.core.windows.net:80/businessphoto-m/9-d90aa6e7-3567-4f7f-a569-29d68f974f48.png , ","1 Month Program , 1 Week Program , 1 Year Program , 2 Weeks Programs , 3 Months Program , 6 Months Program , Classroom Tuitions , Daily Classes , DMRC Entrance Coaching , Evening Classes , Holiday Classes , MAT coaching , MBA & BBA Coaching , MBA in IT Coaching , MBA in Retail Management Coaching , MCA Entrance Coaching , MCA Entrance Exam Coaching , National Talent Search Exam (NTSE) Coaching , Online Test Series for Exam , Online Tuitions , Placement Training , PSU Entrance Coaching , PWD/CPWD Entrance Coaching , RRB Entrance Exam Coaching , SBI PO Training , Short Term , SSC Entrance Exam Coaching , SSC JE Entrance Coaching , Summer Classes , TANCET Entrance Coaching , TNPSC Entrance Coaching , Vedic Maths Coaching , Weekend Classes , XAT Entrance Coaching , "
166276,Nivedita Career Academy,8754002475, 8754002473,,,,"No. 29, 3rd Floor, Thillai Nagar Main Road",Thillai Nagar,620018,trichy,India,info@niveditaedu.info,http://www.niveditaedu.info,Sethuram,Monday - Sunday: 9 AM - 9 PM,"GATE Coaching , Engineering Tuitions , Law Entrance Coaching , GATE Biotechnology Coaching , Mechanical Engineering Tuitions , GATE Civil Engineering Coaching , GATE Computer Science Coaching , Civil Engineering Tuitions , CLAT Entrance Coaching , Electrical Engineering Tuitions , GATE Electronics Engineering Coaching , GATE Electrical Engineering Coaching , IT & Computer Science Engineering Tuitions , SSC Entrance Exam Coaching , RRB Entrance Exam Coaching , GATE Instrumental Engineering Coaching , GATE Mechanical Engineering Coaching , GATE Production Engineering Coaching , Environmental Engineering Tuitions , GATE Coaching for Other Subjects , Engineering Tuitions - Other Branches , Engineering Physics Tuitions , Biotechnology Engineering Tuitions , UPSC Coaching , CTET Coaching , Engineering Chemistry Tuitions , Electronics & Communication Engineering Tuitions , NEET Entrance Coaching , CAT Coaching , IIT Engineering Entrance Coaching , School Tuitions for Math, Physics, Chemistry , School Tuitions for Accounts, Finance, Statistics , Spoken English Classes , MBBS Tuitions , GRE Coaching , SAT Coaching , Medical Entrance Coaching , Banking Tuitions , NATA Coaching , IELTS Coaching , TOEFL Coaching , GMAT Coaching , CBSE Tuitions for Maths , CBSE Tuitions for Physics , CBSE Tuitions for Chemistry , College Tuitions for Maths , College Tuitions for Physics , College Tuitions for Chemistry , IIT HSEE Coaching , Aptitude Training , AIEEE Coaching , 10th STD Tuitions , IIT-JEE Coaching , IES Coaching , 9th STD Tuitions , ","Nivedita Eduinfotrends Private Limited is a leading Indian educational company aiming at providing quality education to the mass of all categories to achieve their dreams. 5 years experiences in this fields, Our primary objective is to provide is provide best guidance, coaching and training to the students for developing required skills for the industry and get them employed. At school level, our Nivedita Career Academy coaches students of CBSE, ICSE, Matriculation and State Board for scoring high marks in the final examinations and offers coaching for IIT-JEE ,NEET and NTSE examinations with rich comprehensive course materials and well experienced learned faculty. We are the Authorized Test Centre of BANSAL CLASSES for IIT-JEE, Pre-Medical, NTSE and KVPY. We offer offline and online classes at our centre. Students who aspire for the above coaching classes may utilize our centre for classroom programs and online practice tests. At college level, we offer IT training in Hardware amp; Networking, Software Programming and Database Management and coaching for competitive examinations such as GATE, CAT, CMAT and TANCET. Our students have excelled in international examinations conducted by CISCO and Microsoft and have been placed in reputed MNCs.  ","http://localserviceassets.blob.core.windows.net:80/businessphoto-t/7402075826%20(1)-afc75eed-660e-49c7-8af7-1c12771db52b.jpg , http://localserviceassets.blob.core.windows.net:80/businessphoto-t/7402075826%20(2)-b0fb7587-29e0-40b4-86ae-b93c87e5034c.jpg , http://localserviceassets.blob.core.windows.net:80/businessphoto-t/7402075826%20(4)-bc7a1907-4ba6-4e2d-bead-0ab826296a70.jpg , http://localserviceassets.blob.core.windows.net:80/businessphoto-t/7402075826%20(5)-7c67a50e-de01-494b-9cbc-29e94e9cf597.jpg , http://localserviceassets.blob.core.windows.net:80/businessphoto-t/7402075826%20(3)-26498298-302c-443f-9b37-4ec1b303c237.jpg , http://localserviceassets.blob.core.windows.net:80/businessphoto-m/7402075826%20(1)-afc75eed-660e-49c7-8af7-1c12771db52b.jpg , http://localserviceassets.blob.core.windows.net:80/businessphoto-m/7402075826%20(2)-b0fb7587-29e0-40b4-86ae-b93c87e5034c.jpg , http://localserviceassets.blob.core.windows.net:80/businessphoto-m/7402075826%20(4)-bc7a1907-4ba6-4e2d-bead-0ab826296a70.jpg , http://localserviceassets.blob.core.windows.net:80/businessphoto-m/7402075826%20(5)-7c67a50e-de01-494b-9cbc-29e94e9cf597.jpg , http://localserviceassets.blob.core.windows.net:80/businessphoto-m/7402075826%20(3)-26498298-302c-443f-9b37-4ec1b303c237.jpg , ","1 Month Program , 1 Week Program , 1 Year Program , 10th STD Tuitions , 2 Weeks Programs , 3 Months Program , 6 Months Program , CAT Coaching , CBSE Tuitions for Chemistry , CBSE Tuitions for Maths , CBSE Tuitions for Physics , Civil Engineering Tuitions , Classroom Tuitions , CLAT Entrance Coaching , College Tuitions for Chemistry , College Tuitions for Maths , College Tuitions for Physics , CTET Coaching , Daily Classes , Electrical Engineering Tuitions , Electronics & Communication Engineering Tuitions , Engineering Chemistry Tuitions , Engineering Physics Tuitions , Engineering Tuitions - Other Branches , Environmental Engineering Tuitions , Evening Classes , GATE Biotechnology Coaching , GATE Civil Engineering Coaching , GATE Coaching for Other Subjects , GATE Computer Science Coaching , GATE Electrical Engineering Coaching , GATE Electronics Engineering Coaching , GATE Instrumental Engineering Coaching , GATE Mechanical Engineering Coaching , GATE Production Engineering Coaching , GMAT Coaching , GRE Coaching , Holiday Classes , IELTS Coaching , IES Coaching , IIT Engineering Entrance Coaching , IIT HSEE Coaching , IIT-JEE Coaching , IT & Computer Science Engineering Tuitions , KMAT Coaching , MBBS Tuitions , Mechanical Engineering Tuitions , Medical Entrance Coaching , NATA Coaching , NEET Entrance Coaching , Online Tuitions , Pre-Medical Test (PMT) Entrance Coaching , RRB Entrance Exam Coaching , SAT Coaching , School Tuitions for Accounts, Finance, Statistics , School Tuitions for Biology , School Tuitions for Math, Physics, Chemistry , Short Term , Spoken English Classes , SSC Entrance Exam Coaching , Summer Classes , TANCET Entrance Coaching , TNPSC Entrance Coaching , TOEFL Coaching , UPSC Coaching , Weekend Classes , "
166277,Grace IAS Academy - GIAT,9789161236, 8526171033,,,,"No.1,",Ramakrishna Nagar,620020,trichy,India,graceiasacademy@gmail.com,,Suganya,Monday - Sunday: 10 AM - 7 PM,"RRB Entrance Exam Coaching , IBPS Bank Interview Coaching , IAS Entrance Coaching , Spoken English Classes , Spoken Hindi Classes , Banking Tuitions , SBI PO Training , Aptitude Training , TNPSC Entrance Coaching , ","Grace IAS Academy - GIAT has massive experience in this business. Our motto has always been timely service, best quality and optimum cost. We are in touch with our customers through quality, performance, service and assistance. Bringing the best of value to our customers, we also care as much about our customers. We value the trust and beliefs vested in us by our clients and professional contacts and provide a dedicated service with an honest and direct approach in all our dealings. We deal in Grace IAS Academy - GIAT. Contact us for further details.  ",,"SBI PO Training , Spoken English Classes , Spoken Hindi Classes , TNPSC Entrance Coaching , "
